,Unnamed: 0,Unnamed: 0.1,business_id,business_name,business_address,business_city,business_state,business_postal_code,business_latitude,business_longitude,business_location,business_phone_number,inspection_id,inspection_date,inspection_score,inspection_type,violation_id,violation_description,risk_category,short_inspect_date,short_violation_id,inspect_date,p1_3,p4_6,p7_9,p10_12,p13_18,p19_24,p25_36
0,0,0,1757,Dar Bar Pakistani/Indian Cusine,1412 Polk St,San Francisco,CA,94109,37.789784000000004,-122.420455,"(37.789784, -122.420455)",,1757_20170928,9/28/2017 0:00,86.0,Routine - Unscheduled,1757_20170928_103131,Moderate risk vermin infestation,Moderate Risk,20170928,103131,2017-09-28,0,0,5,0,0,6,5
1,1,1,4864,DRAGON CITY BAKERY & CAFE,2367 MISSION St,San Francisco,CA,94110,37.759174,-122.41906599999999,"(37.759174, -122.419066)",14155829718.0,4864_20161206,12/6/2016 0:00,84.0,Routine - Unscheduled,4864_20161206_103157,Food safety certificate or food handler card not available,Low Risk,20161206,103157,2016-12-06,0,6,0,0,5,5,3
2,2,2,79782,Deli 23,2449 23rd St,San Francisco,CA,94110,,,,,79782_20160503,5/3/2016 0:00,92.0,Routine - Unscheduled,79782_20160503_103120,Moderate risk food holding temperature,Moderate Risk,20160503,103120,2016-05-03,4,0,2,0,3,3,2
3,3,3,73840,L'acajou Bakery and Cafe,498 09th St Ste. C,San Francisco,CA,94103,,,,,73840_20171207,12/7/2017 0:00,71.0,Routine - Unscheduled,73840_20171207_103105,Improper cooling methods,High Risk,20171207,103105,2017-12-07,0,5,0,0,6,0,0
4,4,4,76437,Sweetheart Cafe,909 Grant Ave,San Francisco,CA,94108,,,,,76437_20160329,3/29/2016 0:00,76.0,Routine - Unscheduled,76437_20160329_103113,Sewage or wastewater contamination,High Risk,20160329,103113,2016-03-29,0,11,0,0,0,6,6
5,5,5,82123,Cafe New Honolulu,888 Stockton St,San Francisco,CA,94108,,,,,82123_20171207,12/7/2017 0:00,87.0,Routine - Unscheduled,82123_20171207_103131,Moderate risk vermin infestation,Moderate Risk,20171207,103131,2017-12-07,0,3,0,0,0,8,8
6,6,6,1146,Aux Delices Vietnam,2327 Polk St,San Francisco,CA,94109,37.798274,-122.42226399999998,"(37.798274, -122.422264)",,1146_20180223,2/23/2018 0:00,77.0,Routine - Unscheduled,1146_20180223_103103,High risk food holding temperature,High Risk,20180223,103103,2018-02-23,6,0,0,0,0,8,0
7,7,7,3838,CAFE PICARO,3120 16th St,San Francisco,CA,94103,37.764908,-122.42244199999999,"(37.764908, -122.422442)",14155434089.0,3838_20180222,2/22/2018 0:00,72.0,Routine - Unscheduled,3838_20180222_103142,Unclean nonfood contact surfaces,Low Risk,20180222,103142,2018-02-22,7,0,0,0,0,1,2
8,8,8,38929,Jelly Donut,3198 24th St,San Francisco,CA,94110,37.752439,-122.41625,"(37.752439, -122.41625)",,38929_20160114,1/14/2016 0:00,88.0,Routine - Unscheduled,38929_20160114_103139,Improper food storage,Low Risk,20160114,103139,2016-01-14,0,0,7,0,3,4,6
9,9,9,81161,Limon Peruvian Rotisserie,1001 South Van Ness Ave,San Francisco,CA,94110,,,,14155548833.0,81161_20160325,3/25/2016 0:00,92.0,Routine - Unscheduled,81161_20160325_103149,Wiping cloths not clean or properly stored or inadequate sanitizer,Low Risk,20160325,103149,2016-03-25,1,0,3,2,4,0,3
10,10,10,85781,Domino's #7764,876 Geary St,San Francisco,CA,94109,,,,,85781_20160311,3/11/2016 0:00,86.0,Routine - Unscheduled,85781_20160311_103124,Inadequately cleaned or sanitized food contact surfaces,Moderate Risk,20160311,103124,2016-03-11,6,0,3,0,0,0,5
11,11,11,82880,Don Pablo,Off The Grid,San Francisco,CA,94102,,,,,82880_20160309,3/9/2016 0:00,,Structural Inspection,82880_20160309_103148,No thermometers or uncalibrated thermometers,Low Risk,20160309,103148,2016-03-09,0,0,0,3,0,6,2
12,12,14,16441,Hawaiian Drive Inn,2600 San Bruno Ave,San Francisco,CA,94134,37.728718,-122.404101,"(37.728718, -122.404101)",,16441_20161206,12/6/2016 0:00,82.0,Routine - Unscheduled,16441_20161206_103154,Unclean or degraded floors walls or ceilings,Low Risk,20161206,103154,2016-12-06,0,6,0,0,5,3,0
13,13,16,2716,RED A BAKERY,634 CLEMENT St,San Francisco,CA,94118,37.782888,-122.466101,"(37.782888, -122.466101)",,2716_20160323,3/23/2016 0:00,57.0,Routine - Unscheduled,2716_20160323_103131,Moderate risk vermin infestation,Moderate Risk,20160323,103131,2016-03-23,0,5,0,0,5,0,7
14,14,17,3165,HAN IL KWAN,1802 BALBOA St,San Francisco,CA,94121,37.776599,-122.478292,"(37.776599, -122.478292)",14153598244.0,3165_20170323,3/23/2017 0:00,79.0,Routine - Unscheduled,3165_20170323_103149,Wiping cloths not clean or properly stored or inadequate sanitizer,Low Risk,20170323,103149,2017-03-23,0,0,0,0,7,0,5
15,15,18,2995,CAFE ROCCO,1131 FOLSOM St,San Francisco,CA,94103,37.776127,-122.408602,"(37.776127, -122.408602)",,2995_20170809,8/9/2017 0:00,74.0,Routine - Unscheduled,2995_20170809_103125,Noncompliance with shell fish tags or display,Moderate Risk,20170809,103125,2017-08-09,0,0,5,0,1,0,6
16,16,20,64380,Michael Mina Restaurant,252 California St,San Francisco,CA,94111,37.793338,-122.399583,"(37.793338, -122.399583)",14155350791.0,64380_20160414,4/14/2016 0:00,86.0,Routine - Unscheduled,64380_20160414_103154,Unclean or degraded floors walls or ceilings,Low Risk,20160414,103154,2016-04-14,0,0,4,0,0,5,0
17,17,21,3594,CELIAS RESTAURANT,4019 JUDAH St,San Francisco,CA,94122,37.760422999999996,-122.50520900000001,"(37.760423, -122.505209)",,3594_20160330,3/30/2016 0:00,88.0,Routine - Unscheduled,3594_20160330_103133,Foods not protected from contamination,Moderate Risk,20160330,103133,2016-03-30,0,0,0,0,0,0,4
18,18,24,5493,AT&T - (CART 17) DELI [145105],24 WILLIE MAYS PLAZA,San Francisco,CA,94107,,,,14155971500.0,5493_20160814,8/14/2016 0:00,94.0,Routine - Unscheduled,5493_20160814_103119,Inadequate and inaccessible handwashing facilities,Moderate Risk,20160814,103119,2016-08-14,0,0,0,0,0,2,0
19,19,25,69762,Chili House Inc.,726 Clement St,San Francisco,CA,94118,,,,,69762_20160413,4/13/2016 0:00,68.0,Routine - Unscheduled,69762_20160413_103133,Foods not protected from contamination,Moderate Risk,20160413,103133,2016-04-13,0,6,0,0,6,7,0
20,20,26,80081,Good MongKok Bakery,1039 Stockton St,San Francisco,CA,94108,,,,,80081_20170104,1/4/2017 0:00,78.0,Routine - Unscheduled,80081_20170104_103120,Moderate risk food holding temperature,Moderate Risk,20170104,103120,2017-01-04,0,1,0,0,8,0,5
21,21,31,62710,Sam's Chowder Mobile,Golden Gate Park,San Francisco,CA,zzzzz,37.777122,-122.41963899999999,"(37.777122, -122.419639)",,62710_20160511,5/11/2016 0:00,86.0,Routine - Unscheduled,62710_20160511_103139,Improper food storage,Low Risk,20160511,103139,2016-05-11,0,0,0,0,0,5,1
22,22,32,93150,Chez Beesen,200 Pine St,San Francisco,CA,94104,,,,,93150_20171030,10/30/2017 0:00,,New Ownership,93150_20171030_103124,Inadequately cleaned or sanitized food contact surfaces,Moderate Risk,20171030,103124,2017-10-30,0,6,0,0,0,0,0
23,23,33,4960,Three Star Restaurant,2515 Noriega St,San Francisco,CA,94122,37.753583,-122.490839,"(37.753583, -122.490839)",,4960_20160413,4/13/2016 0:00,71.0,Routine - Unscheduled,4960_20160413_103154,Unclean or degraded floors walls or ceilings,Low Risk,20160413,103154,2016-04-13,0,3,0,0,2,7,0
24,24,35,74922,Le Marais Bakery,2066 Chestnut St,San Francisco,CA,94123,,,,,74922_20160430,4/30/2016 0:00,82.0,Routine - Unscheduled,74922_20160430_103119,Inadequate and inaccessible handwashing facilities,Moderate Risk,20160430,103119,2016-04-30,0,5,0,0,0,6,0
25,25,36,66999,Super Duper Burgers,2201 Chestnut St,San Francisco,CA,94123,37.800344,-122.439697,"(37.800344, -122.439697)",,66999_20160607,6/7/2016 0:00,87.0,Routine - Unscheduled,66999_20160607_103102,Unclean hands or improper use of gloves,High Risk,20160607,103102,2016-06-07,5,0,0,0,0,3,0
26,26,37,61,Chowders,Pier 39  Space A3,San Francisco,CA,94133,37.80824000000001,-122.41018899999999,"(37.80824, -122.410189)",,61_20150827,8/27/2015 0:00,92.0,Routine - Unscheduled,61_20150827_103133,Foods not protected from contamination,Moderate Risk,20150827,103133,2015-08-27,0,2,0,0,1,3,3
27,27,40,4787,TONY BALONEY'S,1098 HOWARD St,San Francisco,CA,94103,37.778033,-122.40943,"(37.778033, -122.40943)",14155861514.0,4787_20160628,6/28/2016 0:00,83.0,Routine - Unscheduled,4787_20160628_103131,Moderate risk vermin infestation,Moderate Risk,20160628,103131,2016-06-28,0,5,0,0,0,5,0
28,28,41,65066,Lers Ros Thai Noodle,307 Hayes St,San Francisco,CA,94102,37.777017,-122.42143,"(37.777017, -122.42143)",,65066_20160810,8/10/2016 0:00,72.0,Routine - Unscheduled,65066_20160810_103105,Improper cooling methods,High Risk,20160810,103105,2016-08-10,0,0,6,0,0,7,0
29,29,42,82911,Super Duper,346 Kearny St,San Francisco,CA,94108,,,,,82911_20170927,9/27/2017 0:00,88.0,Routine - Unscheduled,82911_20170927_103124,Inadequately cleaned or sanitized food contact surfaces,Moderate Risk,20170927,103124,2017-09-27,0,0,4,0,0,3,0
30,30,43,80494,Tap (415),845 Market St #495,San Francisco,CA,94103,,,,,80494_20180227,2/27/2018 0:00,93.0,Routine - Unscheduled,80494_20180227_103114,High risk vermin infestation,High Risk,20180227,103114,2018-02-27,1,0,0,0,3,1,0
31,31,44,59577,Pasta Moto of San Francisco Centre LLC,845 Market St FE6,San Francisco,CA,94103,37.784848,-122.406892,"(37.784848, -122.406892)",,59577_20160502,5/2/2016 0:00,72.0,Routine - Unscheduled,59577_20160502_103149,Wiping cloths not clean or properly stored or inadequate sanitizer,Low Risk,20160502,103149,2016-05-02,3,0,0,6,0,4,2
32,32,45,33700,Casa Guadalupe #3,2999 MISSION,San Francisco,CA,94110,37.749194,-122.418116,"(37.749194, -122.418116)",14155875145.0,33700_20160412,4/12/2016 0:00,90.0,Routine - Unscheduled,33700_20160412_103119,Inadequate and inaccessible handwashing facilities,Moderate Risk,20160412,103119,2016-04-12,0,3,0,0,3,4,0
33,33,46,5316,Nick's Lighthouse,Pier 45  Shed B Space 1A,San Francisco,CA,94133,,,,,5316_20171130,11/30/2017 0:00,88.0,Routine - Unscheduled,5316_20171130_103145,Improper storage of equipment utensils or linens,Low Risk,20171130,103145,2017-11-30,0,4,0,0,2,6,4
34,34,47,5631,AT&T -Room 5331 GILROY GARLIC FRIES/view [145161],24 WILLIE MAYS PLAZA 5.24.02,San Francisco,CA,94107,37.778382,-122.39115100000001,"(37.778382, -122.391151)",14155971500.0,5631_20160814,8/14/2016 0:00,94.0,Routine - Unscheduled,5631_20160814_103118,Employee eating or smoking,Moderate Risk,20160814,103118,2016-08-14,0,0,1,0,0,2,2
35,35,48,5633,AT&T - FIELD CLUB CONCESSION [145185],24 WILLIE MAYS PLAZA 1.09.04,San Francisco,CA,94107,37.778382,-122.39115100000001,"(37.778382, -122.391151)",14155971500.0,5633_20160814,8/14/2016 0:00,94.0,Routine - Unscheduled,5633_20160814_103120,Moderate risk food holding temperature,Moderate Risk,20160814,103120,2016-08-14,0,0,0,0,2,2,1
36,36,49,1596,BURGERMEISTER,86 Carl St,San Francisco,CA,94117,37.765848,-122.44966399999998,"(37.765848, -122.449664)",14155564433.0,1596_20171201,12/1/2017 0:00,96.0,Routine - Unscheduled,1596_20171201_103144,Unapproved or unmaintained equipment or utensils,Low Risk,20171201,103144,2017-12-01,0,2,0,0,0,0,5
37,37,50,5624,AT&T - DERBY GRILL Room 5311 [145154],24 WILLIE MAYS PLAZA 5.07.02,San Francisco,CA,94107,37.778382,-122.39115100000001,"(37.778382, -122.391151)",14155971500.0,5624_20160814,8/14/2016 0:00,96.0,Routine - Unscheduled,5624_20160814_103120,Moderate risk food holding temperature,Moderate Risk,20160814,103120,2016-08-14,0,0,2,1,0,1,0
38,38,51,3522,Bow Hon Restaurant,850 Grant Ave,San Francisco,CA,94108,37.794958,-122.40636699999999,"(37.794958, -122.406367)",,3522_20160412,4/12/2016 0:00,92.0,Routine - Unscheduled,3522_20160412_103120,Moderate risk food holding temperature,Moderate Risk,20160412,103120,2016-04-12,0,7,0,0,5,2,0
39,39,52,37633,100% Dessert Cafe,2512 Clement St,San Francisco,CA,94121,37.781988,-122.48625200000001,"(37.781988, -122.486252)",,37633_20160519,5/19/2016 0:00,72.0,Routine - Unscheduled,37633_20160519_103114,High risk vermin infestation,High Risk,20160519,103114,2016-05-19,0,0,0,0,5,6,0
40,40,53,39667,Peet's Coffee & Tea,595 Market St  Suite #143,San Francisco,CA,94105,37.789437,-122.40111100000001,"(37.789437, -122.401111)",,39667_20160906,9/6/2016 0:00,96.0,Routine - Unscheduled,39667_20160906_103119,Inadequate and inaccessible handwashing facilities,Moderate Risk,20160906,103119,2016-09-06,0,0,6,0,4,1,4
41,41,56,59838,OTD,2232 Bush St,San Francisco,CA,94115,37.786988,-122.434074,"(37.786988, -122.434074)",14155929578.0,59838_20160531,5/31/2016 0:00,92.0,Routine - Unscheduled,59838_20160531_103133,Foods not protected from contamination,Moderate Risk,20160531,103133,2016-05-31,0,0,0,0,2,2,0
42,42,57,81134,Carmelina's Taqueria,500 Parnassus Ave,San Francisco,CA,94143,,,,14155501121.0,81134_20160127,1/27/2016 0:00,,Reinspection/Followup,81134_20160127_103131,Moderate risk vermin infestation,Moderate Risk,20160127,103131,2016-01-27,0,1,0,0,0,0,1
43,43,59,58673,New Luen Sing Fish Market,1207 Stockton St,San Francisco,CA,94133,37.796973,-122.40850400000001,"(37.796973, -122.408504)",,58673_20160412,4/12/2016 0:00,71.0,Routine - Unscheduled,58673_20160412_103151,Inadequate or unsanitary refuse containers or area or no garbage service,Low Risk,20160412,103151,2016-04-12,0,5,0,0,4,9,8
44,44,60,66534,Midway Grill (Snack Shop),99 Harding Park Road,San Francisco,CA,94103,37.723698,-122.49528899999999,"(37.723698, -122.495289)",,66534_20160413,4/13/2016 0:00,87.0,Routine - Unscheduled,66534_20160413_103120,Moderate risk food holding temperature,Moderate Risk,20160413,103120,2016-04-13,0,4,0,0,4,3,0
45,45,61,39403,Frisco Fried,5176 03rd St,San Francisco,CA,94124,37.73089,-122.392227,"(37.73089, -122.392227)",,39403_20171213,12/13/2017 0:00,90.0,Routine - Unscheduled,39403_20171213_103142,Unclean nonfood contact surfaces,Low Risk,20171213,103142,2017-12-13,0,4,0,0,5,0,0
46,46,62,71065,"Chutney USA, Inc.",511 Jones St,San Francisco,CA,94102,37.786044,-122.413054,"(37.786044, -122.413054)",,71065_20171211,12/11/2017 0:00,89.0,Routine - Unscheduled,71065_20171211_103142,Unclean nonfood contact surfaces,Low Risk,20171211,103142,2017-12-11,0,3,0,0,3,0,3
47,47,63,91480,Mom's Soul Groove,655 Ellis St,San Francisco,CA,94109,,,,,91480_20171002,10/2/2017 0:00,,New Ownership,91480_20171002_103119,Inadequate and inaccessible handwashing facilities,Moderate Risk,20171002,103119,2017-10-02,0,3,0,0,0,0,0
48,48,64,77566,GreenSurge,2301 Market St,San Francisco,CA,94114,,,,14155814131.0,77566_20180223,2/23/2018 0:00,90.0,Routine - Unscheduled,77566_20180223_103177,Non service animal,Low Risk,20180223,103177,2018-02-23,4,0,5,0,0,0,4
49,49,66,85925,New Heng Fung Inc,2444 Noriega St,San Francisco,CA,94122,,,,14155740221.0,85925_20161031,10/31/2016 0:00,76.0,Routine - Unscheduled,85925_20161031_103124,Inadequately cleaned or sanitized food contact surfaces,Moderate Risk,20161031,103124,2016-10-31,0,5,0,0,5,0,8
50,50,67,2331,JADE CAFE,1688 BRYANT St,San Francisco,CA,94103,37.765755,-122.410601,"(37.765755, -122.410601)",,2331_20170329,3/29/2017 0:00,67.0,Routine - Unscheduled,2331_20170329_103144,Unapproved or unmaintained equipment or utensils,Low Risk,20170329,103144,2017-03-29,0,0,0,0,7,10,0
51,51,68,3267,The Olive Garden Italian,3251 20th Ave,San Francisco,CA,94132,37.728497,-122.47563899999999,"(37.728497, -122.475639)",14155666770.0,3267_20161206,12/6/2016 0:00,,Complaint,3267_20161206_103138,Improper storage use or identification of toxic substances,Low Risk,20161206,103138,2016-12-06,0,0,0,5,3,2,2
52,52,69,81987,Celtic Coffee Company,142 McAllister St,San Francisco,CA,94102,,,,,81987_20160627,6/27/2016 0:00,83.0,Routine - Unscheduled,81987_20160627_103156,Permit license or inspection report not posted,Low Risk,20160627,103156,2016-06-27,0,6,0,0,0,6,2
53,53,71,93968,Pollo Campero,2740 Mission St,San Francisco,CA,94110,,,,14155620801.0,93968_20171120,11/20/2017 0:00,98.0,Routine - Unscheduled,93968_20171120_103142,Unclean nonfood contact surfaces,Low Risk,20171120,103142,2017-11-20,0,1,0,0,0,0,0
54,54,72,3241,SHENG KEE BAKERY,1941 IRVING St,San Francisco,CA,94122,37.76344,-122.47864799999999,"(37.76344, -122.478648)",,3241_20160906,9/6/2016 0:00,86.0,Routine - Unscheduled,3241_20160906_103154,Unclean or degraded floors walls or ceilings,Low Risk,20160906,103154,2016-09-06,0,0,5,0,0,5,4
55,55,74,5268,SAN FRANCISCO MUSEUM OF MODERN ART,151 03rd St,San Francisco,CA,94103,37.785643,-122.401192,"(37.785643, -122.401192)",,5268_20160815,8/15/2016 0:00,87.0,Routine - Unscheduled,5268_20160815_103124,Inadequately cleaned or sanitized food contact surfaces,Moderate Risk,20160815,103124,2016-08-15,3,0,0,0,2,3,0
56,56,76,5960,ST. ANNE,1320 14th Ave,San Francisco,CA,94122,37.763403000000004,-122.47158200000001,"(37.763403, -122.471582)",,5960_20160506,5/6/2016 0:00,92.0,Routine - Unscheduled,5960_20160506_103120,Moderate risk food holding temperature,Moderate Risk,20160506,103120,2016-05-06,0,0,0,3,2,3,3
57,57,78,5090,SUNSET SUPERMARKET,2425 IRVING St,San Francisco,CA,94122,37.763221,-122.483832,"(37.763221, -122.483832)",,5090_20170725,7/25/2017 0:00,73.0,Routine - Unscheduled,5090_20170725_103157,Food safety certificate or food handler card not available,Low Risk,20170725,103157,2017-07-25,0,0,10,0,6,6,0
58,58,80,93815,Little Heaven Deli,2348 Mission Street,San Francisco,CA,94110,,,,,93815_20171102,11/2/2017 0:00,96.0,Routine - Unscheduled,93815_20171102_103144,Unapproved or unmaintained equipment or utensils,Low Risk,20171102,103144,2017-11-02,0,2,0,0,0,0,0
59,59,81,3862,IMPERIAL GARDEN SEAFOOD RESTAURANT,2626 SAN BRUNO Ave,San Francisco,CA,94134,37.728458,-122.40399099999999,"(37.728458, -122.403991)",14155469666.0,3862_20170905,9/5/2017 0:00,73.0,Routine - Unscheduled,3862_20170905_103156,Permit license or inspection report not posted,Low Risk,20170905,103156,2017-09-05,0,0,8,0,9,7,0
60,60,82,65649,Krua Thai Kitchen,3214 16th St,San Francisco,CA,94103,37.764788,-122.424462,"(37.764788, -122.424462)",,65649_20161206,12/6/2016 0:00,90.0,Routine - Unscheduled,65649_20161206_103120,Moderate risk food holding temperature,Moderate Risk,20161206,103120,2016-12-06,0,0,0,0,3,3,2
61,61,84,5457,AT&T - (CART 39) DOGGIE DINER v [145126],24 WILLIE MAYS PLAZA,San Francisco,CA,94107,,,,14155971500.0,5457_20160814,8/14/2016 0:00,96.0,Routine - Unscheduled,5457_20160814_103149,Wiping cloths not clean or properly stored or inadequate sanitizer,Low Risk,20160814,103149,2016-08-14,0,0,0,0,0,2,1
62,62,87,86659,Cumaica Coffee Co. #1,2800 California St #102,San Francisco,CA,94115,,,,,86659_20160914,9/14/2016 0:00,90.0,Routine - Unscheduled,86659_20160914_103138,Improper storage use or identification of toxic substances,Low Risk,20160914,103138,2016-09-14,3,0,0,0,0,3,0
63,63,88,87099,Corridor,100 Van Ness Ave #A,San Francisco,CA,94102,,,,,87099_20161110,11/10/2016 0:00,94.0,Routine - Unscheduled,87099_20161110_103157,Food safety certificate or food handler card not available,Low Risk,20161110,103157,2016-11-10,0,0,4,0,3,0,0
64,64,89,69353,Aria,932 Larkin St,San Francisco,CA,94109,37.786565,-122.418116,"(37.786565, -122.418116)",,69353_20160907,9/7/2016 0:00,86.0,Routine - Unscheduled,69353_20160907_103149,Wiping cloths not clean or properly stored or inadequate sanitizer,Low Risk,20160907,103149,2016-09-07,4,0,7,0,0,5,7
65,65,90,58850,Woerner's Liquor,901 Geary St,San Francisco,CA,94109,37.786053,-122.418327,"(37.786053, -122.418327)",,58850_20160906,9/6/2016 0:00,79.0,Routine - Unscheduled,58850_20160906_103156,Permit license or inspection report not posted,Low Risk,20160906,103156,2016-09-06,2,0,3,0,0,6,5
66,66,91,74283,Pizza Express,813 Cortland Ave,San Francisco,CA,94110,,,,14155303323.0,74283_20170824,8/24/2017 0:00,,Complaint,74283_20170824_103154,Unclean or degraded floors walls or ceilings,Low Risk,20170824,103154,2017-08-24,9,0,4,0,5,7,5
67,67,92,32586,Terroir,81 Langton St,San Francisco,CA,94103,37.776494,-122.40856200000002,"(37.776494, -122.408562)",14155718949.0,32586_20160906,9/6/2016 0:00,96.0,Routine - Unscheduled,32586_20160906_103144,Unapproved or unmaintained equipment or utensils,Low Risk,20160906,103144,2016-09-06,0,0,0,0,0,2,0
68,68,93,2627,BURGERMEISTER,Church St,San Francisco,CA,94114,37.768776,-122.42909499999999,"(37.768776, -122.429095)",14155432874.0,2627_20170105,1/5/2017 0:00,86.0,Routine - Unscheduled,2627_20170105_103138,Improper storage use or identification of toxic substances,Low Risk,20170105,103138,2017-01-05,0,0,0,0,5,0,4
69,69,97,36048,Nas Coffee,101 Spear St A-9,San Francisco,CA,94105,37.792577,-122.393992,"(37.792577, -122.393992)",,36048_20170926,9/26/2017 0:00,94.0,Routine - Unscheduled,36048_20170926_103156,Permit license or inspection report not posted,Low Risk,20170926,103156,2017-09-26,0,0,2,0,6,0,0
70,70,98,70685,5 Degree Tea House,2527 SAN BRUNO Ave,San Francisco,CA,94134,37.729753,-122.40446999999999,"(37.729753, -122.40447)",14155828233.0,70685_20171212,12/12/2017 0:00,86.0,Routine - Unscheduled,70685_20171212_103119,Inadequate and inaccessible handwashing facilities,Moderate Risk,20171212,103119,2017-12-12,0,4,0,0,3,4,2
71,71,99,91934,"Keep It, Inc.",1170 Powell St,San Francisco,CA,94108,,,,,91934_20170928,9/28/2017 0:00,94.0,Routine - Unscheduled,91934_20170928_103154,Unclean or degraded floors walls or ceilings,Low Risk,20170928,103154,2017-09-28,0,0,3,0,0,0,0
72,72,100,13671,AFC SUSHI @SAFEWAY 2606,298 KING STREET,San Francisco,CA,94107,37.776491,-122.394175,"(37.776491, -122.394175)",,13671_20180227,2/27/2018 0:00,89.0,Routine - Unscheduled,13671_20180227_103102,Unclean hands or improper use of gloves,High Risk,20180227,103102,2018-02-27,2,0,0,0,0,2,0
73,73,101,79296,Puccini & Pinetti,129 Ellis St,San Francisco,CA,94102,,,,,79296_20160127,1/27/2016 0:00,,Complaint,79296_20160127_103139,Improper food storage,Low Risk,20160127,103139,2016-01-27,0,3,0,0,0,2,3
74,74,102,4907,JIM GEORGIE'S DONUT,2799 16th St,San Francisco,CA,94103,37.765262,-122.41523000000001,"(37.765262, -122.41523)",14155867112.0,4907_20170105,1/5/2017 0:00,80.0,Routine - Unscheduled,4907_20170105_103131,Moderate risk vermin infestation,Moderate Risk,20170105,103131,2017-01-05,0,5,0,0,8,0,0
75,75,103,40217,Pizzetta 211,211 23rd Ave,San Francisco,CA,94121,37.783758,-122.48288500000001,"(37.783758, -122.482885)",,40217_20160502,5/2/2016 0:00,88.0,Routine - Unscheduled,40217_20160502_103124,Inadequately cleaned or sanitized food contact surfaces,Moderate Risk,20160502,103124,2016-05-02,0,0,0,0,4,4,0
76,76,104,1632,SWEET CHINITO,3100 MISSION St,San Francisco,CA,94110,37.748164,-122.418241,"(37.748164, -122.418241)",,1632_20160810,8/10/2016 0:00,92.0,Routine - Unscheduled,1632_20160810_103120,Moderate risk food holding temperature,Moderate Risk,20160810,103120,2016-08-10,2,0,2,0,3,3,3
77,77,105,1833,Rogue Ales Public House,673 Union St,San Francisco,CA,94133,37.800253999999995,-122.41044699999999,"(37.800254, -122.410447)",,1833_20160413,4/13/2016 0:00,78.0,Routine - Unscheduled,1833_20160413_103133,Foods not protected from contamination,Moderate Risk,20160413,103133,2016-04-13,0,0,0,6,0,8,0
78,78,107,69282,New Jumbo Seafood Restaurant,1532 NORIEGA St,San Francisco,CA,94122,37.754132,-122.48005800000001,"(37.754132, -122.480058)",14155681800.0,69282_20160413,4/13/2016 0:00,76.0,Routine - Unscheduled,69282_20160413_103119,Inadequate and inaccessible handwashing facilities,Moderate Risk,20160413,103119,2016-04-13,0,0,0,0,4,6,0
79,79,108,18805,Terzo,3011 Steiner St,San Francisco,CA,94123,37.797144,-122.437224,"(37.797144, -122.437224)",,18805_20160607,6/7/2016 0:00,94.0,Routine - Unscheduled,18805_20160607_103154,Unclean or degraded floors walls or ceilings,Low Risk,20160607,103154,2016-06-07,1,0,0,0,0,2,0
80,80,110,77778,Thai Thai Noodle 2,1400 California St,San Francisco,CA,94109,,,,,77778_20160502,5/2/2016 0:00,81.0,Routine - Unscheduled,77778_20160502_103116,Inadequate food safety knowledge or lack of certified food safety manager,Moderate Risk,20160502,103116,2016-05-02,3,0,6,0,5,4,0
81,81,111,75259,The Battery - Prep Kitchen,717 Battery St Basement,San Francisco,CA,94111,,,,,75259_20160325,3/25/2016 0:00,91.0,Routine - Unscheduled,75259_20160325_103105,Improper cooling methods,High Risk,20160325,103105,2016-03-25,0,0,0,1,1,0,2
82,82,112,76526,Stones Throw,1896 Hyde St,San Francisco,CA,94109,,,,,76526_20180227,2/27/2018 0:00,88.0,Routine - Unscheduled,76526_20180227_103120,Moderate risk food holding temperature,Moderate Risk,20180227,103120,2018-02-27,3,0,0,0,0,0,2
83,83,113,87510,Oyogu Sushi,4036 Balboa St,San Francisco,CA,94121,,,,14155389800.0,87510_20160513,5/13/2016 0:00,92.0,Routine - Unscheduled,87510_20160513_103144,Unapproved or unmaintained equipment or utensils,Low Risk,20160513,103144,2016-05-13,0,0,2,0,0,3,0
84,84,114,3211,PHO HUYNH HIEP II,1833 IRVING St,San Francisco,CA,94122,37.763503,-122.47774799999999,"(37.763503, -122.477748)",,3211_20160815,8/15/2016 0:00,83.0,Routine - Unscheduled,3211_20160815_103133,Foods not protected from contamination,Moderate Risk,20160815,103133,2016-08-15,0,0,4,0,0,4,4
85,85,115,81509,The Flying Falafel,1051 Market St,San Francisco,CA,94103,,,,14158500984.0,81509_20161205,12/5/2016 0:00,85.0,Routine - Unscheduled,81509_20161205_103157,Food safety certificate or food handler card not available,Low Risk,20161205,103157,2016-12-05,5,0,0,0,4,0,4
86,86,116,38798,K's Kitchen,757 Monterey Blvd,San Francisco,CA,94127,37.731503000000004,-122.45237,"(37.731503, -122.45237)",,38798_20160518,5/18/2016 0:00,90.0,Routine - Unscheduled,38798_20160518_103145,Improper storage of equipment utensils or linens,Low Risk,20160518,103145,2016-05-18,0,0,3,0,2,4,0
87,87,117,3253,S F GOLF CLUB,1310 Junipero Serra Blvd,San Francisco,CA,94132,37.711329,-122.47131599999999,"(37.711329, -122.471316)",14155464100.0,3253_20160413,4/13/2016 0:00,88.0,Routine - Unscheduled,3253_20160413_103132,Improper thawing methods,Moderate Risk,20160413,103132,2016-04-13,0,4,0,4,2,4,0
88,88,118,1977,BURMA SUPERSTAR RESTAURANT,309 CLEMENT St,San Francisco,CA,94118,37.783004,-122.46253899999999,"(37.783004, -122.462539)",,1977_20160328,3/28/2016 0:00,87.0,Routine - Unscheduled,1977_20160328_103105,Improper cooling methods,High Risk,20160328,103105,2016-03-28,0,0,0,0,2,0,3
89,89,119,77564,New Cheung Hing Restaurant LLC.,2339 Noriega St,San Francisco,CA,94122,,,,14155815528.0,77564_20160503,5/3/2016 0:00,73.0,Routine - Unscheduled,77564_20160503_103109,Unclean or unsanitary food contact surfaces,High Risk,20160503,103109,2016-05-03,0,0,7,0,4,5,7
90,90,121,36673,Mid City Market,868 Geary St,San Francisco,CA,94109,37.786196999999994,-122.41761399999999,"(37.786197, -122.417614)",,36673_20160901,9/1/2016 0:00,79.0,Routine - Unscheduled,36673_20160901_103161,Low risk vermin infestation,Low Risk,20160901,103161,2016-09-01,0,4,0,7,0,7,9
91,91,122,18728,Fat Belli Deli,2598 San Bruno Ave,San Francisco,CA,94134,37.728947,-122.404201,"(37.728947, -122.404201)",,18728_20160812,8/12/2016 0:00,76.0,Routine - Unscheduled,18728_20160812_103119,Inadequate and inaccessible handwashing facilities,Moderate Risk,20160812,103119,2016-08-12,0,0,0,0,6,5,7
92,92,124,68295,Walgreens #4680,730 Market St,San Francisco,CA,94102,37.78709600000001,-122.404274,"(37.787096, -122.404274)",,68295_20160928,9/28/2016 0:00,96.0,Routine - Unscheduled,68295_20160928_103151,Inadequate or unsanitary refuse containers or area or no garbage service,Low Risk,20160928,103151,2016-09-28,0,2,0,0,0,2,1
93,93,125,5875,THURGOOD MARSHALL HIGH SCHOOL,45 CONKLING St,San Francisco,CA,94124,,,,14155695611.0,5875_20160906,9/6/2016 0:00,92.0,Routine - Unscheduled,5875_20160906_103131,Moderate risk vermin infestation,Moderate Risk,20160906,103131,2016-09-06,2,0,2,0,2,2,1
94,94,126,18826,Fresca Restaurant,2114 FILLMORE St,San Francisco,CA,94115,37.789074,-122.433783,"(37.789074, -122.433783)",14155442668.0,18826_20160926,9/26/2016 0:00,83.0,Routine - Unscheduled,18826_20160926_103119,Inadequate and inaccessible handwashing facilities,Moderate Risk,20160926,103119,2016-09-26,0,3,0,0,0,4,4
95,95,127,73889,Khan Toke Thai House,5937 Geary Blvd,San Francisco,CA,94121,,,,14155666654.0,73889_20160322,3/22/2016 0:00,68.0,Routine - Unscheduled,73889_20160322_103132,Improper thawing methods,Moderate Risk,20160322,103132,2016-03-22,0,0,0,0,0,0,8
96,96,128,2054,Zarzuela,2000 Hyde St,San Francisco,CA,94109,37.799368,-122.41904699999999,"(37.799368, -122.419047)",,2054_20180227,2/27/2018 0:00,90.0,Routine - Unscheduled,2054_20180227_103142,Unclean nonfood contact surfaces,Low Risk,20180227,103142,2018-02-27,4,0,0,0,2,0,2
97,97,129,108,Rue Lepic,900 Pine St,San Francisco,CA,94108,37.790867999999996,-122.410854,"(37.790868, -122.410854)",,108_20150417,4/17/2015 0:00,94.0,Routine - Unscheduled,108_20150417_103133,Foods not protected from contamination,Moderate Risk,20150417,103133,2015-04-17,0,0,0,0,2,0,2
98,98,131,2134,"CHIEFTAIN IRISH PUB, THE",198 05th St,San Francisco,CA,94103,37.781566999999995,-122.40505900000001,"(37.781567, -122.405059)",14155610916.0,2134_20161109,11/9/2016 0:00,87.0,Routine - Unscheduled,2134_20161109_103103,High risk food holding temperature,High Risk,20161109,103103,2016-11-09,0,3,0,0,3,3,0
99,99,132,76615,Top's Cafe,2460 San Bruno Ave,San Francisco,CA,94134,,,,,76615_20160504,5/4/2016 0:00,57.0,Routine - Unscheduled,76615_20160504_103114,High risk vermin infestation,High Risk,20160504,103114,2016-05-04,0,6,0,0,7,8,0
100,100,134,547,LITTLE HENRY'S,3600 BALBOA St,San Francisco,CA,94121,37.775728,-122.497522,"(37.775728, -122.497522)",,547_20160412,4/12/2016 0:00,98.0,Routine - Unscheduled,547_20160412_103142,Unclean nonfood contact surfaces,Low Risk,20160412,103142,2016-04-12,0,0,0,0,3,1,1
101,101,135,70137,Reveille Coffee Co.,200 Columbus St,San Francisco,CA,94133,,,,,70137_20160511,5/11/2016 0:00,89.0,Routine - Unscheduled,70137_20160511_103139,Improper food storage,Low Risk,20160511,103139,2016-05-11,0,1,0,0,0,3,0
102,102,136,86271,Pacific Eatery,977 A North Point St,San Francisco,CA,94109,,,,,86271_20160628,6/28/2016 0:00,87.0,Routine - Unscheduled,86271_20160628_103124,Inadequately cleaned or sanitized food contact surfaces,Moderate Risk,20160628,103124,2016-06-28,0,2,0,0,1,3,0
103,103,137,917,Town & Country Club,218 Stockton St,San Francisco,CA,94108,37.787927,-122.40660700000001,"(37.787927, -122.406607)",,917_20160902,9/2/2016 0:00,96.0,Routine - Unscheduled,917_20160902_103120,Moderate risk food holding temperature,Moderate Risk,20160902,103120,2016-09-02,0,0,0,0,0,1,1
104,104,139,90203,"KBGC, Inc.",275 Battery St,San Francisco,CA,94111,,,,,90203_20180213,2/13/2018 0:00,,Routine - Unscheduled,90203_20180213_103129,Insufficient hot water or running water,Moderate Risk,20180213,103129,2018-02-13,2,0,0,0,0,0,0
105,105,140,76223,AT&T PARK - (CART 6) Espresso & Dessert,24 Willie Mays Plaza,San Francisco,CA,94107,,,,,76223_20160814,8/14/2016 0:00,96.0,Routine - Unscheduled,76223_20160814_103119,Inadequate and inaccessible handwashing facilities,Moderate Risk,20160814,103119,2016-08-14,0,0,1,0,0,1,1
106,106,141,2544,EMPEROR PALACE RESTAURANT,0530 BALBOA St,San Francisco,CA,94118,37.777253,-122.464359,"(37.777253, -122.464359)",,2544_20161205,12/5/2016 0:00,81.0,Routine - Unscheduled,2544_20161205_103133,Foods not protected from contamination,Moderate Risk,20161205,103133,2016-12-05,0,0,6,0,5,0,5
107,107,143,60544,Manzoni,2790 Diamond St,San Francisco,CA,94131,37.73473,-122.433823,"(37.73473, -122.433823)",14155332251.0,60544_20160929,9/29/2016 0:00,92.0,Routine - Unscheduled,60544_20160929_103157,Food safety certificate or food handler card not available,Low Risk,20160929,103157,2016-09-29,0,0,0,2,0,3,0
108,108,146,67985,Moya,121 09th St,San Francisco,CA,94103,37.774722,-122.40676100000002,"(37.774722, -122.406761)",,67985_20160628,6/28/2016 0:00,83.0,Routine - Unscheduled,67985_20160628_103156,Permit license or inspection report not posted,Low Risk,20160628,103156,2016-06-28,0,3,0,0,0,4,0
109,109,148,81680,Sharetea,135 04th St,San Francisco,CA,94103,,,,14155220888.0,81680_20160930,9/30/2016 0:00,94.0,Routine - Unscheduled,81680_20160930_103149,Wiping cloths not clean or properly stored or inadequate sanitizer,Low Risk,20160930,103149,2016-09-30,0,3,0,0,0,2,3
110,110,149,67510,Subway Sandwiches,215 Fremont St,San Francisco,CA,94105,37.788864000000004,-122.39461299999999,"(37.788864, -122.394613)",,67510_20180221,2/21/2018 0:00,,Non-inspection site visit,67510_20180221_103142,Unclean nonfood contact surfaces,Low Risk,20180221,103142,2018-02-21,6,0,0,0,0,3,0
111,111,152,62578,New Chef Hung's Restaurant,823 Clay St,San Francisco,CA,94108,37.794193,-122.406677,"(37.794193, -122.406677)",14155396883.0,62578_20171207,12/7/2017 0:00,66.0,Routine - Unscheduled,62578_20171207_103145,Improper storage of equipment utensils or linens,Low Risk,20171207,103145,2017-12-07,0,10,0,0,0,0,7
112,112,155,140,Cafe Madeleine,300 California St,San Francisco,CA,94104,37.793268,-122.400323,"(37.793268, -122.400323)",,140_20160414,4/14/2016 0:00,85.0,Routine - Unscheduled,140_20160414_103154,Unclean or degraded floors walls or ceilings,Low Risk,20160414,103154,2016-04-14,4,6,0,0,0,4,0
113,113,156,286,PUNJAB KABAB HOUSE,101 EDDY St,San Francisco,CA,94102,37.784303,-122.40964699999999,"(37.784303, -122.409647)",,286_20160607,6/7/2016 0:00,72.0,Routine - Unscheduled,286_20160607_103103,High risk food holding temperature,High Risk,20160607,103103,2016-06-07,0,5,0,0,8,8,0
114,114,157,5486,AT&T - 2114 Portables (Food/Wine Carts),24 WILLIE MAYS PLAZA,San Francisco,CA,94107,,,,14155971500.0,5486_20160814,8/14/2016 0:00,96.0,Routine - Unscheduled,5486_20160814_103129,Insufficient hot water or running water,Moderate Risk,20160814,103129,2016-08-14,0,0,0,0,0,1,1
115,115,161,86567,Poke Bar,1355 Market St,San Francisco,CA,94103,,,,14153557708.0,86567_20180208,2/8/2018 0:00,,Complaint,86567_20180208_103133,Foods not protected from contamination,Moderate Risk,20180208,103133,2018-02-08,4,4,0,0,0,3,0
116,116,162,77484,Ming Kee Restaurant,1548 Ocean Ave,San Francisco,CA,94112,,,,14155338198.0,77484_20160329,3/29/2016 0:00,88.0,Routine - Unscheduled,77484_20160329_103144,Unapproved or unmaintained equipment or utensils,Low Risk,20160329,103144,2016-03-29,0,0,0,0,4,0,5
117,117,163,69181,Cha-Ya Restaurant,762 Valencia St,San Francisco,CA,94110,37.760777000000004,-122.42150500000001,"(37.760777, -122.421505)",14155257825.0,69181_20160330,3/30/2016 0:00,92.0,Routine - Unscheduled,69181_20160330_103120,Moderate risk food holding temperature,Moderate Risk,20160330,103120,2016-03-30,2,0,0,0,1,0,3
118,118,164,3272,Cigar Bar and Grill,850 Montgomery St,San Francisco,CA,94133,37.797137,-122.403586,"(37.797137, -122.403586)",,3272_20151023,10/23/2015 0:00,96.0,Routine - Unscheduled,3272_20151023_103120,Moderate risk food holding temperature,Moderate Risk,20151023,103120,2015-10-23,0,0,0,0,3,0,1
119,119,166,7689,UNOCAL 76  PACIFIC ENTERPRISES,999 OCEAN Ave,San Francisco,CA,94112,37.723133000000004,-122.452707,"(37.723133, -122.452707)",14155588296.0,7689_20160811,8/11/2016 0:00,98.0,Routine - Unscheduled,7689_20160811_103148,No thermometers or uncalibrated thermometers,Low Risk,20160811,103148,2016-08-11,0,0,0,0,0,1,0
120,120,167,5016,The Crab Station of Fisherman's Wharf,Foot of Taylor St #2,San Francisco,CA,94133,37.795202,-122.413169,"(37.795202, -122.413169)",,5016_20171208,12/8/2017 0:00,88.0,Routine - Unscheduled,5016_20171208_103149,Wiping cloths not clean or properly stored or inadequate sanitizer,Low Risk,20171208,103149,2017-12-08,0,4,0,0,5,3,4
121,121,168,89758,An Chi Inc,4683 Mission St,San Francisco,CA,94112,,,,,89758_20171211,12/11/2017 0:00,81.0,Routine - Unscheduled,89758_20171211_103119,Inadequate and inaccessible handwashing facilities,Moderate Risk,20171211,103119,2017-12-11,0,5,0,0,4,0,0
122,122,170,85714,"SK&L Trading, LLC",1101 Stockton St,San Francisco,CA,94133,,,,,85714_20161205,12/5/2016 0:00,77.0,Routine - Unscheduled,85714_20161205_103119,Inadequate and inaccessible handwashing facilities,Moderate Risk,20161205,103119,2016-12-05,0,0,8,0,7,0,0
123,123,172,75223,The Plant Cafe Organic,958 Illinois St,San Francisco,CA,94107,,,,,75223_20180228,2/28/2018 0:00,88.0,Routine - Unscheduled,75223_20180228_103154,Unclean or degraded floors walls or ceilings,Low Risk,20180228,103154,2018-02-28,4,0,0,0,1,0,1
124,124,174,86593,Chestnut Street Coffee Roastery,2331 Chestnut St,San Francisco,CA,94123,,,,14155935282.0,86593_20171207,12/7/2017 0:00,90.0,Routine - Unscheduled,86593_20171207_103138,Improper storage use or identification of toxic substances,Low Risk,20171207,103138,2017-12-07,0,3,0,0,0,2,0
125,125,175,58628,Players,Pier 39  Space L-11,San Francisco,CA,94133,37.80824000000001,-122.41018899999999,"(37.80824, -122.410189)",,58628_20160413,4/13/2016 0:00,87.0,Routine - Unscheduled,58628_20160413_103139,Improper food storage,Low Risk,20160413,103139,2016-04-13,0,4,0,0,0,3,0
126,126,176,5913,ST CHARLES SCHOOL,3250 18th St,San Francisco,CA,94110,37.762074,-122.41610700000001,"(37.762074, -122.416107)",14155867652.0,5913_20160906,9/6/2016 0:00,92.0,Routine - Unscheduled,5913_20160906_103131,Moderate risk vermin infestation,Moderate Risk,20160906,103131,2016-09-06,0,0,0,0,4,2,1
127,127,178,2755,SOCIALE,3665 SACRAMENTO St,San Francisco,CA,94118,37.787364000000004,-122.45298999999999,"(37.787364, -122.45299)",14155920309.0,2755_20161205,12/5/2016 0:00,85.0,Routine - Unscheduled,2755_20161205_103114,High risk vermin infestation,High Risk,20161205,103114,2016-12-05,0,0,0,0,4,0,2
128,128,181,2292,ORIENTAL SEAFOOD RESTAURANT,2520 NORIEGA St,San Francisco,CA,94122,37.753638,-122.49071200000002,"(37.753638, -122.490712)",,2292_20160414,4/14/2016 0:00,90.0,Routine - Unscheduled,2292_20160414_103154,Unclean or degraded floors walls or ceilings,Low Risk,20160414,103154,2016-04-14,0,5,0,0,6,3,8
129,129,182,65873,Capurro's,498 Jefferson St,San Francisco,CA,94109,37.807649,-122.420744,"(37.807649, -122.420744)",,65873_20171208,12/8/2017 0:00,91.0,Routine - Unscheduled,65873_20171208_103156,Permit license or inspection report not posted,Low Risk,20171208,103156,2017-12-08,0,2,0,0,0,5,1
130,130,186,35852,Beach Street Grill,380 Beach St,San Francisco,CA,94133,37.807358,-122.41529399999999,"(37.807358, -122.415294)",,35852_20161205,12/5/2016 0:00,94.0,Routine - Unscheduled,35852_20161205_103154,Unclean or degraded floors walls or ceilings,Low Risk,20161205,103154,2016-12-05,5,0,3,0,3,4,0
131,131,187,134,Mint,400 McAllister St,San Francisco,CA,94102,37.780246999999996,-122.418974,"(37.780247, -122.418974)",,134_20150806,8/6/2015 0:00,98.0,Routine - Unscheduled,134_20150806_103145,Improper storage of equipment utensils or linens,Low Risk,20150806,103145,2015-08-06,0,0,0,0,1,0,1
132,132,189,74358,Mikkeller Bar,34 Mason St,San Francisco,CA,94102,,,,,74358_20160511,5/11/2016 0:00,90.0,Routine - Unscheduled,74358_20160511_103142,Unclean nonfood contact surfaces,Low Risk,20160511,103142,2016-05-11,0,3,0,0,2,4,0
133,133,194,82105,Five Sweets,1125 Ocean Ave 102,San Francisco,CA,94112,,,,14155683731.0,82105_20160812,8/12/2016 0:00,90.0,Routine - Unscheduled,82105_20160812_103157,Food safety certificate or food handler card not available,Low Risk,20160812,103157,2016-08-12,0,0,0,3,0,5,4
134,134,196,92751,The Grubbies,123 02nd St,San Francisco,CA,94105,,,,,92751_20171117,11/17/2017 0:00,72.0,Routine - Unscheduled,92751_20171117_103129,Insufficient hot water or running water,Moderate Risk,20171117,103129,2017-11-17,0,6,0,0,0,0,0
135,135,197,86166,May Sun Market LLC,1101 Grant Ave,San Francisco,CA,94133,,,,,86166_20160823,8/23/2016 0:00,81.0,Routine - Unscheduled,86166_20160823_103119,Inadequate and inaccessible handwashing facilities,Moderate Risk,20160823,103119,2016-08-23,0,6,0,0,0,5,5
136,136,199,1261,REVERIE COFFEE CAFE,848 COLE St,San Francisco,CA,94117,37.766096999999995,-122.449997,"(37.766097, -122.449997)",14155240200.0,1261_20171212,12/12/2017 0:00,,Reinspection/Followup,1261_20171212_103139,Improper food storage,Low Risk,20171212,103139,2017-12-12,0,1,0,0,0,0,2
137,137,200,62064,California Grocery,123 Eddy St,San Francisco,CA,94102,37.784303,-122.40964699999999,"(37.784303, -122.409647)",14155448608.0,62064_20160411,4/11/2016 0:00,75.0,Routine - Unscheduled,62064_20160411_103150,Improper or defective plumbing,Low Risk,20160411,103150,2016-04-11,0,3,0,0,0,5,0
138,138,202,13814,Go Go Market & Deli,99 09th St,San Francisco,CA,94103,37.774722,-122.40676100000002,"(37.774722, -122.406761)",14155863536.0,13814_20160930,9/30/2016 0:00,82.0,Routine - Unscheduled,13814_20160930_103124,Inadequately cleaned or sanitized food contact surfaces,Moderate Risk,20160930,103124,2016-09-30,0,4,0,0,0,5,2
139,139,204,75681,Tokyo Express Battery,77 Battery St Suite 100,San Francisco,CA,94111,,,,,75681_20160608,6/8/2016 0:00,83.0,Routine - Unscheduled,75681_20160608_103103,High risk food holding temperature,High Risk,20160608,103103,2016-06-08,0,8,0,0,0,4,0
140,140,206,2061,ATAMI SUSHI BAR & GRILL,1662 LOMBARD St,San Francisco,CA,94123,37.800788,-122.428894,"(37.800788, -122.428894)",14155611958.0,2061_20180223,2/23/2018 0:00,94.0,Routine - Unscheduled,2061_20180223_103133,Foods not protected from contamination,Moderate Risk,20180223,103133,2018-02-23,2,0,0,0,0,0,0
141,141,208,86180,"Tian Tian Market, Inc.",1117 Stockton St,San Francisco,CA,94133,,,,,86180_20161205,12/5/2016 0:00,84.0,Routine - Unscheduled,86180_20161205_103147,Inadequate ventilation or lighting,Low Risk,20161205,103147,2016-12-05,0,0,5,0,8,0,0
142,142,209,66990,Bai Som Thai Kitchen,2121 CLEMENT St,San Francisco,CA,94121,37.782103,-122.48208899999999,"(37.782103, -122.482089)",,66990_20160601,6/1/2016 0:00,86.0,Routine - Unscheduled,66990_20160601_103138,Improper storage use or identification of toxic substances,Low Risk,20160601,103138,2016-06-01,0,0,4,0,0,4,0
143,143,213,75523,Brioche Bakery & Cafe,210 Columbus Ave,San Francisco,CA,94133,,,,,75523_20160511,5/11/2016 0:00,81.0,Routine - Unscheduled,75523_20160511_103156,Permit license or inspection report not posted,Low Risk,20160511,103156,2016-05-11,0,1,0,0,0,6,0
144,144,215,72120,Heartbaker LLC,1408 Clement St,San Francisco,CA,94118,,,,,72120_20160412,4/12/2016 0:00,88.0,Routine - Unscheduled,72120_20160412_103132,Improper thawing methods,Moderate Risk,20160412,103132,2016-04-12,0,0,4,0,3,4,0
145,145,217,1124,SQUAT & GOBBLE CAFE #3,3600 16th St,San Francisco,CA,94114,37.764247999999995,-122.433392,"(37.764248, -122.433392)",,1124_20171114,11/14/2017 0:00,80.0,Routine - Unscheduled,1124_20171114_103144,Unapproved or unmaintained equipment or utensils,Low Risk,20171114,103144,2017-11-14,0,2,0,0,0,0,3
146,146,218,7610,UNIMART,1201 HOWARD St,San Francisco,CA,94103,37.776098,-122.41171200000001,"(37.776098, -122.411712)",,7610_20171208,12/8/2017 0:00,98.0,Routine - Unscheduled,7610_20171208_103139,Improper food storage,Low Risk,20171208,103139,2017-12-08,0,1,0,0,1,1,1
147,147,219,63082,The Brick Yard,1787 Union St,San Francisco,CA,94123,37.797933,-122.428627,"(37.797933, -122.428627)",14156677676.0,63082_20180222,2/22/2018 0:00,87.0,Routine - Unscheduled,63082_20180222_103133,Foods not protected from contamination,Moderate Risk,20180222,103133,2018-02-22,3,0,4,2,0,0,1
148,148,220,35855,Lava Restaurant & Lounge,527 BRYANT St,San Francisco,CA,94107,37.780728,-122.39652199999999,"(37.780728, -122.396522)",,35855_20170105,1/5/2017 0:00,87.0,Routine - Unscheduled,35855_20170105_103109,Unclean or unsanitary food contact surfaces,High Risk,20170105,103109,2017-01-05,0,2,0,0,3,0,0
149,149,221,91999,Little Swan Bakery,1249 Stockton St,San Francisco,CA,94133,,,,14156622052.0,91999_20170718,7/18/2017 0:00,90.0,Routine - Unscheduled,91999_20170718_103144,Unapproved or unmaintained equipment or utensils,Low Risk,20170718,103144,2017-07-18,4,0,3,0,0,0,0
150,150,222,24279,Park Gyros,1201 09th Ave,San Francisco,CA,94122,37.758941,-122.48591,"(37.758941, -122.48591)",,24279_20160815,8/15/2016 0:00,94.0,Routine - Unscheduled,24279_20160815_103124,Inadequately cleaned or sanitized food contact surfaces,Moderate Risk,20160815,103124,2016-08-15,3,0,0,0,0,2,0
151,151,225,82945,Smitten Ice Cream,2404 California St,San Francisco,CA,94115,,,,,82945_20160927,9/27/2016 0:00,94.0,Routine - Unscheduled,82945_20160927_103131,Moderate risk vermin infestation,Moderate Risk,20160927,103131,2016-09-27,0,1,0,0,0,2,3
152,152,228,39888,Henry's Hunan Restaurant,1708 CHURCH St,San Francisco,CA,94131,37.743427000000004,-122.42666399999999,"(37.743427, -122.426664)",,39888_20160929,9/29/2016 0:00,94.0,Routine - Unscheduled,39888_20160929_103120,Moderate risk food holding temperature,Moderate Risk,20160929,103120,2016-09-29,4,0,0,2,0,2,4
153,153,229,1970,MICADO  RESTAURANT,2126 IRVING St,San Francisco,CA,94122,37.763467999999996,-122.480646,"(37.763468, -122.480646)",,1970_20161207,12/7/2016 0:00,86.0,Routine - Unscheduled,1970_20161207_103124,Inadequately cleaned or sanitized food contact surfaces,Moderate Risk,20161207,103124,2016-12-07,0,4,0,0,5,4,0
154,154,230,4685,NORMAN'S LIQUOR & DELI,733 Randolph St,San Francisco,CA,94132,37.714203999999995,-122.46919299999999,"(37.714204, -122.469193)",14155580088.0,4685_20161203,12/3/2016 0:00,96.0,Routine - Unscheduled,4685_20161203_103156,Permit license or inspection report not posted,Low Risk,20161203,103156,2016-12-03,0,0,3,4,2,0,3
155,155,234,80767,Mainland Market Co.,5601 Geary Blvd,San Francisco,CA,94121,,,,14155257919.0,80767_20180223,2/23/2018 0:00,85.0,Routine - Unscheduled,80767_20180223_103162,Other low risk violation,Low Risk,20180223,103162,2018-02-23,4,0,0,0,0,3,3
156,156,235,1018,PETES BARBEQUE,2399 MISSION St,San Francisco,CA,94110,37.758684,-122.418975,"(37.758684, -122.418975)",14155821009.0,1018_20170718,7/18/2017 0:00,,Complaint,1018_20170718_103124,Inadequately cleaned or sanitized food contact surfaces,Moderate Risk,20170718,103124,2017-07-18,4,0,4,0,0,1,0
157,157,238,77031,Golden Horse Restaurant,1060 Hyde St,San Francisco,CA,94109,,,,,77031_20160930,9/30/2016 0:00,68.0,Routine - Unscheduled,77031_20160930_103102,Unclean hands or improper use of gloves,High Risk,20160930,103102,2016-09-30,6,0,0,3,0,8,4
158,158,239,37389,China House Jumbo Seafood Restaurant,2237 Powell Street,San Francisco,CA,94133,37.805514,-122.411914,"(37.805514, -122.411914)",,37389_20161205,12/5/2016 0:00,90.0,Routine - Unscheduled,37389_20161205_103145,Improper storage of equipment utensils or linens,Low Risk,20161205,103145,2016-12-05,4,0,0,0,4,5,2
159,159,243,7496,Peralta,Pier 41,San Francisco,CA,94133,37.808494,-122.412,"(37.808494, -122.412)",,7496_20160518,5/18/2016 0:00,88.0,Routine - Unscheduled,7496_20160518_103142,Unclean nonfood contact surfaces,Low Risk,20160518,103142,2016-05-18,0,0,0,0,1,4,0
160,160,247,1005,CHAVITA'S MEXICAN RESTAURANT,3006 MISSION St,San Francisco,CA,94110,37.748855,-122.41813400000001,"(37.748855, -122.418134)",14155286927.0,1005_20160502,5/2/2016 0:00,84.0,Routine - Unscheduled,1005_20160502_103131,Moderate risk vermin infestation,Moderate Risk,20160502,103131,2016-05-02,5,0,9,0,0,5,0
161,161,248,2110,A La Turca,869 Geary St,San Francisco,CA,94109,37.786143,-122.41761699999999,"(37.786143, -122.417617)",,2110_20160906,9/6/2016 0:00,63.0,Routine - Unscheduled,2110_20160906_103143,Inadequate warewashing facilities or equipment,Low Risk,20160906,103143,2016-09-06,6,0,6,0,0,11,0
162,162,249,81758,Super Save Supermarket,4517 03rd St,San Francisco,CA,94124,,,,,81758_20160404,4/4/2016 0:00,88.0,Routine - Unscheduled,81758_20160404_103161,Low risk vermin infestation,Low Risk,20160404,103161,2016-04-04,0,7,0,0,0,4,3
163,163,250,64805,Andersen Bread,1390 Market St Suite 110,San Francisco,CA,94102,37.777053,-122.41693899999999,"(37.777053, -122.416939)",14150427100.0,64805_20170105,1/5/2017 0:00,94.0,Routine - Unscheduled,64805_20170105_103120,Moderate risk food holding temperature,Moderate Risk,20170105,103120,2017-01-05,0,0,0,0,2,4,0
164,164,251,999,SERRANO'S PIZZA II,3274 21st St,San Francisco,CA,94110,37.756997,-122.420534,"(37.756997, -122.420534)",14155691615.0,999_20160503,5/3/2016 0:00,81.0,Routine - Unscheduled,999_20160503_103133,Foods not protected from contamination,Moderate Risk,20160503,103133,2016-05-03,7,0,6,0,0,5,4
165,165,254,79829,Aracely Restaurant,401 13th St,San Francisco,CA,94130,,,,,79829_20161207,12/7/2016 0:00,90.0,Routine - Unscheduled,79829_20161207_103120,Moderate risk food holding temperature,Moderate Risk,20161207,103120,2016-12-07,0,0,0,0,4,0,0
166,166,256,38179,Hillstone Restaurant,1800 Montgomery St,San Francisco,CA,94111,37.805642999999996,-122.40529,"(37.805643, -122.40529)",,38179_20160517,5/17/2016 0:00,90.0,Routine - Unscheduled,38179_20160517_103120,Moderate risk food holding temperature,Moderate Risk,20160517,103120,2016-05-17,0,3,0,0,0,3,0
167,167,258,73,DINO'S UNCLE VITO,2101 Fillmore St,San Francisco,CA,94115,37.788932,-122.43389499999999,"(37.788932, -122.433895)",,73_20160927,9/27/2016 0:00,92.0,Routine - Unscheduled,73_20160927_103149,Wiping cloths not clean or properly stored or inadequate sanitizer,Low Risk,20160927,103149,2016-09-27,0,4,0,0,0,3,5
168,168,259,87932,Dabba,71 Stevenson St #100,San Francisco,CA,94105,,,,,87932_20180228,2/28/2018 0:00,92.0,Routine - Unscheduled,87932_20180228_103134,Other moderate risk violation,Moderate Risk,20180228,103134,2018-02-28,2,0,0,0,3,0,0
169,169,261,17947,Um Ma Son,5850 GEARY BLVD,San Francisco,CA,94121,37.780278,-122.48231100000001,"(37.780278, -122.482311)",,17947_20160510,5/10/2016 0:00,84.0,Routine - Unscheduled,17947_20160510_103133,Foods not protected from contamination,Moderate Risk,20160510,103133,2016-05-10,0,4,0,0,0,6,0
170,170,263,4874,JUMP START COFFEE & GROCERY,1192 GUERRERO St,San Francisco,CA,94110,37.752117999999996,-122.42291399999999,"(37.752118, -122.422914)",14155647555.0,4874_20160502,5/2/2016 0:00,90.0,Routine - Unscheduled,4874_20160502_103149,Wiping cloths not clean or properly stored or inadequate sanitizer,Low Risk,20160502,103149,2016-05-02,4,0,4,0,0,3,0
171,171,264,66255,Tempest,431 NATOMA St,San Francisco,CA,94103,37.781249,-122.406222,"(37.781249, -122.406222)",,66255_20161206,12/6/2016 0:00,86.0,Routine - Unscheduled,66255_20161206_103124,Inadequately cleaned or sanitized food contact surfaces,Moderate Risk,20161206,103124,2016-12-06,2,0,0,0,4,5,0
172,172,265,83553,B On The Go LLC,2794 California St,San Francisco,CA,94115,,,,,83553_20160928,9/28/2016 0:00,92.0,Routine - Unscheduled,83553_20160928_103120,Moderate risk food holding temperature,Moderate Risk,20160928,103120,2016-09-28,2,0,0,0,0,2,0
173,173,266,2943,Tarantino's,206 Jefferson St,San Francisco,CA,94133,37.808138,-122.41665400000001,"(37.808138, -122.416654)",,2943_20160510,5/10/2016 0:00,75.0,Routine - Unscheduled,2943_20160510_103139,Improper food storage,Low Risk,20160510,103139,2016-05-10,0,7,0,0,0,5,0
174,174,268,6654,HIEP-THANH MARKET,724 LARKIN St,San Francisco,CA,94109,37.784597999999995,-122.41775700000001,"(37.784598, -122.417757)",,6654_20160121,1/21/2016 0:00,70.0,Routine - Unscheduled,6654_20160121_103120,Moderate risk food holding temperature,Moderate Risk,20160121,103120,2016-01-21,7,0,9,0,0,0,11
175,175,269,60518,Ninki Sushi Bar & Restaurant,1439 TARAVAL St,San Francisco,CA,94116,37.742743,-122.481749,"(37.742743, -122.481749)",,60518_20160511,5/11/2016 0:00,86.0,Routine - Unscheduled,60518_20160511_103132,Improper thawing methods,Moderate Risk,20160511,103132,2016-05-11,0,0,5,0,0,5,0
176,176,270,79753,Mazarine Coffee,720 Market St,San Francisco,CA,94102,,,,,79753_20161014,10/14/2016 0:00,94.0,Routine - Unscheduled,79753_20161014_103139,Improper food storage,Low Risk,20161014,103139,2016-10-14,0,0,0,0,3,0,0
177,177,275,1641,MARTHA & BROS. COFFEE CO,1551 Church St,San Francisco,CA,94131,37.745974,-122.426856,"(37.745974, -122.426856)",14155641166.0,1641_20160812,8/12/2016 0:00,84.0,Routine - Unscheduled,1641_20160812_103145,Improper storage of equipment utensils or linens,Low Risk,20160812,103145,2016-08-12,0,0,4,6,0,6,4
178,178,276,32862,Naked Fish Sushi & Lounge Inc,2084 CHESTNUT St,San Francisco,CA,94123,37.800684999999994,-122.43771000000001,"(37.800685, -122.43771)",,32862_20160628,6/28/2016 0:00,92.0,Routine - Unscheduled,32862_20160628_103124,Inadequately cleaned or sanitized food contact surfaces,Moderate Risk,20160628,103124,2016-06-28,0,2,0,0,0,2,0
179,179,277,88433,The Elite Cafe,2049 Fillmore St,San Francisco,CA,94115,,,,,88433_20161118,11/18/2016 0:00,96.0,Routine - Unscheduled,88433_20161118_103124,Inadequately cleaned or sanitized food contact surfaces,Moderate Risk,20161118,103124,2016-11-18,0,0,0,0,1,0,0
180,180,279,78756,Charlie's Kwik Stop Market & Liquor,153 Bacon St,San Francisco,CA,94134,,,,14155495591.0,78756_20160519,5/19/2016 0:00,90.0,Routine - Unscheduled,78756_20160519_103157,Food safety certificate or food handler card not available,Low Risk,20160519,103157,2016-05-19,0,0,0,0,2,4,0
181,181,280,62900,Curbside Cafe,2417 CALIFORNIA St,San Francisco,CA,94115,37.788821999999996,-122.43411599999999,"(37.788822, -122.434116)",,62900_20161017,10/17/2016 0:00,83.0,Routine - Unscheduled,62900_20161017_103116,Inadequate food safety knowledge or lack of certified food safety manager,Moderate Risk,20161017,103116,2016-10-17,4,0,0,0,4,0,3
182,182,282,39053,Specialty's Cafe & Bakery,101 New Montgomery St,San Francisco,CA,94105,37.787254,-122.40021200000001,"(37.787254, -122.400212)",,39053_20160812,8/12/2016 0:00,85.0,Routine - Unscheduled,39053_20160812_103157,Food safety certificate or food handler card not available,Low Risk,20160812,103157,2016-08-12,0,0,0,0,0,4,0
183,183,283,70225,Arguello Market Corp.,782 ARGUELLO Blvd,San Francisco,CA,94118,,,,14155755121.0,70225_20160223,2/23/2016 0:00,90.0,Routine - Unscheduled,70225_20160223_103161,Low risk vermin infestation,Low Risk,20160223,103161,2016-02-23,0,2,0,0,0,0,3
184,184,285,16349,L's Cafe,2871 24th St,San Francisco,CA,94110,37.752764,-122.40958799999999,"(37.752764, -122.409588)",,16349_20180227,2/27/2018 0:00,90.0,Routine - Unscheduled,16349_20180227_103157,Food safety certificate or food handler card not available,Low Risk,20180227,103157,2018-02-27,5,0,3,4,4,3,3
185,185,286,5033,DESTINATION BAKING COMPANY,598 Chenery St,San Francisco,CA,94131,37.734619,-122.432379,"(37.734619, -122.432379)",14155460730.0,5033_20170104,1/4/2017 0:00,86.0,Routine - Unscheduled,5033_20170104_103147,Inadequate ventilation or lighting,Low Risk,20170104,103147,2017-01-04,0,0,2,0,3,3,0
186,186,289,68254,Four Barrel Coffee,2599 San Bruno Ave,San Francisco,CA,94103,37.776416999999995,-122.43803700000001,"(37.776417, -122.438037)",,68254_20160628,6/28/2016 0:00,90.0,Routine - Unscheduled,68254_20160628_103145,Improper storage of equipment utensils or linens,Low Risk,20160628,103145,2016-06-28,0,0,0,0,0,3,0
187,187,290,76685,Jane,925 Larkin St,San Francisco,CA,94109,,,,,76685_20171208,12/8/2017 0:00,86.0,Routine - Unscheduled,76685_20171208_103149,Wiping cloths not clean or properly stored or inadequate sanitizer,Low Risk,20171208,103149,2017-12-08,0,6,5,0,0,0,3
188,188,291,2249,Ramzi's Cafe,0044 Montgomery St  LL1,San Francisco,CA,94104,37.789552,-122.401999,"(37.789552, -122.401999)",,2249_20171204,12/4/2017 0:00,88.0,Routine - Unscheduled,2249_20171204_103144,Unapproved or unmaintained equipment or utensils,Low Risk,20171204,103144,2017-12-04,0,5,0,0,0,3,4
189,189,292,5853,RAOUL WALLENBERG HIGH SCHOOL,40 VEGA St,San Francisco,CA,94115,37.780133,-122.44586399999999,"(37.780133, -122.445864)",14155743469.0,5853_20180227,2/27/2018 0:00,94.0,Routine - Unscheduled,5853_20180227_103147,Inadequate ventilation or lighting,Low Risk,20180227,103147,2018-02-27,2,1,0,0,1,0,1
190,190,293,85097,Alimento,507 Columbus Ave,San Francisco,CA,94133,,,,,85097_20151009,10/9/2015 0:00,,New Ownership,85097_20151009_103124,Inadequately cleaned or sanitized food contact surfaces,Moderate Risk,20151009,103124,2015-10-09,0,0,0,0,1,0,3
191,191,295,60823,Trace Restaurant,181 3rd St 1/F,San Francisco,CA,94103,37.785207,-122.40062900000001,"(37.785207, -122.400629)",,60823_20171113,11/13/2017 0:00,92.0,Routine - Unscheduled,60823_20171113_103154,Unclean or degraded floors walls or ceilings,Low Risk,20171113,103154,2017-11-13,0,3,0,0,0,3,2
192,192,297,4797,"Good Life Grocery, The",448 CORTLAND Ave,San Francisco,CA,94110,37.73905300000001,-122.416683,"(37.739053, -122.416683)",14155643221.0,4797_20171130,11/30/2017 0:00,86.0,Routine - Unscheduled,4797_20171130_103132,Improper thawing methods,Moderate Risk,20171130,103132,2017-11-30,0,4,0,3,0,4,3
193,193,298,60555,Farm Fresh Underground,1650 Holloway Ave LC,San Francisco,CA,94132,37.720894,-122.478029,"(37.720894, -122.478029)",,60555_20160518,5/18/2016 0:00,94.0,Routine - Unscheduled,60555_20160518_103149,Wiping cloths not clean or properly stored or inadequate sanitizer,Low Risk,20160518,103149,2016-05-18,0,0,0,0,0,2,1
194,194,299,1843,Ma's Dim Sum & Cafe,1315 Powell St,San Francisco,CA,94133,37.796683,-122.41013400000001,"(37.796683, -122.410134)",,1843_20160216,2/16/2016 0:00,57.0,Routine - Unscheduled,1843_20160216_103102,Unclean hands or improper use of gloves,High Risk,20160216,103102,2016-02-16,0,9,0,0,0,0,7
195,195,300,3429,"Safeway Stores, Inc. #1206",350 Bay St,San Francisco,CA,94133,37.805758000000004,-122.412774,"(37.805758, -122.412774)",,3429_20161202,12/2/2016 0:00,90.0,Routine - Unscheduled,3429_20161202_103130,Inadequate sewage or wastewater disposal,Moderate Risk,20161202,103130,2016-12-02,0,4,0,0,3,4,0
196,196,301,1579,Nick's Lighthouse,Foot of Taylor St 5,San Francisco,CA,94133,37.802479,-122.41123400000001,"(37.802479, -122.411234)",,1579_20171211,12/11/2017 0:00,92.0,Routine - Unscheduled,1579_20171211_103120,Moderate risk food holding temperature,Moderate Risk,20171211,103120,2017-12-11,0,3,0,0,3,5,3
197,197,302,59153,Union Square Sports Bar,115 Mason St,San Francisco,CA,94102,37.78453,-122.409392,"(37.78453, -122.409392)",,59153_20161020,10/20/2016 0:00,77.0,Routine - Unscheduled,59153_20161020_103139,Improper food storage,Low Risk,20161020,103139,2016-10-20,0,7,0,0,8,4,0
198,198,303,37462,Jenny's Burger,1233 09th Ave,San Francisco,CA,94122,37.758941,-122.48591,"(37.758941, -122.48591)",,37462_20160520,5/20/2016 0:00,96.0,Routine - Unscheduled,37462_20160520_103120,Moderate risk food holding temperature,Moderate Risk,20160520,103120,2016-05-20,0,2,0,0,0,1,0
199,199,305,6863,Cheese Plus,2001 Polk St,San Francisco,CA,94109,37.795273,-122.42166499999999,"(37.795273, -122.421665)",,6863_20160328,3/28/2016 0:00,98.0,Routine - Unscheduled,6863_20160328_103149,Wiping cloths not clean or properly stored or inadequate sanitizer,Low Risk,20160328,103149,2016-03-28,4,0,4,0,1,0,1
200,200,308,88340,Joyful Kitchen,1919 Ocean Ave,San Francisco,CA,94127,,,,14155331919.0,88340_20160811,8/11/2016 0:00,84.0,Routine - Unscheduled,88340_20160811_103139,Improper food storage,Low Risk,20160811,103139,2016-08-11,0,0,3,0,0,1,0
201,201,311,70459,Garaje,475 03rd St,San Francisco,CA,94107,37.781572,-122.39608100000001,"(37.781572, -122.396081)",,70459_20151202,12/2/2015 0:00,92.0,Routine - Unscheduled,70459_20151202_103144,Unapproved or unmaintained equipment or utensils,Low Risk,20151202,103144,2015-12-02,0,4,0,0,0,0,3
202,202,312,67743,After Osha,432 Sutter St,San Francisco,CA,94108,37.789413,-122.40751100000001,"(37.789413, -122.407511)",,67743_20161019,10/19/2016 0:00,75.0,Routine - Unscheduled,67743_20161019_103154,Unclean or degraded floors walls or ceilings,Low Risk,20161019,103154,2016-10-19,0,0,0,0,6,0,4
203,203,313,64076,The Sycamore,2140 MISSION St,San Francisco,CA,94110,37.762789,-122.419495,"(37.762789, -122.419495)",,64076_20160412,4/12/2016 0:00,,Complaint,64076_20160412_103154,Unclean or degraded floors walls or ceilings,Low Risk,20160412,103154,2016-04-12,0,5,0,0,4,6,4
204,204,317,63258,Greenhouse Cafe,329 WEST PORTAL Ave,San Francisco,CA,94127,37.737539,-122.469495,"(37.737539, -122.469495)",,63258_20160607,6/7/2016 0:00,92.0,Routine - Unscheduled,63258_20160607_103157,Food safety certificate or food handler card not available,Low Risk,20160607,103157,2016-06-07,0,0,0,0,0,4,0
205,205,318,81328,Emanuel Coffee,488 Haight St,San Francisco,CA,94117,,,,14155670782.0,81328_20171208,12/8/2017 0:00,84.0,Routine - Unscheduled,81328_20171208_103114,High risk vermin infestation,High Risk,20171208,103114,2017-12-08,1,3,0,0,0,5,0
206,206,319,61856,Yoppi Yogurt,101 California St,San Francisco,CA,94111,37.793424,-122.398168,"(37.793424, -122.398168)",14155264677.0,61856_20160413,4/13/2016 0:00,90.0,Routine - Unscheduled,61856_20160413_103156,Permit license or inspection report not posted,Low Risk,20160413,103156,2016-04-13,0,0,0,3,0,3,0
207,207,320,386,ADELITA'S CAKES,3780 MISSION St,San Francisco,CA,94110,37.736304,-122.42443200000001,"(37.736304, -122.424432)",,386_20160429,4/29/2016 0:00,82.0,Routine - Unscheduled,386_20160429_103147,Inadequate ventilation or lighting,Low Risk,20160429,103147,2016-04-29,0,6,0,0,0,8,4
208,208,325,4804,SUBWAY #31419,2599 SAN BRUNO Ave,San Francisco,CA,94134,37.72893300000001,-122.40413000000001,"(37.728933, -122.40413)",14150540880.0,4804_20161206,12/6/2016 0:00,86.0,Routine - Unscheduled,4804_20161206_103150,Improper or defective plumbing,Low Risk,20161206,103150,2016-12-06,0,4,0,0,4,3,2
209,209,326,2724,HUNAN EMPIRE,2001 Union St #107,San Francisco,CA,94123,37.797443,-122.43253700000001,"(37.797443, -122.432537)",14155774735.0,2724_20160929,9/29/2016 0:00,92.0,Routine - Unscheduled,2724_20160929_103119,Inadequate and inaccessible handwashing facilities,Moderate Risk,20160929,103119,2016-09-29,3,0,3,0,0,2,3
210,210,328,1434,HOLEY BAGEL BAKERY,3872 24th St,San Francisco,CA,94114,37.751628000000004,-122.42912199999999,"(37.751628, -122.429122)",,1434_20161205,12/5/2016 0:00,96.0,Routine - Unscheduled,1434_20161205_103141,Improper food labeling or menu misrepresentation,Low Risk,20161205,103141,2016-12-05,0,3,0,0,2,0,1
211,211,329,5813,LICK MIDDLE SCHOOL,1220 Noe St,San Francisco,CA,94114,37.74949,-122.43175,"(37.74949, -122.43175)",14155816139.0,5813_20151021,10/21/2015 0:00,96.0,Routine - Unscheduled,5813_20151021_103120,Moderate risk food holding temperature,Moderate Risk,20151021,103120,2015-10-21,2,1,0,0,0,1,1
212,212,330,1754,Fisherman's Pizzeria Inc [#50],2800 Leavenworth St,San Francisco,CA,94133,37.807167,-122.41893600000002,"(37.807167, -122.418936)",,1754_20161202,12/2/2016 0:00,86.0,Routine - Unscheduled,1754_20161202_103119,Inadequate and inaccessible handwashing facilities,Moderate Risk,20161202,103119,2016-12-02,0,4,0,0,5,0,6
213,213,331,3328,Gary Danko,800 North Point St,San Francisco,CA,94109,37.805728,-122.42056399999998,"(37.805728, -122.420564)",,3328_20160510,5/10/2016 0:00,92.0,Routine - Unscheduled,3328_20160510_103161,Low risk vermin infestation,Low Risk,20160510,103161,2016-05-10,1,0,0,0,0,4,0
214,214,333,5841,JEFFERSON ELEMENTARY SCHOOL,1725 IRVING St,San Francisco,CA,94122,37.763543,-122.47633200000001,"(37.763543, -122.476332)",14155752821.0,5841_20160506,5/6/2016 0:00,91.0,Routine - Unscheduled,5841_20160506_103144,Unapproved or unmaintained equipment or utensils,Low Risk,20160506,103144,2016-05-06,0,0,0,2,3,1,2
215,215,335,4801,YICK'S LIQUOR,4701 MISSION St,San Francisco,CA,94112,37.72304000000001,-122.43601699999999,"(37.72304, -122.436017)",14155582662.0,4801_20161110,11/10/2016 0:00,94.0,Routine - Unscheduled,4801_20161110_103119,Inadequate and inaccessible handwashing facilities,Moderate Risk,20161110,103119,2016-11-10,0,1,0,0,2,2,0
216,216,336,82538,Montesacro,510 Stevenson St,San Francisco,CA,94103,,,,,82538_20180222,2/22/2018 0:00,96.0,Routine - Unscheduled,82538_20180222_103131,Moderate risk vermin infestation,Moderate Risk,20180222,103131,2018-02-22,1,0,0,0,1,4,0
217,217,337,67567,Rolling-Out,1722 Taraval St,San Francisco,CA,94116,37.74267800000001,-122.484682,"(37.742678, -122.484682)",,67567_20170104,1/4/2017 0:00,94.0,Routine - Unscheduled,67567_20170104_103124,Inadequately cleaned or sanitized food contact surfaces,Moderate Risk,20170104,103124,2017-01-04,3,0,0,0,2,3,0
218,218,338,3476,GRAND LODGE OF CALIFORNIA,5051 MISSION St,San Francisco,CA,94112,37.71765900000001,-122.44005,"(37.717659, -122.44005)",,3476_20180226,2/26/2018 0:00,96.0,Routine - Unscheduled,3476_20180226_103139,Improper food storage,Low Risk,20180226,103139,2018-02-26,2,0,0,0,4,3,0
219,219,339,82803,Old Bus Tavern,3193 Mission St,San Francisco,CA,94110,,,,,82803_20160810,8/10/2016 0:00,94.0,Routine - Unscheduled,82803_20160810_103127,Noncompliance with HAACP plan or variance,Moderate Risk,20160810,103127,2016-08-10,0,0,0,0,1,2,0
220,220,340,7744,SAFEWAY #759,625 MONTEREY Blvd,San Francisco,CA,94127,37.731522999999996,-122.45005,"(37.731523, -122.45005)",14155582421.0,7744_20160809,8/9/2016 0:00,98.0,Routine - Unscheduled,7744_20160809_103144,Unapproved or unmaintained equipment or utensils,Low Risk,20160809,103144,2016-08-09,0,0,4,0,0,1,4
221,221,342,9869,Donut World,1399 09th Ave,San Francisco,CA,94122,37.758941,-122.48591,"(37.758941, -122.48591)",,9869_20160520,5/20/2016 0:00,98.0,Routine - Unscheduled,9869_20160520_103154,Unclean or degraded floors walls or ceilings,Low Risk,20160520,103154,2016-05-20,1,0,0,0,0,1,0
222,222,344,2898,The Cheesecake Factory,"251 Geary St, 8th Floor",San Francisco,CA,94102,37.787423,-122.407417,"(37.787423, -122.407417)",,2898_20150818,8/18/2015 0:00,81.0,Routine - Unscheduled,2898_20150818_103150,Improper or defective plumbing,Low Risk,20150818,103150,2015-08-18,0,0,0,0,3,0,6
223,223,345,19373,Las Isletas,4508 03rd St,San Francisco,CA,94124,37.737021,-122.39004299999999,"(37.737021, -122.390043)",14155577698.0,19373_20180103,1/3/2018 0:00,73.0,Routine - Unscheduled,19373_20180103_103132,Improper thawing methods,Moderate Risk,20180103,103132,2018-01-03,7,0,0,7,7,0,3
224,224,347,5990,MISSION YMCA SENIOR MEALS PROGRAM,4080 MISSION St,San Francisco,CA,94112,37.732292,-122.42783100000001,"(37.732292, -122.427831)",,5990_20160930,9/30/2016 0:00,98.0,Routine - Unscheduled,5990_20160930_103157,Food safety certificate or food handler card not available,Low Risk,20160930,103157,2016-09-30,0,0,0,0,0,1,1
225,225,352,69618,Fancy Wheatfield Bakery,1362 Stockton St,San Francisco,CA,94133,,,,,69618_20171213,12/13/2017 0:00,69.0,Routine - Unscheduled,69618_20171213_103139,Improper food storage,Low Risk,20171213,103139,2017-12-13,0,8,0,0,0,5,0
226,226,356,80442,Hearth,3985 17th St,San Francisco,CA,94114,,,,14155511463.0,80442_20171004,10/4/2017 0:00,,Complaint,80442_20171004_103131,Moderate risk vermin infestation,Moderate Risk,20171004,103131,2017-10-04,0,2,0,0,3,0,1
227,227,358,69351,Sarku Japan,865 Market St Space#C08,San Francisco,CA,94103,37.784317,-122.40756299999998,"(37.784317, -122.407563)",,69351_20171207,12/7/2017 0:00,85.0,Routine - Unscheduled,69351_20171207_103142,Unclean nonfood contact surfaces,Low Risk,20171207,103142,2017-12-07,0,4,0,0,5,5,7
228,228,359,87762,New Village Cafe,1426 Polk St,San Francisco,CA,94109,,,,,87762_20170808,8/8/2017 0:00,86.0,Routine - Unscheduled,87762_20170808_103158,Unpermitted food facility,Low Risk,20170808,103158,2017-08-08,4,0,6,0,4,0,0
229,229,360,3031,Victor's Pizza,1411 Polk St,San Francisco,CA,94109,37.789944,-122.42059499999999,"(37.789944, -122.420595)",,3031_20160929,9/29/2016 0:00,82.0,Routine - Unscheduled,3031_20160929_103116,Inadequate food safety knowledge or lack of certified food safety manager,Moderate Risk,20160929,103116,2016-09-29,2,0,7,0,0,6,2
230,230,361,65580,Subway #25578,99 Drumm St,San Francisco,CA,94111,37.794576,-122.396643,"(37.794576, -122.396643)",,65580_20160511,5/11/2016 0:00,86.0,Routine - Unscheduled,65580_20160511_103118,Employee eating or smoking,Moderate Risk,20160511,103118,2016-05-11,0,0,4,0,0,4,0
231,231,362,71761,Roccaupulco Supper Club,3140 MISSION St,San Francisco,CA,94110,37.747029,-122.418976,"(37.747029, -122.418976)",14155726940.0,71761_20160325,3/25/2016 0:00,,Routine - Scheduled,71761_20160325_103154,Unclean or degraded floors walls or ceilings,Low Risk,20160325,103154,2016-03-25,0,0,0,0,0,0,2
232,232,364,24431,Peet's Coffee & Tea,680 Mission St,San Francisco,CA,94103,37.78658400000001,-122.40163899999999,"(37.786584, -122.401639)",,24431_20171213,12/13/2017 0:00,92.0,Routine - Unscheduled,24431_20171213_103161,Low risk vermin infestation,Low Risk,20171213,103161,2017-12-13,0,3,0,0,2,0,2
233,233,365,78371,AT&T PARK - Food Cart,24 Willie Mays Plaza,San Francisco,CA,94107,,,,,78371_20160814,8/14/2016 0:00,96.0,Routine - Unscheduled,78371_20160814_103120,Moderate risk food holding temperature,Moderate Risk,20160814,103120,2016-08-14,0,0,1,2,0,1,0
234,234,366,37882,First Cake,5901 GEARY Blvd,San Francisco,CA,94121,37.780087,-122.482596,"(37.780087, -122.482596)",,37882_20160322,3/22/2016 0:00,88.0,Routine - Unscheduled,37882_20160322_103139,Improper food storage,Low Risk,20160322,103139,2016-03-22,0,0,0,0,0,0,5
235,235,368,5940,Sts. Peter & Paul School,666 Filbert St,San Francisco,CA,94133,37.801278,-122.41038400000001,"(37.801278, -122.410384)",,5940_20170925,9/25/2017 0:00,93.0,Routine - Unscheduled,5940_20170925_103114,High risk vermin infestation,High Risk,20170925,103114,2017-09-25,0,0,1,0,2,0,1
236,236,372,88117,Adventure in Food and Wine,3331 24th St,San Francisco,CA,94110,,,,14158443430.0,88117_20170928,9/28/2017 0:00,96.0,Routine - Unscheduled,88117_20170928_103161,Low risk vermin infestation,Low Risk,20170928,103161,2017-09-28,0,0,2,0,0,0,0
237,237,376,1399,La Copa Loca,3150 22nd St,San Francisco,CA,94110,37.755538,-122.41798200000001,"(37.755538, -122.417982)",,1399_20160503,5/3/2016 0:00,98.0,Routine - Unscheduled,1399_20160503_103149,Wiping cloths not clean or properly stored or inadequate sanitizer,Low Risk,20160503,103149,2016-05-03,0,1,0,0,1,1,0
238,238,378,3189,MOSCOW & TBILSI BAKERY STORE,5540 GEARY Blvd,San Francisco,CA,94121,37.780439,-122.478982,"(37.780439, -122.478982)",,3189_20160510,5/10/2016 0:00,85.0,Routine - Unscheduled,3189_20160510_103157,Food safety certificate or food handler card not available,Low Risk,20160510,103157,2016-05-10,0,0,0,0,3,5,0
239,239,379,86116,Popsons,998 Market St,San Francisco,CA,94102,,,,14158881393.0,86116_20161229,12/29/2016 0:00,91.0,Routine - Unscheduled,86116_20161229_103156,Permit license or inspection report not posted,Low Risk,20161229,103156,2016-12-29,0,0,3,0,2,2,0
240,240,380,81978,Rangoon Ruby Burmese Cuisine,1608 Polk St,San Francisco,CA,94109,,,,,81978_20180227,2/27/2018 0:00,86.0,Routine - Unscheduled,81978_20180227_103142,Unclean nonfood contact surfaces,Low Risk,20180227,103142,2018-02-27,5,0,0,9,0,1,11
241,241,382,81309,Kyoto Sushi,1233 Van Ness Ave,San Francisco,CA,94109,,,,,81309_20160219,2/19/2016 0:00,73.0,Routine - Unscheduled,81309_20160219_103103,High risk food holding temperature,High Risk,20160219,103103,2016-02-19,5,0,0,0,1,0,5
242,242,383,3405,GARDEN CT. RESTAURANT & BAR,2 NEW MONTGOMERY St,San Francisco,CA,94105,37.788286,-122.40154299999999,"(37.788286, -122.401543)",,3405_20171212,12/12/2017 0:00,85.0,Routine - Unscheduled,3405_20171212_103109,Unclean or unsanitary food contact surfaces,High Risk,20171212,103109,2017-12-12,0,3,0,0,0,4,0
243,243,385,4654,House of Bagels,5030 Geary Blvd,San Francisco,CA,94118,37.780688,-122.47347099999999,"(37.780688, -122.473471)",,4654_20170425,4/25/2017 0:00,,Complaint,4654_20170425_103139,Improper food storage,Low Risk,20170425,103139,2017-04-25,0,0,0,4,0,6,3
244,244,387,2369,CLOONEY'S,1401 Valencia St,San Francisco,CA,94110,37.750374,-122.420456,"(37.750374, -122.420456)",14155824988.0,2369_20160324,3/24/2016 0:00,86.0,Routine - Unscheduled,2369_20160324_103120,Moderate risk food holding temperature,Moderate Risk,20160324,103120,2016-03-24,4,0,5,0,0,0,4
245,245,393,4917,LA VICTORIA BAKERY,2937 24th St,San Francisco,CA,94110,37.752373,-122.410876,"(37.752373, -122.410876)",14155647120.0,4917_20160906,9/6/2016 0:00,78.0,Routine - Unscheduled,4917_20160906_103142,Unclean nonfood contact surfaces,Low Risk,20160906,103142,2016-09-06,0,0,0,0,0,8,0
246,246,394,78328,Golden Wok,295 B Orizaba Ave,San Francisco,CA,94132,,,,14155588000.0,78328_20150820,8/20/2015 0:00,,Complaint,78328_20150820_103149,Wiping cloths not clean or properly stored or inadequate sanitizer,Low Risk,20150820,103149,2015-08-20,0,0,10,0,0,6,2
247,247,399,2542,PETER D'S RESTAURANT,2201 Van Ness St,San Francisco,CA,94109,37.795993,-122.423585,"(37.795993, -122.423585)",14155778505.0,2542_20171208,12/8/2017 0:00,65.0,Routine - Unscheduled,2542_20171208_103116,Inadequate food safety knowledge or lack of certified food safety manager,Moderate Risk,20171208,103116,2017-12-08,0,8,0,0,0,5,0
248,248,406,77185,The Ramp,855 Terry Francois Blvd,San Francisco,CA,94107,,,,14155597267.0,77185_20161205,12/5/2016 0:00,81.0,Routine - Unscheduled,77185_20161205_103131,Moderate risk vermin infestation,Moderate Risk,20161205,103131,2016-12-05,4,0,0,0,4,0,0
249,249,411,78184,Smokin' Warehouse BBQ,3336 Sacramento Ave,San Francisco,CA,94118,,,,,78184_20161206,12/6/2016 0:00,90.0,Routine - Unscheduled,78184_20161206_103116,Inadequate food safety knowledge or lack of certified food safety manager,Moderate Risk,20161206,103116,2016-12-06,0,0,4,0,3,3,0
250,250,412,91473,Royal Indian Cuisine,1740 fillmore St,San Francisco,CA,94115,,,,,91473_20180227,2/27/2018 0:00,82.0,Routine - Unscheduled,91473_20180227_103105,Improper cooling methods,High Risk,20180227,103105,2018-02-27,4,0,3,0,0,0,0
251,251,415,82361,Yangtze Market,2026 Mission St,San Francisco,CA,94110,,,,14155552878.0,82361_20150731,7/31/2015 0:00,90.0,Routine - Unscheduled,82361_20150731_103154,Unclean or degraded floors walls or ceilings,Low Risk,20150731,103154,2015-07-31,0,0,10,0,0,11,4
252,252,416,59407,Parkside Quickly,1050 TARAVAL St,San Francisco,CA,94116,37.742989,-122.47766200000001,"(37.742989, -122.477662)",,59407_20171207,12/7/2017 0:00,90.0,Routine - Unscheduled,59407_20171207_103120,Moderate risk food holding temperature,Moderate Risk,20171207,103120,2017-12-07,0,4,0,0,0,5,5
253,253,419,89686,Big Fish Little Fish Poke,121 Spear St B09,San Francisco,CA,94105,,,,,89686_20180227,2/27/2018 0:00,82.0,Routine - Unscheduled,89686_20180227_103120,Moderate risk food holding temperature,Moderate Risk,20180227,103120,2018-02-27,6,0,0,0,0,0,0
254,254,420,34102,The Broken Record,1166 Geneva Ave,San Francisco,CA,94112,37.71444,-122.43683500000002,"(37.71444, -122.436835)",,34102_20171212,12/12/2017 0:00,88.0,Routine - Unscheduled,34102_20171212_103120,Moderate risk food holding temperature,Moderate Risk,20171212,103120,2017-12-12,0,4,0,0,3,0,2
255,255,424,7528,Encinal,Pier 41,San Francisco,CA,94133,37.808494,-122.412,"(37.808494, -122.412)",,7528_20160518,5/18/2016 0:00,92.0,Routine - Unscheduled,7528_20160518_103120,Moderate risk food holding temperature,Moderate Risk,20160518,103120,2016-05-18,2,0,0,0,1,2,0
256,256,426,89599,La Boulange de San Francisco,222 Sutter St,San Francisco,CA,94108,,,,,89599_20161215,12/15/2016 0:00,92.0,Routine - Unscheduled,89599_20161215_103139,Improper food storage,Low Risk,20161215,103139,2016-12-15,0,0,0,0,3,0,0
257,257,427,85480,Jimmy John's,120 Pine St,San Francisco,CA,94111,,,,,85480_20160629,6/29/2016 0:00,92.0,Routine - Unscheduled,85480_20160629_103124,Inadequately cleaned or sanitized food contact surfaces,Moderate Risk,20160629,103124,2016-06-29,0,3,0,0,0,3,0
258,258,431,4542,Shaws San Francisco,122 West Portal Ave,San Francisco,CA,94127,37.739565,-122.467317,"(37.739565, -122.467317)",,4542_20160603,6/3/2016 0:00,94.0,Routine - Unscheduled,4542_20160603_103154,Unclean or degraded floors walls or ceilings,Low Risk,20160603,103154,2016-06-03,0,2,0,0,0,3,0
259,259,432,76926,J-Shack,Off The Grid,San Francisco,CA,94102,,,,,76926_20160607,6/7/2016 0:00,90.0,Routine - Unscheduled,76926_20160607_103120,Moderate risk food holding temperature,Moderate Risk,20160607,103120,2016-06-07,0,0,0,0,0,3,0
260,260,433,76544,Saiwalks,3348 Steiner St,San Francisco,CA,94123,,,,,76544_20160628,6/28/2016 0:00,89.0,Routine - Unscheduled,76544_20160628_103105,Improper cooling methods,High Risk,20160628,103105,2016-06-28,1,0,0,0,0,2,0
261,261,434,10625,Boxed Foods Company,245 Kearny St,San Francisco,CA,94108,37.790453,-122.403994,"(37.790453, -122.403994)",,10625_20170927,9/27/2017 0:00,79.0,Routine - Unscheduled,10625_20170927_103157,Food safety certificate or food handler card not available,Low Risk,20170927,103157,2017-09-27,0,0,6,0,0,6,0
262,262,437,68831,Super Duper,783 Mission St #1010,San Francisco,CA,94103,37.784758000000004,-122.40383700000001,"(37.784758, -122.403837)",,68831_20160325,3/25/2016 0:00,77.0,Routine - Unscheduled,68831_20160325_103145,Improper storage of equipment utensils or linens,Low Risk,20160325,103145,2016-03-25,0,4,0,0,0,2,6
263,263,438,69722,Moolicious,101 4th St  #9120,San Francisco,CA,94103,37.784548,-122.40418999999999,"(37.784548, -122.40419)",,69722_20170104,1/4/2017 0:00,94.0,Routine - Unscheduled,69722_20170104_103145,Improper storage of equipment utensils or linens,Low Risk,20170104,103145,2017-01-04,0,0,0,0,3,2,0
264,264,439,275,Ben & Jerry's,170 O'Farrell St Basement,San Francisco,CA,94102,37.786547999999996,-122.40731299999999,"(37.786548, -122.407313)",,275_20151020,10/20/2015 0:00,96.0,Routine - Unscheduled,275_20151020_103141,Improper food labeling or menu misrepresentation,Low Risk,20151020,103141,2015-10-20,1,0,0,0,2,0,2
265,265,441,65672,Golden Veggie Market,1475 Polk St,San Francisco,CA,94109,37.790324,-122.42066399999999,"(37.790324, -122.420664)",,65672_20180226,2/26/2018 0:00,94.0,Routine - Unscheduled,65672_20180226_103149,Wiping cloths not clean or properly stored or inadequate sanitizer,Low Risk,20180226,103149,2018-02-26,3,0,4,0,3,1,2
266,266,442,71424,"SDG Jazz, LLC",205 Franklin St,San Francisco,CA,94102,,,,,71424_20160922,9/22/2016 0:00,98.0,Routine - Unscheduled,71424_20160922_103143,Inadequate warewashing facilities or equipment,Low Risk,20160922,103143,2016-09-22,0,0,0,0,0,1,0
267,267,450,2050,"Hyde Street Seafood House & Raw Bar, Inc",1509 Hyde St,San Francisco,CA,94109,37.794753,-122.41818400000001,"(37.794753, -122.418184)",,2050_20171207,12/7/2017 0:00,98.0,Routine - Unscheduled,2050_20171207_103149,Wiping cloths not clean or properly stored or inadequate sanitizer,Low Risk,20171207,103149,2017-12-07,0,1,0,0,0,2,0
268,268,454,61512,Delarosa,2175 CHESTNUT St,San Francisco,CA,94123,37.800414,-122.439127,"(37.800414, -122.439127)",,61512_20160628,6/28/2016 0:00,90.0,Routine - Unscheduled,61512_20160628_103124,Inadequately cleaned or sanitized food contact surfaces,Moderate Risk,20160628,103124,2016-06-28,3,0,0,0,0,3,0
269,269,457,68768,Elsy's Restaurant,2893 Mission St,San Francisco,CA,94110,,,,14155728521.0,68768_20160607,6/7/2016 0:00,88.0,Routine - Unscheduled,68768_20160607_103124,Inadequately cleaned or sanitized food contact surfaces,Moderate Risk,20160607,103124,2016-06-07,5,0,6,0,0,5,0
270,270,458,4479,Courtney's Produce II,101 CASTRO St,San Francisco,CA,94114,37.767194,-122.435576,"(37.767194, -122.435576)",14155621850.0,4479_20170105,1/5/2017 0:00,92.0,Routine - Unscheduled,4479_20170105_103141,Improper food labeling or menu misrepresentation,Low Risk,20170105,103141,2017-01-05,5,0,0,0,3,0,3
271,271,459,68454,Kippu Japanese Restaurant,1707 BUCHANAN St,San Francisco,CA,94115,37.785639,-122.429841,"(37.785639, -122.429841)",,68454_20160223,2/23/2016 0:00,77.0,Routine - Unscheduled,68454_20160223_103149,Wiping cloths not clean or properly stored or inadequate sanitizer,Low Risk,20160223,103149,2016-02-23,0,0,0,0,0,0,7
272,272,462,2144,SHERA.-PAL.HOTEL MAXFIELD'S GRILL,2 NEW MONTGOMERY St,San Francisco,CA,94105,37.788286,-122.40154299999999,"(37.788286, -122.401543)",,2144_20171212,12/12/2017 0:00,92.0,Routine - Unscheduled,2144_20171212_103154,Unclean or degraded floors walls or ceilings,Low Risk,20171212,103154,2017-12-12,0,3,0,0,0,3,0
273,273,463,502,COURTYARD BY MARRIOTT-COFFEE SHOP,299 02nd St,San Francisco,CA,94105,37.785614,-122.396693,"(37.785614, -122.396693)",,502_20161206,12/6/2016 0:00,98.0,Routine - Unscheduled,502_20161206_103145,Improper storage of equipment utensils or linens,Low Risk,20161206,103145,2016-12-06,0,2,0,0,1,0,0
274,274,464,302,MOULIN ROUGE,887 GEARY St,San Francisco,CA,94109,37.786084,-122.41788899999999,"(37.786084, -122.417889)",,302_20160902,9/2/2016 0:00,89.0,Routine - Unscheduled,302_20160902_103139,Improper food storage,Low Risk,20160902,103139,2016-09-02,2,0,5,0,0,3,11
275,275,465,20116,Sushi Zen,1041 Taraval St,San Francisco,CA,94116,37.742933,-122.47745,"(37.742933, -122.47745)",,20116_20160511,5/11/2016 0:00,90.0,Routine - Unscheduled,20116_20160511_103124,Inadequately cleaned or sanitized food contact surfaces,Moderate Risk,20160511,103124,2016-05-11,0,4,0,0,3,3,0
276,276,470,5313,S.F. Bay Concessionaires Commissary,Pier 41,San Francisco,CA,94133,,,,,5313_20160518,5/18/2016 0:00,92.0,Routine - Unscheduled,5313_20160518_103157,Food safety certificate or food handler card not available,Low Risk,20160518,103157,2016-05-18,0,2,0,0,1,4,1
277,277,471,37639,George's BBQ on 24th,3231 24th St,San Francisco,CA,94110,37.752313,-122.416978,"(37.752313, -122.416978)",,37639_20171204,12/4/2017 0:00,92.0,Routine - Unscheduled,37639_20171204_103139,Improper food storage,Low Risk,20171204,103139,2017-12-04,0,3,0,0,2,0,2
278,278,473,62308,Sam's Diner,1220 Market Street,San Francisco,CA,94102,37.778496999999994,-122.415146,"(37.778497, -122.415146)",14155628590.0,62308_20160203,2/3/2016 0:00,72.0,Routine - Unscheduled,62308_20160203_103131,Moderate risk vermin infestation,Moderate Risk,20160203,103131,2016-02-03,0,4,0,0,0,0,6
279,279,474,6619,J C Market,830 Jackson St,San Francisco,CA,94133,37.795788,-122.40883400000001,"(37.795788, -122.408834)",,6619_20170104,1/4/2017 0:00,73.0,Routine - Unscheduled,6619_20170104_103139,Improper food storage,Low Risk,20170104,103139,2017-01-04,0,0,5,0,9,0,5
280,280,477,1674,NORDSTROM CAFE BISTRO,865 MARKET St,San Francisco,CA,94103,37.784317,-122.40756299999998,"(37.784317, -122.407563)",,1674_20160429,4/29/2016 0:00,82.0,Routine - Unscheduled,1674_20160429_103116,Inadequate food safety knowledge or lack of certified food safety manager,Moderate Risk,20160429,103116,2016-04-29,1,0,0,3,3,3,0
281,281,479,69799,Lers Ros Thai Noodle,730 Larkin St,San Francisco,CA,94109,37.784741,-122.417754,"(37.784741, -122.417754)",,69799_20160311,3/11/2016 0:00,,Reinspection/Followup,69799_20160311_103165,No plan review or Building Permit,Low Risk,20160311,103165,2016-03-11,0,2,0,0,5,0,2
282,282,480,1350,KING OF THAI NOODLE HOUSE,639 CLEMENT St,San Francisco,CA,94118,37.782833000000004,-122.46615,"(37.782833, -122.46615)",,1350_20160518,5/18/2016 0:00,77.0,Routine - Unscheduled,1350_20160518_103116,Inadequate food safety knowledge or lack of certified food safety manager,Moderate Risk,20160518,103116,2016-05-18,0,0,0,0,4,7,0
283,283,483,81077,Waffle Cone Shop,Pier 39  B-4,San Francisco,CA,94133,,,,14155959312.0,81077_20170928,9/28/2017 0:00,94.0,Routine - Unscheduled,81077_20170928_103131,Moderate risk vermin infestation,Moderate Risk,20170928,103131,2017-09-28,0,0,2,0,0,3,2
284,284,484,78985,Pepper Palace,2800 Leavenworth St #A7,San Francisco,CA,94109,,,,,78985_20160812,8/12/2016 0:00,96.0,Routine - Unscheduled,78985_20160812_103154,Unclean or degraded floors walls or ceilings,Low Risk,20160812,103154,2016-08-12,3,0,5,0,0,2,0
285,285,485,68865,Grant Place Restaurant,737 Washington St,San Francisco,CA,94108,37.795165999999995,-122.405924,"(37.795166, -122.405924)",,68865_20160628,6/28/2016 0:00,74.0,Routine - Unscheduled,68865_20160628_103139,Improper food storage,Low Risk,20160628,103139,2016-06-28,0,3,0,0,0,7,4
286,286,489,61595,Hog & Rocks,3431 19th St,San Francisco,CA,94110,37.760153,-122.419849,"(37.760153, -122.419849)",,61595_20160413,4/13/2016 0:00,86.0,Routine - Unscheduled,61595_20160413_103127,Noncompliance with HAACP plan or variance,Moderate Risk,20160413,103127,2016-04-13,0,0,3,0,0,4,0
287,287,490,4702,SHUFAT MARKET,3807 24th St,San Francisco,CA,94114,37.751664,-122.42768799999999,"(37.751664, -122.427688)",14155826207.0,4702_20180226,2/26/2018 0:00,96.0,Routine - Unscheduled,4702_20180226_103131,Moderate risk vermin infestation,Moderate Risk,20180226,103131,2018-02-26,1,0,0,0,0,3,2
288,288,492,16513,Evergreen Garden Restaurant,3100 18th St,San Francisco,CA,94110,37.762249,-122.41309199999999,"(37.762249, -122.413092)",,16513_20180226,2/26/2018 0:00,83.0,Routine - Unscheduled,16513_20180226_103144,Unapproved or unmaintained equipment or utensils,Low Risk,20180226,103144,2018-02-26,4,0,0,0,4,0,4
289,289,494,4920,A B C MARKET,2801 BRYANT St,San Francisco,CA,94110,37.749612,-122.40878899999998,"(37.749612, -122.408789)",,4920_20160810,8/10/2016 0:00,96.0,Routine - Unscheduled,4920_20160810_103142,Unclean nonfood contact surfaces,Low Risk,20160810,103142,2016-08-10,0,0,1,0,2,2,3
290,290,497,5470,AT&T - (CART 52) Lemonade/Kettle Corn view [145139],24 WILLIE MAYS PLAZA,San Francisco,CA,94107,,,,14155971500.0,5470_20160814,8/14/2016 0:00,94.0,Routine - Unscheduled,5470_20160814_103154,Unclean or degraded floors walls or ceilings,Low Risk,20160814,103154,2016-08-14,0,0,0,0,2,2,1
291,291,498,60898,Patxi's Chicago Pizza,3318 Fillmore St,San Francisco,CA,94123,37.800061,-122.43602,"(37.800061, -122.43602)",,60898_20160510,5/10/2016 0:00,94.0,Routine - Unscheduled,60898_20160510_103149,Wiping cloths not clean or properly stored or inadequate sanitizer,Low Risk,20160510,103149,2016-05-10,0,0,0,0,5,2,0
292,292,500,82009,Chai Bar By David Rio,1019 Market St,San Francisco,CA,94103,,,,,82009_20160304,3/4/2016 0:00,92.0,Routine - Unscheduled,82009_20160304_103124,Inadequately cleaned or sanitized food contact surfaces,Moderate Risk,20160304,103124,2016-03-04,0,2,0,0,0,2,2
293,293,508,79193,Bon Appetit @ Twitter,1355 Market St 5th floor,San Francisco,CA,94103,,,,,79193_20160502,5/2/2016 0:00,93.0,Routine - Unscheduled,79193_20160502_103109,Unclean or unsanitary food contact surfaces,High Risk,20160502,103109,2016-05-02,0,0,0,1,2,1,0
294,294,509,69207,Ilana Cafe,2314 Clement St,San Francisco,CA,94121,37.78207800000001,-122.48417099999999,"(37.782078, -122.484171)",,69207_20160412,4/12/2016 0:00,92.0,Routine - Unscheduled,69207_20160412_103149,Wiping cloths not clean or properly stored or inadequate sanitizer,Low Risk,20160412,103149,2016-04-12,0,1,0,0,4,3,0
295,295,511,5951,ST. THOMAS MORE,50 THOMAS MORE Way,San Francisco,CA,94132,37.712259,-122.47308000000001,"(37.712259, -122.47308)",14155330100.0,5951_20160413,4/13/2016 0:00,91.0,Routine - Unscheduled,5951_20160413_103103,High risk food holding temperature,High Risk,20160413,103103,2016-04-13,1,0,0,2,2,2,0
296,296,514,79272,Dim Sum Club,2550 Van Ness Ave,San Francisco,CA,94109,,,,,79272_20160929,9/29/2016 0:00,70.0,Routine - Unscheduled,79272_20160929_103133,Foods not protected from contamination,Moderate Risk,20160929,103133,2016-09-29,8,0,0,0,0,7,0
297,297,515,27791,Osha Thai Restaurant & Bar,4 Embarcadero Center  Street Level,San Francisco,CA,94111,37.795108,-122.396184,"(37.795108, -122.396184)",,27791_20150414,4/14/2015 0:00,,Reinspection/Followup,27791_20150414_103142,Unclean nonfood contact surfaces,Low Risk,20150414,103142,2015-04-14,0,0,0,0,0,2,2
298,298,516,59986,Tsunami Panhandle,1306 Fulton St,San Francisco,CA,94117,37.776838,-122.43856299999999,"(37.776838, -122.438563)",,59986_20150910,9/10/2015 0:00,89.0,Routine - Unscheduled,59986_20150910_103120,Moderate risk food holding temperature,Moderate Risk,20150910,103120,2015-09-10,0,0,0,0,0,0,2
299,299,517,315,The Posh Bagel,495A CASTRO St,San Francisco,CA,94114,37.760954,-122.43493500000001,"(37.760954, -122.434935)",,315_20150518,5/18/2015 0:00,89.0,Routine - Unscheduled,315_20150518_103114,High risk vermin infestation,High Risk,20150518,103114,2015-05-18,0,0,3,0,2,0,2
300,300,522,27799,Buckhorn Grill,845 Market St FE-5,San Francisco,CA,94103,37.784848,-122.406892,"(37.784848, -122.406892)",14155979770.0,27799_20170829,8/29/2017 0:00,89.0,Routine - Unscheduled,27799_20170829_103109,Unclean or unsanitary food contact surfaces,High Risk,20170829,103109,2017-08-29,3,0,2,3,0,3,1
301,301,524,1296,TAQUERIA EL BUEN SABOR,699 VALENCIA St,San Francisco,CA,94112,37.761743,-122.42149199999999,"(37.761743, -122.421492)",14155588745.0,1296_20160209,2/9/2016 0:00,,Routine - Scheduled,1296_20160209_103161,Low risk vermin infestation,Low Risk,20160209,103161,2016-02-09,0,0,5,0,0,3,7
302,302,525,90233,Access SFUSD: Bay Street,416 Bay St,San Francisco,CA,94109,,,,,90233_20171208,12/8/2017 0:00,96.0,Routine - Unscheduled,90233_20171208_103157,Food safety certificate or food handler card not available,Low Risk,20171208,103157,2017-12-08,2,2,0,0,0,0,0
303,303,526,64835,Jane,2123 Fillmore St,San Francisco,CA,94115,37.789404,-122.433954,"(37.789404, -122.433954)",,64835_20171211,12/11/2017 0:00,86.0,Routine - Unscheduled,64835_20171211_103132,Improper thawing methods,Moderate Risk,20171211,103132,2017-12-11,0,4,0,0,4,0,2
304,304,527,74399,Whiz Burger,700 South Van Ness Ave,San Francisco,CA,94110,,,,14155825888.0,74399_20161206,12/6/2016 0:00,89.0,Routine - Unscheduled,74399_20161206_103120,Moderate risk food holding temperature,Moderate Risk,20161206,103120,2016-12-06,0,0,4,0,2,3,3
305,305,528,84759,Hang Ah Tea Room,1 Pagoda Pl,San Francisco,CA,94108,,,,,84759_20171207,12/7/2017 0:00,92.0,Routine - Unscheduled,84759_20171207_103119,Inadequate and inaccessible handwashing facilities,Moderate Risk,20171207,103119,2017-12-07,0,3,0,0,0,5,0
306,306,534,89969,Red Sea Pizza and Market,1801 San Jose Ave,San Francisco,CA,94112,,,,,89969_20180228,2/28/2018 0:00,92.0,Routine - Unscheduled,89969_20180228_103124,Inadequately cleaned or sanitized food contact surfaces,Moderate Risk,20180228,103124,2018-02-28,3,0,0,0,3,0,0
307,307,536,4672,IRVING SEAFOOD MARKET,2130 IRVING St,San Francisco,CA,94122,37.76342800000001,-122.480921,"(37.763428, -122.480921)",,4672_20161206,12/6/2016 0:00,84.0,Routine - Unscheduled,4672_20161206_103154,Unclean or degraded floors walls or ceilings,Low Risk,20161206,103154,2016-12-06,0,6,0,0,3,5,0
308,308,537,63926,Bar Agricole LLC,355 11th St Suite 100,San Francisco,CA,94103,37.771204,-122.413131,"(37.771204, -122.413131)",,63926_20160906,9/6/2016 0:00,92.0,Routine - Unscheduled,63926_20160906_103119,Inadequate and inaccessible handwashing facilities,Moderate Risk,20160906,103119,2016-09-06,0,0,2,0,0,2,0
309,309,538,69026,GM Market Inc.,958 Geneva Ave,San Francisco,CA,94112,37.715948,-122.44015,"(37.715948, -122.44015)",,69026_20160607,6/7/2016 0:00,92.0,Routine - Unscheduled,69026_20160607_103149,Wiping cloths not clean or properly stored or inadequate sanitizer,Low Risk,20160607,103149,2016-06-07,0,4,0,0,3,3,0
310,310,539,18079,Joe's coffee Shop,6134 Geary Blvd,San Francisco,CA,94121,37.780408,-122.48538300000001,"(37.780408, -122.485383)",,18079_20160502,5/2/2016 0:00,92.0,Routine - Unscheduled,18079_20160502_103139,Improper food storage,Low Risk,20160502,103139,2016-05-02,0,0,0,0,2,3,0
311,311,543,1800,BRAVO PIZZA,5145 MISSION St,San Francisco,CA,94112,37.716583,-122.44083400000001,"(37.716583, -122.440834)",,1800_20171207,12/7/2017 0:00,84.0,Routine - Unscheduled,1800_20171207_103133,Foods not protected from contamination,Moderate Risk,20171207,103133,2017-12-07,0,5,0,0,0,5,3
312,312,545,9273,Taqueria Mana,439 Stockton St,San Francisco,CA,94108,37.790043,-122.407104,"(37.790043, -122.407104)",,9273_20161018,10/18/2016 0:00,85.0,Routine - Unscheduled,9273_20161018_103144,Unapproved or unmaintained equipment or utensils,Low Risk,20161018,103144,2016-10-18,0,0,0,0,4,0,5
313,313,549,774,BAY VIEW BOAT CLUB,429 Terry Francois St,San Francisco,CA,94107,37.772667,-122.387032,"(37.772667, -122.387032)",14155567650.0,774_20161205,12/5/2016 0:00,90.0,Routine - Unscheduled,774_20161205_103157,Food safety certificate or food handler card not available,Low Risk,20161205,103157,2016-12-05,0,0,0,0,5,0,0
314,314,552,89922,Sheraton Fisherman's Wharf Hotel,2500 Mason St,San Francisco,CA,94133,,,,,89922_20171212,12/12/2017 0:00,94.0,Routine - Unscheduled,89922_20171212_103144,Unapproved or unmaintained equipment or utensils,Low Risk,20171212,103144,2017-12-12,0,3,0,0,0,0,0
315,315,553,80419,San Francisco Farmers Market,4929 Mission St,San Francisco,CA,94112,,,,,80419_20160930,9/30/2016 0:00,79.0,Routine - Unscheduled,80419_20160930_103133,Foods not protected from contamination,Moderate Risk,20160930,103133,2016-09-30,0,4,0,0,0,5,2
316,316,556,79406,Marla Bakery,3619 Balboa St,San Francisco,CA,94121,,,,14155822253.0,79406_20160412,4/12/2016 0:00,87.0,Routine - Unscheduled,79406_20160412_103133,Foods not protected from contamination,Moderate Risk,20160412,103133,2016-04-12,3,0,0,0,0,3,3
317,317,558,62943,Irving Pizza,928 Geary St,San Francisco,CA,94109,37.786068,-122.418644,"(37.786068, -122.418644)",14155367320.0,62943_20160902,9/2/2016 0:00,75.0,Routine - Unscheduled,62943_20160902_103148,No thermometers or uncalibrated thermometers,Low Risk,20160902,103148,2016-09-02,0,4,5,0,0,7,0
318,318,559,86362,Aina,900 22nd St,San Francisco,CA,94107,,,,14155338758.0,86362_20160923,9/23/2016 0:00,98.0,Routine - Unscheduled,86362_20160923_103139,Improper food storage,Low Risk,20160923,103139,2016-09-23,3,0,0,0,0,1,0
319,319,560,6660,Tuong Phong Market,628 Ellis St,San Francisco,CA,94102,37.784408,-122.416614,"(37.784408, -122.416614)",,6660_20171214,12/14/2017 0:00,86.0,Routine - Unscheduled,6660_20171214_103132,Improper thawing methods,Moderate Risk,20171214,103132,2017-12-14,0,5,0,3,0,0,9
320,320,561,85952,Juice Craze,3251 20th Ave 5517,San Francisco,CA,94132,,,,14150421739.0,85952_20161018,10/18/2016 0:00,76.0,Routine - Unscheduled,85952_20161018_103129,Insufficient hot water or running water,Moderate Risk,20161018,103129,2016-10-18,0,0,2,0,4,0,0
321,321,562,65238,La Quinta Restaurant,2425 MISSION St,San Francisco,CA,94110,37.758204,-122.418976,"(37.758204, -122.418976)",,65238_20161206,12/6/2016 0:00,92.0,Routine - Unscheduled,65238_20161206_103133,Foods not protected from contamination,Moderate Risk,20161206,103133,2016-12-06,0,3,0,0,2,2,2
322,322,564,14568,THE Art Bistro,6900 GEARY BLVD,San Francisco,CA,94121,37.779718,-122.49366200000001,"(37.779718, -122.493662)",,14568_20160502,5/2/2016 0:00,88.0,Routine - Unscheduled,14568_20160502_103119,Inadequate and inaccessible handwashing facilities,Moderate Risk,20160502,103119,2016-05-02,0,0,2,0,3,3,0
323,323,567,9164,WORKING GIRLS' CAFE #4,122 NEW MONTGOMERY STREET,San Francisco,CA,94105,37.787227,-122.40028000000001,"(37.787227, -122.40028)",,9164_20160812,8/12/2016 0:00,83.0,Routine - Unscheduled,9164_20160812_103157,Food safety certificate or food handler card not available,Low Risk,20160812,103157,2016-08-12,4,0,0,0,0,4,0
324,324,569,3659,SQUAT & GOBBLE CAFE #4,001 WEST PORTAL Ave,San Francisco,CA,94127,37.740821999999994,-122.46573899999999,"(37.740822, -122.465739)",,3659_20160603,6/3/2016 0:00,88.0,Routine - Unscheduled,3659_20160603_103120,Moderate risk food holding temperature,Moderate Risk,20160603,103120,2016-06-03,2,0,0,0,0,4,5
325,325,575,99,J & M A-1 CAFE RESTAURANT LLC,779 Clay St,San Francisco,CA,94108,37.794292999999996,-122.40596699999999,"(37.794293, -122.405967)",,99_20171207,12/7/2017 0:00,82.0,Routine - Unscheduled,99_20171207_103131,Moderate risk vermin infestation,Moderate Risk,20171207,103131,2017-12-07,0,6,0,0,0,0,8
326,326,576,3478,ROUND TABLE PIZZA,2660 SAN BRUNO Ave,San Francisco,CA,94134,37.728027000000004,-122.403811,"(37.728027, -122.403811)",,3478_20180223,2/23/2018 0:00,,Complaint,3478_20180223_103119,Inadequate and inaccessible handwashing facilities,Moderate Risk,20180223,103119,2018-02-23,2,2,0,0,1,2,0
327,327,578,5478,AT&T - (CART 60) Murph's Pub [145147],24 WILLIE MAYS PLAZA,San Francisco,CA,94107,,,,,5478_20160814,8/14/2016 0:00,96.0,Routine - Unscheduled,5478_20160814_103119,Inadequate and inaccessible handwashing facilities,Moderate Risk,20160814,103119,2016-08-14,0,0,0,1,2,1,1
328,328,579,63136,Sodexo at PG & E Energy Center,851 HOWARD St,San Francisco,CA,94103,37.782336,-122.40378799999999,"(37.782336, -122.403788)",,63136_20161109,11/9/2016 0:00,96.0,Routine - Unscheduled,63136_20161109_103131,Moderate risk vermin infestation,Moderate Risk,20161109,103131,2016-11-09,1,0,0,0,1,2,0
329,329,583,3228,THANH LONG RESTAURANT,4101 JUDAH St,San Francisco,CA,94122,37.760383000000004,-122.50608999999999,"(37.760383, -122.50609)",14155257984.0,3228_20160330,3/30/2016 0:00,92.0,Routine - Unscheduled,3228_20160330_103157,Food safety certificate or food handler card not available,Low Risk,20160330,103157,2016-03-30,0,0,0,0,0,0,3
330,330,585,66717,Giordano Bros.,3108 16th St,San Francisco,CA,94103,37.76495300000001,-122.42211299999998,"(37.764953, -122.422113)",,66717_20180222,2/22/2018 0:00,85.0,Routine - Unscheduled,66717_20180222_103114,High risk vermin infestation,High Risk,20180222,103114,2018-02-22,3,0,0,0,0,3,1
331,331,586,1677,PRIMO PATIO CAFE,214 Townsend St,San Francisco,CA,94107,37.778593,-122.393149,"(37.778593, -122.393149)",14155951129.0,1677_20170105,1/5/2017 0:00,88.0,Routine - Unscheduled,1677_20170105_103133,Foods not protected from contamination,Moderate Risk,20170105,103133,2017-01-05,0,0,0,0,4,0,0
332,332,589,77858,AFC Sushi @ Good Life Grocers,448 Cortland Ave,San Francisco,CA,94110,,,,,77858_20171130,11/30/2017 0:00,94.0,Routine - Unscheduled,77858_20171130_103119,Inadequate and inaccessible handwashing facilities,Moderate Risk,20171130,103119,2017-11-30,0,2,0,0,0,2,1
333,333,593,64513,Gold Coast Grill & Catering,1650 HOLLOWAY Ave,San Francisco,CA,94132,37.720894,-122.478029,"(37.720894, -122.478029)",,64513_20160518,5/18/2016 0:00,92.0,Routine - Unscheduled,64513_20160518_103144,Unapproved or unmaintained equipment or utensils,Low Risk,20160518,103144,2016-05-18,2,0,0,0,2,3,0
334,334,596,64612,Henry's Hunan Restaurant,4753 MISSION St,San Francisco,CA,94112,37.72225200000001,-122.436625,"(37.722252, -122.436625)",,64612_20180226,2/26/2018 0:00,80.0,Routine - Unscheduled,64612_20180226_103124,Inadequately cleaned or sanitized food contact surfaces,Moderate Risk,20180226,103124,2018-02-26,7,0,5,0,0,4,3
335,335,597,78374,AT&T PARK - Food Cart,24 Willie Mays Plaza,San Francisco,CA,94107,,,,,78374_20160814,8/14/2016 0:00,96.0,Routine - Unscheduled,78374_20160814_103119,Inadequate and inaccessible handwashing facilities,Moderate Risk,20160814,103119,2016-08-14,0,0,0,0,0,1,0
336,336,600,5824,S.F. International High School,1050 YORK St,San Francisco,CA,94110,37.755257,-122.408455,"(37.755257, -122.408455)",14155695780.0,5824_20180227,2/27/2018 0:00,92.0,Routine - Unscheduled,5824_20180227_103116,Inadequate food safety knowledge or lack of certified food safety manager,Moderate Risk,20180227,103116,2018-02-27,2,3,0,0,0,0,2
337,337,604,2497,PLUTO'S,3258 SCOTT St,San Francisco,CA,94123,37.799796,-122.441041,"(37.799796, -122.441041)",14155778867.0,2497_20160607,6/7/2016 0:00,85.0,Routine - Unscheduled,2497_20160607_103133,Foods not protected from contamination,Moderate Risk,20160607,103133,2016-06-07,0,0,4,0,0,4,0
338,338,607,65382,Manna,845 Irving St,San Francisco,CA,94122,37.763983,-122.46708999999998,"(37.763983, -122.46709)",,65382_20170927,9/27/2017 0:00,,Complaint,65382_20170927_103139,Improper food storage,Low Risk,20170927,103139,2017-09-27,0,0,3,0,0,3,0
339,339,609,86284,Los Yaquis,324 South Van Ness Ave,San Francisco,CA,94103,,,,14155258204.0,86284_20161005,10/5/2016 0:00,,New Ownership,86284_20161005_103157,Food safety certificate or food handler card not available,Low Risk,20161005,103157,2016-10-05,0,5,0,4,3,0,0
340,340,613,59397,Basa Seafood Express,3064 24th St,San Francisco,CA,94110,37.752578,-122.413372,"(37.752578, -122.413372)",,59397_20160114,1/14/2016 0:00,90.0,Routine - Unscheduled,59397_20160114_103144,Unapproved or unmaintained equipment or utensils,Low Risk,20160114,103144,2016-01-14,0,3,0,0,3,8,4
341,341,615,79632,Buttermilk Southern Kitchen,2848 23rd St,San Francisco,CA,94110,,,,,79632_20160322,3/22/2016 0:00,89.0,Routine - Unscheduled,79632_20160322_103120,Moderate risk food holding temperature,Moderate Risk,20160322,103120,2016-03-22,0,6,0,0,4,2,2
342,342,617,69792,Samiramis Imports,2990 MISSION St,San Francisco,CA,94110,37.74923,-122.418224,"(37.74923, -122.418224)",14155826555.0,69792_20160412,4/12/2016 0:00,88.0,Routine - Unscheduled,69792_20160412_103177,Non service animal,Low Risk,20160412,103177,2016-04-12,0,0,0,0,5,4,4
343,343,622,69147,Mission Rock Resort,817 TERRY FRANCOIS Blvd,San Francisco,CA,94107,,,,,69147_20161205,12/5/2016 0:00,91.0,Routine - Unscheduled,69147_20161205_103105,Improper cooling methods,High Risk,20161205,103105,2016-12-05,0,3,0,0,2,0,0
344,344,626,66536,Cypress Grill,99 Harding Park Rd,San Francisco,CA,94132,37.723698,-122.49528899999999,"(37.723698, -122.495289)",14155664690.0,66536_20160413,4/13/2016 0:00,90.0,Routine - Unscheduled,66536_20160413_103120,Moderate risk food holding temperature,Moderate Risk,20160413,103120,2016-04-13,0,4,0,0,4,3,0
345,345,629,3174,PARK CHOW,1240 09th Ave,San Francisco,CA,94122,37.758941,-122.48591,"(37.758941, -122.48591)",,3174_20151104,11/4/2015 0:00,76.0,Routine - Unscheduled,3174_20151104_103102,Unclean hands or improper use of gloves,High Risk,20151104,103102,2015-11-04,0,0,0,0,0,0,5
346,346,632,12199,El Gallo Giro,3055 23rd St,San Francisco,CA,94110,37.754218,-122.41328500000002,"(37.754218, -122.413285)",14155572661.0,12199_20160628,6/28/2016 0:00,92.0,Routine - Unscheduled,12199_20160628_103154,Unclean or degraded floors walls or ceilings,Low Risk,20160628,103154,2016-06-28,0,0,0,0,0,3,0
347,347,634,393,SUPER STAR RESTAURANT,4919 MISSION St B,San Francisco,CA,94112,37.719691999999995,-122.438575,"(37.719692, -122.438575)",,393_20150707,7/7/2015 0:00,90.0,Routine - Unscheduled,393_20150707_103143,Inadequate warewashing facilities or equipment,Low Risk,20150707,103143,2015-07-07,0,0,5,0,0,6,4
348,348,644,85377,El Toro,2470 San Bruno Ave,San Francisco,CA,94134,,,,,85377_20170104,1/4/2017 0:00,89.0,Routine - Unscheduled,85377_20170104_103119,Inadequate and inaccessible handwashing facilities,Moderate Risk,20170104,103119,2017-01-04,4,0,0,0,2,0,0
349,349,645,589,WON TON HOUSE,1325 NORIEGA St,San Francisco,CA,94122,37.754106,-122.477841,"(37.754106, -122.477841)",,589_20160503,5/3/2016 0:00,80.0,Routine - Unscheduled,589_20160503_103105,Improper cooling methods,High Risk,20160503,103105,2016-05-03,0,0,0,0,4,4,0
350,350,648,80631,Tea Plus,2541 San Bruno Ave,San Francisco,CA,94134,,,,,80631_20171212,12/12/2017 0:00,79.0,Routine - Unscheduled,80631_20171212_103154,Unclean or degraded floors walls or ceilings,Low Risk,20171212,103154,2017-12-12,0,6,0,0,5,3,3
351,351,653,71997,Independence High School,1350 07th Ave,San Francisco,CA,94122,,,,14155246000.0,71997_20151006,10/6/2015 0:00,94.0,Routine - Unscheduled,71997_20151006_103120,Moderate risk food holding temperature,Moderate Risk,20151006,103120,2015-10-06,0,0,1,3,0,2,2
352,352,654,33160,Mission Bay Cafe,550 Terry Francois St,San Francisco,CA,94158,37.770518,-122.386525,"(37.770518, -122.386525)",14155831002.0,33160_20161205,12/5/2016 0:00,94.0,Routine - Unscheduled,33160_20161205_103165,No plan review or Building Permit,Low Risk,20161205,103165,2016-12-05,0,0,0,0,2,0,0
353,353,655,74468,Francisca's,3047 Mission St,San Francisco,CA,94110,,,,14155371185.0,74468_20171212,12/12/2017 0:00,88.0,Routine - Unscheduled,74468_20171212_103142,Unclean nonfood contact surfaces,Low Risk,20171212,103142,2017-12-12,0,5,0,0,0,0,0
354,354,659,89687,Mi Lindo Peru,3226 Mission St.,San Francisco,CA,94110,,,,14155644897.0,89687_20170301,3/1/2017 0:00,,New Ownership,89687_20170301_103139,Improper food storage,Low Risk,20170301,103139,2017-03-01,0,3,0,0,4,0,0
355,355,661,415,Cafe Madeleine,43 O'Farrell St,San Francisco,CA,94108,37.786698,-122.405473,"(37.786698, -122.405473)",,415_20150903,9/3/2015 0:00,87.0,Routine - Unscheduled,415_20150903_103154,Unclean or degraded floors walls or ceilings,Low Risk,20150903,103154,2015-09-03,0,0,0,0,2,0,4
356,356,665,17723,Sushi Suki Restaurant,360 C West Portal Ave,San Francisco,CA,94127,37.738857,-122.45758400000001,"(37.738857, -122.457584)",,17723_20180222,2/22/2018 0:00,84.0,Routine - Unscheduled,17723_20180222_103124,Inadequately cleaned or sanitized food contact surfaces,Moderate Risk,20180222,103124,2018-02-22,6,0,0,0,0,5,0
357,357,669,1797,TIO CHILOS GRILL,2872 24th St,San Francisco,CA,94110,37.752807000000004,-122.409752,"(37.752807, -122.409752)",,1797_20160113,1/13/2016 0:00,85.0,Routine - Unscheduled,1797_20160113_103105,Improper cooling methods,High Risk,20160113,103105,2016-01-13,0,4,0,0,6,4,4
358,358,670,5847,John Muir Elementary School,380 Webster St,San Francisco,CA,94117,37.77404600000001,-122.429076,"(37.774046, -122.429076)",14155246335.0,5847_20160309,3/9/2016 0:00,92.0,Routine - Unscheduled,5847_20160309_103131,Moderate risk vermin infestation,Moderate Risk,20160309,103131,2016-03-09,0,2,0,0,1,0,2
359,359,671,83773,Bar Nua,561 Columbus Ave,San Francisco,CA,94133,,,,,83773_20170104,1/4/2017 0:00,86.0,Routine - Unscheduled,83773_20170104_103129,Insufficient hot water or running water,Moderate Risk,20170104,103129,2017-01-04,0,0,0,0,4,0,5
360,360,673,88657,Fang Yuan Kitchen,31 Cambon Dr,San Francisco,CA,94132,,,,14155278848.0,88657_20160830,8/30/2016 0:00,86.0,Routine - Unscheduled,88657_20160830_103120,Moderate risk food holding temperature,Moderate Risk,20160830,103120,2016-08-30,0,0,0,4,0,1,0
361,361,679,74800,Chubby Noodle Marina,2205 Lombard St,San Francisco,CA,94123,,,,,74800_20180212,2/12/2018 0:00,91.0,Routine - Unscheduled,74800_20180212_103109,Unclean or unsanitary food contact surfaces,High Risk,20180212,103109,2018-02-12,2,0,0,0,2,8,0
362,362,681,84394,NKG Cafe,28 Leland Ave,San Francisco,CA,94134,,,,,84394_20151222,12/22/2015 0:00,85.0,Routine - Unscheduled,84394_20151222_103103,High risk food holding temperature,High Risk,20151222,103103,2015-12-22,0,0,5,0,0,6,4
363,363,682,3350,House of Prime Rib,1906 Van Ness Ave,San Francisco,CA,94109,37.793338,-122.422827,"(37.793338, -122.422827)",,3350_20171214,12/14/2017 0:00,96.0,Routine - Unscheduled,3350_20171214_103124,Inadequately cleaned or sanitized food contact surfaces,Moderate Risk,20171214,103124,2017-12-14,0,1,0,0,0,2,2
364,364,684,19,Nrgize Lifestyle Cafe,"1200 Van Ness Ave, 3rd Floor",San Francisco,CA,94109,37.786848,-122.421547,"(37.786848, -122.421547)",,19_20171211,12/11/2017 0:00,94.0,Routine - Unscheduled,19_20171211_103144,Unapproved or unmaintained equipment or utensils,Low Risk,20171211,103144,2017-12-11,0,2,0,0,0,3,0
365,365,686,86074,Congregation Adath Israel,1851 Noriega St,San Francisco,CA,94122,,,,14155565665.0,86074_20170105,1/5/2017 0:00,98.0,Routine - Unscheduled,86074_20170105_103154,Unclean or degraded floors walls or ceilings,Low Risk,20170105,103154,2017-01-05,1,0,0,0,1,0,2
366,366,690,85924,Domino's #8421,5200 Geary Blvd,San Francisco,CA,94118,,,,14155383030.0,85924_20160203,2/3/2016 0:00,92.0,Routine - Unscheduled,85924_20160203_103124,Inadequately cleaned or sanitized food contact surfaces,Moderate Risk,20160203,103124,2016-02-03,0,0,0,5,0,5,2
367,367,694,87624,Proper Food,235 2nd St,San Francisco,CA,94105,,,,,87624_20161206,12/6/2016 0:00,92.0,Routine - Unscheduled,87624_20161206_103116,Inadequate food safety knowledge or lack of certified food safety manager,Moderate Risk,20161206,103116,2016-12-06,0,0,0,0,2,0,0
368,368,696,72153,Kwik & Convenient,600 Monterey Blvd,San Francisco,CA,94127,,,,14155334140.0,72153_20160809,8/9/2016 0:00,94.0,Routine - Unscheduled,72153_20160809_103120,Moderate risk food holding temperature,Moderate Risk,20160809,103120,2016-08-09,1,0,0,2,0,2,0
369,369,700,28169,Bloomingdales,845 Market St,San Francisco,CA,94103,,,,,28169_20161206,12/6/2016 0:00,90.0,Routine - Unscheduled,28169_20161206_103143,Inadequate warewashing facilities or equipment,Low Risk,20161206,103143,2016-12-06,3,0,0,0,4,1,0
370,370,703,65833,Ristorante Milano,1448 Pacific Ave,San Francisco,CA,94109,37.795398,-122.419044,"(37.795398, -122.419044)",,65833_20171208,12/8/2017 0:00,92.0,Routine - Unscheduled,65833_20171208_103133,Foods not protected from contamination,Moderate Risk,20171208,103133,2017-12-08,0,2,0,0,0,2,0
371,371,706,5477,AT&T - (CART 59) Carvery cart-Club level [145146],24 WILLIE MAYS PLAZA,San Francisco,CA,94107,,,,14155971500.0,5477_20160814,8/14/2016 0:00,96.0,Routine - Unscheduled,5477_20160814_103120,Moderate risk food holding temperature,Moderate Risk,20160814,103120,2016-08-14,0,0,3,0,2,1,0
372,372,707,83538,Happy Donuts,299 Ellis St,San Francisco,CA,94102,,,,,83538_20150729,7/29/2015 0:00,86.0,Routine - Unscheduled,83538_20150729_103154,Unclean or degraded floors walls or ceilings,Low Risk,20150729,103154,2015-07-29,7,0,4,0,0,7,5
373,373,709,18940,Bruno's,2389 MISSION St,San Francisco,CA,94110,37.758914000000004,-122.419036,"(37.758914, -122.419036)",,18940_20160930,9/30/2016 0:00,94.0,Routine - Unscheduled,18940_20160930_103154,Unclean or degraded floors walls or ceilings,Low Risk,20160930,103154,2016-09-30,0,0,0,0,0,3,0
374,374,711,4794,VICTOR'S,210 TOWNSEND St,San Francisco,CA,94107,37.778634000000004,-122.39308899999999,"(37.778634, -122.393089)",14155607018.0,4794_20170105,1/5/2017 0:00,90.0,Routine - Unscheduled,4794_20170105_103157,Food safety certificate or food handler card not available,Low Risk,20170105,103157,2017-01-05,5,0,0,0,3,0,0
375,375,714,69288,Plaj Restaurant & Bar,333 FULTON St,San Francisco,CA,94102,37.778853999999995,-122.42223700000001,"(37.778854, -122.422237)",,69288_20160531,5/31/2016 0:00,94.0,Routine - Unscheduled,69288_20160531_103119,Inadequate and inaccessible handwashing facilities,Moderate Risk,20160531,103119,2016-05-31,0,0,0,0,0,2,0
376,376,715,5459,AT&T - CART 41 NACHOS-COMPADRES,24 Willie Mays Pl,San Francisco,CA,94107,,,,14155971500.0,5459_20160814,8/14/2016 0:00,96.0,Routine - Unscheduled,5459_20160814_103120,Moderate risk food holding temperature,Moderate Risk,20160814,103120,2016-08-14,0,0,1,1,1,1,0
377,377,718,7603,Royal Star,Pier 41,San Francisco,CA,94133,37.808494,-122.412,"(37.808494, -122.412)",,7603_20180223,2/23/2018 0:00,96.0,Routine - Unscheduled,7603_20180223_103154,Unclean or degraded floors walls or ceilings,Low Risk,20180223,103154,2018-02-23,2,0,0,0,1,0,2
378,378,720,68826,Vanda Siam Restaurant,668 Sacramento St,San Francisco,CA,94111,37.79373,-122.403974,"(37.79373, -122.403974)",,68826_20160204,2/4/2016 0:00,,Reinspection/Followup,68826_20160204_103157,Food safety certificate or food handler card not available,Low Risk,20160204,103157,2016-02-04,0,0,0,0,6,0,4
379,379,722,82926,Hops & Hominy,12 Tillman St,San Francisco,CA,94108,,,,,82926_20161003,10/3/2016 0:00,96.0,Routine - Unscheduled,82926_20161003_103159,Worker safety hazards,Low Risk,20161003,103159,2016-10-03,0,0,0,0,2,0,0
380,380,727,3076,Limon Restaurant,524 VALENCIA St,San Francisco,CA,94103,37.764437,-122.421885,"(37.764437, -122.421885)",,3076_20160815,8/15/2016 0:00,88.0,Routine - Unscheduled,3076_20160815_103120,Moderate risk food holding temperature,Moderate Risk,20160815,103120,2016-08-15,0,0,0,4,0,3,2
381,381,733,7880,Ballroom Bakery,55 4th St,San Francisco,CA,94103,37.784964,-122.404752,"(37.784964, -122.404752)",,7880_20171107,11/7/2017 0:00,96.0,Routine - Unscheduled,7880_20171107_103131,Moderate risk vermin infestation,Moderate Risk,20171107,103131,2017-11-07,0,1,0,0,0,2,0
382,382,734,39528,Darwin Cafe,212 Ritch St,San Francisco,CA,94107,37.780607,-122.39609899999999,"(37.780607, -122.396099)",,39528_20170105,1/5/2017 0:00,74.0,Routine - Unscheduled,39528_20170105_103114,High risk vermin infestation,High Risk,20170105,103114,2017-01-05,1,0,0,0,1,0,0
383,383,735,3335,The Bell,1900 Polk St,San Francisco,CA,94109,37.794298,-122.42138700000001,"(37.794298, -122.421387)",,3335_20160815,8/15/2016 0:00,83.0,Routine - Unscheduled,3335_20160815_103156,Permit license or inspection report not posted,Low Risk,20160815,103156,2016-08-15,5,0,5,0,0,5,2
384,384,743,74149,Guang Dong Barbecue Tea House,2191 Irving St,San Francisco,CA,94122,,,,14155739948.0,74149_20161207,12/7/2016 0:00,86.0,Routine - Unscheduled,74149_20161207_103124,Inadequately cleaned or sanitized food contact surfaces,Moderate Risk,20161207,103124,2016-12-07,0,7,0,0,4,3,0
385,385,744,80027,Edible Arrangements,312 West Portal Ave,San Francisco,CA,94127,,,,14155733120.0,80027_20160603,6/3/2016 0:00,98.0,Routine - Unscheduled,80027_20160603_103149,Wiping cloths not clean or properly stored or inadequate sanitizer,Low Risk,20160603,103149,2016-06-03,0,0,0,0,0,1,0
386,386,745,5630,AT&T - VENDING COMMISSARY Rm5326 [145160],24 WILLIE MAYS PLAZA 5.21.01,San Francisco,CA,94107,37.778382,-122.39115100000001,"(37.778382, -122.391151)",14155971500.0,5630_20160814,8/14/2016 0:00,92.0,Routine - Unscheduled,5630_20160814_103154,Unclean or degraded floors walls or ceilings,Low Risk,20160814,103154,2016-08-14,0,0,0,0,0,3,0
387,387,747,7488,EUROPA EXPRESS,746-750 LA PLAYA St,San Francisco,CA,94121,37.774248,-122.510043,"(37.774248, -122.510043)",14155644917.0,7488_20180209,2/9/2018 0:00,94.0,Routine - Unscheduled,7488_20180209_103144,Unapproved or unmaintained equipment or utensils,Low Risk,20180209,103144,2018-02-09,3,0,0,0,0,6,4
388,388,748,37507,The Pub At S.F.S.U.,1650 Holloway Ave C-134,San Francisco,CA,94132,37.720894,-122.478029,"(37.720894, -122.478029)",,37507_20160518,5/18/2016 0:00,94.0,Routine - Unscheduled,37507_20160518_103144,Unapproved or unmaintained equipment or utensils,Low Risk,20160518,103144,2016-05-18,0,0,3,0,0,2,0
389,389,751,7095,ABE'S MARKET,378 FILLMORE St,San Francisco,CA,94117,37.772822,-122.430498,"(37.772822, -122.430498)",14155862576.0,7095_20171211,12/11/2017 0:00,92.0,Routine - Unscheduled,7095_20171211_103119,Inadequate and inaccessible handwashing facilities,Moderate Risk,20171211,103119,2017-12-11,0,3,0,0,0,0,0
390,390,752,81579,Salem Grocery,920 Geary St,San Francisco,CA,94109,,,,,81579_20160902,9/2/2016 0:00,88.0,Routine - Unscheduled,81579_20160902_103131,Moderate risk vermin infestation,Moderate Risk,20160902,103131,2016-09-02,0,2,4,0,0,3,0
391,391,753,34865,Regent Thai Restaurant,1700 Church St,San Francisco,CA,94131,37.743567,-122.426685,"(37.743567, -122.426685)",,34865_20170104,1/4/2017 0:00,86.0,Routine - Unscheduled,34865_20170104_103144,Unapproved or unmaintained equipment or utensils,Low Risk,20170104,103144,2017-01-04,0,3,0,0,4,0,1
392,392,755,65425,Panda Express,500 Parnassus Ave J Level,San Francisco,CA,94143,37.763473,-122.458202,"(37.763473, -122.458202)",,65425_20160126,1/26/2016 0:00,87.0,Routine - Unscheduled,65425_20160126_103142,Unclean nonfood contact surfaces,Low Risk,20160126,103142,2016-01-26,0,0,0,0,0,0,3
393,393,759,1452,CAFE V,1525 FOLSOM St,San Francisco,CA,94103,37.771538,-122.414372,"(37.771538, -122.414372)",,1452_20171205,12/5/2017 0:00,89.0,Routine - Unscheduled,1452_20171205_103132,Improper thawing methods,Moderate Risk,20171205,103132,2017-12-05,0,2,0,0,3,0,0
394,394,761,68261,MV Pisces,Pier 41,San Francisco,CA,94133,37.808494,-122.412,"(37.808494, -122.412)",,68261_20160518,5/18/2016 0:00,94.0,Routine - Unscheduled,68261_20160518_103119,Inadequate and inaccessible handwashing facilities,Moderate Risk,20160518,103119,2016-05-18,0,0,0,0,0,2,1
395,395,764,33641,Roti Indian Bistro,53 West Portal Ave,San Francisco,CA,94127,37.740227000000004,-122.466338,"(37.740227, -122.466338)",,33641_20160607,6/7/2016 0:00,94.0,Routine - Unscheduled,33641_20160607_103154,Unclean or degraded floors walls or ceilings,Low Risk,20160607,103154,2016-06-07,6,0,0,0,0,3,0
396,396,765,93361,Las Palmas on SF,5251 3rd St.,San Francisco,CA,94124,,,,,93361_20171219,12/19/2017 0:00,,New Ownership,93361_20171219_103131,Moderate risk vermin infestation,Moderate Risk,20171219,103131,2017-12-19,0,3,0,0,0,0,0
397,397,767,3649,SAFEWAY #1490,2300 16th St,San Francisco,CA,94103,37.765708000000004,-122.409002,"(37.765708, -122.409002)",14155571120.0,3649_20160930,9/30/2016 0:00,86.0,Routine - Unscheduled,3649_20160930_103124,Inadequately cleaned or sanitized food contact surfaces,Moderate Risk,20160930,103124,2016-09-30,0,3,0,0,0,4,1
398,398,768,34665,Le Petit Laurent,699 CHENERY St,San Francisco,CA,94131,37.734483000000004,-122.433729,"(37.734483, -122.433729)",,34665_20160929,9/29/2016 0:00,87.0,Routine - Unscheduled,34665_20160929_103149,Wiping cloths not clean or properly stored or inadequate sanitizer,Low Risk,20160929,103149,2016-09-29,0,0,0,4,0,4,0
399,399,769,37755,The Grind Cafe,783 Haight St,San Francisco,CA,94117,37.771483,-122.43512700000001,"(37.771483, -122.435127)",,37755_20150819,8/19/2015 0:00,91.0,Routine - Unscheduled,37755_20150819_103161,Low risk vermin infestation,Low Risk,20150819,103161,2015-08-19,0,0,0,0,4,0,2
400,400,774,81468,Hoffmann's Grill & Rotisserie,1000 Guerrero St,San Francisco,CA,94110,,,,14155377479.0,81468_20161206,12/6/2016 0:00,96.0,Routine - Unscheduled,81468_20161206_103154,Unclean or degraded floors walls or ceilings,Low Risk,20161206,103154,2016-12-06,0,0,0,0,2,0,0
401,401,775,83808,2227 Irving Seafood Market Inc,2227 Irving St,San Francisco,CA,94122,,,,14155215212.0,83808_20160329,3/29/2016 0:00,84.0,Routine - Unscheduled,83808_20160329_103132,Improper thawing methods,Moderate Risk,20160329,103132,2016-03-29,0,0,6,0,0,5,4
402,402,776,5905,MARINA MIDDLE SCHOOL,3500 FILLMORE St,San Francisco,CA,94123,37.801776000000004,-122.43641000000001,"(37.801776, -122.43641)",14155743495.0,5905_20160325,3/25/2016 0:00,92.0,Routine - Unscheduled,5905_20160325_103147,Inadequate ventilation or lighting,Low Risk,20160325,103147,2016-03-25,2,0,3,0,5,3,4
403,403,803,74829,Outerlands,4001 Judah St,San Francisco,CA,94122,,,,14155666140.0,74829_20160923,9/23/2016 0:00,88.0,Routine - Unscheduled,74829_20160923_103124,Inadequately cleaned or sanitized food contact surfaces,Moderate Risk,20160923,103124,2016-09-23,0,0,1,0,0,3,3
404,404,809,83476,Kio Ramen,3528 Balboa St,San Francisco,CA,94121,,,,14155535056.0,83476_20160428,4/28/2016 0:00,64.0,Routine - Unscheduled,83476_20160428_103133,Foods not protected from contamination,Moderate Risk,20160428,103133,2016-04-28,0,3,0,0,7,7,0
405,405,813,84165,Cup A Joe Coffehaus,896 Sutter St,San Francisco,CA,94109,,,,,84165_20160209,2/9/2016 0:00,84.0,Routine - Unscheduled,84165_20160209_103139,Improper food storage,Low Risk,20160209,103139,2016-02-09,0,5,0,0,7,0,6
406,406,820,1144,Star Bagels,1475 Polk St,San Francisco,CA,94109,37.790324,-122.42066399999999,"(37.790324, -122.420664)",,1144_20160929,9/29/2016 0:00,79.0,Routine - Unscheduled,1144_20160929_103124,Inadequately cleaned or sanitized food contact surfaces,Moderate Risk,20160929,103124,2016-09-29,5,0,4,0,0,6,5
407,407,822,2418,MANIVANH THAI RESTAURANT,2732 24th St,San Francisco,CA,94110,37.752968,-122.40706200000001,"(37.752968, -122.407062)",,2418_20160113,1/13/2016 0:00,86.0,Routine - Unscheduled,2418_20160113_103124,Inadequately cleaned or sanitized food contact surfaces,Moderate Risk,20160113,103124,2016-01-13,0,5,0,0,5,5,5
408,408,827,2282,PACIFIC CAFE,7000 GEARY Blvd,San Francisco,CA,94121,37.779668,-122.49456200000002,"(37.779668, -122.494562)",,2282_20160510,5/10/2016 0:00,83.0,Routine - Unscheduled,2282_20160510_103132,Improper thawing methods,Moderate Risk,20160510,103132,2016-05-10,0,0,4,0,0,4,0
409,409,832,26379,Sushi Kazu,841 Irving St,San Francisco,CA,94122,37.763983,-122.46708999999998,"(37.763983, -122.46709)",,26379_20171004,10/4/2017 0:00,,Complaint,26379_20171004_103133,Foods not protected from contamination,Moderate Risk,20171004,103133,2017-10-04,0,2,0,0,4,0,0
410,410,843,62277,Tacos San Buena,16th & Shotwell St,San Francisco,CA,94102,37.779847,-122.418985,"(37.779847, -122.418985)",14155556127.0,62277_20180221,2/21/2018 0:00,87.0,Routine - Unscheduled,62277_20180221_103103,High risk food holding temperature,High Risk,20180221,103103,2018-02-21,3,0,0,0,0,4,2
411,411,851,2902,Myconos Restaurant,1431 Polk St,San Francisco,CA,94109,37.78996400000001,-122.42059499999999,"(37.789964, -122.420595)",,2902_20151223,12/23/2015 0:00,87.0,Routine - Unscheduled,2902_20151223_103119,Inadequate and inaccessible handwashing facilities,Moderate Risk,20151223,103119,2015-12-23,0,0,5,0,0,5,3
412,412,853,29610,Lee's Sandwiches,625 Larkin St,San Francisco,CA,94109,37.783664,-122.417635,"(37.783664, -122.417635)",,29610_20160217,2/17/2016 0:00,67.0,Routine - Unscheduled,29610_20160217_103103,High risk food holding temperature,High Risk,20160217,103103,2016-02-17,0,0,6,0,0,0,8
413,413,855,62597,J J Fish & Chicken,5100 03rd St,San Francisco,CA,94124,37.732442999999996,-122.391682,"(37.732443, -122.391682)",,62597_20171213,12/13/2017 0:00,86.0,Routine - Unscheduled,62597_20171213_103133,Foods not protected from contamination,Moderate Risk,20171213,103133,2017-12-13,0,5,0,0,4,0,2
414,414,860,3222,MEL'S DRIVE-IN,3355 GEARY Blvd,San Francisco,CA,94118,37.781403999999995,-122.45493700000002,"(37.781404, -122.454937)",,3222_20171117,11/17/2017 0:00,82.0,Routine - Unscheduled,3222_20171117_103120,Moderate risk food holding temperature,Moderate Risk,20171117,103120,2017-11-17,0,3,0,0,0,3,0
415,415,861,66328,Chairman Bao,Off The Grid,San Francisco,CA,94102,37.721453000000004,-122.48629,"(37.721453, -122.48629)",,66328_20160930,9/30/2016 0:00,96.0,Routine - Unscheduled,66328_20160930_103160,Inadequate HACCP plan record keeping,Low Risk,20160930,103160,2016-09-30,0,0,0,0,0,2,0
416,416,862,36473,Maggie Cafe,848 Grant Ave,San Francisco,CA,94108,37.794897999999996,-122.406356,"(37.794898, -122.406356)",,36473_20160412,4/12/2016 0:00,94.0,Routine - Unscheduled,36473_20160412_103144,Unapproved or unmaintained equipment or utensils,Low Risk,20160412,103144,2016-04-12,0,3,0,0,3,3,3
417,417,868,57653,Tacos San Buena #2,79 Sansome St,San Francisco,CA,zzzzz,,,,14155556127.0,57653_20171018,10/18/2017 0:00,83.0,Routine - Unscheduled,57653_20171018_103144,Unapproved or unmaintained equipment or utensils,Low Risk,20171018,103144,2017-10-18,0,5,6,0,0,5,0
418,418,869,3217,MARNEE THAI RESTAURANT,1243 09th Ave,San Francisco,CA,94122,37.758941,-122.48591,"(37.758941, -122.48591)",,3217_20150709,7/9/2015 0:00,71.0,Routine - Unscheduled,3217_20150709_103131,Moderate risk vermin infestation,Moderate Risk,20150709,103131,2015-07-09,4,0,0,0,0,0,1
419,419,870,85739,Kawashima's Kitchen,5800 3rd St  C1001,San Francisco,CA,94124,,,,14155234447.0,85739_20160310,3/10/2016 0:00,,New Ownership,85739_20160310_103102,Unclean hands or improper use of gloves,High Risk,20160310,103102,2016-03-10,0,0,2,0,0,0,6
420,420,875,5522,AT&T - (J-2B) TULLY'S,24 Willie Mays Pl,San Francisco,CA,94107,,,,,5522_20160814,8/14/2016 0:00,98.0,Routine - Unscheduled,5522_20160814_103144,Unapproved or unmaintained equipment or utensils,Low Risk,20160814,103144,2016-08-14,0,0,2,1,1,1,0
421,421,878,217,PROGRESSIVE GROUNDS,400 CORTLAND Ave,San Francisco,CA,94110,37.739143,-122.417653,"(37.739143, -122.417653)",,217_20160329,3/29/2016 0:00,94.0,Routine - Unscheduled,217_20160329_103144,Unapproved or unmaintained equipment or utensils,Low Risk,20160329,103144,2016-03-29,0,0,1,0,3,4,3
422,422,879,83472,The Spice Jar,2500 Bryant St,San Francisco,CA,94110,,,,,83472_20160322,3/22/2016 0:00,94.0,Routine - Unscheduled,83472_20160322_103149,Wiping cloths not clean or properly stored or inadequate sanitizer,Low Risk,20160322,103149,2016-03-22,0,3,0,0,0,3,2
423,423,880,90238,USA Power Market,1524 \ Ave,San Francisco,CA,94112,,,,14155331878.0,90238_20170131,1/31/2017 0:00,,New Ownership,90238_20170131_103120,Moderate risk food holding temperature,Moderate Risk,20170131,103120,2017-01-31,0,0,0,2,4,0,0
424,424,886,337,GORDO TAQUERIA #2,1239 09th Ave,San Francisco,CA,94122,37.758941,-122.48591,"(37.758941, -122.48591)",,337_20160520,5/20/2016 0:00,90.0,Routine - Unscheduled,337_20160520_103154,Unclean or degraded floors walls or ceilings,Low Risk,20160520,103154,2016-05-20,3,0,0,0,0,3,0
425,425,889,33315,Cafe 101,1650 Holloway St 134,San Francisco,CA,94132,37.720894,-122.478029,"(37.720894, -122.478029)",,33315_20160518,5/18/2016 0:00,94.0,Routine - Unscheduled,33315_20160518_103131,Moderate risk vermin infestation,Moderate Risk,20160518,103131,2016-05-18,0,0,1,0,1,2,0
426,426,890,65531,Yellow Submarine,503 IRVING St,San Francisco,CA,94122,37.764136,-122.463146,"(37.764136, -122.463146)",,65531_20180226,2/26/2018 0:00,96.0,Routine - Unscheduled,65531_20180226_103154,Unclean or degraded floors walls or ceilings,Low Risk,20180226,103154,2018-02-26,2,0,0,0,0,3,0
427,427,894,1896,SIMPLE PLEASURES CAFE,3434 BALBOA St,San Francisco,CA,94121,37.775818,-122.495802,"(37.775818, -122.495802)",,1896_20180223,2/23/2018 0:00,85.0,Routine - Unscheduled,1896_20180223_103109,Unclean or unsanitary food contact surfaces,High Risk,20180223,103109,2018-02-23,4,0,0,0,0,3,4
428,428,895,82466,Tanuki Restaurant,4419 California St,San Francisco,CA,94118,,,,,82466_20161206,12/6/2016 0:00,92.0,Routine - Unscheduled,82466_20161206_103138,Improper storage use or identification of toxic substances,Low Risk,20161206,103138,2016-12-06,0,0,3,0,3,0,4
429,429,897,37482,Bursa,60 West Portal Ave.,San Francisco,CA,94127,37.740144,-122.46656899999999,"(37.740144, -122.466569)",,37482_20180222,2/22/2018 0:00,92.0,Routine - Unscheduled,37482_20180222_103120,Moderate risk food holding temperature,Moderate Risk,20180222,103120,2018-02-22,3,0,0,0,0,1,0
430,430,899,67920,Noori,1924 IRVING St,San Francisco,CA,94122,,,,,67920_20171213,12/13/2017 0:00,86.0,Routine - Unscheduled,67920_20171213_103133,Foods not protected from contamination,Moderate Risk,20171213,103133,2017-12-13,0,5,0,0,5,3,5
431,431,901,62548,Estrella Taqueria,533 Haight St,San Francisco,CA,94117,37.772013,-122.43104699999999,"(37.772013, -122.431047)",,62548_20171211,12/11/2017 0:00,84.0,Routine - Unscheduled,62548_20171211_103139,Improper food storage,Low Risk,20171211,103139,2017-12-11,0,6,0,0,0,5,3
432,432,905,86423,Pete's on Green,570 Green St,San Francisco,CA,94133,,,,14155390939.0,86423_20160628,6/28/2016 0:00,91.0,Routine - Unscheduled,86423_20160628_103156,Permit license or inspection report not posted,Low Risk,20160628,103156,2016-06-28,0,0,5,0,0,2,0
433,433,907,87337,Whisk On Wheels,Off the Grid,San Francisco,CA,zzzzz,,,,,87337_20160812,8/12/2016 0:00,94.0,Routine - Unscheduled,87337_20160812_103120,Moderate risk food holding temperature,Moderate Risk,20160812,103120,2016-08-12,0,0,0,0,0,2,2
434,434,920,5461,AT&T - (CART 43) DOGGIE DINNER [145130],24 WILLIE MAYS PLAZA,San Francisco,CA,94107,,,,14155971500.0,5461_20160814,8/14/2016 0:00,89.0,Routine - Unscheduled,5461_20160814_103120,Moderate risk food holding temperature,Moderate Risk,20160814,103120,2016-08-14,0,0,1,0,1,2,2
435,435,924,80079,Quickly,2800 Leavenworth St #A11,San Francisco,CA,94133,,,,,80079_20160812,8/12/2016 0:00,92.0,Routine - Unscheduled,80079_20160812_103139,Improper food storage,Low Risk,20160812,103139,2016-08-12,5,0,4,0,0,3,0
436,436,929,1978,GOLDEN CHARIOT BAKERY & REST,3308 BALBOA St,San Francisco,CA,94121,37.77587800000001,-122.494382,"(37.775878, -122.494382)",,1978_20171024,10/24/2017 0:00,81.0,Routine - Unscheduled,1978_20171024_103139,Improper food storage,Low Risk,20171024,103139,2017-10-24,0,6,0,0,7,0,6
437,437,935,78313,Sajj Street Eats #2,Off The Grid,San Francisco,CA,94102,,,,,78313_20160324,3/24/2016 0:00,96.0,Routine - Unscheduled,78313_20160324_103148,No thermometers or uncalibrated thermometers,Low Risk,20160324,103148,2016-03-24,0,0,0,0,1,0,2
438,438,937,86164,The Myriad,2175 Market St,San Francisco,CA,94114,,,,14155644318.0,86164_20160328,3/28/2016 0:00,98.0,Routine - Unscheduled,86164_20160328_103138,Improper storage use or identification of toxic substances,Low Risk,20160328,103138,2016-03-28,0,0,0,0,0,0,1
439,439,946,60355,Taqueria Castillo B,86 McAllister St,San Francisco,CA,94102,37.780994,-122.41363700000001,"(37.780994, -122.413637)",,60355_20180222,2/22/2018 0:00,88.0,Routine - Unscheduled,60355_20180222_103142,Unclean nonfood contact surfaces,Low Risk,20180222,103142,2018-02-22,5,0,4,0,0,7,5
440,440,950,2858,Kokkari,200 Jackson St,San Francisco,CA,94111,37.796918,-122.399864,"(37.796918, -122.399864)",,2858_20170222,2/22/2017 0:00,,Complaint,2858_20170222_103145,Improper storage of equipment utensils or linens,Low Risk,20170222,103145,2017-02-22,0,0,0,0,4,4,0
441,441,954,5622,AT&T - VENDING COMMISSARY [145152],24 Willie Mays Pl,San Francisco,CA,94107,37.757923,-122.393914,"(37.757923, -122.393914)",14155971500.0,5622_20160814,8/14/2016 0:00,94.0,Routine - Unscheduled,5622_20160814_103119,Inadequate and inaccessible handwashing facilities,Moderate Risk,20160814,103119,2016-08-14,0,0,2,0,2,2,0
442,442,956,5653,S. F. Chowder A Chili Cart,Pier 39,San Francisco,CA,94133,37.80824000000001,-122.41018899999999,"(37.80824, -122.410189)",,5653_20170928,9/28/2017 0:00,94.0,Routine - Unscheduled,5653_20170928_103145,Improper storage of equipment utensils or linens,Low Risk,20170928,103145,2017-09-28,0,0,3,0,1,2,0
443,443,959,2357,CHINA EXPRESS,2798 MISSION St,San Francisco,CA,94110,37.752408,-122.418535,"(37.752408, -122.418535)",14155640881.0,2357_20170602,6/2/2017 0:00,,Complaint,2357_20170602_103124,Inadequately cleaned or sanitized food contact surfaces,Moderate Risk,20170602,103124,2017-06-02,0,7,0,10,0,2,6
444,444,961,1631,Casa Mexicana Restaurant,3917 24th St,San Francisco,CA,94114,37.751513,-122.43017900000001,"(37.751513, -122.430179)",,1631_20160906,9/6/2016 0:00,77.0,Routine - Unscheduled,1631_20160906_103131,Moderate risk vermin infestation,Moderate Risk,20160906,103131,2016-09-06,0,0,7,0,0,6,6
445,445,970,905,Working Girls' Cafe',0259 Kearny St,San Francisco,CA,94108,37.790477,-122.40403300000001,"(37.790477, -122.404033)",,905_20160921,9/21/2016 0:00,,Reinspection/Followup,905_20160921_103162,Other low risk violation,Low Risk,20160921,103162,2016-09-21,0,2,0,0,0,1,2
446,446,972,500,Roxanne Cafe,570 Powell St,San Francisco,CA,94108,37.79000300000001,-122.40868799999998,"(37.790003, -122.408688)",,500_20150930,9/30/2015 0:00,86.0,Routine - Unscheduled,500_20150930_103142,Unclean nonfood contact surfaces,Low Risk,20150930,103142,2015-09-30,0,0,0,0,2,0,5
447,447,973,88799,Village House,3398 Balboa St A,San Francisco,CA,94121,,,,14155526655.0,88799_20170918,9/18/2017 0:00,,Complaint,88799_20170918_103114,High risk vermin infestation,High Risk,20170918,103114,2017-09-18,0,0,5,0,4,5,0
448,448,978,4999,HARVEST MARKET,2285 MARKET St,San Francisco,CA,94114,37.764607,-122.432452,"(37.764607, -122.432452)",14155620805.0,4999_20170501,5/1/2017 0:00,,Complaint,4999_20170501_103149,Wiping cloths not clean or properly stored or inadequate sanitizer,Low Risk,20170501,103149,2017-05-01,0,6,0,1,1,0,3
449,449,979,3571,CITY CLUB,"155 Sansome St, 10th Floor",San Francisco,CA,94104,37.791714,-122.40083500000001,"(37.791714, -122.400835)",,3571_20171213,12/13/2017 0:00,74.0,Routine - Unscheduled,3571_20171213_103150,Improper or defective plumbing,Low Risk,20171213,103150,2017-12-13,0,8,0,0,0,7,2
450,450,985,37038,Live Sushi Bar,2001 17th St,San Francisco,CA,94103,37.764693,-122.403699,"(37.764693, -122.403699)",,37038_20180222,2/22/2018 0:00,89.0,Routine - Unscheduled,37038_20180222_103139,Improper food storage,Low Risk,20180222,103139,2018-02-22,3,0,0,0,3,0,1
451,451,986,84205,Common Sage,1552 Polk St,San Francisco,CA,94109,,,,,84205_20180227,2/27/2018 0:00,94.0,Routine - Unscheduled,84205_20180227_103141,Improper food labeling or menu misrepresentation,Low Risk,20180227,103141,2018-02-27,3,0,4,0,0,7,5
452,452,987,795,Ben & Jerry's,Pier 41,San Francisco,CA,94133,37.808494,-122.412,"(37.808494, -122.412)",,795_20160607,6/7/2016 0:00,96.0,Routine - Unscheduled,795_20160607_103142,Unclean nonfood contact surfaces,Low Risk,20160607,103142,2016-06-07,0,2,0,0,1,2,2
453,453,990,32170,La Torta Gorda,2833 24th St,San Francisco,CA,94110,37.752813,-122.408799,"(37.752813, -122.408799)",,32170_20160120,1/20/2016 0:00,85.0,Routine - Unscheduled,32170_20160120_103154,Unclean or degraded floors walls or ceilings,Low Risk,20160120,103154,2016-01-20,0,5,0,0,2,4,4
454,454,991,18825,Fresca Restaurant,3945 24th St,San Francisco,CA,94114,37.751474,-122.43070800000001,"(37.751474, -122.430708)",,18825_20161205,12/5/2016 0:00,94.0,Routine - Unscheduled,18825_20161205_103120,Moderate risk food holding temperature,Moderate Risk,20161205,103120,2016-12-05,4,0,0,0,2,0,3
455,455,993,5632,AT&T - DOGGIE DINNER - Rm 5333/v [145162],24 WILLIE MAYS PLAZA 5.26.01,San Francisco,CA,94107,37.778382,-122.39115100000001,"(37.778382, -122.391151)",14155971500.0,5632_20160814,8/14/2016 0:00,93.0,Routine - Unscheduled,5632_20160814_103103,High risk food holding temperature,High Risk,20160814,103103,2016-08-14,0,0,0,0,0,1,3
456,456,1004,886,Le Petit Cafe,1 Maritime Plaza,San Francisco,CA,94111,37.795227000000004,-122.39913999999999,"(37.795227, -122.39914)",,886_20151120,11/20/2015 0:00,94.0,Routine - Unscheduled,886_20151120_103153,Inadequate dressing rooms or improper storage of personal items,Low Risk,20151120,103153,2015-11-20,0,0,0,0,2,0,3
457,457,1005,19082,Moscone Ctr. Northside Cafe/Cafe D,747 Howard St Basement,San Francisco,CA,94103,37.784128,-122.401533,"(37.784128, -122.401533)",,19082_20160607,6/7/2016 0:00,96.0,Routine - Unscheduled,19082_20160607_103131,Moderate risk vermin infestation,Moderate Risk,20160607,103131,2016-06-07,0,0,0,0,3,1,0
458,458,1016,82388,Jin Mi BBQ & Tofu,366 Golden Gate Ave,San Francisco,CA,94102,,,,,82388_20150630,6/30/2015 0:00,89.0,Routine - Unscheduled,82388_20150630_103133,Foods not protected from contamination,Moderate Risk,20150630,103133,2015-06-30,0,0,0,0,3,0,2
459,459,1023,81383,Sammy's Cafe,1416 Bush St,San Francisco,CA,94109,,,,,81383_20171211,12/11/2017 0:00,94.0,Routine - Unscheduled,81383_20171211_103149,Wiping cloths not clean or properly stored or inadequate sanitizer,Low Risk,20171211,103149,2017-12-11,0,2,6,0,8,3,0
460,460,1036,76992,City Taqueria,1836 Divisadero St,San Francisco,CA,94115,,,,,76992_20160928,9/28/2016 0:00,75.0,Routine - Unscheduled,76992_20160928_103150,Improper or defective plumbing,Low Risk,20160928,103150,2016-09-28,5,0,0,0,0,5,7
461,461,1037,37344,Civic Restaurant & Bar,272 McAllister St,San Francisco,CA,94102,37.780597,-122.41646399999999,"(37.780597, -122.416464)",,37344_20151019,10/19/2015 0:00,,Complaint,37344_20151019_103154,Unclean or degraded floors walls or ceilings,Low Risk,20151019,103154,2015-10-19,0,0,0,0,6,0,8
462,462,1038,7477,Harbor Emperor,377,San Francisco,CA,94133,37.808494,-122.412,"(37.808494, -122.412)",,7477_20160518,5/18/2016 0:00,98.0,Routine - Unscheduled,7477_20160518_103145,Improper storage of equipment utensils or linens,Low Risk,20160518,103145,2016-05-18,1,0,0,0,2,1,0
463,463,1042,6800,Arts Valero,2985 San Bruno Ave,San Francisco,CA,94134,37.72405300000001,-122.402069,"(37.724053, -122.402069)",,6800_20160519,5/19/2016 0:00,92.0,Routine - Unscheduled,6800_20160519_103149,Wiping cloths not clean or properly stored or inadequate sanitizer,Low Risk,20160519,103149,2016-05-19,0,2,0,0,3,3,0
464,464,1046,90222,Punch Line San Francisco,444 Battery St,San Francisco,CA,94111,,,,,90222_20170727,7/27/2017 0:00,,New Ownership,90222_20170727_103124,Inadequately cleaned or sanitized food contact surfaces,Moderate Risk,20170727,103124,2017-07-27,0,0,4,0,0,0,0
465,465,1048,5501,AT&T - (CART 25) FRESH CATCH-Clam chowder soup [145112],24 WILLIE MAYS PLAZA,San Francisco,CA,94107,,,,14155971500.0,5501_20160814,8/14/2016 0:00,92.0,Routine - Unscheduled,5501_20160814_103120,Moderate risk food holding temperature,Moderate Risk,20160814,103120,2016-08-14,0,0,1,2,0,2,2
466,466,1058,87447,The Castro Republic,2295 Market St,San Francisco,CA,94114,,,,14155930525.0,87447_20161027,10/27/2016 0:00,90.0,Routine - Unscheduled,87447_20161027_103119,Inadequate and inaccessible handwashing facilities,Moderate Risk,20161027,103119,2016-10-27,5,0,6,0,3,0,0
467,467,1063,68716,The Sweet House,3512 BALBOA St,San Francisco,CA,94121,37.775818,-122.496401,"(37.775818, -122.496401)",14155871388.0,68716_20180226,2/26/2018 0:00,80.0,Routine - Unscheduled,68716_20180226_103129,Insufficient hot water or running water,Moderate Risk,20180226,103129,2018-02-26,4,0,0,0,0,0,0
468,468,1064,3529,Great Eastern Restaurant,649 Jackson St,San Francisco,CA,94133,37.796093,-122.405918,"(37.796093, -122.405918)",,3529_20171213,12/13/2017 0:00,83.0,Routine - Unscheduled,3529_20171213_103103,High risk food holding temperature,High Risk,20171213,103103,2017-12-13,0,5,0,6,0,1,0
469,469,1074,83704,Z011 Coffee Traders,1035 Fillmore St #3,San Francisco,CA,94115,,,,,83704_20161104,11/4/2016 0:00,92.0,Routine - Unscheduled,83704_20161104_103157,Food safety certificate or food handler card not available,Low Risk,20161104,103157,2016-11-04,0,0,0,0,4,0,2
470,470,1077,3920,BOSTON MARKET,2300 16th St,San Francisco,CA,94103,37.765708000000004,-122.409002,"(37.765708, -122.409002)",14155867666.0,3920_20160516,5/16/2016 0:00,88.0,Routine - Unscheduled,3920_20160516_103154,Unclean or degraded floors walls or ceilings,Low Risk,20160516,103154,2016-05-16,3,0,0,0,3,4,0
471,471,1078,82376,Nieves Cinco De Mayo Produce,3052 16th St,San Francisco,CA,94103,,,,14155807536.0,82376_20150730,7/30/2015 0:00,90.0,Routine - Unscheduled,82376_20150730_103139,Improper food storage,Low Risk,20150730,103139,2015-07-30,5,0,0,0,3,4,4
472,472,1079,3256,"Connection, The",5740 MISSION St,San Francisco,CA,94112,37.709737,-122.45007,"(37.709737, -122.45007)",14155336172.0,3256_20161005,10/5/2016 0:00,87.0,Routine - Unscheduled,3256_20161005_103119,Inadequate and inaccessible handwashing facilities,Moderate Risk,20161005,103119,2016-10-05,0,3,0,0,3,0,1
473,473,1089,71416,The Supremo Pizza LLC,87 06th St,San Francisco,CA,94103,,,,,71416_20171213,12/13/2017 0:00,72.0,Routine - Unscheduled,71416_20171213_103156,Permit license or inspection report not posted,Low Risk,20171213,103156,2017-12-13,0,7,0,0,7,0,8
474,474,1092,19277,Farmer Brown,25 Mason St,San Francisco,CA,94102,37.783657,-122.409227,"(37.783657, -122.409227)",,19277_20160930,9/30/2016 0:00,90.0,Routine - Unscheduled,19277_20160930_103120,Moderate risk food holding temperature,Moderate Risk,20160930,103120,2016-09-30,0,0,6,0,0,4,0
475,475,1093,68784,Joe's Ice Cream,5420 Geary Blvd,San Francisco,CA,94121,37.780488,-122.477751,"(37.780488, -122.477751)",,68784_20160510,5/10/2016 0:00,90.0,Routine - Unscheduled,68784_20160510_103139,Improper food storage,Low Risk,20160510,103139,2016-05-10,0,0,0,0,1,3,0
476,476,1095,93431,Subway #12181,423 Bush St,San Francisco,CA,94108,,,,,93431_20171211,12/11/2017 0:00,89.0,Routine - Unscheduled,93431_20171211_103150,Improper or defective plumbing,Low Risk,20171211,103150,2017-12-11,0,3,0,0,0,0,0
477,477,1097,81637,Jordan's Kitchen LLC,413 10th St,San Francisco,CA,94107,,,,14155710761.0,81637_20170925,9/25/2017 0:00,96.0,Routine - Unscheduled,81637_20170925_103129,Insufficient hot water or running water,Moderate Risk,20170925,103129,2017-09-25,0,0,1,0,0,0,0
478,478,1103,88128,Stoner's Sandwiches of San Francisco,752 Van Ness Ave,San Francisco,CA,94110,,,,,88128_20170104,1/4/2017 0:00,94.0,Routine - Unscheduled,88128_20170104_103120,Moderate risk food holding temperature,Moderate Risk,20170104,103120,2017-01-04,0,0,0,0,2,0,0
479,479,1107,82394,Senor Sisig #4,Off The Grid,San Francisco,CA,94102,,,,,82394_20160618,6/18/2016 0:00,89.0,Routine - Unscheduled,82394_20160618_103144,Unapproved or unmaintained equipment or utensils,Low Risk,20160618,103144,2016-06-18,0,0,0,3,0,3,0
480,480,1112,3839,EL TORO TAQUERIA,598 VALENCIA St,San Francisco,CA,94110,37.763458,-122.421784,"(37.763458, -122.421784)",14155433351.0,3839_20160815,8/15/2016 0:00,87.0,Routine - Unscheduled,3839_20160815_103133,Foods not protected from contamination,Moderate Risk,20160815,103133,2016-08-15,0,0,6,0,0,3,5
481,481,1114,5118,KFC,1150 TARAVAL St,San Francisco,CA,94116,37.742948,-122.47873200000001,"(37.742948, -122.478732)",14155733314.0,5118_20161207,12/7/2016 0:00,98.0,Routine - Unscheduled,5118_20161207_103154,Unclean or degraded floors walls or ceilings,Low Risk,20161207,103154,2016-12-07,0,0,0,0,1,1,0
482,482,1115,1345,Cordon Bleu,1574 California St,San Francisco,CA,94109,37.790683,-122.42026399999999,"(37.790683, -122.420264)",,1345_20150623,6/23/2015 0:00,79.0,Routine - Unscheduled,1345_20150623_103119,Inadequate and inaccessible handwashing facilities,Moderate Risk,20150623,103119,2015-06-23,0,0,5,0,0,5,5
483,483,1116,3084,ITALIAN AMERICAN SOCIAL CLUB,25 RUSSIA Ave,San Francisco,CA,94112,37.721346999999994,-122.436628,"(37.721347, -122.436628)",,3084_20160907,9/7/2016 0:00,85.0,Routine - Unscheduled,3084_20160907_103109,Unclean or unsanitary food contact surfaces,High Risk,20160907,103109,2016-09-07,0,4,0,0,0,3,2
484,484,1122,74983,Nizario's Pizza SFSU,1650 Holloway Ave,San Francisco,CA,94132,,,,14155335555.0,74983_20160518,5/18/2016 0:00,96.0,Routine - Unscheduled,74983_20160518_103156,Permit license or inspection report not posted,Low Risk,20160518,103156,2016-05-18,0,0,1,0,2,2,0
485,485,1123,438,Hawaii West,729 Vallejo St,San Francisco,CA,94133,37.798494,-122.40933700000001,"(37.798494, -122.409337)",,438_20160321,3/21/2016 0:00,90.0,Routine - Unscheduled,438_20160321_103138,Improper storage use or identification of toxic substances,Low Risk,20160321,103138,2016-03-21,0,5,0,0,0,0,5
486,486,1125,400,COW HOLLOW CATERING,3301 LYON St,San Francisco,CA,94123,37.801401,-122.44785700000001,"(37.801401, -122.447857)",,400_20180222,2/22/2018 0:00,90.0,Routine - Unscheduled,400_20180222_103138,Improper storage use or identification of toxic substances,Low Risk,20180222,103138,2018-02-22,3,0,0,0,0,0,0
487,487,1126,3190,NORIEGA TERIYAKI HOUSE,1755 NORIEGA St,San Francisco,CA,94122,37.753953,-122.482629,"(37.753953, -122.482629)",,3190_20170105,1/5/2017 0:00,92.0,Routine - Unscheduled,3190_20170105_103133,Foods not protected from contamination,Moderate Risk,20170105,103133,2017-01-05,6,0,0,0,3,2,0
488,488,1132,5621,AT&T - Pub Murph's Guiness Club House/Room5302 [145151],24 WILLIE MAYS PLAZA 5.01.02,San Francisco,CA,94107,37.778382,-122.39115100000001,"(37.778382, -122.391151)",14155971500.0,5621_20160814,8/14/2016 0:00,96.0,Routine - Unscheduled,5621_20160814_103119,Inadequate and inaccessible handwashing facilities,Moderate Risk,20160814,103119,2016-08-14,0,0,0,0,0,1,0
489,489,1140,35862,Toast Eatery,3991 24th St,San Francisco,CA,94114,37.751422999999996,-122.431618,"(37.751423, -122.431618)",,35862_20161205,12/5/2016 0:00,94.0,Routine - Unscheduled,35862_20161205_103120,Moderate risk food holding temperature,Moderate Risk,20161205,103120,2016-12-05,4,0,0,0,2,0,1
490,490,1144,82664,Pizza Joint,3088 Balboa St,San Francisco,CA,94121,,,,14155384992.0,82664_20161109,11/9/2016 0:00,90.0,Routine - Unscheduled,82664_20161109_103120,Moderate risk food holding temperature,Moderate Risk,20161109,103120,2016-11-09,4,0,0,0,3,0,2
491,491,1149,10931,ROYAL GROUND COFFEE,3101 Geary Blvd,San Francisco,CA,94118,37.781735999999995,-122.452151,"(37.781736, -122.452151)",,10931_20160309,3/9/2016 0:00,80.0,Routine - Unscheduled,10931_20160309_103142,Unclean nonfood contact surfaces,Low Risk,20160309,103142,2016-03-09,2,0,0,0,0,0,8
492,492,1150,88488,Dim Sum Kitchen Inc,2520 San Bruno Ave,San Francisco,CA,94134,,,,,88488_20170321,3/21/2017 0:00,,Complaint,88488_20170321_103112,No hot water or running water,High Risk,20170321,103112,2017-03-21,0,0,0,0,4,0,0
493,493,1171,87780,Laksa,1005 Guerrero St,San Francisco,CA,94110,,,,14155917396.0,87780_20171211,12/11/2017 0:00,86.0,Routine - Unscheduled,87780_20171211_103132,Improper thawing methods,Moderate Risk,20171211,103132,2017-12-11,0,5,0,0,4,0,0
494,494,1172,70779,Davids Tea,845 Market St #13,San Francisco,CA,zzzzz,,,,,70779_20171212,12/12/2017 0:00,92.0,Routine - Unscheduled,70779_20171212_103156,Permit license or inspection report not posted,Low Risk,20171212,103156,2017-12-12,0,4,0,0,2,2,2
495,495,1175,64682,Straw,203 Octavia St,San Francisco,CA,94102,37.77392800000001,-122.42419,"(37.773928, -122.42419)",,64682_20171212,12/12/2017 0:00,90.0,Routine - Unscheduled,64682_20171212_103131,Moderate risk vermin infestation,Moderate Risk,20171212,103131,2017-12-12,0,4,0,0,0,0,5
496,496,1176,60825,W Cafe,181 03rd St 3/F,San Francisco,CA,94103,37.785207,-122.40062900000001,"(37.785207, -122.400629)",,60825_20171113,11/13/2017 0:00,96.0,Routine - Unscheduled,60825_20171113_103124,Inadequately cleaned or sanitized food contact surfaces,Moderate Risk,20171113,103124,2017-11-13,0,1,0,0,0,2,2
497,497,1178,67276,The Cow Hollow Market,3165 STEINER St,San Francisco,CA,94123,37.798624,-122.437525,"(37.798624, -122.437525)",,67276_20160430,4/30/2016 0:00,90.0,Routine - Unscheduled,67276_20160430_103124,Inadequately cleaned or sanitized food contact surfaces,Moderate Risk,20160430,103124,2016-04-30,2,0,0,0,0,3,0
498,498,1185,67982,Caffe Central,845 Market St,San Francisco,CA,94103,37.784848,-122.406892,"(37.784848, -122.406892)",,67982_20160930,9/30/2016 0:00,92.0,Routine - Unscheduled,67982_20160930_103129,Insufficient hot water or running water,Moderate Risk,20160930,103129,2016-09-30,0,3,0,0,0,2,5
499,499,1195,3496,Bohemian Club,624 Taylor St,San Francisco,CA,94102,37.788227,-122.411727,"(37.788227, -122.411727)",,3496_20161202,12/2/2016 0:00,92.0,Routine - Unscheduled,3496_20161202_103120,Moderate risk food holding temperature,Moderate Risk,20161202,103120,2016-12-02,0,0,0,0,3,0,0
500,500,1203,74866,Tacolicious,1548 Stockton St,San Francisco,CA,94133,,,,,74866_20170508,5/8/2017 0:00,,Complaint,74866_20170508_103156,Permit license or inspection report not posted,Low Risk,20170508,103156,2017-05-08,0,0,0,5,0,2,0
501,501,1206,81250,Stanford Court Hotel,905 California St,San Francisco,CA,94108,,,,,81250_20150713,7/13/2015 0:00,94.0,Routine - Unscheduled,81250_20150713_103133,Foods not protected from contamination,Moderate Risk,20150713,103133,2015-07-13,0,3,0,0,0,4,2
502,502,1211,36348,El Tepa,2198 Folsom St,San Francisco,CA,94110,37.762217,-122.415035,"(37.762217, -122.415035)",,36348_20171205,12/5/2017 0:00,90.0,Routine - Unscheduled,36348_20171205_103120,Moderate risk food holding temperature,Moderate Risk,20171205,103120,2017-12-05,0,3,0,0,4,0,3
503,503,1212,90010,Noeteca,1551 Dolores St,San Francisco,CA,94110,,,,14155825524.0,90010_20170105,1/5/2017 0:00,96.0,Routine - Unscheduled,90010_20170105_103119,Inadequate and inaccessible handwashing facilities,Moderate Risk,20170105,103119,2017-01-05,0,0,3,0,1,0,0
504,504,1213,70494,The Little Chihuahua Mexican Restaurant,581 VALENCIA St,San Francisco,CA,94110,37.763664,-122.42173600000001,"(37.763664, -122.421736)",14155207111.0,70494_20160216,2/16/2016 0:00,92.0,Routine - Unscheduled,70494_20160216_103133,Foods not protected from contamination,Moderate Risk,20160216,103133,2016-02-16,2,0,0,0,0,2,3
505,505,1219,59637,Flour & Water,2401 Harrison St,San Francisco,CA,94110,37.758913,-122.412426,"(37.758913, -122.412426)",,59637_20160324,3/24/2016 0:00,96.0,Routine - Unscheduled,59637_20160324_103147,Inadequate ventilation or lighting,Low Risk,20160324,103147,2016-03-24,2,0,0,4,0,0,2
506,506,1221,85095,T-28 Bakery & Caf,1753 Taraval St,San Francisco,CA,94116,,,,14155688200.0,85095_20170104,1/4/2017 0:00,90.0,Routine - Unscheduled,85095_20170104_103139,Improper food storage,Low Risk,20170104,103139,2017-01-04,0,0,5,0,3,2,0
507,507,1224,89833,AJ's BBQ  & Cafe,2275 San Jose St,San Francisco,CA,94112,,,,,89833_20171207,12/7/2017 0:00,72.0,Routine - Unscheduled,89833_20171207_103139,Improper food storage,Low Risk,20171207,103139,2017-12-07,0,7,0,0,7,0,0
508,508,1225,60824,XYZ Bar,181 03rd St 2/F,San Francisco,CA,94103,37.785207,-122.40062900000001,"(37.785207, -122.400629)",,60824_20171113,11/13/2017 0:00,94.0,Routine - Unscheduled,60824_20171113_103142,Unclean nonfood contact surfaces,Low Risk,20171113,103142,2017-11-13,0,2,0,0,0,2,0
509,509,1227,75402,Champa Garden,613 Faxon Ave,San Francisco,CA,94112,,,,14155344186.0,75402_20170105,1/5/2017 0:00,87.0,Routine - Unscheduled,75402_20170105_103152,Unclean unmaintained or improperly constructed toilet facilities,Low Risk,20170105,103152,2017-01-05,0,0,2,0,4,1,3
510,510,1235,82290,Papa Mak's Burgers,3755 Noriega St,San Francisco,CA,94122,,,,14155682244.0,82290_20160329,3/29/2016 0:00,85.0,Routine - Unscheduled,82290_20160329_103133,Foods not protected from contamination,Moderate Risk,20160329,103133,2016-03-29,0,0,3,0,0,1,3
511,511,1238,80591,L & G Vietnamese Sandwich,602 Eddy St,San Francisco,CA,94109,,,,14155886402.0,80591_20160129,1/29/2016 0:00,,Complaint,80591_20160129_103116,Inadequate food safety knowledge or lack of certified food safety manager,Moderate Risk,20160129,103116,2016-01-29,0,6,0,0,6,0,8
512,512,1240,88764,Anar Restaurant Persian Cuisine LLC,937 Harrison St,San Francisco,CA,94107,,,,,88764_20161215,12/15/2016 0:00,,New Ownership,88764_20161215_103142,Unclean nonfood contact surfaces,Low Risk,20161215,103142,2016-12-15,0,0,0,0,3,0,0
513,513,1243,67828,King's Thai Cuisine,346 CLEMENT St,San Francisco,CA,94118,37.783028,-122.463141,"(37.783028, -122.463141)",,67828_20150424,4/24/2015 0:00,83.0,Routine - Unscheduled,67828_20150424_103124,Inadequately cleaned or sanitized food contact surfaces,Moderate Risk,20150424,103124,2015-04-24,0,4,0,0,3,7,5
514,514,1250,81884,Little Sweet,3836 Geary Blvd,San Francisco,CA,94118,,,,,81884_20161206,12/6/2016 0:00,87.0,Routine - Unscheduled,81884_20161206_103109,Unclean or unsanitary food contact surfaces,High Risk,20161206,103109,2016-12-06,0,0,0,0,3,5,0
515,515,1251,67869,Yuubi Japanese Restaurant,501 BALBOA ST,San Francisco,CA,94118,37.777157,-122.464045,"(37.777157, -122.464045)",,67869_20161205,12/5/2016 0:00,94.0,Routine - Unscheduled,67869_20161205_103144,Unapproved or unmaintained equipment or utensils,Low Risk,20161205,103144,2016-12-05,0,0,4,0,2,0,2
516,516,1254,74591,"Flying Ninja, Inc.",2801 Leavenworth St #1011,San Francisco,CA,94133,,,,,74591_20160815,8/15/2016 0:00,90.0,Routine - Unscheduled,74591_20160815_103128,Consumer advisory not provided for raw or undercooked foods,Moderate Risk,20160815,103128,2016-08-15,0,3,0,0,0,4,5
517,517,1268,28044,Century Theatres,845 Market St Suite 500,San Francisco,CA,94103,37.784848,-122.406892,"(37.784848, -122.406892)",14155538422.0,28044_20171212,12/12/2017 0:00,98.0,Routine - Unscheduled,28044_20171212_103154,Unclean or degraded floors walls or ceilings,Low Risk,20171212,103154,2017-12-12,0,1,0,0,1,2,0
518,518,1273,695,BARBARY COAST PASTRY & COFFEE,55 Cyril Magnin St,San Francisco,CA,94102,37.784965,-122.40861399999999,"(37.784965, -122.408614)",,695_20160930,9/30/2016 0:00,94.0,Routine - Unscheduled,695_20160930_103120,Moderate risk food holding temperature,Moderate Risk,20160930,103120,2016-09-30,2,0,2,0,0,2,0
519,519,1274,75526,Chang Hong Meat Market,1335 Powell St,San Francisco,CA,94133,,,,,75526_20150505,5/5/2015 0:00,86.0,Routine - Unscheduled,75526_20150505_103139,Improper food storage,Low Risk,20150505,103139,2015-05-05,0,5,0,0,0,6,5
520,520,1277,83351,City Super,1108 Stockton St,San Francisco,CA,94133,,,,,83351_20150615,6/15/2015 0:00,,New Ownership,83351_20150615_103154,Unclean or degraded floors walls or ceilings,Low Risk,20150615,103154,2015-06-15,0,9,0,0,0,5,7
521,521,1278,91042,Hot Sauce and Panko,1468 Hyde St,San Francisco,CA,94109,,,,,91042_20171214,12/14/2017 0:00,96.0,Routine - Unscheduled,91042_20171214_103133,Foods not protected from contamination,Moderate Risk,20171214,103133,2017-12-14,0,1,0,0,0,0,0
522,522,1279,68260,MV Bay Breeze,Pier 41,San Francisco,CA,94133,,,,,68260_20160518,5/18/2016 0:00,98.0,Routine - Unscheduled,68260_20160518_103139,Improper food storage,Low Risk,20160518,103139,2016-05-18,2,0,0,0,1,1,0
523,523,1280,68872,Jiang Ling Cuisine Restaurant,2517 SAN BRUNO Ave,San Francisco,CA,94134,37.729985,-122.404526,"(37.729985, -122.404526)",,68872_20171212,12/12/2017 0:00,72.0,Routine - Unscheduled,68872_20171212_103133,Foods not protected from contamination,Moderate Risk,20171212,103133,2017-12-12,0,6,0,0,0,6,5
524,524,1286,5471,AT&T - Edsel Ford Fong,24 WILLIE MAYS PLAZA,San Francisco,CA,94107,,,,14155971500.0,5471_20160814,8/14/2016 0:00,96.0,Routine - Unscheduled,5471_20160814_103130,Inadequate sewage or wastewater disposal,Moderate Risk,20160814,103130,2016-08-14,0,0,0,0,1,1,0
525,525,1289,4592,E-Z STOP MARKET,2203 GENEVA Ave,San Francisco,CA,94134,37.708356,-122.41998899999999,"(37.708356, -122.419989)",,4592_20160907,9/7/2016 0:00,94.0,Routine - Unscheduled,4592_20160907_103139,Improper food storage,Low Risk,20160907,103139,2016-09-07,0,0,2,0,0,3,3
526,526,1290,4884,LUCCA RAVIOLI CO,1100 VALENCIA St,San Francisco,CA,94110,37.755177,-122.42099499999999,"(37.755177, -122.420995)",14155645581.0,4884_20160120,1/20/2016 0:00,94.0,Routine - Unscheduled,4884_20160120_103124,Inadequately cleaned or sanitized food contact surfaces,Moderate Risk,20160120,103124,2016-01-20,0,1,0,0,0,0,2
527,527,1304,79186,Ferry Plaza Seafood,655 Union St,San Francisco,CA,94133,,,,,79186_20160413,4/13/2016 0:00,96.0,Routine - Unscheduled,79186_20160413_103125,Noncompliance with shell fish tags or display,Moderate Risk,20160413,103125,2016-04-13,0,0,0,3,0,1,0
528,528,1310,69115,Hahn's Hibachi,1710 Polk St,San Francisco,CA,94109,37.792577,-122.42105600000001,"(37.792577, -122.421056)",,69115_20180227,2/27/2018 0:00,86.0,Routine - Unscheduled,69115_20180227_103154,Unclean or degraded floors walls or ceilings,Low Risk,20180227,103154,2018-02-27,5,0,5,0,0,6,8
529,529,1313,5823,WEBSTER ELEMENTARY SCHOOL,465 MISSOURI St,San Francisco,CA,94107,37.760474,-122.39629599999999,"(37.760474, -122.396296)",14155695787.0,5823_20160322,3/22/2016 0:00,92.0,Routine - Unscheduled,5823_20160322_103116,Inadequate food safety knowledge or lack of certified food safety manager,Moderate Risk,20160322,103116,2016-03-22,1,0,0,0,2,0,2
530,530,1314,78172,Rhea's Deli & Market,800 Valencia St,San Francisco,CA,94110,,,,14155285255.0,78172_20160330,3/30/2016 0:00,92.0,Routine - Unscheduled,78172_20160330_103139,Improper food storage,Low Risk,20160330,103139,2016-03-30,4,0,0,0,4,0,4
531,531,1321,37820,Natural Sensations,1650 HOLLOWAY St #134,San Francisco,CA,94132,37.720894,-122.478029,"(37.720894, -122.478029)",14155238257.0,37820_20160509,5/9/2016 0:00,96.0,Routine - Unscheduled,37820_20160509_103120,Moderate risk food holding temperature,Moderate Risk,20160509,103120,2016-05-09,0,0,3,0,2,1,0
532,532,1333,300,SUBWAY,2001 VAN NESS Ave,San Francisco,CA,94109,37.794134,-122.42323400000001,"(37.794134, -122.423234)",14155779929.0,300_20171208,12/8/2017 0:00,86.0,Routine - Unscheduled,300_20171208_103143,Inadequate warewashing facilities or equipment,Low Risk,20171208,103143,2017-12-08,0,5,0,0,0,7,0
533,533,1335,5463,AT&T - (CART 45) SNOW CONES view [145132],24 WILLIE MAYS PLAZA,San Francisco,CA,94107,,,,14155971500.0,5463_20160814,8/14/2016 0:00,93.0,Routine - Unscheduled,5463_20160814_103112,No hot water or running water,High Risk,20160814,103112,2016-08-14,0,0,1,1,0,1,0
534,534,1341,69595,Cafe Creme de Hayes Valley,50 Oak St  Basement,San Francisco,CA,94102,37.775379,-122.42013600000001,"(37.775379, -122.420136)",,69595_20160516,5/16/2016 0:00,93.0,Routine - Unscheduled,69595_20160516_103103,High risk food holding temperature,High Risk,20160516,103103,2016-05-16,0,0,0,3,0,1,0
535,535,1342,87517,Cecilia's Pizza & Restaurant,3515 Mission St,San Francisco,CA,94110,,,,14155825852.0,87517_20160512,5/12/2016 0:00,,New Ownership,87517_20160512_103120,Moderate risk food holding temperature,Moderate Risk,20160512,103120,2016-05-12,0,0,0,7,0,3,0
536,536,1345,87924,Deccan Spice by M&M,1142 Valencia St,San Francisco,CA,94110,,,,14155912222.0,87924_20160927,9/27/2016 0:00,92.0,Routine - Unscheduled,87924_20160927_103149,Wiping cloths not clean or properly stored or inadequate sanitizer,Low Risk,20160927,103149,2016-09-27,0,4,0,0,0,3,0
537,537,1347,15738,Lao Table,149 2nd St,San Francisco,CA,94105,37.787343,-122.398902,"(37.787343, -122.398902)",,15738_20150507,5/7/2015 0:00,67.0,Routine - Unscheduled,15738_20150507_103103,High risk food holding temperature,High Risk,20150507,103103,2015-05-07,0,0,0,0,0,0,7
538,538,1348,5973,DAVIES MEDICAL CENTER,045 CASTRO St,San Francisco,CA,94114,,,,14155566000.0,5973_20151204,12/4/2015 0:00,90.0,Routine - Unscheduled,5973_20151204_103145,Improper storage of equipment utensils or linens,Low Risk,20151204,103145,2015-12-04,0,2,0,0,0,1,4
539,539,1352,66988,Park Tavern,1652 Stockton St,San Francisco,CA,94133,37.801068,-122.40926699999999,"(37.801068, -122.409267)",,66988_20180226,2/26/2018 0:00,87.0,Routine - Unscheduled,66988_20180226_103119,Inadequate and inaccessible handwashing facilities,Moderate Risk,20180226,103119,2018-02-26,3,0,0,0,0,2,0
540,540,1354,64881,New Alternatives,1600 GUERRERO St,San Francisco,CA,94110,37.745437,-122.42234499999999,"(37.745437, -122.422345)",,64881_20160217,2/17/2016 0:00,88.0,Routine - Unscheduled,64881_20160217_103144,Unapproved or unmaintained equipment or utensils,Low Risk,20160217,103144,2016-02-17,4,0,0,0,3,0,5
541,541,1357,5476,AT&T - (CART58) FRESH PRODUCE-Pretzels & Juice [145145],24 WILLIE MAYS PLAZA,San Francisco,CA,94107,,,,14155971500.0,5476_20160814,8/14/2016 0:00,98.0,Routine - Unscheduled,5476_20160814_103149,Wiping cloths not clean or properly stored or inadequate sanitizer,Low Risk,20160814,103149,2016-08-14,0,0,0,0,0,1,0
542,542,1362,77558,Gyro Xpress Mediterranean Cuis,499 Castro St,San Francisco,CA,94114,,,,14155550352.0,77558_20160607,6/7/2016 0:00,92.0,Routine - Unscheduled,77558_20160607_103124,Inadequately cleaned or sanitized food contact surfaces,Moderate Risk,20160607,103124,2016-06-07,0,6,0,0,4,2,0
543,543,1364,75055,Tierra Mia Coffee Company,3188 Mission St,San Francisco,CA,94110,,,,,75055_20160809,8/9/2016 0:00,98.0,Routine - Unscheduled,75055_20160809_103161,Low risk vermin infestation,Low Risk,20160809,103161,2016-08-09,0,1,0,1,1,1,1
544,544,1368,5607,SFSU STATION CAFE,1600 Holloway Ave,San Francisco,CA,94132,37.720851,-122.477084,"(37.720851, -122.477084)",14155374525.0,5607_20150626,6/26/2015 0:00,77.0,Routine - Unscheduled,5607_20150626_103102,Unclean hands or improper use of gloves,High Risk,20150626,103102,2015-06-26,0,3,0,0,0,0,4
545,545,1380,77562,Ha Tien Cove,1650 Holloway Ave Student Ctr. West Plaza Alcove B,San Francisco,CA,94132,,,,14155337188.0,77562_20171213,12/13/2017 0:00,92.0,Routine - Unscheduled,77562_20171213_103149,Wiping cloths not clean or properly stored or inadequate sanitizer,Low Risk,20171213,103149,2017-12-13,0,3,0,0,2,3,2
546,546,1391,1764,FLORIO,1915 FILLMORE St,San Francisco,CA,94115,37.787553,-122.433574,"(37.787553, -122.433574)",14155774300.0,1764_20160531,5/31/2016 0:00,93.0,Routine - Unscheduled,1764_20160531_103103,High risk food holding temperature,High Risk,20160531,103103,2016-05-31,0,0,0,0,2,1,0
547,547,1395,4893,S & W MARKET,399 HAIGHT St,San Francisco,CA,94102,37.772323,-122.428627,"(37.772323, -122.428627)",14155862346.0,4893_20171211,12/11/2017 0:00,92.0,Routine - Unscheduled,4893_20171211_103131,Moderate risk vermin infestation,Moderate Risk,20171211,103131,2017-12-11,0,3,0,0,0,3,0
548,548,1397,7537,NEW WING HING SEAFOOD MARKET,2222 CLEMENT St,San Francisco,CA,94121,37.782118,-122.48319099999999,"(37.782118, -122.483191)",,7537_20160520,5/20/2016 0:00,86.0,Routine - Unscheduled,7537_20160520_103127,Noncompliance with HAACP plan or variance,Moderate Risk,20160520,103127,2016-05-20,0,0,0,1,0,4,0
549,549,1401,16432,AFC Sushi @ Safeway #1206,300 Bay St,San Francisco,CA,94133,37.805758000000004,-122.412774,"(37.805758, -122.412774)",,16432_20160516,5/16/2016 0:00,94.0,Routine - Unscheduled,16432_20160516_103145,Improper storage of equipment utensils or linens,Low Risk,20160516,103145,2016-05-16,0,0,0,0,0,2,0
550,550,1413,83475,Fine and Rare,555 Golden Gate Ave,San Francisco,CA,94102,,,,,83475_20170105,1/5/2017 0:00,94.0,Routine - Unscheduled,83475_20170105_103150,Improper or defective plumbing,Low Risk,20170105,103150,2017-01-05,0,0,0,0,2,0,8
551,551,1414,78196,Javalenica Cafe,920 Valencia St,San Francisco,CA,94110,,,,14155822321.0,78196_20160120,1/20/2016 0:00,82.0,Routine - Unscheduled,78196_20160120_103129,Insufficient hot water or running water,Moderate Risk,20160120,103129,2016-01-20,5,0,0,0,6,0,6
552,552,1421,19061,Moscone Convention Center - Stand #3,747 HOWARD St,San Francisco,CA,94103,37.784128,-122.401533,"(37.784128, -122.401533)",,19061_20160607,6/7/2016 0:00,92.0,Routine - Unscheduled,19061_20160607_103131,Moderate risk vermin infestation,Moderate Risk,20160607,103131,2016-06-07,0,0,0,0,1,2,0
553,553,1433,83572,Cathay Express Restaurant,720 14th St,San Francisco,CA,94114,,,,14155433229.0,83572_20150713,7/13/2015 0:00,,New Ownership,83572_20150713_103133,Foods not protected from contamination,Moderate Risk,20150713,103133,2015-07-13,0,0,0,0,3,0,3
554,554,1439,63624,Seoul on Wheels,Fort Mason,San Francisco,CA,94123,37.804012,-122.42804,"(37.804012, -122.42804)",,63624_20160511,5/11/2016 0:00,93.0,Routine - Unscheduled,63624_20160511_103107,Improper reheating of food,High Risk,20160511,103107,2016-05-11,0,0,0,0,0,1,0
555,555,1444,38580,Punjab Restaurant,2838 24th St,San Francisco,CA,94110,37.752858,-122.40891200000002,"(37.752858, -122.408912)",,38580_20160321,3/21/2016 0:00,84.0,Routine - Unscheduled,38580_20160321_103142,Unclean nonfood contact surfaces,Low Risk,20160321,103142,2016-03-21,0,4,0,5,0,4,5
556,556,1457,58803,Catering For Two Or More,5051 MISSION STREET,San Francisco,CA,94110,37.71765900000001,-122.44005,"(37.717659, -122.44005)",,58803_20180226,2/26/2018 0:00,96.0,Routine - Unscheduled,58803_20180226_103161,Low risk vermin infestation,Low Risk,20180226,103161,2018-02-26,2,0,0,0,4,3,0
557,557,1461,61467,Dagwood & Scoops,2736 24 St,San Francisco,CA,94110,37.752968,-122.40706200000001,"(37.752968, -122.407062)",,61467_20160328,3/28/2016 0:00,94.0,Routine - Unscheduled,61467_20160328_103157,Food safety certificate or food handler card not available,Low Risk,20160328,103157,2016-03-28,2,0,4,0,4,3,3
558,558,1469,70723,Dirty Habit,12 04th St,San Francisco,CA,94103,37.785388,-122.405369,"(37.785388, -122.405369)",,70723_20160518,5/18/2016 0:00,85.0,Routine - Unscheduled,70723_20160518_103129,Insufficient hot water or running water,Moderate Risk,20160518,103129,2016-05-18,0,0,0,0,4,4,0
559,559,1472,91106,Rincon Nayarit,1500 South Van Ness Ave 100,San Francisco,CA,94110,,,,14155552780.0,91106_20170928,9/28/2017 0:00,92.0,Routine - Unscheduled,91106_20170928_103125,Noncompliance with shell fish tags or display,Moderate Risk,20170928,103125,2017-09-28,0,0,2,0,0,0,0
560,560,1475,77108,Happy Donut,2101 Van Ness Ave,San Francisco,CA,94109,,,,,77108_20160413,4/13/2016 0:00,76.0,Routine - Unscheduled,77108_20160413_103124,Inadequately cleaned or sanitized food contact surfaces,Moderate Risk,20160413,103124,2016-04-13,0,6,0,0,0,8,0
561,561,1481,6625,House of Coffee,1618 Noriega St,San Francisco,CA,94122,37.754058,-122.481201,"(37.754058, -122.481201)",,6625_20160930,9/30/2016 0:00,98.0,Routine - Unscheduled,6625_20160930_103154,Unclean or degraded floors walls or ceilings,Low Risk,20160930,103154,2016-09-30,2,0,0,0,0,1,0
562,562,1491,5629,AT&T - DOGGIE DINNER - Room 5325 [145159],24 WILLIE MAYS PLAZA 5.19.01,San Francisco,CA,94107,37.778382,-122.39115100000001,"(37.778382, -122.391151)",14155971500.0,5629_20160814,8/14/2016 0:00,98.0,Routine - Unscheduled,5629_20160814_103162,Other low risk violation,Low Risk,20160814,103162,2016-08-14,0,0,0,0,0,1,1
563,563,1494,62521,Isa Restaurant,3324 STEINER St,San Francisco,CA,94123,37.800057,-122.43773600000002,"(37.800057, -122.437736)",,62521_20160607,6/7/2016 0:00,92.0,Routine - Unscheduled,62521_20160607_103121,Inadequate procedures or records for time as a public health control,Moderate Risk,20160607,103121,2016-06-07,0,0,0,0,0,2,0
564,564,1501,65245,Let's Eat,5130 03rd St,San Francisco,CA,94124,37.731831,-122.39186200000002,"(37.731831, -122.391862)",,65245_20171213,12/13/2017 0:00,90.0,Routine - Unscheduled,65245_20171213_103161,Low risk vermin infestation,Low Risk,20171213,103161,2017-12-13,0,4,0,0,2,0,2
565,565,1502,4914,LA PALMA,2884 24th St,San Francisco,CA,94110,37.752798,-122.409922,"(37.752798, -122.409922)",,4914_20160323,3/23/2016 0:00,92.0,Routine - Unscheduled,4914_20160323_103144,Unapproved or unmaintained equipment or utensils,Low Risk,20160323,103144,2016-03-23,0,0,0,0,0,0,3
566,566,1503,76886,Tsing Tao #2,1117 Fillmore St,San Francisco,CA,94115,,,,,76886_20160331,3/31/2016 0:00,80.0,Routine - Unscheduled,76886_20160331_103102,Unclean hands or improper use of gloves,High Risk,20160331,103102,2016-03-31,0,0,0,6,0,0,4
567,567,1508,2519,PACIFIC PLAZA CAFE,1340 FRANKLIN St,San Francisco,CA,94109,37.786864,-122.42321799999999,"(37.786864, -122.423218)",,2519_20160413,4/13/2016 0:00,80.0,Routine - Unscheduled,2519_20160413_103120,Moderate risk food holding temperature,Moderate Risk,20160413,103120,2016-04-13,0,0,0,0,3,4,0
568,568,1510,84656,Kaiju Eats Inc,3409 Geary Blvd,San Francisco,CA,94118,,,,14155744309.0,84656_20160412,4/12/2016 0:00,86.0,Routine - Unscheduled,84656_20160412_103147,Inadequate ventilation or lighting,Low Risk,20160412,103147,2016-04-12,6,0,0,0,0,5,8
569,569,1513,22606,Canyon Market,2815 Diamond St,San Francisco,CA,94131,37.734072,-122.433948,"(37.734072, -122.433948)",,22606_20160414,4/14/2016 0:00,79.0,Routine - Unscheduled,22606_20160414_103144,Unapproved or unmaintained equipment or utensils,Low Risk,20160414,103144,2016-04-14,0,0,0,0,4,1,2
570,570,1514,69750,Mango's Taqueria & Cantina,"Pier 39  P-214-A2,3,4",San Francisco,CA,94133,,,,,69750_20160414,4/14/2016 0:00,88.0,Routine - Unscheduled,69750_20160414_103119,Inadequate and inaccessible handwashing facilities,Moderate Risk,20160414,103119,2016-04-14,0,8,0,0,7,7,0
571,571,1515,69045,AT&T PARK - NEW VENDING ROOM,24 Willie Mays Plaza,San Francisco,CA,94107,,,,,69045_20160814,8/14/2016 0:00,98.0,Routine - Unscheduled,69045_20160814_103145,Improper storage of equipment utensils or linens,Low Risk,20160814,103145,2016-08-14,0,0,1,1,0,1,2
572,572,1516,67262,Wonglee LLC,732 Jackson St,San Francisco,CA,94133,,,,,67262_20160412,4/12/2016 0:00,69.0,Routine - Unscheduled,67262_20160412_103154,Unclean or degraded floors walls or ceilings,Low Risk,20160412,103154,2016-04-12,0,0,5,0,4,7,0
573,573,1519,79587,AT&T PARK - Hearth Table Stand,24 Willie Mays Plaza,San Francisco,CA,94107,,,,,79587_20160814,8/14/2016 0:00,96.0,Routine - Unscheduled,79587_20160814_103145,Improper storage of equipment utensils or linens,Low Risk,20160814,103145,2016-08-14,0,0,0,3,0,2,1
574,574,1520,83013,Loews Regency San Francisco (Pastry Kitchen),222 Sansome St 37th Floor,San Francisco,CA,94104,,,,14155279888.0,83013_20170928,9/28/2017 0:00,98.0,Routine - Unscheduled,83013_20170928_103154,Unclean or degraded floors walls or ceilings,Low Risk,20170928,103154,2017-09-28,0,0,1,0,0,3,0
575,575,1521,91331,Sutter Cafe,330 Sutter St,San Francisco,CA,94108,,,,,91331_20170428,4/28/2017 0:00,90.0,Routine - Unscheduled,91331_20170428_103119,Inadequate and inaccessible handwashing facilities,Moderate Risk,20170428,103119,2017-04-28,0,0,0,3,0,0,0
576,576,1525,63124,Marengo on Union,1980 Union St Upper Street Level,San Francisco,CA,94123,37.797578,-122.43188300000001,"(37.797578, -122.431883)",14155442575.0,63124_20160929,9/29/2016 0:00,94.0,Routine - Unscheduled,63124_20160929_103149,Wiping cloths not clean or properly stored or inadequate sanitizer,Low Risk,20160929,103149,2016-09-29,0,3,0,0,0,2,4
577,577,1528,1734,SAI JAI THAI,771 O'FARRELL St,San Francisco,CA,94109,37.785182,-122.417409,"(37.785182, -122.417409)",14155675774.0,1734_20160311,3/11/2016 0:00,82.0,Routine - Unscheduled,1734_20160311_103120,Moderate risk food holding temperature,Moderate Risk,20160311,103120,2016-03-11,0,4,0,6,0,0,7
578,578,1534,88712,Illy Caffe SF 200 Montgomery,220 Montgomery St Suite 144 & 148,San Francisco,CA,94104,,,,,88712_20180222,2/22/2018 0:00,92.0,Routine - Unscheduled,88712_20180222_103148,No thermometers or uncalibrated thermometers,Low Risk,20180222,103148,2018-02-22,3,0,0,0,6,0,0
579,579,1538,78372,AT&T PARK - Outta Here Cheesesteak,24 Willie Mays Plaza,San Francisco,CA,94107,,,,,78372_20160814,8/14/2016 0:00,91.0,Routine - Unscheduled,78372_20160814_103112,No hot water or running water,High Risk,20160814,103112,2016-08-14,0,0,0,0,1,2,1
580,580,1539,77951,Hahn's Hibachi #6,535 Irving St,San Francisco,CA,94122,,,,,77951_20180226,2/26/2018 0:00,91.0,Routine - Unscheduled,77951_20180226_103103,High risk food holding temperature,High Risk,20180226,103103,2018-02-26,2,0,0,0,0,5,0
581,581,1540,1199,PANCHO'S,3440 GEARY Blvd,San Francisco,CA,94118,37.781507,-122.456176,"(37.781507, -122.456176)",,1199_20160414,4/14/2016 0:00,90.0,Routine - Unscheduled,1199_20160414_103120,Moderate risk food holding temperature,Moderate Risk,20160414,103120,2016-04-14,3,0,0,0,0,3,0
582,582,1544,27472,SF Bay Club -  Court Commisary,150 Greenwich St,San Francisco,CA,94111,37.8032,-122.402841,"(37.8032, -122.402841)",,27472_20160413,4/13/2016 0:00,85.0,Routine - Unscheduled,27472_20160413_103161,Low risk vermin infestation,Low Risk,20160413,103161,2016-04-13,0,0,0,0,4,4,0
583,583,1547,5454,AT&T - (CART 36) BAYSIDE BREWS [145123],24 WILLIE MAYS PLAZA,San Francisco,CA,94107,,,,14155971500.0,5454_20160410,4/10/2016 0:00,98.0,Routine - Unscheduled,5454_20160410_103149,Wiping cloths not clean or properly stored or inadequate sanitizer,Low Risk,20160410,103149,2016-04-10,0,0,1,1,0,1,0
584,584,1552,92767,Island Market and Deli,"1 Avenue of the Palms,  Suite A",San Francisco,CA,94130,,,,,92767_20180112,1/12/2018 0:00,,New Construction,92767_20180112_103161,Low risk vermin infestation,Low Risk,20180112,103161,2018-01-12,3,0,0,0,0,0,0
585,585,1553,77611,Papito West,425 A Hayes St,San Francisco,CA,94102,,,,14155308075.0,77611_20160412,4/12/2016 0:00,84.0,Routine - Unscheduled,77611_20160412_103105,Improper cooling methods,High Risk,20160412,103105,2016-04-12,0,0,0,5,0,3,0
586,586,1559,64859,Modera Liquor & Wine,4401 Geary Blvd,San Francisco,CA,94118,37.78083400000001,-122.46659,"(37.780834, -122.46659)",,64859_20150924,9/24/2015 0:00,96.0,Routine - Unscheduled,64859_20150924_103144,Unapproved or unmaintained equipment or utensils,Low Risk,20150924,103144,2015-09-24,0,2,0,0,2,0,4
587,587,1560,60354,Taqueria Castillo B,10 Mason St,San Francisco,CA,94102,37.783527,-122.40906100000001,"(37.783527, -122.409061)",,60354_20151216,12/16/2015 0:00,,Reinspection/Followup,60354_20151216_103136,Unsanitary employee garments hair or nails,Low Risk,20151216,103136,2015-12-16,0,5,0,0,7,7,8
588,588,1573,5618,AT&T - DOGGIE DINER room 3228 [145164],24 WILLIE MAYS PLAZA 3.24.01,San Francisco,CA,94107,37.778382,-122.39115100000001,"(37.778382, -122.391151)",14155971500.0,5618_20160814,8/14/2016 0:00,96.0,Routine - Unscheduled,5618_20160814_103118,Employee eating or smoking,Moderate Risk,20160814,103118,2016-08-14,0,0,3,0,0,1,0
589,589,1574,71909,Shanghai Dumpling King 2,696 Monterey Blvd,San Francisco,CA,94127,37.731567999999996,-122.45097,"(37.731568, -122.45097)",14155232380.0,71909_20171213,12/13/2017 0:00,92.0,Routine - Unscheduled,71909_20171213_103154,Unclean or degraded floors walls or ceilings,Low Risk,20171213,103154,2017-12-13,0,4,0,0,4,0,6
590,590,1576,5952,IMMACULATE CONCPTION ACADEMY,3625 24th St,San Francisco,CA,94110,37.751923,-122.42355800000001,"(37.751923, -122.423558)",14155822052.0,5952_20180226,2/26/2018 0:00,98.0,Routine - Unscheduled,5952_20180226_103144,Unapproved or unmaintained equipment or utensils,Low Risk,20180226,103144,2018-02-26,1,0,1,0,0,1,0
591,591,1592,68104,Freshroll,157 04th St,San Francisco,CA,94103,37.783840999999995,-122.403325,"(37.783841, -122.403325)",,68104_20160829,8/29/2016 0:00,94.0,Routine - Unscheduled,68104_20160829_103120,Moderate risk food holding temperature,Moderate Risk,20160829,103120,2016-08-29,2,0,0,0,0,2,0
592,592,1597,80638,Dapper Dog,417 Castro St,San Francisco,CA,94114,,,,14150576221.0,80638_20161206,12/6/2016 0:00,96.0,Routine - Unscheduled,80638_20161206_103116,Inadequate food safety knowledge or lack of certified food safety manager,Moderate Risk,20161206,103116,2016-12-06,1,0,2,0,1,0,1
593,593,1602,59727,Luigi's Pizzeria,Pier 39  Space 211-212,San Francisco,CA,94133,37.80824000000001,-122.41018899999999,"(37.80824, -122.410189)",,59727_20160406,4/6/2016 0:00,80.0,Routine - Unscheduled,59727_20160406_103149,Wiping cloths not clean or properly stored or inadequate sanitizer,Low Risk,20160406,103149,2016-04-06,0,6,0,0,5,6,0
594,594,1607,7691,Golden Bear,Pier 41,San Francisco,CA,94133,37.808494,-122.412,"(37.808494, -122.412)",,7691_20180223,2/23/2018 0:00,96.0,Routine - Unscheduled,7691_20180223_103144,Unapproved or unmaintained equipment or utensils,Low Risk,20180223,103144,2018-02-23,2,0,0,0,3,3,2
595,595,1608,7722,Bay Monarch,Pier 41,San Francisco,CA,94133,37.808494,-122.412,"(37.808494, -122.412)",,7722_20160518,5/18/2016 0:00,98.0,Routine - Unscheduled,7722_20160518_103144,Unapproved or unmaintained equipment or utensils,Low Risk,20160518,103144,2016-05-18,1,0,0,0,0,1,1
596,596,1618,5815,ALVARADO ELEMENTARY SCHOOL,625  DOUGLASS St,San Francisco,CA,94114,37.753684,-122.438696,"(37.753684, -122.438696)",14155695695.0,5815_20170928,9/28/2017 0:00,96.0,Routine - Unscheduled,5815_20170928_103124,Inadequately cleaned or sanitized food contact surfaces,Moderate Risk,20170928,103124,2017-09-28,0,0,1,0,0,1,2
597,597,1621,62560,Tasty Coffee,1818 San Jose Avenue,San Francisco,CA,94112,37.728688,-122.440358,"(37.728688, -122.440358)",,62560_20180228,2/28/2018 0:00,86.0,Routine - Unscheduled,62560_20180228_103143,Inadequate warewashing facilities or equipment,Low Risk,20180228,103143,2018-02-28,4,4,0,0,3,2,0
598,598,1622,78656,AT&T PARK - Snack Stand,24 Willie Mays Plaza,San Francisco,CA,94107,,,,,78656_20160410,4/10/2016 0:00,93.0,Routine - Unscheduled,78656_20160410_103112,No hot water or running water,High Risk,20160410,103112,2016-04-10,0,0,1,1,0,1,1
599,599,1623,18767,Wonderful Dessert & Cafe,2035 IRVING St,San Francisco,CA,94122,37.763399,-122.47965400000001,"(37.763399, -122.479654)",,18767_20160408,4/8/2016 0:00,87.0,Routine - Unscheduled,18767_20160408_103119,Inadequate and inaccessible handwashing facilities,Moderate Risk,20160408,103119,2016-04-08,0,0,5,0,0,4,0
600,600,1630,38202,Ilobasco Restaurant & Pupuseria,2680 San Bruno Ave,San Francisco,CA,94134,37.727897999999996,-122.403751,"(37.727898, -122.403751)",,38202_20160812,8/12/2016 0:00,80.0,Routine - Unscheduled,38202_20160812_103144,Unapproved or unmaintained equipment or utensils,Low Risk,20160812,103144,2016-08-12,0,0,5,0,0,6,3
601,601,1636,87492,Nan king Road Bistro,1360 9th Ave,San Francisco,CA,94122,,,,14155752900.0,87492_20180222,2/22/2018 0:00,90.0,Routine - Unscheduled,87492_20180222_103133,Foods not protected from contamination,Moderate Risk,20180222,103133,2018-02-22,4,0,0,0,1,0,0
602,602,1645,64416,Yoppi Yogurt,845 Market St 277,San Francisco,CA,94103,37.784848,-122.406892,"(37.784848, -122.406892)",,64416_20171207,12/7/2017 0:00,90.0,Routine - Unscheduled,64416_20171207_103116,Inadequate food safety knowledge or lack of certified food safety manager,Moderate Risk,20171207,103116,2017-12-07,0,4,0,0,4,5,0
603,603,1646,520,Daily Health,1235 09th Ave,San Francisco,CA,94122,37.758941,-122.48591,"(37.758941, -122.48591)",,520_20160520,5/20/2016 0:00,98.0,Routine - Unscheduled,520_20160520_103162,Other low risk violation,Low Risk,20160520,103162,2016-05-20,3,0,0,0,0,1,0
604,604,1650,80773,Round Table Pizza,4523 Mission St,San Francisco,CA,94112,,,,,80773_20161110,11/10/2016 0:00,91.0,Routine - Unscheduled,80773_20161110_103109,Unclean or unsanitary food contact surfaces,High Risk,20161110,103109,2016-11-10,0,2,0,0,2,2,0
605,605,1651,69294,We Sushi,428 11th,San Francisco,CA,zzzzz,37.770613,-122.41219099999999,"(37.770613, -122.412191)",,69294_20160328,3/28/2016 0:00,83.0,Routine - Unscheduled,69294_20160328_103149,Wiping cloths not clean or properly stored or inadequate sanitizer,Low Risk,20160328,103149,2016-03-28,0,0,0,0,6,0,4
606,606,1652,80051,Wrecking Ball Coffee Roasters,2271 Union St,San Francisco,CA,94123,,,,14155718189.0,80051_20160408,4/8/2016 0:00,84.0,Routine - Unscheduled,80051_20160408_103156,Permit license or inspection report not posted,Low Risk,20160408,103156,2016-04-08,0,5,0,6,0,6,0
607,607,1653,69051,AT&T PARK - P6 DRAFT CART,24 Willie Mays Plaza,San Francisco,CA,94107,,,,,69051_20160410,4/10/2016 0:00,98.0,Routine - Unscheduled,69051_20160410_103149,Wiping cloths not clean or properly stored or inadequate sanitizer,Low Risk,20160410,103149,2016-04-10,0,0,0,0,0,1,0
608,608,1654,1444,Starbucks Coffee,1560 Van Ness Ave,San Francisco,CA,94111,37.790085999999995,-122.42216699999999,"(37.790086, -122.422167)",,1444_20160408,4/8/2016 0:00,96.0,Routine - Unscheduled,1444_20160408_103131,Moderate risk vermin infestation,Moderate Risk,20160408,103131,2016-04-08,0,0,0,0,0,1,0
609,609,1657,29956,Orchard Garden Hotel,466 Bush St,San Francisco,CA,94108,37.790648,-122.40518300000001,"(37.790648, -122.405183)",,29956_20171212,12/12/2017 0:00,96.0,Routine - Unscheduled,29956_20171212_103148,No thermometers or uncalibrated thermometers,Low Risk,20171212,103148,2017-12-12,0,2,0,0,0,4,0
610,610,1658,63597,Zero Zero,826 FOLSOM St,San Francisco,CA,94107,37.781494,-122.401909,"(37.781494, -122.401909)",,63597_20171207,12/7/2017 0:00,94.0,Routine - Unscheduled,63597_20171207_103119,Inadequate and inaccessible handwashing facilities,Moderate Risk,20171207,103119,2017-12-07,0,2,0,0,0,3,0
611,611,1659,3439,Wipe Out Bar & Grill,Pier 39,San Francisco,CA,94133,37.80824000000001,-122.41018899999999,"(37.80824, -122.410189)",,3439_20160414,4/14/2016 0:00,96.0,Routine - Unscheduled,3439_20160414_103142,Unclean nonfood contact surfaces,Low Risk,20160414,103142,2016-04-14,0,2,0,0,0,2,0
612,612,1666,69520,Inay - Metreon SF,135 04th St FC-10,San Francisco,CA,94103,37.784103,-122.403669,"(37.784103, -122.403669)",,69520_20160503,5/3/2016 0:00,63.0,Routine - Unscheduled,69520_20160503_103109,Unclean or unsanitary food contact surfaces,High Risk,20160503,103109,2016-05-03,0,0,0,0,0,3,0
613,613,1670,81460,"Le Soleil International Holdings, Inc",133 Clement  St.,San Francisco,CA,94118,,,,14155664848.0,81460_20150723,7/23/2015 0:00,55.0,Routine - Unscheduled,81460_20150723_103133,Foods not protected from contamination,Moderate Risk,20150723,103133,2015-07-23,4,0,0,0,0,7,12
614,614,1672,7503,The Daily Habit,1 Maritime Plaza,San Francisco,CA,94111,37.795227000000004,-122.39913999999999,"(37.795227, -122.39914)",,7503_20151120,11/20/2015 0:00,94.0,Routine - Unscheduled,7503_20151120_103120,Moderate risk food holding temperature,Moderate Risk,20151120,103120,2015-11-20,0,0,0,0,2,0,2
615,615,1674,7711,RICHMOND NEW MAY WAH SUPERMARKET,719 CLEMENT St,San Francisco,CA,94118,37.782784,-122.467028,"(37.782784, -122.467028)",,7711_20160608,6/8/2016 0:00,82.0,Routine - Unscheduled,7711_20160608_103154,Unclean or degraded floors walls or ceilings,Low Risk,20160608,103154,2016-06-08,0,0,0,6,0,1,0
616,616,1677,36876,Kasa Indian Eatery,4001 18th St,San Francisco,CA,94114,37.760974,-122.43295900000001,"(37.760974, -122.432959)",,36876_20151223,12/23/2015 0:00,92.0,Routine - Unscheduled,36876_20151223_103119,Inadequate and inaccessible handwashing facilities,Moderate Risk,20151223,103119,2015-12-23,0,0,2,0,2,0,2
617,617,1678,2427,TAQUERIA EL FAROLITO #3,2950 24th St,San Francisco,CA,94110,37.75272800000001,-122.41112199999999,"(37.752728, -122.411122)",,2427_20160119,1/19/2016 0:00,88.0,Routine - Unscheduled,2427_20160119_103142,Unclean nonfood contact surfaces,Low Risk,20160119,103142,2016-01-19,2,0,4,0,0,3,4
618,618,1687,92453,Kaiju Cooks,1650 Balboa St.,San Francisco,CA,94121,,,,,92453_20170912,9/12/2017 0:00,,New Ownership,92453_20170912_103102,Unclean hands or improper use of gloves,High Risk,20170912,103102,2017-09-12,0,0,3,0,0,0,0
619,619,1699,81886,Cafe Broadway,674 Broadway St,San Francisco,CA,94133,,,,,81886_20160503,5/3/2016 0:00,68.0,Routine - Unscheduled,81886_20160503_103154,Unclean or degraded floors walls or ceilings,Low Risk,20160503,103154,2016-05-03,0,0,0,0,0,9,7
620,620,1702,7527,DON CHUYS MEXI-MERCADO,544 EXCELSIOR Ave,San Francisco,CA,94112,37.724121999999994,-122.429309,"(37.724122, -122.429309)",14155588092.0,7527_20160812,8/12/2016 0:00,96.0,Routine - Unscheduled,7527_20160812_103120,Moderate risk food holding temperature,Moderate Risk,20160812,103120,2016-08-12,0,0,0,2,0,1,1
621,621,1704,5925,ARCHBISHOP RIORDAN HIGH SCHOOL CAFE,175 PHELAN,San Francisco,CA,94112,37.727337,-122.45245,"(37.727337, -122.45245)",14155588200.0,5925_20180223,2/23/2018 0:00,90.0,Routine - Unscheduled,5925_20180223_103119,Inadequate and inaccessible handwashing facilities,Moderate Risk,20180223,103119,2018-02-23,4,0,2,0,3,7,4
622,622,1706,78368,AT&T PARK - Food Cart,24 Willie Mays Plaza,San Francisco,CA,94107,,,,,78368_20160814,8/14/2016 0:00,96.0,Routine - Unscheduled,78368_20160814_103124,Inadequately cleaned or sanitized food contact surfaces,Moderate Risk,20160814,103124,2016-08-14,0,0,0,0,1,1,1
623,623,1718,35418,Eternal Springs,750 Clement St,San Francisco,CA,94118,37.782818,-122.46744199999999,"(37.782818, -122.467442)",,35418_20161110,11/10/2016 0:00,85.0,Routine - Unscheduled,35418_20161110_103109,Unclean or unsanitary food contact surfaces,High Risk,20161110,103109,2016-11-10,0,0,2,0,3,3,0
624,624,1723,34585,Hing Wang Bakery,339 JUDAH St,San Francisco,CA,94122,37.762174,-122.46580900000001,"(37.762174, -122.465809)",,34585_20160201,2/1/2016 0:00,56.0,Routine - Unscheduled,34585_20160201_103142,Unclean nonfood contact surfaces,Low Risk,20160201,103142,2016-02-01,5,0,0,0,0,0,1
625,625,1725,5877,CLAIRE LILIENTHAL SCHOOL-MADISON CA,3950 SACRAMENTO St,San Francisco,CA,94118,37.786808,-122.45801399999999,"(37.786808, -122.458014)",14155758603.0,5877_20160411,4/11/2016 0:00,94.0,Routine - Unscheduled,5877_20160411_103149,Wiping cloths not clean or properly stored or inadequate sanitizer,Low Risk,20160411,103149,2016-04-11,0,0,0,0,0,2,2
626,626,1728,2692,TYGER'S,2798 DIAMOND St,San Francisco,CA,94131,37.734579,-122.4339,"(37.734579, -122.4339)",14155234064.0,2692_20160823,8/23/2016 0:00,,Complaint,2692_20160823_103103,High risk food holding temperature,High Risk,20160823,103103,2016-08-23,0,3,0,0,2,2,5
627,627,1732,1289,ORPHAN ANDY'S,3991 A 17th St,San Francisco,CA,94114,37.758132,-122.43561399999999,"(37.758132, -122.435614)",,1289_20161206,12/6/2016 0:00,94.0,Routine - Unscheduled,1289_20161206_103133,Foods not protected from contamination,Moderate Risk,20161206,103133,2016-12-06,0,0,4,0,2,0,6
628,628,1740,87923,Mission Picnic,3275 22nd St,San Francisco,CA,94110,,,,14155733080.0,87923_20180227,2/27/2018 0:00,89.0,Routine - Unscheduled,87923_20180227_103112,No hot water or running water,High Risk,20180227,103112,2018-02-27,2,0,3,0,0,1,0
629,629,1741,62010,Chile Lindo,2944 16th St,San Francisco,CA,94103,37.765155,-122.41876599999999,"(37.765155, -122.418766)",,62010_20160415,4/15/2016 0:00,96.0,Routine - Unscheduled,62010_20160415_103121,Inadequate procedures or records for time as a public health control,Moderate Risk,20160415,103121,2016-04-15,0,0,0,0,1,1,2
630,630,1751,27793,Coriander Gourmet Thai,845 Market St FE-4,San Francisco,CA,94103,37.784848,-122.406892,"(37.784848, -122.406892)",14155530800.0,27793_20160323,3/23/2016 0:00,81.0,Routine - Unscheduled,27793_20160323_103129,Insufficient hot water or running water,Moderate Risk,20160323,103129,2016-03-23,5,4,0,0,0,4,6
631,631,1752,60210,Cafe Seventy 8,78 29th St,San Francisco,CA,94110,37.744012,-122.42226399999998,"(37.744012, -122.422264)",,60210_20160330,3/30/2016 0:00,88.0,Routine - Unscheduled,60210_20160330_103120,Moderate risk food holding temperature,Moderate Risk,20160330,103120,2016-03-30,0,1,0,3,4,4,4
632,632,1755,3229,TOMMYS MEXICAN RESTAURANT,5929 GEARY Blvd,San Francisco,CA,94121,37.78008300000001,-122.483108,"(37.780083, -122.483108)",,3229_20180207,2/7/2018 0:00,81.0,Routine - Unscheduled,3229_20180207_103145,Improper storage of equipment utensils or linens,Low Risk,20180207,103145,2018-02-07,5,0,0,0,3,0,3
633,633,1756,63554,Kin Khao Thai Eatery,55 CYRIL MAGNIN St,San Francisco,CA,94102,37.784965,-122.40861399999999,"(37.784965, -122.408614)",,63554_20160511,5/11/2016 0:00,89.0,Routine - Unscheduled,63554_20160511_103161,Low risk vermin infestation,Low Risk,20160511,103161,2016-05-11,3,0,0,0,2,3,0
634,634,1757,83643,Burma Love,211 Valencia St,San Francisco,CA,94103,,,,14155535800.0,83643_20160415,4/15/2016 0:00,86.0,Routine - Unscheduled,83643_20160415_103119,Inadequate and inaccessible handwashing facilities,Moderate Risk,20160415,103119,2016-04-15,0,0,0,0,4,5,1
635,635,1758,32738,Gialina,2842 DIAMOND St,San Francisco,CA,94131,37.73393400000001,-122.434095,"(37.733934, -122.434095)",,32738_20160414,4/14/2016 0:00,96.0,Routine - Unscheduled,32738_20160414_103149,Wiping cloths not clean or properly stored or inadequate sanitizer,Low Risk,20160414,103149,2016-04-14,0,0,0,3,0,2,0
636,636,1761,5852,CARVER ELEMENTARY SCHOOL,1360 OAKDALE Ave,San Francisco,CA,94124,37.732408,-122.38639099999999,"(37.732408, -122.386391)",14155331540.0,5852_20160906,9/6/2016 0:00,96.0,Routine - Unscheduled,5852_20160906_103124,Inadequately cleaned or sanitized food contact surfaces,Moderate Risk,20160906,103124,2016-09-06,0,0,0,0,0,1,1
637,637,1763,11416,El Beach Burrito,3914 Judah St,San Francisco,CA,94122,37.760851,-122.503998,"(37.760851, -122.503998)",,11416_20160502,5/2/2016 0:00,94.0,Routine - Unscheduled,11416_20160502_103116,Inadequate food safety knowledge or lack of certified food safety manager,Moderate Risk,20160502,103116,2016-05-02,0,0,4,0,0,2,1
638,638,1764,2421,ST FRANCIS FOUNTAIN,2801 24th St,San Francisco,CA,94110,37.752833,-122.408349,"(37.752833, -122.408349)",14155824200.0,2421_20160120,1/20/2016 0:00,85.0,Routine - Unscheduled,2421_20160120_103142,Unclean nonfood contact surfaces,Low Risk,20160120,103142,2016-01-20,0,4,0,2,0,4,4
639,639,1765,949,BUFFALO BURGERS RESTAURANT,5317-19 Geary Blvd,San Francisco,CA,94121,37.780372,-122.476354,"(37.780372, -122.476354)",,949_20150708,7/8/2015 0:00,96.0,Routine - Unscheduled,949_20150708_103124,Inadequately cleaned or sanitized food contact surfaces,Moderate Risk,20150708,103124,2015-07-08,0,0,0,2,0,0,1
640,640,1778,83327,Corner Bakery Cafe #1584,665 Market St,San Francisco,CA,94105,,,,,83327_20171211,12/11/2017 0:00,96.0,Routine - Unscheduled,83327_20171211_103154,Unclean or degraded floors walls or ceilings,Low Risk,20171211,103154,2017-12-11,0,2,0,0,0,1,1
641,641,1779,247,Toy Boat Dessert Cafe,401 Clement St,San Francisco,CA,94118,37.782953000000006,-122.46351000000001,"(37.782953, -122.46351)",,247_20160503,5/3/2016 0:00,83.0,Routine - Unscheduled,247_20160503_103120,Moderate risk food holding temperature,Moderate Risk,20160503,103120,2016-05-03,0,0,0,0,5,4,0
642,642,1788,74202,Coffeeshop - 3139 Mission,3139 Mission St,San Francisco,CA,94110,,,,14155363802.0,74202_20160325,3/25/2016 0:00,98.0,Routine - Unscheduled,74202_20160325_103154,Unclean or degraded floors walls or ceilings,Low Risk,20160325,103154,2016-03-25,0,2,0,1,0,1,1
643,643,1790,9631,7-Eleven Store 2231-33429A,43 Drumm St,San Francisco,CA,94111,37.794066,-122.39653500000001,"(37.794066, -122.396535)",,9631_20160504,5/4/2016 0:00,92.0,Routine - Unscheduled,9631_20160504_103116,Inadequate food safety knowledge or lack of certified food safety manager,Moderate Risk,20160504,103116,2016-05-04,0,0,4,0,0,3,0
644,644,1797,70184,Kitchen Story Cafe,3499 16th St,San Francisco,CA,94114,,,,14155939663.0,70184_20151223,12/23/2015 0:00,66.0,Routine - Unscheduled,70184_20151223_103103,High risk food holding temperature,High Risk,20151223,103103,2015-12-23,5,0,6,0,0,0,9
645,645,1798,63280,Good Luck Market,1215 Taraval St,San Francisco,CA,94116,37.742863,-122.47925900000001,"(37.742863, -122.479259)",,63280_20160504,5/4/2016 0:00,92.0,Routine - Unscheduled,63280_20160504_103152,Unclean unmaintained or improperly constructed toilet facilities,Low Risk,20160504,103152,2016-05-04,0,5,0,0,5,4,0
646,646,1802,87615,Mustafio's Pizza,1116 Polk St,San Francisco,CA,94109,,,,,87615_20171208,12/8/2017 0:00,94.0,Routine - Unscheduled,87615_20171208_103157,Food safety certificate or food handler card not available,Low Risk,20171208,103157,2017-12-08,0,2,0,0,2,2,0
647,647,1806,59044,Taqueria Cazadores,1600 C Mission St,San Francisco,CA,94110,37.749851,-122.415121,"(37.749851, -122.415121)",14156781286.0,59044_20180122,1/22/2018 0:00,78.0,Routine - Unscheduled,59044_20180122_103114,High risk vermin infestation,High Risk,20180122,103114,2018-01-22,4,0,0,0,0,7,5
648,648,1810,77958,Richmond Republic,642 Clement St,San Francisco,CA,94118,,,,14150522364.0,77958_20160608,6/8/2016 0:00,81.0,Routine - Unscheduled,77958_20160608_103124,Inadequately cleaned or sanitized food contact surfaces,Moderate Risk,20160608,103124,2016-06-08,0,0,5,0,0,4,0
649,649,1811,37818,Nick's Crispy Tacos,1500 Broadway St,San Francisco,CA,94109,37.795991,-122.42181699999999,"(37.795991, -122.421817)",,37818_20171213,12/13/2017 0:00,96.0,Routine - Unscheduled,37818_20171213_103150,Improper or defective plumbing,Low Risk,20171213,103150,2017-12-13,0,2,0,0,0,6,4
650,650,1812,5866,KING ELEMENTARY SCHOOL,1215 CAROLINA St,San Francisco,CA,94107,37.753196,-122.39939,"(37.753196, -122.39939)",14155695797.0,5866_20180227,2/27/2018 0:00,96.0,Routine - Unscheduled,5866_20180227_103116,Inadequate food safety knowledge or lack of certified food safety manager,Moderate Risk,20180227,103116,2018-02-27,1,1,0,0,2,1,3
651,651,1815,88792,Starbucks Coffee #47471,3801 03rd St,San Francisco,CA,94124,,,,,88792_20160901,9/1/2016 0:00,96.0,Routine - Unscheduled,88792_20160901_103118,Employee eating or smoking,Moderate Risk,20160901,103118,2016-09-01,0,1,0,0,0,1,0
652,652,1820,3861,CINCO DE MAYO TAQUERIA & GROCERY,2426 SAN BRUNO Ave,San Francisco,CA,94134,37.731788,-122.405381,"(37.731788, -122.405381)",,3861_20160503,5/3/2016 0:00,74.0,Routine - Unscheduled,3861_20160503_103105,Improper cooling methods,High Risk,20160503,103105,2016-05-03,0,4,0,0,3,6,0
653,653,1821,7467,RUSSELL'S CONVENIENCE #621,199 FREMONT St,San Francisco,CA,94105,37.78931400000001,-122.395192,"(37.789314, -122.395192)",,7467_20180221,2/21/2018 0:00,90.0,Routine - Unscheduled,7467_20180221_103119,Inadequate and inaccessible handwashing facilities,Moderate Risk,20180221,103119,2018-02-21,3,0,0,0,4,0,2
654,654,1824,5136,Taco Bell,7 Drumm St,San Francisco,CA,94111,37.793874,-122.396464,"(37.793874, -122.396464)",,5136_20160504,5/4/2016 0:00,98.0,Routine - Unscheduled,5136_20160504_103150,Improper or defective plumbing,Low Risk,20160504,103150,2016-05-04,0,0,3,0,0,1,0
655,655,1827,80,LAW SCHOOL CAFE,2199 Fulton St,San Francisco,CA,94117,37.774941,-122.452797,"(37.774941, -122.452797)",,80_20160412,4/12/2016 0:00,98.0,Routine - Unscheduled,80_20160412_103139,Improper food storage,Low Risk,20160412,103139,2016-04-12,0,2,0,0,0,1,0
656,656,1829,7558,Seafood Center,831 Clement St,San Francisco,CA,94118,37.782724,-122.46826000000001,"(37.782724, -122.46826)",,7558_20160503,5/3/2016 0:00,90.0,Routine - Unscheduled,7558_20160503_103157,Food safety certificate or food handler card not available,Low Risk,20160503,103157,2016-05-03,0,0,0,0,3,4,0
657,657,1833,67237,La Jefa,445 Bayshore Blvd,San Francisco,CA,94107,37.749871,-122.405648,"(37.749871, -122.405648)",,67237_20160414,4/14/2016 0:00,88.0,Routine - Unscheduled,67237_20160414_103116,Inadequate food safety knowledge or lack of certified food safety manager,Moderate Risk,20160414,103116,2016-04-14,0,0,3,0,0,4,3
658,658,1835,66685,Tacolicious,741 Valencia St,San Francisco,CA,94110,37.760974,-122.421456,"(37.760974, -122.421456)",,66685_20161205,12/5/2016 0:00,90.0,Routine - Unscheduled,66685_20161205_103133,Foods not protected from contamination,Moderate Risk,20161205,103133,2016-12-05,0,3,0,0,3,0,3
659,659,1837,3550,Noah's New York Bagels #2113,100 Bush St #102,San Francisco,CA,94104,37.791348,-122.39983400000001,"(37.791348, -122.399834)",,3550_20160405,4/5/2016 0:00,81.0,Routine - Unscheduled,3550_20160405_103103,High risk food holding temperature,High Risk,20160405,103103,2016-04-05,0,0,11,0,0,5,4
660,660,1839,505,Quickly,5301 MISSION St,San Francisco,CA,94112,37.714458,-122.44277,"(37.714458, -122.44277)",,505_20160607,6/7/2016 0:00,,Complaint,505_20160607_103154,Unclean or degraded floors walls or ceilings,Low Risk,20160607,103154,2016-06-07,3,0,0,0,3,3,2
661,661,1852,5903,Yick Wo Elementary School,2245 Jones St,San Francisco,CA,94109,37.801964,-122.41625400000001,"(37.801964, -122.416254)",,5903_20171208,12/8/2017 0:00,96.0,Routine - Unscheduled,5903_20171208_103127,Noncompliance with HAACP plan or variance,Moderate Risk,20171208,103127,2017-12-08,1,1,0,0,0,1,0
662,662,1856,6860,Searchlight Market,1964 Hyde St,San Francisco,CA,94109,37.799006,-122.41898700000002,"(37.799006, -122.418987)",,6860_20160414,4/14/2016 0:00,88.0,Routine - Unscheduled,6860_20160414_103116,Inadequate food safety knowledge or lack of certified food safety manager,Moderate Risk,20160414,103116,2016-04-14,0,3,0,0,0,3,0
663,663,1859,93561,Papito,317 Connecticut St,San Francisco,CA,94107,,,,,93561_20180220,2/20/2018 0:00,,New Ownership,93561_20180220_103103,High risk food holding temperature,High Risk,20180220,103103,2018-02-20,3,0,0,0,0,0,0
664,664,1865,67043,Jang Soo BBQ,6314 Geary Blvd,San Francisco,CA,94121,37.780068,-122.487241,"(37.780068, -122.487241)",,67043_20160512,5/12/2016 0:00,70.0,Routine - Unscheduled,67043_20160512_103102,Unclean hands or improper use of gloves,High Risk,20160512,103102,2016-05-12,0,0,1,0,3,6,0
665,665,1873,63618,Contraband Coffee LLC,1415 Larkin St,San Francisco,CA,94109,37.790933,-122.41913999999998,"(37.790933, -122.41914)",14155221520.0,63618_20160328,3/28/2016 0:00,96.0,Routine - Unscheduled,63618_20160328_103149,Wiping cloths not clean or properly stored or inadequate sanitizer,Low Risk,20160328,103149,2016-03-28,0,0,2,0,0,2,2
666,666,1875,85582,Conching's Kusina,4994 Mission St,San Francisco,CA,94112,,,,14155270703.0,85582_20161021,10/21/2016 0:00,87.0,Routine - Unscheduled,85582_20161021_103150,Improper or defective plumbing,Low Risk,20161021,103150,2016-10-21,0,5,0,0,3,8,0
667,667,1877,65415,Nob Hill Liquors,1000 Hyde St,San Francisco,CA,94109,37.790208,-122.417197,"(37.790208, -122.417197)",,65415_20160511,5/11/2016 0:00,90.0,Routine - Unscheduled,65415_20160511_103120,Moderate risk food holding temperature,Moderate Risk,20160511,103120,2016-05-11,3,0,2,0,0,4,0
668,668,1879,5460,AT&T - (CART 42) FRESH POPCORN [145129],24 WILLIE MAYS PLAZA,San Francisco,CA,94107,,,,14155971500.0,5460_20160814,8/14/2016 0:00,98.0,Routine - Unscheduled,5460_20160814_103149,Wiping cloths not clean or properly stored or inadequate sanitizer,Low Risk,20160814,103149,2016-08-14,0,0,0,0,0,1,0
669,669,1883,61390,Fondue Cowboy,1052 FOLSOM St,San Francisco,CA,94103,37.777504,-122.406948,"(37.777504, -122.406948)",,61390_20160906,9/6/2016 0:00,94.0,Routine - Unscheduled,61390_20160906_103120,Moderate risk food holding temperature,Moderate Risk,20160906,103120,2016-09-06,2,0,0,0,0,2,0
670,670,1884,19060,Moscone Convention Center - Stand #2,747 HOWARD St,San Francisco,CA,94103,37.784128,-122.401533,"(37.784128, -122.401533)",,19060_20160607,6/7/2016 0:00,96.0,Routine - Unscheduled,19060_20160607_103131,Moderate risk vermin infestation,Moderate Risk,20160607,103131,2016-06-07,0,0,0,0,2,1,0
671,671,1886,773,MARIPOSA HUNTERS POINT YACHT CLUB,405 TERRY FRANCOIS Blvd,San Francisco,CA,94107,37.77325,-122.387222,"(37.77325, -122.387222)",14155789296.0,773_20161205,12/5/2016 0:00,96.0,Routine - Unscheduled,773_20161205_103144,Unapproved or unmaintained equipment or utensils,Low Risk,20161205,103144,2016-12-05,0,0,0,0,2,0,0
672,672,1893,58576,Than Tam II,577 Valencia St.,San Francisco,CA,94103,37.763664,-122.42173600000001,"(37.763664, -122.421736)",,58576_20180213,2/13/2018 0:00,77.0,Routine - Unscheduled,58576_20180213_103154,Unclean or degraded floors walls or ceilings,Low Risk,20180213,103154,2018-02-13,6,0,0,0,1,7,4
673,673,1898,4643,CHEUNG HING CHINESE DELI & MEAT INC,323 Clement St,San Francisco,CA,94118,37.782993,-122.462709,"(37.782993, -122.462709)",14155754259.0,4643_20160512,5/12/2016 0:00,67.0,Routine - Unscheduled,4643_20160512_103139,Improper food storage,Low Risk,20160512,103139,2016-05-12,5,0,0,0,0,7,0
674,674,1905,1649,COURTYARD BY MARRIOTT-RESTAURANT,299 02nd St,San Francisco,CA,94105,37.785614,-122.396693,"(37.785614, -122.396693)",,1649_20161206,12/6/2016 0:00,98.0,Routine - Unscheduled,1649_20161206_103145,Improper storage of equipment utensils or linens,Low Risk,20161206,103145,2016-12-06,0,4,0,0,1,0,0
675,675,1908,1339,HIGHER GROUNDS,691 CHENERY St,San Francisco,CA,94131,37.734483000000004,-122.43368000000001,"(37.734483, -122.43368)",14155582933.0,1339_20160414,4/14/2016 0:00,90.0,Routine - Unscheduled,1339_20160414_103120,Moderate risk food holding temperature,Moderate Risk,20160414,103120,2016-04-14,0,0,1,0,4,4,0
676,676,1909,10030,Marshall Elementary School,1575 15th St,San Francisco,CA,94103,37.766864,-122.41901399999999,"(37.766864, -122.419014)",14155246280.0,10030_20170928,9/28/2017 0:00,93.0,Routine - Unscheduled,10030_20170928_103103,High risk food holding temperature,High Risk,20170928,103103,2017-09-28,0,0,1,0,0,3,1
677,677,1911,92444,Mixt Greens,3130 Fillmore St,San Francisco,CA,94123,,,,,92444_20171213,12/13/2017 0:00,93.0,Routine - Unscheduled,92444_20171213_103103,High risk food holding temperature,High Risk,20171213,103103,2017-12-13,0,1,0,0,0,0,0
678,678,1920,903,Sabra Restaurant,419 Grant Ave,San Francisco,CA,94108,37.790874,-122.405634,"(37.790874, -122.405634)",14155983656.0,903_20171211,12/11/2017 0:00,91.0,Routine - Unscheduled,903_20171211_103144,Unapproved or unmaintained equipment or utensils,Low Risk,20171211,103144,2017-12-11,0,2,0,0,0,4,0
679,679,1921,3090,YANK SING RESTAURANT,101 SPEAR St A-16,San Francisco,CA,94105,37.792577,-122.393992,"(37.792577, -122.393992)",,3090_20150619,6/19/2015 0:00,82.0,Routine - Unscheduled,3090_20150619_103148,No thermometers or uncalibrated thermometers,Low Risk,20150619,103148,2015-06-19,0,0,3,0,0,0,4
680,680,1925,86073,Ginza Japanese Restaurant,1793 Haight St,San Francisco,CA,94117,,,,14155740552.0,86073_20160127,1/27/2016 0:00,,New Ownership,86073_20160127_103109,Unclean or unsanitary food contact surfaces,High Risk,20160127,103109,2016-01-27,0,0,0,0,2,0,1
681,681,1932,88862,Piece of Heaven,1380 Sutter St,San Francisco,CA,94109,,,,,88862_20161018,10/18/2016 0:00,96.0,Routine - Unscheduled,88862_20161018_103129,Insufficient hot water or running water,Moderate Risk,20161018,103129,2016-10-18,2,0,0,0,1,0,0
682,682,1934,5634,AT&T - COMMISARY KITCHEN [145184],24 WILLIE MAYS PLAZA 1.24.06,San Francisco,CA,94107,37.778382,-122.39115100000001,"(37.778382, -122.391151)",14155971500.0,5634_20160814,8/14/2016 0:00,98.0,Routine - Unscheduled,5634_20160814_103144,Unapproved or unmaintained equipment or utensils,Low Risk,20160814,103144,2016-08-14,0,0,3,1,1,1,2
683,683,1942,79025,Phat Philly,3388 24th St,San Francisco,CA,94110,,,,14155557428.0,79025_20170928,9/28/2017 0:00,92.0,Routine - Unscheduled,79025_20170928_103120,Moderate risk food holding temperature,Moderate Risk,20170928,103120,2017-09-28,0,0,3,0,2,0,4
684,684,1943,22671,Chiotras Grocery,858 RHODE ISLAND St,San Francisco,CA,94107,37.758944,-122.40210400000001,"(37.758944, -122.402104)",,22671_20180227,2/27/2018 0:00,96.0,Routine - Unscheduled,22671_20180227_103139,Improper food storage,Low Risk,20180227,103139,2018-02-27,2,0,0,0,1,0,2
685,685,1950,86399,Lima Peruvian Food LLC,2200 Jerrold Ave Suite N,San Francisco,CA,94124,,,,14156794193.0,86399_20170928,9/28/2017 0:00,,Complaint,86399_20170928_103116,Inadequate food safety knowledge or lack of certified food safety manager,Moderate Risk,20170928,103116,2017-09-28,0,0,2,0,2,0,0
686,686,1952,88082,Chongqing Xiaomian,915 Kearny St,San Francisco,CA,94133,,,,14155980888.0,88082_20160830,8/30/2016 0:00,,New Ownership,88082_20160830_103148,No thermometers or uncalibrated thermometers,Low Risk,20160830,103148,2016-08-30,0,6,0,0,0,5,0
687,687,1962,77427,Diamond Cafe,751 Diamond St,San Francisco,CA,94114,,,,14155289551.0,77427_20160503,5/3/2016 0:00,94.0,Routine - Unscheduled,77427_20160503_103139,Improper food storage,Low Risk,20160503,103139,2016-05-03,0,0,2,0,0,3,0
688,688,1963,33145,"7-Eleven, Store 2231-33006B",2650 Mason St,San Francisco,CA,94133,37.807888,-122.414027,"(37.807888, -122.414027)",,33145_20160324,3/24/2016 0:00,94.0,Routine - Unscheduled,33145_20160324_103156,Permit license or inspection report not posted,Low Risk,20160324,103156,2016-03-24,0,0,5,0,0,4,3
689,689,1964,58861,The Tipsy Pig,2231 CHESTNUT St,San Francisco,CA,94123,37.800286,-122.439982,"(37.800286, -122.439982)",,58861_20160330,3/30/2016 0:00,92.0,Routine - Unscheduled,58861_20160330_103124,Inadequately cleaned or sanitized food contact surfaces,Moderate Risk,20160330,103124,2016-03-30,1,0,0,0,0,0,2
690,690,1967,5908,SHERMAN ELEMENTARY SCHOOL,1651 UNION St,San Francisco,CA,94123,37.798243,-122.42616699999999,"(37.798243, -122.426167)",14155743530.0,5908_20160325,3/25/2016 0:00,96.0,Routine - Unscheduled,5908_20160325_103144,Unapproved or unmaintained equipment or utensils,Low Risk,20160325,103144,2016-03-25,1,0,3,0,5,4,2
691,691,1985,3676,Chinatown Restaurant,744 Washington St,San Francisco,CA,94108,37.795248,-122.405943,"(37.795248, -122.405943)",,3676_20150619,6/19/2015 0:00,85.0,Routine - Unscheduled,3676_20150619_103154,Unclean or degraded floors walls or ceilings,Low Risk,20150619,103154,2015-06-19,0,0,5,0,0,3,5
692,692,1989,1529,STARBUCKS,490 BRANNAN St,San Francisco,CA,94107,37.778694,-122.39613899999999,"(37.778694, -122.396139)",14155240256.0,1529_20180109,1/9/2018 0:00,,Complaint,1529_20180109_103154,Unclean or degraded floors walls or ceilings,Low Risk,20180109,103154,2018-01-09,1,0,0,1,0,0,0
693,693,1995,76546,Landmark Theatres Embarcadero Center,1 Embarcadero Center,San Francisco,CA,94111,,,,,76546_20160922,9/22/2016 0:00,,Reinspection/Followup,76546_20160922_103120,Moderate risk food holding temperature,Moderate Risk,20160922,103120,2016-09-22,0,2,0,0,0,2,0
694,694,2009,35786,Subway #33355,750 FONT Blvd,San Francisco,CA,94132,37.723054,-122.48361200000001,"(37.723054, -122.483612)",,35786_20160511,5/11/2016 0:00,84.0,Routine - Unscheduled,35786_20160511_103103,High risk food holding temperature,High Risk,20160511,103103,2016-05-11,0,3,0,0,3,1,0
695,695,2015,18577,AMC Theatres Metreon 16 - Main Stand,135 04th St  3000,San Francisco,CA,94103,37.784548,-122.40418999999999,"(37.784548, -122.40419)",,18577_20160519,5/19/2016 0:00,98.0,Routine - Unscheduled,18577_20160519_103145,Improper storage of equipment utensils or linens,Low Risk,20160519,103145,2016-05-19,2,0,0,0,1,1,0
696,696,2029,69186,"Premier Catering & Events, Inc.",1255 22nd St,San Francisco,CA,94107,,,,14155530288.0,69186_20180221,2/21/2018 0:00,81.0,Routine - Unscheduled,69186_20180221_103129,Insufficient hot water or running water,Moderate Risk,20180221,103129,2018-02-21,5,0,0,0,3,0,2
697,697,2044,5854,Gateway High/Kip Schools,1430 Scott St,San Francisco,CA,94115,37.783427,-122.437747,"(37.783427, -122.437747)",14155743600.0,5854_20180227,2/27/2018 0:00,98.0,Routine - Unscheduled,5854_20180227_103144,Unapproved or unmaintained equipment or utensils,Low Risk,20180227,103144,2018-02-27,1,1,0,3,3,1,3
698,698,2048,68986,Cafe Troya Fillmore,2125 FILLMORE St,San Francisco,CA,94115,37.789404,-122.433954,"(37.789404, -122.433954)",,68986_20171211,12/11/2017 0:00,80.0,Routine - Unscheduled,68986_20171211_103105,Improper cooling methods,High Risk,20171211,103105,2017-12-11,1,4,0,0,0,3,0
699,699,2053,1381,PEBBLE'S CAFE,2852 Diamond St,San Francisco,CA,94131,37.73382,-122.43409299999999,"(37.73382, -122.434093)",14155332270.0,1381_20160415,4/15/2016 0:00,,Reinspection/Followup,1381_20160415_103161,Low risk vermin infestation,Low Risk,20160415,103161,2016-04-15,0,0,1,0,4,2,6
700,700,2057,1139,MINI CAFE,28 VAN NESS,San Francisco,CA,94102,37.775867,-122.41935600000001,"(37.775867, -122.419356)",14155430177.0,1139_20150501,5/1/2015 0:00,79.0,Routine - Unscheduled,1139_20150501_103154,Unclean or degraded floors walls or ceilings,Low Risk,20150501,103154,2015-05-01,0,7,0,0,0,5,7
701,701,2066,36687,Jay's Cheesesteak,3285 21st St,San Francisco,CA,94110,37.756893,-122.420849,"(37.756893, -122.420849)",,36687_20160504,5/4/2016 0:00,98.0,Routine - Unscheduled,36687_20160504_103150,Improper or defective plumbing,Low Risk,20160504,103150,2016-05-04,2,0,4,0,0,1,1
702,702,2070,5650,AT&T - DOGGIE DINER room 3205 [145167],24 WILLIE MAYS PLAZA,San Francisco,CA,94107,37.778382,-122.39115100000001,"(37.778382, -122.391151)",14155971500.0,5650_20160814,8/14/2016 0:00,94.0,Routine - Unscheduled,5650_20160814_103154,Unclean or degraded floors walls or ceilings,Low Risk,20160814,103154,2016-08-14,0,0,1,0,0,2,1
703,703,2076,83990,Counter Offer,806 S Van Ness Ave,San Francisco,CA,94110,,,,14155821800.0,83990_20160628,6/28/2016 0:00,92.0,Routine - Unscheduled,83990_20160628_103154,Unclean or degraded floors walls or ceilings,Low Risk,20160628,103154,2016-06-28,0,0,3,0,0,3,1
704,704,2081,33920,Lalita Thai Restaurant & Bar,96 McAllister St,San Francisco,CA,94102,37.780989,-122.41368600000001,"(37.780989, -122.413686)",,33920_20180222,2/22/2018 0:00,70.0,Routine - Unscheduled,33920_20180222_103147,Inadequate ventilation or lighting,Low Risk,20180222,103147,2018-02-22,8,0,5,0,0,6,0
705,705,2082,78642,ABV,3174 16th St,San Francisco,CA,94103,,,,14155335126.0,78642_20160629,6/29/2016 0:00,86.0,Routine - Unscheduled,78642_20160629_103133,Foods not protected from contamination,Moderate Risk,20160629,103133,2016-06-29,0,0,0,0,0,4,0
706,706,2091,68895,It' Sugar,333 Jefferson St Space B-101,San Francisco,CA,94133,37.807922999999995,-122.41788700000001,"(37.807923, -122.417887)",,68895_20160808,8/8/2016 0:00,98.0,Routine - Unscheduled,68895_20160808_103139,Improper food storage,Low Risk,20160808,103139,2016-08-08,2,0,4,0,0,1,2
707,707,2093,7602,Oski,Pier 41,San Francisco,CA,94133,37.808494,-122.412,"(37.808494, -122.412)",,7602_20160518,5/18/2016 0:00,96.0,Routine - Unscheduled,7602_20160518_103124,Inadequately cleaned or sanitized food contact surfaces,Moderate Risk,20160518,103124,2016-05-18,2,0,0,0,0,1,0
708,708,2096,3481,Trattoria Contadina Restaurant,1800 Mason St,San Francisco,CA,94133,37.800146999999996,-122.412456,"(37.800147, -122.412456)",,3481_20160105,1/5/2016 0:00,,Complaint,3481_20160105_103119,Inadequate and inaccessible handwashing facilities,Moderate Risk,20160105,103119,2016-01-05,0,4,0,0,0,0,4
709,709,2101,1571,SF Bay Club - Court Cafe,150 Greenwich St,San Francisco,CA,94111,37.80320800000001,-122.402534,"(37.803208, -122.402534)",,1571_20160413,4/13/2016 0:00,85.0,Routine - Unscheduled,1571_20160413_103109,Unclean or unsanitary food contact surfaces,High Risk,20160413,103109,2016-04-13,0,0,0,0,4,3,0
710,710,2103,3881,International House of Pancakes,2299 LOMBARD St,San Francisco,CA,94123,37.79943400000001,-122.439067,"(37.799434, -122.439067)",,3881_20160511,5/11/2016 0:00,76.0,Routine - Unscheduled,3881_20160511_103144,Unapproved or unmaintained equipment or utensils,Low Risk,20160511,103144,2016-05-11,3,0,0,0,0,6,0
711,711,2105,5927,CORNERSTONES ACADEMY,801 SILVER Ave,San Francisco,CA,94134,37.729108000000004,-122.418728,"(37.729108, -122.418728)",,5927_20160324,3/24/2016 0:00,90.0,Routine - Unscheduled,5927_20160324_103154,Unclean or degraded floors walls or ceilings,Low Risk,20160324,103154,2016-03-24,0,0,2,0,2,3,4
712,712,2109,1156,Boudin Petit Cafe,"170 O'Farrell St, 1st Floor",San Francisco,CA,94102,37.786547999999996,-122.40731299999999,"(37.786548, -122.407313)",,1156_20150317,3/17/2015 0:00,93.0,Routine - Unscheduled,1156_20150317_103109,Unclean or unsanitary food contact surfaces,High Risk,20150317,103109,2015-03-17,0,0,0,2,0,3,0
713,713,2111,36840,Four Barrel Coffee,375 Valencia St,San Francisco,CA,94103,37.766994,-122.42203500000001,"(37.766994, -122.422035)",,36840_20171207,12/7/2017 0:00,82.0,Routine - Unscheduled,36840_20171207_103119,Inadequate and inaccessible handwashing facilities,Moderate Risk,20171207,103119,2017-12-07,0,3,0,0,2,0,2
714,714,2113,62939,Hooker's Sweet Treats,442 Hyde St,San Francisco,CA,94109,37.784869,-122.416078,"(37.784869, -122.416078)",,62939_20160907,9/7/2016 0:00,96.0,Routine - Unscheduled,62939_20160907_103116,Inadequate food safety knowledge or lack of certified food safety manager,Moderate Risk,20160907,103116,2016-09-07,0,0,1,0,0,1,2
715,715,2116,1351,EXIT THEATRE,156 EDDY St,San Francisco,CA,94102,37.784288000000004,-122.410224,"(37.784288, -122.410224)",,1351_20160629,6/29/2016 0:00,96.0,Routine - Unscheduled,1351_20160629_103129,Insufficient hot water or running water,Moderate Risk,20160629,103129,2016-06-29,0,0,0,0,0,1,0
716,716,2121,72049,Tai Chi Restaurant,2031 Polk St,San Francisco,CA,94109,,,,,72049_20160330,3/30/2016 0:00,86.0,Routine - Unscheduled,72049_20160330_103150,Improper or defective plumbing,Low Risk,20160330,103150,2016-03-30,7,4,1,0,0,5,5
717,717,2128,5497,AT&T - (CART 21) GOURMET SAUSAGES & BUDWEISER [145109],24 WILLIE MAYS PLAZA,San Francisco,CA,94107,,,,14155971500.0,5497_20160814,8/14/2016 0:00,96.0,Routine - Unscheduled,5497_20160814_103120,Moderate risk food holding temperature,Moderate Risk,20160814,103120,2016-08-14,0,0,0,0,4,1,1
718,718,2133,66406,Charley's Grilled Subs,865 Market St,San Francisco,CA,94103,37.784317,-122.40756299999998,"(37.784317, -122.407563)",,66406_20160510,5/10/2016 0:00,79.0,Routine - Unscheduled,66406_20160510_103116,Inadequate food safety knowledge or lack of certified food safety manager,Moderate Risk,20160510,103116,2016-05-10,0,5,0,0,0,3,0
719,719,2134,81974,Sons & Daughters,708 Bush St,San Francisco,CA,94108,,,,,81974_20160629,6/29/2016 0:00,87.0,Routine - Unscheduled,81974_20160629_103109,Unclean or unsanitary food contact surfaces,High Risk,20160629,103109,2016-06-29,0,0,0,0,0,4,0
720,720,2137,69584,Eden Cafe,47 FRANKLIN St,San Francisco,CA,94102,,,,,69584_20160512,5/12/2016 0:00,75.0,Routine - Unscheduled,69584_20160512_103161,Low risk vermin infestation,Low Risk,20160512,103161,2016-05-12,0,0,0,0,5,8,0
721,721,2138,87015,Morty's Delicatessen,280 Golden Gate Ave,San Francisco,CA,94102,,,,,87015_20160630,6/30/2016 0:00,89.0,Routine - Unscheduled,87015_20160630_103109,Unclean or unsanitary food contact surfaces,High Risk,20160630,103109,2016-06-30,0,0,0,6,0,2,0
722,722,2144,519,SHERATON PALACE - EMP.  CAFETERIA,2 NEW MONTGOMERY St,San Francisco,CA,94105,37.788286,-122.40154299999999,"(37.788286, -122.401543)",,519_20171212,12/12/2017 0:00,91.0,Routine - Unscheduled,519_20171212_103142,Unclean nonfood contact surfaces,Low Risk,20171212,103142,2017-12-12,0,2,0,0,0,4,0
723,723,2151,1103,STARBUCKS COFFEE,4094 18th St,San Francisco,CA,94114,37.760938,-122.434692,"(37.760938, -122.434692)",,1103_20151224,12/24/2015 0:00,96.0,Routine - Unscheduled,1103_20151224_103154,Unclean or degraded floors walls or ceilings,Low Risk,20151224,103154,2015-12-24,0,0,2,0,1,0,2
724,724,2153,7361,PastaGina,741 Diamond St,San Francisco,CA,94114,37.751403,-122.43628600000001,"(37.751403, -122.436286)",14155280738.0,7361_20160503,5/3/2016 0:00,86.0,Routine - Unscheduled,7361_20160503_103149,Wiping cloths not clean or properly stored or inadequate sanitizer,Low Risk,20160503,103149,2016-05-03,0,0,0,0,0,6,4
725,725,2157,80495,Arashi Sushi House,4724 Geary Blvd,San Francisco,CA,94118,,,,,80495_20160629,6/29/2016 0:00,83.0,Routine - Unscheduled,80495_20160629_103149,Wiping cloths not clean or properly stored or inadequate sanitizer,Low Risk,20160629,103149,2016-06-29,0,4,0,0,0,4,5
726,726,2165,2336,Ristorante Ti Piacera,1507 Polk St,San Francisco,CA,94109,37.790645,-122.42076499999999,"(37.790645, -122.420765)",,2336_20160321,3/21/2016 0:00,82.0,Routine - Unscheduled,2336_20160321_103150,Improper or defective plumbing,Low Risk,20160321,103150,2016-03-21,4,0,5,0,0,3,6
727,727,2176,5926,"SAN FRANCISCO SCHOOL, THE",300 GAVEN St,San Francisco,CA,94134,37.732518,-122.411648,"(37.732518, -122.411648)",14155235065.0,5926_20180223,2/23/2018 0:00,96.0,Routine - Unscheduled,5926_20180223_103133,Foods not protected from contamination,Moderate Risk,20180223,103133,2018-02-23,1,0,1,0,1,0,1
728,728,2187,496,Caffe Trieste,601 Vallejo St,San Francisco,CA,94133,37.798744,-122.407408,"(37.798744, -122.407408)",,496_20160412,4/12/2016 0:00,91.0,Routine - Unscheduled,496_20160412_103139,Improper food storage,Low Risk,20160412,103139,2016-04-12,0,2,0,0,0,2,0
729,729,2188,65829,CHAMBERS eat + drink,601 Eddy St,San Francisco,CA,94109,37.783194,-122.41809599999999,"(37.783194, -122.418096)",,65829_20160630,6/30/2016 0:00,94.0,Routine - Unscheduled,65829_20160630_103160,Inadequate HACCP plan record keeping,Low Risk,20160630,103160,2016-06-30,0,0,0,0,0,2,0
730,730,2189,77714,Hopwater Distribution,850 Bush St,San Francisco,CA,94108,,,,,77714_20160629,6/29/2016 0:00,89.0,Routine - Unscheduled,77714_20160629_103156,Permit license or inspection report not posted,Low Risk,20160629,103156,2016-06-29,0,0,0,0,0,3,0
731,731,2190,11492,Burgermeister,759 Columbus Ave,San Francisco,CA,94133,37.801696,-122.41225700000001,"(37.801696, -122.412257)",,11492_20160219,2/19/2016 0:00,88.0,Routine - Unscheduled,11492_20160219_103124,Inadequately cleaned or sanitized food contact surfaces,Moderate Risk,20160219,103124,2016-02-19,0,0,0,0,4,0,4
732,732,2196,19416,Starbucks,865 Market St C26,San Francisco,CA,94103,37.784317,-122.40756299999998,"(37.784317, -122.407563)",14155604908.0,19416_20160629,6/29/2016 0:00,94.0,Routine - Unscheduled,19416_20160629_103154,Unclean or degraded floors walls or ceilings,Low Risk,20160629,103154,2016-06-29,0,3,0,0,2,3,1
733,733,2200,4555,UNITED LIQUORS & DELI,2401 CHESTNUT St,San Francisco,CA,94123,37.799934,-122.442977,"(37.799934, -122.442977)",,4555_20160414,4/14/2016 0:00,92.0,Routine - Unscheduled,4555_20160414_103149,Wiping cloths not clean or properly stored or inadequate sanitizer,Low Risk,20160414,103149,2016-04-14,0,3,0,0,0,3,0
734,734,2206,69635,Sophie's Crepes,1581 Webster St 275,San Francisco,CA,94115,,,,,69635_20160407,4/7/2016 0:00,89.0,Routine - Unscheduled,69635_20160407_103114,High risk vermin infestation,High Risk,20160407,103114,2016-04-07,0,0,0,0,0,2,0
735,735,2214,83633,As Quoted,3613 Sacramento St,San Francisco,CA,94118,,,,,83633_20160411,4/11/2016 0:00,89.0,Routine - Unscheduled,83633_20160411_103133,Foods not protected from contamination,Moderate Risk,20160411,103133,2016-04-11,0,0,0,0,2,2,0
736,736,2216,63755,Hana Zen Sushi & Yakitori Bar,Pier 39  Space M209,San Francisco,CA,94133,37.80824000000001,-122.41018899999999,"(37.80824, -122.410189)",,63755_20160608,6/8/2016 0:00,70.0,Routine - Unscheduled,63755_20160608_103156,Permit license or inspection report not posted,Low Risk,20160608,103156,2016-06-08,0,6,0,0,7,8,5
737,737,2223,83844,Taste of Jiangnan,332 Clement St,San Francisco,CA,94118,,,,,83844_20160629,6/29/2016 0:00,73.0,Routine - Unscheduled,83844_20160629_103132,Improper thawing methods,Moderate Risk,20160629,103132,2016-06-29,0,0,0,7,0,1,4
738,738,2224,4548,Starbucks Coffee,500 Beach St,San Francisco,CA,94133,37.807047999999995,-122.417704,"(37.807048, -122.417704)",,4548_20160421,4/21/2016 0:00,98.0,Routine - Unscheduled,4548_20160421_103157,Food safety certificate or food handler card not available,Low Risk,20160421,103157,2016-04-21,2,0,3,0,2,1,0
739,739,2227,65337,Layaly,2435 Clement St,San Francisco,CA,94121,,,,,65337_20160511,5/11/2016 0:00,78.0,Routine - Unscheduled,65337_20160511_103161,Low risk vermin infestation,Low Risk,20160511,103161,2016-05-11,0,0,0,5,0,1,0
740,740,2228,5502,AT&T -26 SNOW CONES/COTTON CANDY [145113],24 WILLIE MAYS PLAZA,San Francisco,CA,94107,,,,14155971500.0,5502_20160814,8/14/2016 0:00,96.0,Routine - Unscheduled,5502_20160814_103119,Inadequate and inaccessible handwashing facilities,Moderate Risk,20160814,103119,2016-08-14,0,0,0,0,1,1,0
741,741,2230,59009,Woodhouse Fish Co.,1914 FILLMORE St,San Francisco,CA,94116,37.787386,-122.433476,"(37.787386, -122.433476)",14155432722.0,59009_20160926,9/26/2016 0:00,92.0,Routine - Unscheduled,59009_20160926_103131,Moderate risk vermin infestation,Moderate Risk,20160926,103131,2016-09-26,0,2,0,0,0,2,1
742,742,2234,90874,Ladle & Leaf,55 2nd St.,San Francisco,CA,94105,,,,,90874_20171117,11/17/2017 0:00,,Reinspection/Followup,90874_20171117_103150,Improper or defective plumbing,Low Risk,20171117,103150,2017-11-17,0,4,0,0,0,0,0
743,743,2236,77642,Royal Bakery,4773 Mission St,San Francisco,CA,94112,,,,14155337756.0,77642_20160630,6/30/2016 0:00,88.0,Routine - Unscheduled,77642_20160630_103144,Unapproved or unmaintained equipment or utensils,Low Risk,20160630,103144,2016-06-30,0,0,0,0,5,5,0
744,744,2239,77781,Grubbin',1404 Taraval St,San Francisco,CA,94116,,,,14155216029.0,77781_20160512,5/12/2016 0:00,96.0,Routine - Unscheduled,77781_20160512_103119,Inadequate and inaccessible handwashing facilities,Moderate Risk,20160512,103119,2016-05-12,0,0,0,0,1,1,0
745,745,2243,1243,JAVA SUPREME,0703 GUERRERO St,San Francisco,CA,94110,37.759934,-122.423553,"(37.759934, -122.423553)",14155201832.0,1243_20150728,7/28/2015 0:00,91.0,Routine - Unscheduled,1243_20150728_103154,Unclean or degraded floors walls or ceilings,Low Risk,20150728,103154,2015-07-28,0,3,0,0,0,3,2
746,746,2246,1626,LUPA TRATTORIA,4109 24th St,San Francisco,CA,94114,37.751243,-122.434529,"(37.751243, -122.434529)",14155644664.0,1626_20150706,7/6/2015 0:00,94.0,Routine - Unscheduled,1626_20150706_103139,Improper food storage,Low Risk,20150706,103139,2015-07-06,0,0,0,0,3,0,2
747,747,2248,68196,Happy Yogurt,503 33rd Ave,San Francisco,CA,94121,37.779613,-122.493349,"(37.779613, -122.493349)",,68196_20180228,2/28/2018 0:00,96.0,Routine - Unscheduled,68196_20180228_103119,Inadequate and inaccessible handwashing facilities,Moderate Risk,20180228,103119,2018-02-28,1,0,0,0,0,0,0
748,748,2251,83602,George and Lennie,277 Golden Gate Ave #114,San Francisco,CA,94102,,,,,83602_20160630,6/30/2016 0:00,94.0,Routine - Unscheduled,83602_20160630_103144,Unapproved or unmaintained equipment or utensils,Low Risk,20160630,103144,2016-06-30,0,0,0,0,0,2,0
749,749,2257,13226,CALIFORNIA WINE MERCHANT,2113 CHESTNUT ST,San Francisco,CA,94123,37.800534000000006,-122.438217,"(37.800534, -122.438217)",,13226_20160415,4/15/2016 0:00,98.0,Routine - Unscheduled,13226_20160415_103145,Improper storage of equipment utensils or linens,Low Risk,20160415,103145,2016-04-15,0,1,0,0,0,1,0
750,750,2261,77750,Pollo,2823 Mission St,San Francisco,CA,94110,,,,14159729942.0,77750_20171212,12/12/2017 0:00,98.0,Routine - Unscheduled,77750_20171212_103142,Unclean nonfood contact surfaces,Low Risk,20171212,103142,2017-12-12,0,1,0,0,1,0,1
751,751,2262,74336,AT&T PARK - BABY BULL (P 10),24 Willie Mays Plaza,San Francisco,CA,94107,,,,,74336_20160814,8/14/2016 0:00,96.0,Routine - Unscheduled,74336_20160814_103133,Foods not protected from contamination,Moderate Risk,20160814,103133,2016-08-14,0,0,0,0,0,1,0
752,752,2264,76441,El Nuevo Porvenir,2950 21st St,San Francisco,CA,94110,,,,,76441_20160119,1/19/2016 0:00,86.0,Routine - Unscheduled,76441_20160119_103119,Inadequate and inaccessible handwashing facilities,Moderate Risk,20160119,103119,2016-01-19,0,4,0,0,4,8,5
753,753,2266,5310,"Alioto Fish Co., Ltd",360A Jefferson St,San Francisco,CA,94133,37.80792,-122.418577,"(37.80792, -122.418577)",,5310_20160603,6/3/2016 0:00,,Reinspection/Followup,5310_20160603_103129,Insufficient hot water or running water,Moderate Risk,20160603,103129,2016-06-03,0,2,0,0,0,2,0
754,754,2269,3338,La Folie,2316 Polk St,San Francisco,CA,94109,37.798097999999996,-122.422156,"(37.798098, -122.422156)",,3338_20180223,2/23/2018 0:00,92.0,Routine - Unscheduled,3338_20180223_103127,Noncompliance with HAACP plan or variance,Moderate Risk,20180223,103127,2018-02-23,3,0,0,0,0,3,0
755,755,2274,69906,The Chairman,177 Eddy St,San Francisco,CA,94102,,,,,69906_20160629,6/29/2016 0:00,90.0,Routine - Unscheduled,69906_20160629_103139,Improper food storage,Low Risk,20160629,103139,2016-06-29,0,0,0,0,4,5,0
756,756,2276,557,KATIA'S,600 05th Ave,San Francisco,CA,94118,37.77721,-122.462874,"(37.77721, -122.462874)",14155669292.0,557_20160629,6/29/2016 0:00,85.0,Routine - Unscheduled,557_20160629_103136,Unsanitary employee garments hair or nails,Low Risk,20160629,103136,2016-06-29,0,5,0,0,0,5,3
757,757,2279,81461,Mescolanza Restaurant,3750 Geary Blvd,San Francisco,CA,94118,,,,14155662221.0,81461_20160629,6/29/2016 0:00,90.0,Routine - Unscheduled,81461_20160629_103161,Low risk vermin infestation,Low Risk,20160629,103161,2016-06-29,0,0,0,0,2,4,0
758,758,2283,436,North Beach Restaurant,1512 Stockton St,San Francisco,CA,94133,37.799646,-122.40893899999999,"(37.799646, -122.408939)",,436_20160608,6/8/2016 0:00,79.0,Routine - Unscheduled,436_20160608_103139,Improper food storage,Low Risk,20160608,103139,2016-06-08,0,0,0,0,3,5,0
759,759,2302,85857,Dabba,Off the Grid,San Francisco,CA,zzzzz,,,,14155697876.0,85857_20160930,9/30/2016 0:00,94.0,Routine - Unscheduled,85857_20160930_103122,Reservice of previously served foods,Moderate Risk,20160930,103122,2016-09-30,0,0,0,0,5,2,0
760,760,2303,2580,CAFE MARS,798 BRANNAN St,San Francisco,CA,94103,37.773174,-122.40311000000001,"(37.773174, -122.40311)",,2580_20150622,6/22/2015 0:00,84.0,Routine - Unscheduled,2580_20150622_103150,Improper or defective plumbing,Low Risk,20150622,103150,2015-06-22,0,0,3,0,0,0,5
761,761,2305,75892,Mateo's Bay Area Hot Dogs,Treasure Island,San Francisco,CA,94103,,,,,75892_20160629,6/29/2016 0:00,87.0,Routine - Unscheduled,75892_20160629_103156,Permit license or inspection report not posted,Low Risk,20160629,103156,2016-06-29,4,0,0,0,2,4,2
762,762,2306,61789,Coffee Mine,79 09th St,San Francisco,CA,94103,37.774722,-122.40676100000002,"(37.774722, -122.406761)",14155259795.0,61789_20160405,4/5/2016 0:00,88.0,Routine - Unscheduled,61789_20160405_103120,Moderate risk food holding temperature,Moderate Risk,20160405,103120,2016-04-05,0,0,0,0,3,4,0
763,763,2310,60984,W San Francisco Hotel,181 03rd St,San Francisco,CA,94103,37.785207,-122.40062900000001,"(37.785207, -122.400629)",,60984_20171113,11/13/2017 0:00,90.0,Routine - Unscheduled,60984_20171113_103120,Moderate risk food holding temperature,Moderate Risk,20171113,103120,2017-11-13,0,3,0,0,0,3,3
764,764,2314,78727,Submarine Center,820 Ulloa St,San Francisco,CA,94127,,,,14155561455.0,78727_20160629,6/29/2016 0:00,88.0,Routine - Unscheduled,78727_20160629_103149,Wiping cloths not clean or properly stored or inadequate sanitizer,Low Risk,20160629,103149,2016-06-29,0,1,0,0,0,4,0
765,765,2319,77054,Henry's Hunan North Restaurant,1398 Grant Ave,San Francisco,CA,94133,,,,,77054_20160608,6/8/2016 0:00,87.0,Routine - Unscheduled,77054_20160608_103109,Unclean or unsanitary food contact surfaces,High Risk,20160608,103109,2016-06-08,2,0,0,0,0,4,0
766,766,2321,69122,Hiyaaa!,Off The Grid,San Francisco,CA,94102,0.0,0.0,"(0, 0)",,69122_20160119,1/19/2016 0:00,,Structural Inspection,69122_20160119_103148,No thermometers or uncalibrated thermometers,Low Risk,20160119,103148,2016-01-19,0,0,0,1,0,1,2
767,767,2322,79961,Taqueria El Farolito #10,358 Beach St,San Francisco,CA,94133,,,,,79961_20160216,2/16/2016 0:00,74.0,Routine - Unscheduled,79961_20160216_103103,High risk food holding temperature,High Risk,20160216,103103,2016-02-16,8,0,5,0,5,4,5
768,768,2325,7534,RUSSELL'S CONVENIENCE #605,333 MARKET St,San Francisco,CA,94105,37.792037,-122.397852,"(37.792037, -122.397852)",,7534_20171207,12/7/2017 0:00,96.0,Routine - Unscheduled,7534_20171207_103152,Unclean unmaintained or improperly constructed toilet facilities,Low Risk,20171207,103152,2017-12-07,0,2,0,0,3,0,0
769,769,2326,1741,Osha Thai Noodle Cafe,696 Geary St,San Francisco,CA,94102,37.786598,-122.41458300000001,"(37.786598, -122.414583)",,1741_20160520,5/20/2016 0:00,92.0,Routine - Unscheduled,1741_20160520_103161,Low risk vermin infestation,Low Risk,20160520,103161,2016-05-20,0,0,0,4,0,3,0
770,770,2330,5812,Zaida T. Rodriguez (ZTR) Annex Child Development Center,421  BARTLETT St,San Francisco,CA,94110,37.750243,-122.419293,"(37.750243, -122.419293)",14155695844.0,5812_20180223,2/23/2018 0:00,98.0,Routine - Unscheduled,5812_20180223_103161,Low risk vermin infestation,Low Risk,20180223,103161,2018-02-23,1,0,0,0,0,1,0
771,771,2333,76735,Over the Moon,2144 Chestnut St,San Francisco,CA,94123,,,,,76735_20160608,6/8/2016 0:00,85.0,Routine - Unscheduled,76735_20160608_103124,Inadequately cleaned or sanitized food contact surfaces,Moderate Risk,20160608,103124,2016-06-08,0,4,0,0,0,4,0
772,772,2347,2326,IRMA'S PAMPANGA RESTAURANT,2901 16th St,San Francisco,CA,94103,37.765122999999996,-122.417919,"(37.765123, -122.417919)",14155626688.0,2326_20160304,3/4/2016 0:00,72.0,Routine - Unscheduled,2326_20160304_103131,Moderate risk vermin infestation,Moderate Risk,20160304,103131,2016-03-04,0,0,0,0,2,0,6
773,773,2357,3510,City View Restaurant,662 Commercial St,San Francisco,CA,94111,37.794127,-122.404074,"(37.794127, -122.404074)",,3510_20161109,11/9/2016 0:00,68.0,Routine - Unscheduled,3510_20161109_103133,Foods not protected from contamination,Moderate Risk,20161109,103133,2016-11-09,0,0,0,0,8,0,5
774,774,2361,943,EL CASTILLITO TAQUERIA INC.,136 CHURCH St,San Francisco,CA,94114,37.768776,-122.42909499999999,"(37.768776, -122.429095)",14155623428.0,943_20150720,7/20/2015 0:00,,Complaint,943_20150720_103107,Improper reheating of food,High Risk,20150720,103107,2015-07-20,0,0,0,0,3,0,4
775,775,2364,90896,Mae Krua LLC,331 Cortland St,San Francisco,CA,94110,,,,,90896_20180223,2/23/2018 0:00,96.0,Routine - Unscheduled,90896_20180223_103134,Other moderate risk violation,Moderate Risk,20180223,103134,2018-02-23,1,0,1,0,0,0,0
776,776,2371,85256,Buffalo Theory,1735 Polk St,San Francisco,CA,94109,,,,,85256_20180226,2/26/2018 0:00,85.0,Routine - Unscheduled,85256_20180226_103124,Inadequately cleaned or sanitized food contact surfaces,Moderate Risk,20180226,103124,2018-02-26,3,0,0,0,5,0,0
777,777,2373,86490,3Geeks,Off The Grid,San Francisco,CA,94102,,,,,86490_20160319,3/19/2016 0:00,90.0,Routine - Unscheduled,86490_20160319_103145,Improper storage of equipment utensils or linens,Low Risk,20160319,103145,2016-03-19,0,3,0,0,0,0,3
778,778,2377,34387,Lombard Union 76,2498 LOMBARD St,San Francisco,CA,94123,37.799078,-122.442374,"(37.799078, -122.442374)",,34387_20160414,4/14/2016 0:00,96.0,Routine - Unscheduled,34387_20160414_103142,Unclean nonfood contact surfaces,Low Risk,20160414,103142,2016-04-14,3,0,0,0,0,2,0
779,779,2379,2135,HOWARD STREET COFFEE ROASTERY CAFE,180 HOWARD St,San Francisco,CA,94105,37.790863,-122.39315900000001,"(37.790863, -122.393159)",,2135_20180222,2/22/2018 0:00,90.0,Routine - Unscheduled,2135_20180222_103149,Wiping cloths not clean or properly stored or inadequate sanitizer,Low Risk,20180222,103149,2018-02-22,3,0,0,0,5,0,0
780,780,2385,1778,Academy Bar & Kitchen,1800 Fillmore St,San Francisco,CA,94115,37.786497999999995,-122.430283,"(37.786498, -122.430283)",14155771800.0,1778_20171213,12/13/2017 0:00,94.0,Routine - Unscheduled,1778_20171213_103144,Unapproved or unmaintained equipment or utensils,Low Risk,20171213,103144,2017-12-13,0,2,0,0,0,2,0
781,781,2386,10990,Tak Kee Lee Restaurant,2435 Noriega St,San Francisco,CA,94122,37.753623,-122.489929,"(37.753623, -122.489929)",,10990_20161114,11/14/2016 0:00,84.0,Routine - Unscheduled,10990_20161114_103131,Moderate risk vermin infestation,Moderate Risk,20161114,103131,2016-11-14,0,4,0,0,5,5,0
782,782,2392,83779,Can Tho Coffee Shop,411 Ellis St,San Francisco,CA,94102,,,,,83779_20160815,8/15/2016 0:00,92.0,Routine - Unscheduled,83779_20160815_103156,Permit license or inspection report not posted,Low Risk,20160815,103156,2016-08-15,0,0,3,0,0,3,4
783,783,2393,77559,Union Larder,1945 Hyde St,San Francisco,CA,94109,,,,,77559_20180223,2/23/2018 0:00,90.0,Routine - Unscheduled,77559_20180223_103150,Improper or defective plumbing,Low Risk,20180223,103150,2018-02-23,3,0,0,0,0,0,1
784,784,2395,68763,Kichi Grill,835 Market St FE#9,San Francisco,CA,94103,37.785014000000004,-122.40664,"(37.785014, -122.40664)",,68763_20171211,12/11/2017 0:00,88.0,Routine - Unscheduled,68763_20171211_103124,Inadequately cleaned or sanitized food contact surfaces,Moderate Risk,20171211,103124,2017-12-11,0,4,0,0,0,2,4
785,785,2397,70921,Hotel Rex - Library Bar,562 Sutter St,San Francisco,CA,94102,37.789108,-122.409724,"(37.789108, -122.409724)",,70921_20171211,12/11/2017 0:00,98.0,Routine - Unscheduled,70921_20171211_103154,Unclean or degraded floors walls or ceilings,Low Risk,20171211,103154,2017-12-11,0,1,0,0,1,0,2
786,786,2401,187,TAZA WRAPS & JUICE,"750 FONT, BLDG B Blvd",San Francisco,CA,94132,37.723054,-122.48361200000001,"(37.723054, -122.483612)",14155374525.0,187_20160511,5/11/2016 0:00,89.0,Routine - Unscheduled,187_20160511_103107,Improper reheating of food,High Risk,20160511,103107,2016-05-11,0,1,0,0,2,2,0
787,787,2402,83439,SF Marriott Union Square (Banquet Kitchen),480 Sutter St Mezzanine,San Francisco,CA,94108,,,,,83439_20160628,6/28/2016 0:00,98.0,Routine - Unscheduled,83439_20160628_103139,Improper food storage,Low Risk,20160628,103139,2016-06-28,2,0,0,0,0,1,0
788,788,2404,3016,"R & G Executive Lounge, Inc",631 Kearny St,San Francisco,CA,94108,37.794154,-122.404765,"(37.794154, -122.404765)",,3016_20171213,12/13/2017 0:00,79.0,Routine - Unscheduled,3016_20171213_103142,Unclean nonfood contact surfaces,Low Risk,20171213,103142,2017-12-13,0,6,0,4,7,8,0
789,789,2407,65267,Calif Pacific Medical Ctr -  Kitchen,3700 CALIFORNIA St,San Francisco,CA,94118,37.786145,-122.455913,"(37.786145, -122.455913)",,65267_20161206,12/6/2016 0:00,92.0,Routine - Unscheduled,65267_20161206_103129,Insufficient hot water or running water,Moderate Risk,20161206,103129,2016-12-06,0,0,0,0,2,0,2
790,790,2410,2189,PRINCESS BAKERY,4617 MISSION St,San Francisco,CA,94112,37.724422,-122.43498500000001,"(37.724422, -122.434985)",,2189_20160816,8/16/2016 0:00,79.0,Routine - Unscheduled,2189_20160816_103124,Inadequately cleaned or sanitized food contact surfaces,Moderate Risk,20160816,103124,2016-08-16,0,0,6,0,0,6,6
791,791,2416,82429,Blue Bottle Coffee,1355 Market St,San Francisco,CA,94103,,,,,82429_20160929,9/29/2016 0:00,96.0,Routine - Unscheduled,82429_20160929_103124,Inadequately cleaned or sanitized food contact surfaces,Moderate Risk,20160929,103124,2016-09-29,0,1,0,0,0,1,1
792,792,2418,78113,Urban Putt,1096 South Van Ness Ave,San Francisco,CA,94110,,,,14155341080.0,78113_20160628,6/28/2016 0:00,90.0,Routine - Unscheduled,78113_20160628_103154,Unclean or degraded floors walls or ceilings,Low Risk,20160628,103154,2016-06-28,0,0,2,0,0,3,0
793,793,2424,88932,Chase Luck Bakery,1325 Ocean Ave,San Francisco,CA,94112,,,,14155982063.0,88932_20170105,1/5/2017 0:00,,Reinspection/Followup,88932_20170105_103103,High risk food holding temperature,High Risk,20170105,103103,2017-01-05,0,0,0,0,2,0,0
794,794,2425,37319,Velo Rouge Cafe,798 Arguello Blvd,San Francisco,CA,94118,37.77538300000001,-122.45841499999999,"(37.775383, -122.458415)",,37319_20160412,4/12/2016 0:00,98.0,Routine - Unscheduled,37319_20160412_103139,Improper food storage,Low Risk,20160412,103139,2016-04-12,0,1,0,0,0,1,1
795,795,2431,2051,Cocotte,1521 Hyde St,San Francisco,CA,94109,37.794753,-122.41818400000001,"(37.794753, -122.418184)",,2051_20160323,3/23/2016 0:00,96.0,Routine - Unscheduled,2051_20160323_103124,Inadequately cleaned or sanitized food contact surfaces,Moderate Risk,20160323,103124,2016-03-23,4,0,0,0,2,0,1
796,796,2442,84668,F2 Founders LLC,400 Grove St,San Francisco,CA,94102,,,,,84668_20160412,4/12/2016 0:00,91.0,Routine - Unscheduled,84668_20160412_103103,High risk food holding temperature,High Risk,20160412,103103,2016-04-12,0,0,0,0,3,1,0
797,797,2448,68880,Soma Corp.,1082 FOLSOM St,San Francisco,CA,94103,,,,,68880_20151007,10/7/2015 0:00,73.0,Routine - Unscheduled,68880_20151007_103154,Unclean or degraded floors walls or ceilings,Low Risk,20151007,103154,2015-10-07,0,0,0,0,0,0,6
798,798,2453,4072,Hustler Club,1031 kearny St,San Francisco,CA,94133,37.797545,-122.405455,"(37.797545, -122.405455)",,4072_20160520,5/20/2016 0:00,88.0,Routine - Unscheduled,4072_20160520_103157,Food safety certificate or food handler card not available,Low Risk,20160520,103157,2016-05-20,0,0,2,0,0,4,0
799,799,2457,81187,City Pizza & Yucatan Food,294 Turk St,San Francisco,CA,94102,,,,14155933500.0,81187_20171212,12/12/2017 0:00,81.0,Routine - Unscheduled,81187_20171212_103105,Improper cooling methods,High Risk,20171212,103105,2017-12-12,0,5,0,8,0,6,0
800,800,2461,77681,Tart To Tart Inc.,641 Irving St,San Francisco,CA,94122,,,,14155507068.0,77681_20160609,6/9/2016 0:00,88.0,Routine - Unscheduled,77681_20160609_103144,Unapproved or unmaintained equipment or utensils,Low Risk,20160609,103144,2016-06-09,8,0,0,0,0,4,0
801,801,2465,5794,LINCOLN HIGH SCHOOL,2162 24th Ave,San Francisco,CA,94116,37.747228,-122.48129899999999,"(37.747228, -122.481299)",14155752700.0,5794_20160907,9/7/2016 0:00,96.0,Routine - Unscheduled,5794_20160907_103144,Unapproved or unmaintained equipment or utensils,Low Risk,20160907,103144,2016-09-07,0,0,0,0,0,2,1
802,802,2468,2555,EXTREME PIZZA,1980 UNION St,San Francisco,CA,94123,37.797578,-122.43188300000001,"(37.797578, -122.431883)",14155928234.0,2555_20160929,9/29/2016 0:00,96.0,Routine - Unscheduled,2555_20160929_103144,Unapproved or unmaintained equipment or utensils,Low Risk,20160929,103144,2016-09-29,0,3,0,0,2,2,3
803,803,2472,68353,Hops & Hominy,1 Tillman Pl,San Francisco,CA,94108,37.789277,-122.405324,"(37.789277, -122.405324)",,68353_20161003,10/3/2016 0:00,96.0,Routine - Unscheduled,68353_20161003_103131,Moderate risk vermin infestation,Moderate Risk,20161003,103131,2016-10-03,0,0,0,0,1,0,0
804,804,2474,226,Grumpy's American Pub,125 Vallejo St,San Francisco,CA,94111,37.799594,-122.400586,"(37.799594, -122.400586)",,226_20160523,5/23/2016 0:00,82.0,Routine - Unscheduled,226_20160523_103105,Improper cooling methods,High Risk,20160523,103105,2016-05-23,0,0,0,0,0,4,0
805,805,2476,62179,Pampanguena Cuisine,4441 Mission St,San Francisco,CA,94112,37.727111,-122.432926,"(37.727111, -122.432926)",14155588899.0,62179_20160629,6/29/2016 0:00,92.0,Routine - Unscheduled,62179_20160629_103133,Foods not protected from contamination,Moderate Risk,20160629,103133,2016-06-29,0,0,0,3,0,2,2
806,806,2478,65375,Geppetto LLC,658 Vallejo St,San Francisco,CA,94133,37.798648,-122.40855400000001,"(37.798648, -122.408554)",,65375_20160816,8/16/2016 0:00,91.0,Routine - Unscheduled,65375_20160816_103105,Improper cooling methods,High Risk,20160816,103105,2016-08-16,0,0,0,0,0,2,0
807,807,2483,86773,Fiddler's Green of SF,1333 Columbus Ave,San Francisco,CA,94133,,,,,86773_20171208,12/8/2017 0:00,86.0,Routine - Unscheduled,86773_20171208_103143,Inadequate warewashing facilities or equipment,Low Risk,20171208,103143,2017-12-08,0,6,0,0,5,0,0
808,808,2488,5509,AT&T - (CART 33) PRETZELS GRILL [145120],24  Pl,San Francisco,CA,94107,,,,14155971500.0,5509_20160410,4/10/2016 0:00,91.0,Routine - Unscheduled,5509_20160410_103108,Contaminated or adulterated food,High Risk,20160410,103108,2016-04-10,0,0,0,0,0,2,0
809,809,2489,4502,LA LOMA PRODUCE #7,2695 San Bruno Ave,San Francisco,CA,94134,37.727739,-122.40357900000001,"(37.727739, -122.403579)",,4502_20180223,2/23/2018 0:00,74.0,Routine - Unscheduled,4502_20180223_103114,High risk vermin infestation,High Risk,20180223,103114,2018-02-23,5,0,0,7,6,7,0
810,810,2497,84500,The Plant Cafe Organic,250 Montgomery St,San Francisco,CA,94104,,,,,84500_20161110,11/10/2016 0:00,87.0,Routine - Unscheduled,84500_20161110_103145,Improper storage of equipment utensils or linens,Low Risk,20161110,103145,2016-11-10,0,1,0,0,3,0,0
811,811,2502,80070,The Lab By Napaology,930 Bush St,San Francisco,CA,94109,,,,,80070_20161110,11/10/2016 0:00,87.0,Routine - Unscheduled,80070_20161110_103156,Permit license or inspection report not posted,Low Risk,20161110,103156,2016-11-10,0,0,0,0,3,0,2
812,812,2505,71803,Charles Chocolates,535 Florida St,San Francisco,CA,94110,,,,,71803_20180223,2/23/2018 0:00,98.0,Routine - Unscheduled,71803_20180223_103161,Low risk vermin infestation,Low Risk,20180223,103161,2018-02-23,1,0,0,0,2,0,1
813,813,2511,75888,The Mayflower,1422 Ocean Ave,San Francisco,CA,94112,,,,14155586061.0,75888_20160329,3/29/2016 0:00,90.0,Routine - Unscheduled,75888_20160329_103136,Unsanitary employee garments hair or nails,Low Risk,20160329,103136,2016-03-29,0,0,4,0,3,0,4
814,814,2513,75662,Golden Gate Market,2767 Lombard St,San Francisco,CA,94123,,,,,75662_20160511,5/11/2016 0:00,90.0,Routine - Unscheduled,75662_20160511_103131,Moderate risk vermin infestation,Moderate Risk,20160511,103131,2016-05-11,5,0,0,0,0,3,0
815,815,2518,65724,Le Meridien SF Main Kitchen/Employee Cafeteria,333 Battery St Level A & B,San Francisco,CA,94111,37.799005,-122.39986200000001,"(37.799005, -122.399862)",14155292904.0,65724_20161108,11/8/2016 0:00,96.0,Routine - Unscheduled,65724_20161108_103127,Noncompliance with HAACP plan or variance,Moderate Risk,20161108,103127,2016-11-08,0,0,0,0,1,0,0
816,816,2520,5808,BALBOA HIGH SCHOOL,1000 CAYUGA Ave,San Francisco,CA,94112,37.722066999999996,-122.43983,"(37.722067, -122.43983)",14155464090.0,5808_20160908,9/8/2016 0:00,98.0,Routine - Unscheduled,5808_20160908_103153,Inadequate dressing rooms or improper storage of personal items,Low Risk,20160908,103153,2016-09-08,0,0,1,0,0,1,2
817,817,2525,2589,Dojima-Ann,219 O'Farrell St,San Francisco,CA,94102,37.786363,-122.40835700000001,"(37.786363, -122.408357)",,2589_20160329,3/29/2016 0:00,92.0,Routine - Unscheduled,2589_20160329_103138,Improper storage use or identification of toxic substances,Low Risk,20160329,103138,2016-03-29,0,2,0,0,7,0,3
818,818,2528,74326,AT&T PARK - CLUB LEMONADE,24 Willie Mays Plaza,San Francisco,CA,94107,,,,,74326_20160410,4/10/2016 0:00,93.0,Routine - Unscheduled,74326_20160410_103109,Unclean or unsanitary food contact surfaces,High Risk,20160410,103109,2016-04-10,0,0,0,1,0,1,1
819,819,2531,33516,Julia Morgan Ballroom,465 California St 15th Floor,San Francisco,CA,94104,37.792921,-122.40229599999999,"(37.792921, -122.402296)",,33516_20160415,4/15/2016 0:00,89.0,Routine - Unscheduled,33516_20160415_103138,Improper storage use or identification of toxic substances,Low Risk,20160415,103138,2016-04-15,0,4,0,0,0,3,0
820,820,2533,1398,YUMMA'S MED GRILL,721 IRVING St,San Francisco,CA,94122,37.764053000000004,-122.46553899999999,"(37.764053, -122.465539)",,1398_20160609,6/9/2016 0:00,,Complaint,1398_20160609_103116,Inadequate food safety knowledge or lack of certified food safety manager,Moderate Risk,20160609,103116,2016-06-09,4,0,0,0,0,1,0
821,821,2543,2548,NOAH'S NEW YORK BAGELS #2120,3519 CALIFORNIA St,San Francisco,CA,94118,37.786564,-122.45188700000001,"(37.786564, -122.451887)",,2548_20150602,6/2/2015 0:00,90.0,Routine - Unscheduled,2548_20150602_103139,Improper food storage,Low Risk,20150602,103139,2015-06-02,0,4,0,0,0,0,4
822,822,2544,75350,Beyond the Border,428 11th St,San Francisco,CA,94103,,,,14150899069.0,75350_20150402,4/2/2015 0:00,96.0,Routine - Unscheduled,75350_20150402_103157,Food safety certificate or food handler card not available,Low Risk,20150402,103157,2015-04-02,0,0,3,0,0,0,2
823,823,2549,726,BEN WAH RESTAURANT,2786 CALIFORNIA St,San Francisco,CA,94115,37.788138000000004,-122.440174,"(37.788138, -122.440174)",,726_20160217,2/17/2016 0:00,75.0,Routine - Unscheduled,726_20160217_103109,Unclean or unsanitary food contact surfaces,High Risk,20160217,103109,2016-02-17,0,0,0,0,4,0,4
824,824,2554,83644,A Desi Cafe,1501 Noriega St,San Francisco,CA,94112,,,,14155759088.0,83644_20160608,6/8/2016 0:00,94.0,Routine - Unscheduled,83644_20160608_103139,Improper food storage,Low Risk,20160608,103139,2016-06-08,0,0,0,0,0,2,0
825,825,2556,63493,The Golden West,8 Trinity Pl,San Francisco,CA,94104,37.790053,-122.40258600000001,"(37.790053, -122.402586)",14155270896.0,63493_20151222,12/22/2015 0:00,83.0,Routine - Unscheduled,63493_20151222_103154,Unclean or degraded floors walls or ceilings,Low Risk,20151222,103154,2015-12-22,0,5,0,0,3,0,5
826,826,2559,38530,Portico IV,550 Market St,San Francisco,CA,94104,37.789804,-122.40077,"(37.789804, -122.40077)",14155399994.0,38530_20160512,5/12/2016 0:00,85.0,Routine - Unscheduled,38530_20160512_103154,Unclean or degraded floors walls or ceilings,Low Risk,20160512,103154,2016-05-12,0,6,0,0,0,4,0
827,827,2572,94544,D'maize Cafe,50 Phelan Ave,San Francisco,CA,94112,,,,,94544_20180223,2/23/2018 0:00,94.0,Routine - Unscheduled,94544_20180223_103120,Moderate risk food holding temperature,Moderate Risk,20180223,103120,2018-02-23,2,0,0,0,0,0,0
828,828,2583,82653,Starbucks Coffee #9211,1 Market St,San Francisco,CA,94105,,,,,82653_20170926,9/26/2017 0:00,96.0,Routine - Unscheduled,82653_20170926_103144,Unapproved or unmaintained equipment or utensils,Low Risk,20170926,103144,2017-09-26,0,0,2,0,0,0,0
829,829,2588,10540,Slanted Door Restaurant,1 Ferry Building #3,San Francisco,CA,94111,37.795225,-122.39376999999999,"(37.795225, -122.39377)",,10540_20150324,3/24/2015 0:00,,Reinspection/Followup,10540_20150324_103102,Unclean hands or improper use of gloves,High Risk,20150324,103102,2015-03-24,0,0,0,7,0,2,0
830,830,2590,72129,The Slider Shack #2,428 11th St,San Francisco,CA,94103,,,,,72129_20160328,3/28/2016 0:00,90.0,Routine - Unscheduled,72129_20160328_103150,Improper or defective plumbing,Low Risk,20160328,103150,2016-03-28,0,0,0,1,0,0,4
831,831,2595,239,Just Wonton,1241 Vicente St,San Francisco,CA,94116,37.739063,-122.48040900000001,"(37.739063, -122.480409)",,239_20171207,12/7/2017 0:00,88.0,Routine - Unscheduled,239_20171207_103154,Unclean or degraded floors walls or ceilings,Low Risk,20171207,103154,2017-12-07,0,4,0,0,0,4,0
832,832,2597,2987,The Penthouse Club & Steakhouse,412 Broadway St,San Francisco,CA,94133,37.798217,-122.404214,"(37.798217, -122.404214)",,2987_20160520,5/20/2016 0:00,89.0,Routine - Unscheduled,2987_20160520_103149,Wiping cloths not clean or properly stored or inadequate sanitizer,Low Risk,20160520,103149,2016-05-20,0,0,3,0,0,3,0
833,833,2598,79145,Chart House,Pier 39  Space 206-8,San Francisco,CA,94133,,,,14155432260.0,79145_20151019,10/19/2015 0:00,81.0,Routine - Unscheduled,79145_20151019_103133,Foods not protected from contamination,Moderate Risk,20151019,103133,2015-10-19,0,3,0,0,0,3,6
834,834,2600,85956,Waxman's,900 North Point St #B-201,San Francisco,CA,94109,,,,,85956_20160630,6/30/2016 0:00,89.0,Routine - Unscheduled,85956_20160630_103118,Employee eating or smoking,Moderate Risk,20160630,103118,2016-06-30,0,0,0,0,2,2,0
835,835,2601,510,Donut Time,2401 Noriega St,San Francisco,CA,94122,37.753633,-122.48953999999999,"(37.753633, -122.48954)",,510_20160523,5/23/2016 0:00,88.0,Routine - Unscheduled,510_20160523_103120,Moderate risk food holding temperature,Moderate Risk,20160523,103120,2016-05-23,0,0,4,0,3,4,0
836,836,2604,3953,Trattoria Pinocchio,401 Columbus Ave,San Francisco,CA,94133,37.799036,-122.408426,"(37.799036, -122.408426)",,3953_20160816,8/16/2016 0:00,79.0,Routine - Unscheduled,3953_20160816_103131,Moderate risk vermin infestation,Moderate Risk,20160816,103131,2016-08-16,0,0,0,0,0,5,5
837,837,2606,94412,Native Baking Company,1324 Fitzgerald Ave,San Francisco,CA,94124,,,,,94412_20180222,2/22/2018 0:00,,New Ownership,94412_20180222_103129,Insufficient hot water or running water,Moderate Risk,20180222,103129,2018-02-22,1,0,0,0,0,0,0
838,838,2610,86849,Lobsta Truck,Off The Grid,San Francisco,CA,94102,,,,,86849_20160528,5/28/2016 0:00,92.0,Routine - Unscheduled,86849_20160528_103153,Inadequate dressing rooms or improper storage of personal items,Low Risk,20160528,103153,2016-05-28,0,0,0,0,0,3,0
839,839,2623,69324,Las Brisas,3137 MISSION St,San Francisco,CA,94110,37.747173,-122.41880400000001,"(37.747173, -122.418804)",,69324_20150901,9/1/2015 0:00,87.0,Routine - Unscheduled,69324_20150901_103142,Unclean nonfood contact surfaces,Low Risk,20150901,103142,2015-09-01,3,0,2,4,4,3,3
840,840,2634,64524,Fresca Restaurant,737 IRVING St,San Francisco,CA,94122,37.76403300000001,-122.4659,"(37.764033, -122.4659)",14155745727.0,64524_20160630,6/30/2016 0:00,96.0,Routine - Unscheduled,64524_20160630_103145,Improper storage of equipment utensils or linens,Low Risk,20160630,103145,2016-06-30,0,0,0,0,0,2,0
841,841,2641,6432,CLAY THEATRE,2261 FILLMORE St,San Francisco,CA,94115,37.790494,-122.434174,"(37.790494, -122.434174)",,6432_20161205,12/5/2016 0:00,91.0,Routine - Unscheduled,6432_20161205_103154,Unclean or degraded floors walls or ceilings,Low Risk,20161205,103154,2016-12-05,0,0,0,0,2,0,2
842,842,2659,73998,Crown & Crumpet,1746 Post St,San Francisco,CA,94115,,,,,73998_20160407,4/7/2016 0:00,92.0,Routine - Unscheduled,73998_20160407_103124,Inadequately cleaned or sanitized food contact surfaces,Moderate Risk,20160407,103124,2016-04-07,0,0,0,0,0,2,0
843,843,2661,4531,AK SUBS,397 08th St,San Francisco,CA,94103,37.773884,-122.408631,"(37.773884, -122.408631)",14155249600.0,4531_20170724,7/24/2017 0:00,,Complaint,4531_20170724_103139,Improper food storage,Low Risk,20170724,103139,2017-07-24,0,0,4,0,0,0,5
844,844,2664,37651,Jack In The Box #545,400 Geary St,San Francisco,CA,94102,37.787168,-122.410124,"(37.787168, -122.410124)",14155670868.0,37651_20161114,11/14/2016 0:00,87.0,Routine - Unscheduled,37651_20161114_103144,Unapproved or unmaintained equipment or utensils,Low Risk,20161114,103144,2016-11-14,0,0,1,0,4,0,2
845,845,2666,80621,CA Academy of Science Terrace,55 Music Concourse Dr,San Francisco,CA,94118,,,,14152332403.0,80621_20160121,1/21/2016 0:00,91.0,Routine - Unscheduled,80621_20160121_103147,Inadequate ventilation or lighting,Low Risk,20160121,103147,2016-01-21,0,0,0,0,3,0,2
846,846,2671,71532,Xpresso Tea,6901 Geary Blvd,San Francisco,CA,94121,37.779663,-122.493618,"(37.779663, -122.493618)",14155277367.0,71532_20160330,3/30/2016 0:00,96.0,Routine - Unscheduled,71532_20160330_103154,Unclean or degraded floors walls or ceilings,Low Risk,20160330,103154,2016-03-30,3,0,0,0,0,0,2
847,847,2672,59935,Zantes Pizza,3489 MISSION St,San Francisco,CA,94110,37.741184000000004,-122.422693,"(37.741184, -122.422693)",,59935_20160330,3/30/2016 0:00,96.0,Routine - Unscheduled,59935_20160330_103144,Unapproved or unmaintained equipment or utensils,Low Risk,20160330,103144,2016-03-30,0,3,0,2,0,0,2
848,848,2673,39176,Crave,2164 Polk St,San Francisco,CA,94109,37.796748,-122.421897,"(37.796748, -122.421897)",,39176_20160407,4/7/2016 0:00,79.0,Routine - Unscheduled,39176_20160407_103102,Unclean hands or improper use of gloves,High Risk,20160407,103102,2016-04-07,0,6,0,0,0,5,0
849,849,2675,3155,The Royal Exchange Restaurant Co.,301 Sacramento St,San Francisco,CA,94111,37.794274,-122.39923700000001,"(37.794274, -122.399237)",,3155_20160408,4/8/2016 0:00,83.0,Routine - Unscheduled,3155_20160408_103139,Improper food storage,Low Risk,20160408,103139,2016-04-08,0,2,0,0,0,5,0
850,850,2679,60380,Whole Foods Market,3950 24TH St,San Francisco,CA,94114,37.751517,-122.430842,"(37.751517, -122.430842)",,60380_20160126,1/26/2016 0:00,,Complaint,60380_20160126_103149,Wiping cloths not clean or properly stored or inadequate sanitizer,Low Risk,20160126,103149,2016-01-26,0,0,2,0,0,3,3
851,851,2681,5796,APTOS MIDDLE SCHOOL,105 APTOS Ave,San Francisco,CA,94127,37.730198,-122.46623799999999,"(37.730198, -122.466238)",,5796_20160414,4/14/2016 0:00,98.0,Routine - Unscheduled,5796_20160414_103139,Improper food storage,Low Risk,20160414,103139,2016-04-14,3,0,1,0,4,1,1
852,852,2689,38330,Carlin's Corner,298 Valencia St,San Francisco,CA,94103,37.768168,-122.42225,"(37.768168, -122.42225)",,38330_20160217,2/17/2016 0:00,88.0,Routine - Unscheduled,38330_20160217_103119,Inadequate and inaccessible handwashing facilities,Moderate Risk,20160217,103119,2016-02-17,0,2,0,0,3,0,3
853,853,2691,79805,Temo Cafe,3000 24th St,San Francisco,CA,94110,,,,,79805_20160328,3/28/2016 0:00,94.0,Routine - Unscheduled,79805_20160328_103120,Moderate risk food holding temperature,Moderate Risk,20160328,103120,2016-03-28,3,0,2,0,2,2,2
854,854,2699,24936,San Francisco Soup Company,315 California St,San Francisco,CA,94104,37.793199,-122.400152,"(37.793199, -122.400152)",,24936_20160609,6/9/2016 0:00,77.0,Routine - Unscheduled,24936_20160609_103124,Inadequately cleaned or sanitized food contact surfaces,Moderate Risk,20160609,103124,2016-06-09,0,3,0,0,0,6,0
855,855,2710,83352,Edible Arrangements,515 Bay St,San Francisco,CA,94133,,,,,83352_20160218,2/18/2016 0:00,94.0,Routine - Unscheduled,83352_20160218_103129,Insufficient hot water or running water,Moderate Risk,20160218,103129,2016-02-18,1,0,0,0,0,1,2
856,856,2712,62739,Tortas Los Picudos,2969 24th St,San Francisco,CA,94110,37.752653,-122.411359,"(37.752653, -122.411359)",,62739_20160119,1/19/2016 0:00,89.0,Routine - Unscheduled,62739_20160119_103144,Unapproved or unmaintained equipment or utensils,Low Risk,20160119,103144,2016-01-19,1,0,4,0,2,3,3
857,857,2720,81976,Little Beijing Restaurant,1316 Noriega St,San Francisco,CA,94122,,,,14155710365.0,81976_20150601,6/1/2015 0:00,82.0,Routine - Unscheduled,81976_20150601_103133,Foods not protected from contamination,Moderate Risk,20150601,103133,2015-06-01,7,0,0,0,0,4,6
858,858,2729,92283,SINI,322 Kearny St,San Francisco,CA,94108,,,,,92283_20171204,12/4/2017 0:00,88.0,Routine - Unscheduled,92283_20171204_103139,Improper food storage,Low Risk,20171204,103139,2017-12-04,0,4,0,0,0,0,0
859,859,2731,799,Courtyard by Marriott at Fisherman's Wharf,580 Beach St,San Francisco,CA,94133,37.806964,-122.41861999999999,"(37.806964, -122.41862)",,799_20160608,6/8/2016 0:00,92.0,Routine - Unscheduled,799_20160608_103139,Improper food storage,Low Risk,20160608,103139,2016-06-08,0,0,1,0,0,3,0
860,860,2732,2039,VIA VENETO,2244 FILLMORE St,San Francisco,CA,94115,37.790437,-122.434097,"(37.790437, -122.434097)",,2039_20160809,8/9/2016 0:00,85.0,Routine - Unscheduled,2039_20160809_103131,Moderate risk vermin infestation,Moderate Risk,20160809,103131,2016-08-09,0,0,0,2,0,4,0
861,861,2747,65725,Le Meridien SF Park Grill Restaurant & Bar,333 Battery St Level 2 & 3,San Francisco,CA,94111,37.799005,-122.39986200000001,"(37.799005, -122.399862)",14155292904.0,65725_20161108,11/8/2016 0:00,92.0,Routine - Unscheduled,65725_20161108_103154,Unclean or degraded floors walls or ceilings,Low Risk,20161108,103154,2016-11-08,0,0,0,0,3,0,0
862,862,2752,2808,NEW EMMY'S RESTAURANT,1923 OCEAN Ave,San Francisco,CA,94127,37.725404,-122.462776,"(37.725404, -122.462776)",14155728615.0,2808_20160520,5/20/2016 0:00,,Reinspection/Followup,2808_20160520_103151,Inadequate or unsanitary refuse containers or area or no garbage service,Low Risk,20160520,103151,2016-05-20,0,0,0,4,0,1,5
863,863,2753,66896,Lite Bite,1796 Union St,San Francisco,CA,94123,37.797978,-122.428754,"(37.797978, -122.428754)",,66896_20160408,4/8/2016 0:00,96.0,Routine - Unscheduled,66896_20160408_103139,Improper food storage,Low Risk,20160408,103139,2016-04-08,0,1,0,2,0,2,0
864,864,2770,3693,NEW HING LUNG RESTAURANT,1556 NORIEGA St,San Francisco,CA,94122,37.754123,-122.48031,"(37.754123, -122.48031)",,3693_20160816,8/16/2016 0:00,76.0,Routine - Unscheduled,3693_20160816_103103,High risk food holding temperature,High Risk,20160816,103103,2016-08-16,0,0,0,0,0,5,8
865,865,2774,67862,The Social Study,1795 Geary Blvd,San Francisco,CA,94115,,,,,67862_20180227,2/27/2018 0:00,94.0,Routine - Unscheduled,67862_20180227_103144,Unapproved or unmaintained equipment or utensils,Low Risk,20180227,103144,2018-02-27,2,0,0,0,2,0,7
866,866,2775,792,Boudin Bakery,Pier 39  Front,San Francisco,CA,94133,37.791924,-122.39858799999999,"(37.791924, -122.398588)",,792_20160414,4/14/2016 0:00,94.0,Routine - Unscheduled,792_20160414_103120,Moderate risk food holding temperature,Moderate Risk,20160414,103120,2016-04-14,2,0,1,0,3,2,0
867,867,2780,29950,Mrs. Fields Cookies,Pier 39  B-06,San Francisco,CA,94133,37.802479,-122.41123400000001,"(37.802479, -122.411234)",,29950_20170928,9/28/2017 0:00,98.0,Routine - Unscheduled,29950_20170928_103145,Improper storage of equipment utensils or linens,Low Risk,20170928,103145,2017-09-28,0,0,1,0,2,5,2
868,868,2782,1532,Neiman Marcus On The Square,"150 Stockton St, Ground Floor",San Francisco,CA,94108,37.791585999999995,-122.408452,"(37.791586, -122.408452)",,1532_20150323,3/23/2015 0:00,94.0,Routine - Unscheduled,1532_20150323_103139,Improper food storage,Low Risk,20150323,103139,2015-03-23,0,0,0,1,0,2,0
869,869,2785,2384,TWO JACKS SEAFOOD,401 HAIGHT St,San Francisco,CA,94117,37.772273999999996,-122.428997,"(37.772274, -122.428997)",14155436290.0,2384_20160323,3/23/2016 0:00,91.0,Routine - Unscheduled,2384_20160323_103103,High risk food holding temperature,High Risk,20160323,103103,2016-03-23,6,0,0,0,0,0,2
870,870,2786,82996,Loews Regency San Francisco (Main Kitchen),222 Sansome St 2nd Floor,San Francisco,CA,94104,,,,,82996_20170928,9/28/2017 0:00,92.0,Routine - Unscheduled,82996_20170928_103127,Noncompliance with HAACP plan or variance,Moderate Risk,20170928,103127,2017-09-28,0,0,2,0,0,6,0
871,871,2788,6000,Mission Neighborhood Centers,362 Capp St,San Francisco,CA,94110,37.761007,-122.41821499999999,"(37.761007, -122.418215)",14155207747.0,6000_20160324,3/24/2016 0:00,92.0,Routine - Unscheduled,6000_20160324_103116,Inadequate food safety knowledge or lack of certified food safety manager,Moderate Risk,20160324,103116,2016-03-24,2,0,2,0,0,0,2
872,872,2793,68331,Blackwood Thai Cuisine,2150 CHESTNUT St,San Francisco,CA,94123,37.800508,-122.438824,"(37.800508, -122.438824)",,68331_20160608,6/8/2016 0:00,88.0,Routine - Unscheduled,68331_20160608_103145,Improper storage of equipment utensils or linens,Low Risk,20160608,103145,2016-06-08,0,4,0,0,0,4,0
873,873,2796,78747,Palm House,2032 Union St,San Francisco,CA,94133,,,,,78747_20160217,2/17/2016 0:00,90.0,Routine - Unscheduled,78747_20160217_103124,Inadequately cleaned or sanitized food contact surfaces,Moderate Risk,20160217,103124,2016-02-17,0,3,0,4,0,0,4
874,874,2800,15535,Boudin Bakery & Cafe,160 Jefferson St 1st Floor,San Francisco,CA,94133,37.808352,-122.41515700000001,"(37.808352, -122.415157)",,15535_20171211,12/11/2017 0:00,92.0,Routine - Unscheduled,15535_20171211_103154,Unclean or degraded floors walls or ceilings,Low Risk,20171211,103154,2017-12-11,0,3,0,0,1,2,0
875,875,2808,3048,Crustacean,1475 Polk St,San Francisco,CA,94109,37.790324,-122.42066399999999,"(37.790324, -122.420664)",,3048_20161018,10/18/2016 0:00,76.0,Routine - Unscheduled,3048_20161018_103154,Unclean or degraded floors walls or ceilings,Low Risk,20161018,103154,2016-10-18,0,5,0,0,5,1,0
876,876,2853,26343,Bien Hoa,463 Ellis St,San Francisco,CA,94102,37.784734,-122.413776,"(37.784734, -122.413776)",,26343_20160815,8/15/2016 0:00,94.0,Routine - Unscheduled,26343_20160815_103154,Unclean or degraded floors walls or ceilings,Low Risk,20160815,103154,2016-08-15,0,2,0,0,0,2,1
877,877,2855,84587,Lady Saigon,Off The Grid,San Francisco,CA,94102,,,,,84587_20160422,4/22/2016 0:00,83.0,Routine - Unscheduled,84587_20160422_103139,Improper food storage,Low Risk,20160422,103139,2016-04-22,0,0,5,0,5,4,0
878,878,2859,7207,GOLDEN PRODUCE,172 CHURCH St,San Francisco,CA,94114,37.768187,-122.429024,"(37.768187, -122.429024)",14155431536.0,7207_20170105,1/5/2017 0:00,92.0,Routine - Unscheduled,7207_20170105_103131,Moderate risk vermin infestation,Moderate Risk,20170105,103131,2017-01-05,0,0,0,0,3,2,5
879,879,2860,323,WAYO,1407 VAN NESS Ave,San Francisco,CA,94109,37.788609,-122.42213000000001,"(37.788609, -122.42213)",14155478369.0,323_20161108,11/8/2016 0:00,94.0,Routine - Unscheduled,323_20161108_103120,Moderate risk food holding temperature,Moderate Risk,20161108,103120,2016-11-08,0,0,0,0,2,0,0
880,880,2865,83196,TJ Cups Inc,2437 Noriega St,San Francisco,CA,94122,,,,14155682877.0,83196_20161110,11/10/2016 0:00,93.0,Routine - Unscheduled,83196_20161110_103102,Unclean hands or improper use of gloves,High Risk,20161110,103102,2016-11-10,0,1,0,0,1,1,0
881,881,2876,3621,JIM'S RESTAURANT,2420 MISSION St,San Francisco,CA,94110,37.758271,-122.419081,"(37.758271, -122.419081)",14155286020.0,3621_20160908,9/8/2016 0:00,92.0,Routine - Unscheduled,3621_20160908_103154,Unclean or degraded floors walls or ceilings,Low Risk,20160908,103154,2016-09-08,0,0,4,0,0,3,3
882,882,2880,85899,Kabab King,1109 Fillmore St,San Francisco,CA,94115,,,,14155671301.0,85899_20161107,11/7/2016 0:00,72.0,Routine - Unscheduled,85899_20161107_103119,Inadequate and inaccessible handwashing facilities,Moderate Risk,20161107,103119,2016-11-07,0,0,0,0,6,0,4
883,883,2889,59949,Aicha,1303 Polk St,San Francisco,CA,94109,37.788964,-122.42038400000001,"(37.788964, -122.420384)",,59949_20161021,10/21/2016 0:00,85.0,Routine - Unscheduled,59949_20161021_103114,High risk vermin infestation,High Risk,20161021,103114,2016-10-21,0,2,0,0,3,2,0
884,884,2893,544,THAI TIME RESTAURANT,315 08th Ave,San Francisco,CA,94118,37.78253400000001,-122.46661499999999,"(37.782534, -122.466615)",14155387992.0,544_20160608,6/8/2016 0:00,78.0,Routine - Unscheduled,544_20160608_103131,Moderate risk vermin infestation,Moderate Risk,20160608,103131,2016-06-08,0,0,6,0,0,4,0
885,885,2899,74975,Mourad,140 New Montgomery St,San Francisco,CA,94105,,,,,74975_20171207,12/7/2017 0:00,89.0,Routine - Unscheduled,74975_20171207_103124,Inadequately cleaned or sanitized food contact surfaces,Moderate Risk,20171207,103124,2017-12-07,0,2,0,0,0,3,3
886,886,2903,1594,Young's Restaurant,601 Kearny St,San Francisco,CA,94108,37.793702,-122.404653,"(37.793702, -122.404653)",,1594_20150623,6/23/2015 0:00,86.0,Routine - Unscheduled,1594_20150623_103133,Foods not protected from contamination,Moderate Risk,20150623,103133,2015-06-23,0,8,0,0,0,7,5
887,887,2914,78670,"Panda Boba, Inc",2763 San Bruno Ave,San Francisco,CA,94134,,,,,78670_20161206,12/6/2016 0:00,98.0,Routine - Unscheduled,78670_20161206_103149,Wiping cloths not clean or properly stored or inadequate sanitizer,Low Risk,20161206,103149,2016-12-06,0,3,0,0,1,3,0
888,888,2923,2234,Kam Lok Restaurant,834 Washington St,San Francisco,CA,94108,37.795118,-122.40708300000001,"(37.795118, -122.407083)",,2234_20161018,10/18/2016 0:00,83.0,Routine - Unscheduled,2234_20161018_103103,High risk food holding temperature,High Risk,20161018,103103,2016-10-18,0,5,0,0,2,1,0
889,889,2926,84893,The Perennial Restaurant,59 09th St,San Francisco,CA,94103,,,,,84893_20160510,5/10/2016 0:00,85.0,Routine - Unscheduled,84893_20160510_103103,High risk food holding temperature,High Risk,20160510,103103,2016-05-10,0,0,1,0,0,3,0
890,890,2940,4935,Lebeau's Nob Hill Market,1263 Leavenworth St,San Francisco,CA,94109,37.792854,-122.416114,"(37.792854, -122.416114)",,4935_20161020,10/20/2016 0:00,81.0,Routine - Unscheduled,4935_20161020_103143,Inadequate warewashing facilities or equipment,Low Risk,20161020,103143,2016-10-20,2,0,4,0,5,0,4
891,891,2942,5868,LONGFELLOW ELEMENTARY SCHOOL,755 MORSE St,San Francisco,CA,94112,37.710459,-122.447713,"(37.710459, -122.447713)",14155464730.0,5868_20160908,9/8/2016 0:00,90.0,Routine - Unscheduled,5868_20160908_103129,Insufficient hot water or running water,Moderate Risk,20160908,103129,2016-09-08,0,0,1,0,1,3,3
892,892,2944,5955,SF CHRISTIAN DAY SCHOOL,25 WHITTIER St,San Francisco,CA,94112,37.709896,-122.448082,"(37.709896, -122.448082)",14155581117.0,5955_20160908,9/8/2016 0:00,93.0,Routine - Unscheduled,5955_20160908_103102,Unclean hands or improper use of gloves,High Risk,20160908,103102,2016-09-08,0,0,2,0,2,1,3
893,893,2949,33056,"7-Eleven, Store 2231-33501",564 Market St,San Francisco,CA,94104,37.789575,-122.401091,"(37.789575, -122.401091)",,33056_20160512,5/12/2016 0:00,87.0,Routine - Unscheduled,33056_20160512_103119,Inadequate and inaccessible handwashing facilities,Moderate Risk,20160512,103119,2016-05-12,0,0,4,0,0,3,0
894,894,2953,78903,Basik Cafe,1958 Polk St,San Francisco,CA,94109,,,,14155653283.0,78903_20160330,3/30/2016 0:00,96.0,Routine - Unscheduled,78903_20160330_103161,Low risk vermin infestation,Low Risk,20160330,103161,2016-03-30,1,0,3,0,1,0,2
895,895,2958,85526,Turner's Kitchen,3505 B 17th St,San Francisco,CA,94110,,,,14155670837.0,85526_20151102,11/2/2015 0:00,,New Ownership,85526_20151102_103161,Low risk vermin infestation,Low Risk,20151102,103161,2015-11-02,0,2,0,0,0,1,3
896,896,2960,85316,Curry Up Now,Approved Locations,San Francisco,CA,zzzzz,,,,14155827000.0,85316_20160805,8/5/2016 0:00,88.0,Routine - Unscheduled,85316_20160805_103154,Unclean or degraded floors walls or ceilings,Low Risk,20160805,103154,2016-08-05,0,0,0,0,0,2,3
897,897,2964,93520,La Loma #6,4788 Mission St.,San Francisco,CA,94112,,,,,93520_20180221,2/21/2018 0:00,,Reinspection/Followup,93520_20180221_103154,Unclean or degraded floors walls or ceilings,Low Risk,20180221,103154,2018-02-21,2,0,0,0,0,0,0
898,898,2966,1615,Starbucks Coffee,27 Drumm St,San Francisco,CA,94111,37.794184,-122.396524,"(37.794184, -122.396524)",,1615_20160504,5/4/2016 0:00,98.0,Routine - Unscheduled,1615_20160504_103154,Unclean or degraded floors walls or ceilings,Low Risk,20160504,103154,2016-05-04,0,0,2,0,0,1,0
899,899,2973,87664,Poke Kana,65 Cambon Dr,San Francisco,CA,94132,,,,,87664_20160816,8/16/2016 0:00,85.0,Routine - Unscheduled,87664_20160816_103120,Moderate risk food holding temperature,Moderate Risk,20160816,103120,2016-08-16,0,2,0,0,4,4,0
900,900,2974,88389,Bobo Drinks,245 Jefferson St,San Francisco,CA,94133,,,,,88389_20171206,12/6/2017 0:00,67.0,Routine - Unscheduled,88389_20171206_103123,Food in poor condition,Moderate Risk,20171206,103123,2017-12-06,0,11,0,0,0,0,0
901,901,2976,69214,Dolce Amore,1477 Van Ness Ave,San Francisco,CA,94109,37.789259,-122.42227700000001,"(37.789259, -122.422277)",,69214_20161020,10/20/2016 0:00,92.0,Routine - Unscheduled,69214_20161020_103124,Inadequately cleaned or sanitized food contact surfaces,Moderate Risk,20161020,103124,2016-10-20,1,0,0,0,2,0,2
902,902,2977,60649,Papa John's Pizza,69 Cambon Dr,San Francisco,CA,94132,37.717766,-122.47438600000001,"(37.717766, -122.474386)",,60649_20160816,8/16/2016 0:00,86.0,Routine - Unscheduled,60649_20160816_103157,Food safety certificate or food handler card not available,Low Risk,20160816,103157,2016-08-16,3,0,0,0,3,6,3
903,903,2984,5654,S. F. Gourmet Hot Dog Cart,Pier 39,San Francisco,CA,94133,37.80824000000001,-122.41018899999999,"(37.80824, -122.410189)",,5654_20170928,9/28/2017 0:00,96.0,Routine - Unscheduled,5654_20170928_103149,Wiping cloths not clean or properly stored or inadequate sanitizer,Low Risk,20170928,103149,2017-09-28,0,0,2,0,1,2,0
904,904,2994,26149,Mrs. Fields Cookies,865 Market St 9000,San Francisco,CA,94103,37.784317,-122.40756299999998,"(37.784317, -122.407563)",14155971993.0,26149_20170928,9/28/2017 0:00,82.0,Routine - Unscheduled,26149_20170928_103131,Moderate risk vermin infestation,Moderate Risk,20170928,103131,2017-09-28,0,0,3,0,3,4,3
905,905,2995,2317,BURGER JOINT,807 VALENCIA St,San Francisco,CA,94110,37.759933000000004,-122.421356,"(37.759933, -122.421356)",14155823494.0,2317_20160816,8/16/2016 0:00,93.0,Routine - Unscheduled,2317_20160816_103102,Unclean hands or improper use of gloves,High Risk,20160816,103102,2016-08-16,0,0,3,0,0,1,2
906,906,2997,83429,San Francisco Marriott Union Square - Employee,480 Sutter St Service Level,San Francisco,CA,94108,,,,,83429_20160628,6/28/2016 0:00,98.0,Routine - Unscheduled,83429_20160628_103149,Wiping cloths not clean or properly stored or inadequate sanitizer,Low Risk,20160628,103149,2016-06-28,1,0,0,0,0,1,0
907,907,3003,67602,Chipotle Mexican Grill #1702,865 Market St Space #C10,San Francisco,CA,94103,37.784317,-122.40756299999998,"(37.784317, -122.407563)",,67602_20160520,5/20/2016 0:00,94.0,Routine - Unscheduled,67602_20160520_103145,Improper storage of equipment utensils or linens,Low Risk,20160520,103145,2016-05-20,0,2,0,0,2,2,0
908,908,3028,81316,Soma Pizza,483 03rd St,San Francisco,CA,94107,,,,14150264580.0,81316_20170124,1/24/2017 0:00,,Complaint,81316_20170124_103147,Inadequate ventilation or lighting,Low Risk,20170124,103147,2017-01-24,0,0,0,0,5,0,0
909,909,3032,63047,Roam Artisan Burgers,1785 UNION St,San Francisco,CA,94123,37.797954,-122.428477,"(37.797954, -122.428477)",14155414247.0,63047_20160906,9/6/2016 0:00,91.0,Routine - Unscheduled,63047_20160906_103105,Improper cooling methods,High Risk,20160906,103105,2016-09-06,0,4,2,0,0,2,4
910,910,3034,78347,The Devil's Acre,256 Columbus Ave,San Francisco,CA,94133,,,,,78347_20160520,5/20/2016 0:00,89.0,Routine - Unscheduled,78347_20160520_103109,Unclean or unsanitary food contact surfaces,High Risk,20160520,103109,2016-05-20,0,0,0,0,0,2,0
911,911,3036,91802,Roxie Food Center,1901 San Jose Ave.,San Francisco,CA,94112,,,,,91802_20180228,2/28/2018 0:00,96.0,Routine - Unscheduled,91802_20180228_103139,Improper food storage,Low Risk,20180228,103139,2018-02-28,2,0,2,0,0,0,0
912,912,3044,74671,7 Eleven #2366-24139C,3998 18th St,San Francisco,CA,94114,,,,14155558611.0,74671_20151224,12/24/2015 0:00,91.0,Routine - Unscheduled,74671_20151224_103109,Unclean or unsanitary food contact surfaces,High Risk,20151224,103109,2015-12-24,0,2,0,0,2,2,2
913,913,3056,89535,Project juice,506 Castro St,San Francisco,CA,94114,,,,14156962612.0,89535_20170310,3/10/2017 0:00,,Non-inspection site visit,89535_20170310_103132,Improper thawing methods,Moderate Risk,20170310,103132,2017-03-10,0,1,0,1,6,0,0
914,914,3059,77492,Los Compadres Catering (Lic #5E50688),350 02nd St,San Francisco,CA,94107,,,,,77492_20150819,8/19/2015 0:00,81.0,Routine - Unscheduled,77492_20150819_103172,Mobile food facility with unapproved operating conditions,High Risk,20150819,103172,2015-08-19,0,3,0,0,0,0,4
915,915,3060,78781,Eight AM,1323 Columbus Ave,San Francisco,CA,94133,,,,,78781_20160415,4/15/2016 0:00,,Reinspection/Followup,78781_20160415_103149,Wiping cloths not clean or properly stored or inadequate sanitizer,Low Risk,20160415,103149,2016-04-15,0,0,0,0,2,4,5
916,916,3069,60933,Mayes,1233 Polk St,San Francisco,CA,94109,37.788313,-122.420254,"(37.788313, -122.420254)",,60933_20161019,10/19/2016 0:00,83.0,Routine - Unscheduled,60933_20161019_103150,Improper or defective plumbing,Low Risk,20161019,103150,2016-10-19,0,5,0,0,5,3,0
917,917,3071,7636,LEE'S FOOD MARKET,1397 Revere Ave,San Francisco,CA,94124,37.729455,-122.38636399999999,"(37.729455, -122.386364)",14155822818.0,7636_20161019,10/19/2016 0:00,81.0,Routine - Unscheduled,7636_20161019_103154,Unclean or degraded floors walls or ceilings,Low Risk,20161019,103154,2016-10-19,0,0,0,0,5,0,5
918,918,3073,71910,Giorgio's Pizzeria,50 Post St #63,San Francisco,CA,94104,,,,,71910_20161110,11/10/2016 0:00,92.0,Routine - Unscheduled,71910_20161110_103144,Unapproved or unmaintained equipment or utensils,Low Risk,20161110,103144,2016-11-10,0,4,0,0,3,0,2
919,919,3075,78528,Wetzel's Pretzels,865 Market St Ste. 9008,San Francisco,CA,94103,,,,,78528_20171208,12/8/2017 0:00,92.0,Routine - Unscheduled,78528_20171208_103154,Unclean or degraded floors walls or ceilings,Low Risk,20171208,103154,2017-12-08,0,3,0,0,1,4,0
920,920,3077,87298,Tacos El Primo,2225 Jennings St,San Francisco,CA,94124,,,,,87298_20160511,5/11/2016 0:00,96.0,Routine - Unscheduled,87298_20160511_103154,Unclean or degraded floors walls or ceilings,Low Risk,20160511,103154,2016-05-11,5,0,0,0,0,2,0
921,921,3084,4686,RICE GARDEN,1515 SLOAT Blvd,San Francisco,CA,94132,37.733944,-122.49043799999998,"(37.733944, -122.490438)",,4686_20170105,1/5/2017 0:00,94.0,Routine - Unscheduled,4686_20170105_103124,Inadequately cleaned or sanitized food contact surfaces,Moderate Risk,20170105,103124,2017-01-05,0,3,0,2,2,2,2
922,922,3085,73978,The Crew,1330 Noriega St,San Francisco,CA,94122,,,,14155668548.0,73978_20150316,3/16/2015 0:00,61.0,Routine - Unscheduled,73978_20150316_103129,Insufficient hot water or running water,Moderate Risk,20150316,103129,2015-03-16,0,0,0,0,0,0,0
923,923,3087,3495,Ryoko's,619 Taylor St,San Francisco,CA,94102,37.788134,-122.411817,"(37.788134, -122.411817)",,3495_20171211,12/11/2017 0:00,98.0,Routine - Unscheduled,3495_20171211_103142,Unclean nonfood contact surfaces,Low Risk,20171211,103142,2017-12-11,0,1,0,0,6,0,2
924,924,3094,75406,Victory Hall And Parlor,360 Ritch St,San Francisco,CA,94107,,,,,75406_20170105,1/5/2017 0:00,94.0,Routine - Unscheduled,75406_20170105_103119,Inadequate and inaccessible handwashing facilities,Moderate Risk,20170105,103119,2017-01-05,0,0,3,0,2,0,0
925,925,3095,79000,AT&T PARK-Virgin America Flight Deck Bar,24 Willie Mays Plaza,San Francisco,CA,94107,,,,,79000_20160520,5/20/2016 0:00,88.0,Routine - Unscheduled,79000_20160520_103123,Food in poor condition,Moderate Risk,20160520,103123,2016-05-20,0,0,0,0,0,3,0
926,926,3099,65795,Mr. Pizza Man,2680 22nd St,San Francisco,CA,94110,37.756133,-122.40816399999999,"(37.756133, -122.408164)",,65795_20160114,1/14/2016 0:00,94.0,Routine - Unscheduled,65795_20160114_103149,Wiping cloths not clean or properly stored or inadequate sanitizer,Low Risk,20160114,103149,2016-01-14,2,0,5,0,3,4,3
927,927,3100,90114,San Francisco Marriott Fisherman's Wharf,1250 Columbus Ave,San Francisco,CA,94133,,,,,90114_20171213,12/13/2017 0:00,98.0,Routine - Unscheduled,90114_20171213_103154,Unclean or degraded floors walls or ceilings,Low Risk,20171213,103154,2017-12-13,0,1,0,0,0,0,0
928,928,3104,19379,Andersen Bakery,50 Post St #1,San Francisco,CA,94104,37.789064,-122.40286100000002,"(37.789064, -122.402861)",,19379_20161109,11/9/2016 0:00,89.0,Routine - Unscheduled,19379_20161109_103157,Food safety certificate or food handler card not available,Low Risk,20161109,103157,2016-11-09,0,3,0,0,3,0,2
929,929,3108,68508,Pho Nice,880 Geneva Ave #A,San Francisco,CA,94112,37.716903,-122.441337,"(37.716903, -122.441337)",,68508_20161004,10/4/2016 0:00,84.0,Routine - Unscheduled,68508_20161004_103147,Inadequate ventilation or lighting,Low Risk,20161004,103147,2016-10-04,0,0,0,3,5,0,4
930,930,3123,83588,Bei Fang Style,2218 Irving St,San Francisco,CA,94122,,,,14155207160.0,83588_20161209,12/9/2016 0:00,86.0,Routine - Unscheduled,83588_20161209_103132,Improper thawing methods,Moderate Risk,20161209,103132,2016-12-09,0,4,0,0,4,3,0
931,931,3130,6864,Green & Polk Produce,2222 Polk St,San Francisco,CA,94109,37.797238,-122.42195600000001,"(37.797238, -122.421956)",,6864_20161021,10/21/2016 0:00,90.0,Routine - Unscheduled,6864_20161021_103124,Inadequately cleaned or sanitized food contact surfaces,Moderate Risk,20161021,103124,2016-10-21,0,1,0,0,3,0,7
932,932,3136,1042,LOVE 'N HAIGHT COFFEE & DELI,553 HAIGHT St,San Francisco,CA,94117,37.771964000000004,-122.43133600000002,"(37.771964, -122.431336)",14155258190.0,1042_20171211,12/11/2017 0:00,92.0,Routine - Unscheduled,1042_20171211_103131,Moderate risk vermin infestation,Moderate Risk,20171211,103131,2017-12-11,0,2,0,0,0,2,2
933,933,3148,62702,Comstock Saloon,155 Columbus Ave.,San Francisco,CA,94133,37.79668,-122.40498000000001,"(37.79668, -122.40498)",14155610071.0,62702_20150818,8/18/2015 0:00,,Reinspection/Followup,62702_20150818_103154,Unclean or degraded floors walls or ceilings,Low Risk,20150818,103154,2015-08-18,0,0,0,0,2,0,1
934,934,3149,10438,Piraat Pizza,696 Sutter St,San Francisco,CA,94102,37.78885800000001,-122.411754,"(37.788858, -122.411754)",,10438_20161207,12/7/2016 0:00,92.0,Routine - Unscheduled,10438_20161207_103131,Moderate risk vermin infestation,Moderate Risk,20161207,103131,2016-12-07,0,0,3,0,3,0,2
935,935,3153,1608,CLADDAGH COFFEE,951 Geneva Ave,San Francisco,CA,94112,37.715996999999994,-122.440048,"(37.715997, -122.440048)",,1608_20161209,12/9/2016 0:00,94.0,Routine - Unscheduled,1608_20161209_103133,Foods not protected from contamination,Moderate Risk,20161209,103133,2016-12-09,0,4,0,0,2,3,0
936,936,3156,1241,Banwich,1105 TARAVAL St,San Francisco,CA,94116,37.742895000000004,-122.477898,"(37.742895, -122.477898)",,1241_20160523,5/23/2016 0:00,90.0,Routine - Unscheduled,1241_20160523_103120,Moderate risk food holding temperature,Moderate Risk,20160523,103120,2016-05-23,0,3,0,0,3,3,0
937,937,3164,74084,Miss Saigon LLC,100 06th St,San Francisco,CA,94103,,,,,74084_20160126,1/26/2016 0:00,83.0,Routine - Unscheduled,74084_20160126_103118,Employee eating or smoking,Moderate Risk,20160126,103118,2016-01-26,5,0,0,6,0,4,4
938,938,3166,125,Centerfolds,391 Broadway St,San Francisco,CA,94133,37.798233,-122.40363700000002,"(37.798233, -122.403637)",,125_20160520,5/20/2016 0:00,92.0,Routine - Unscheduled,125_20160520_103161,Low risk vermin infestation,Low Risk,20160520,103161,2016-05-20,0,0,4,0,0,3,0
939,939,3167,1742,McAllister Grocery & Deli,136 McAllister St,San Francisco,CA,94102,37.780916,-122.41431200000001,"(37.780916, -122.414312)",,1742_20150630,6/30/2015 0:00,86.0,Routine - Unscheduled,1742_20150630_103129,Insufficient hot water or running water,Moderate Risk,20150630,103129,2015-06-30,0,0,0,0,4,0,4
940,940,3171,66985,Pho Vietnam San Francisco,1406 Polk St,San Francisco,CA,94109,37.78973,-122.420445,"(37.78973, -122.420445)",,66985_20151223,12/23/2015 0:00,94.0,Routine - Unscheduled,66985_20151223_103145,Improper storage of equipment utensils or linens,Low Risk,20151223,103145,2015-12-23,0,5,0,0,0,4,2
941,941,3173,70064,Gracias Madre,2211 Mission St,San Francisco,CA,94103,,,,14155654366.0,70064_20161207,12/7/2016 0:00,94.0,Routine - Unscheduled,70064_20161207_103150,Improper or defective plumbing,Low Risk,20161207,103150,2016-12-07,0,4,0,0,2,4,3
942,942,3176,71168,Sa Beang Thai,312 DIVISADERO St,San Francisco,CA,94117,37.772458,-122.437247,"(37.772458, -122.437247)",14155795454.0,71168_20151020,10/20/2015 0:00,65.0,Routine - Unscheduled,71168_20151020_103103,High risk food holding temperature,High Risk,20151020,103103,2015-10-20,0,0,0,0,8,0,8
943,943,3186,19403,Starbucks,499 Bay St,San Francisco,CA,94133,37.805493,-122.41440700000001,"(37.805493, -122.414407)",,19403_20160329,3/29/2016 0:00,98.0,Routine - Unscheduled,19403_20160329_103154,Unclean or degraded floors walls or ceilings,Low Risk,20160329,103154,2016-03-29,2,0,2,0,0,1,1
944,944,3190,75942,Cole Valley Cafe,701 Cole St,San Francisco,CA,94117,,,,14155665282.0,75942_20171201,12/1/2017 0:00,90.0,Routine - Unscheduled,75942_20171201_103157,Food safety certificate or food handler card not available,Low Risk,20171201,103157,2017-12-01,0,4,0,0,0,2,3
945,945,3196,86231,"Brew Brothers Cafe, Inc.",1299 Pacific Ave,San Francisco,CA,94109,,,,,86231_20161021,10/21/2016 0:00,88.0,Routine - Unscheduled,86231_20161021_103161,Low risk vermin infestation,Low Risk,20161021,103161,2016-10-21,3,0,4,0,5,1,0
946,946,3197,69350,Chipotle Mexican Grill #1460,121 04th St Space #1035,San Francisco,CA,94103,37.784283,-122.40388100000001,"(37.784283, -122.403881)",,69350_20161110,11/10/2016 0:00,96.0,Routine - Unscheduled,69350_20161110_103131,Moderate risk vermin infestation,Moderate Risk,20161110,103131,2016-11-10,0,1,0,0,1,2,2
947,947,3211,78762,Paprika,3324 24th St,San Francisco,CA,94110,,,,14155371477.0,78762_20161003,10/3/2016 0:00,98.0,Routine - Unscheduled,78762_20161003_103149,Wiping cloths not clean or properly stored or inadequate sanitizer,Low Risk,20161003,103149,2016-10-03,0,2,0,0,1,0,1
948,948,3216,63615,Saiwaii Ramen,2240 IRVING St,San Francisco,CA,94122,37.763368,-122.482262,"(37.763368, -122.482262)",,63615_20160608,6/8/2016 0:00,94.0,Routine - Unscheduled,63615_20160608_103154,Unclean or degraded floors walls or ceilings,Low Risk,20160608,103154,2016-06-08,0,2,0,0,3,2,0
949,949,3219,38423,Dynamo,2760 24th St,San Francisco,CA,94110,37.752928000000004,-122.40761200000001,"(37.752928, -122.407612)",,38423_20171201,12/1/2017 0:00,96.0,Routine - Unscheduled,38423_20171201_103131,Moderate risk vermin infestation,Moderate Risk,20171201,103131,2017-12-01,0,1,0,0,0,1,0
950,950,3230,86997,JW Marriott SF Union Square,500 Post St,San Francisco,CA,94102,,,,,86997_20161209,12/9/2016 0:00,92.0,Routine - Unscheduled,86997_20161209_103119,Inadequate and inaccessible handwashing facilities,Moderate Risk,20161209,103119,2016-12-09,0,2,0,0,3,0,0
951,951,3235,63286,El Paraiso,1198 Treat Ave,San Francisco,CA,94110,,,,,63286_20160112,1/12/2016 0:00,86.0,Routine - Unscheduled,63286_20160112_103154,Unclean or degraded floors walls or ceilings,Low Risk,20160112,103154,2016-01-12,0,5,0,4,0,6,5
952,952,3248,1777,Pete's Deli & Cafe,1661 Divisadero St,San Francisco,CA,94115,37.785123999999996,-122.439874,"(37.785124, -122.439874)",,1777_20150330,3/30/2015 0:00,81.0,Routine - Unscheduled,1777_20150330_103139,Improper food storage,Low Risk,20150330,103139,2015-03-30,0,0,0,0,0,0,0
953,953,3259,38258,Hong Kong Bakery,4711 MISSION St,San Francisco,CA,94112,37.722898,-122.43608600000002,"(37.722898, -122.436086)",,38258_20150708,7/8/2015 0:00,77.0,Routine - Unscheduled,38258_20150708_103131,Moderate risk vermin infestation,Moderate Risk,20150708,103131,2015-07-08,0,0,6,0,0,5,7
954,954,3263,1685,"New Lun Ting Cafe, Inc",670 Jackson St,San Francisco,CA,94133,37.796098,-122.406275,"(37.796098, -122.406275)",,1685_20161019,10/19/2016 0:00,76.0,Routine - Unscheduled,1685_20161019_103105,Improper cooling methods,High Risk,20161019,103105,2016-10-19,0,4,0,0,6,4,0
955,955,3266,2849,Kells,530 Jackson St,San Francisco,CA,94133,37.796378000000004,-122.40402399999999,"(37.796378, -122.404024)",,2849_20171206,12/6/2017 0:00,,Reinspection/Followup,2849_20171206_103119,Inadequate and inaccessible handwashing facilities,Moderate Risk,20171206,103119,2017-12-06,0,1,0,0,3,0,7
956,956,3270,1788,EXECUTIVE CAFE,150 EXECUTIVE PARK Blvd 2000,San Francisco,CA,94134,37.711323,-122.393371,"(37.711323, -122.393371)",14155532612.0,1788_20150909,9/9/2015 0:00,87.0,Routine - Unscheduled,1788_20150909_103129,Insufficient hot water or running water,Moderate Risk,20150909,103129,2015-09-09,0,0,0,0,3,0,3
957,957,3275,36160,Zabb,4440 Mission St,San Francisco,CA,94112,37.726489,-122.433485,"(37.726489, -122.433485)",14155582455.0,36160_20161208,12/8/2016 0:00,94.0,Routine - Unscheduled,36160_20161208_103142,Unclean nonfood contact surfaces,Low Risk,20161208,103142,2016-12-08,0,3,0,0,3,3,0
958,958,3276,82259,Seniores Pizza,559 Divisadero St,San Francisco,CA,94117,,,,14155405222.0,82259_20150428,4/28/2015 0:00,,New Ownership,82259_20150428_103138,Improper storage use or identification of toxic substances,Low Risk,20150428,103138,2015-04-28,0,0,0,0,2,0,3
959,959,3283,80800,Caffe Cova a Boriana Foods Co.,550 Kearny St,San Francisco,CA,94108,,,,,80800_20150325,3/25/2015 0:00,92.0,Routine - Unscheduled,80800_20150325_103129,Insufficient hot water or running water,Moderate Risk,20150325,103129,2015-03-25,0,0,0,0,0,0,0
960,960,3302,4881,STOP N SHOP,3000 Mission St,San Francisco,CA,94110,37.748924,-122.418144,"(37.748924, -122.418144)",14155550905.0,4881_20161021,10/21/2016 0:00,90.0,Routine - Unscheduled,4881_20161021_103141,Improper food labeling or menu misrepresentation,Low Risk,20161021,103141,2016-10-21,0,0,0,0,4,0,0
961,961,3313,61494,Golden City Inn,5131 03rd St,San Francisco,CA,94124,37.73190200000001,-122.391576,"(37.731902, -122.391576)",,61494_20150318,3/18/2015 0:00,80.0,Routine - Unscheduled,61494_20150318_103108,Contaminated or adulterated food,High Risk,20150318,103108,2015-03-18,0,0,0,0,1,0,0
962,962,3324,2925,Marines Memorial Club - Banquet,609 Sutter St 10th Floor,San Francisco,CA,94102,37.788954,-122.410467,"(37.788954, -122.410467)",,2925_20161207,12/7/2016 0:00,88.0,Routine - Unscheduled,2925_20161207_103132,Improper thawing methods,Moderate Risk,20161207,103132,2016-12-07,0,3,0,0,4,0,0
963,963,3327,57552,Cafe Prague,424 Merchant St,San Francisco,CA,94111,37.795398,-122.400944,"(37.795398, -122.400944)",,57552_20161206,12/6/2016 0:00,68.0,Routine - Unscheduled,57552_20161206_103109,Unclean or unsanitary food contact surfaces,High Risk,20161206,103109,2016-12-06,0,0,0,0,8,0,6
964,964,3328,89900,Tout Sweet Patisserie,170 O'Farrell St,San Francisco,CA,zzzzz,,,,14155659020.0,89900_20161206,12/6/2016 0:00,93.0,Routine - Unscheduled,89900_20161206_103112,No hot water or running water,High Risk,20161206,103112,2016-12-06,0,0,0,0,1,0,0
965,965,3330,2315,TAQUERIA CAN-CUN,2288 MISSION St,San Francisco,CA,94110,37.760487,-122.41928500000002,"(37.760487, -122.419285)",14155259560.0,2315_20161207,12/7/2016 0:00,88.0,Routine - Unscheduled,2315_20161207_103154,Unclean or degraded floors walls or ceilings,Low Risk,20161207,103154,2016-12-07,0,4,0,0,4,4,4
966,966,3334,67788,Sushi Taka,600 Kearny St,San Francisco,CA,94108,37.793669,-122.404578,"(37.793669, -122.404578)",,67788_20161205,12/5/2016 0:00,84.0,Routine - Unscheduled,67788_20161205_103129,Insufficient hot water or running water,Moderate Risk,20161205,103129,2016-12-05,0,0,0,0,4,0,0
967,967,3344,86910,L'a Poke,314 Church St,San Francisco,CA,94114,,,,14155246016.0,86910_20161003,10/3/2016 0:00,,Reinspection/Followup,86910_20161003_103121,Inadequate procedures or records for time as a public health control,Moderate Risk,20161003,103121,2016-10-03,1,0,2,0,1,4,0
968,968,3345,79390,City Lunch Restaurant,2101 Ingalls St,San Francisco,CA,94124,,,,,79390_20150318,3/18/2015 0:00,88.0,Routine - Unscheduled,79390_20150318_103120,Moderate risk food holding temperature,Moderate Risk,20150318,103120,2015-03-18,0,0,0,0,5,0,4
969,969,3349,10986,7-Eleven Store 2231-33437T,217 Sutter St,San Francisco,CA,94108,37.789721,-122.40426799999999,"(37.789721, -122.404268)",,10986_20160810,8/10/2016 0:00,92.0,Routine - Unscheduled,10986_20160810_103150,Improper or defective plumbing,Low Risk,20160810,103150,2016-08-10,0,3,0,0,0,3,1
970,970,3350,34066,Jitlada Thai Cuisine,1826 B Buchanan St,San Francisco,CA,94115,37.785872,-122.437335,"(37.785872, -122.437335)",,34066_20160309,3/9/2016 0:00,87.0,Routine - Unscheduled,34066_20160309_103132,Improper thawing methods,Moderate Risk,20160309,103132,2016-03-09,0,0,0,0,3,0,3
971,971,3351,88342,Noname Sushi,2175 Market St,San Francisco,CA,94114,,,,14155638884.0,88342_20171213,12/13/2017 0:00,96.0,Routine - Unscheduled,88342_20171213_103124,Inadequately cleaned or sanitized food contact surfaces,Moderate Risk,20171213,103124,2017-12-13,0,1,0,0,0,2,0
972,972,3355,5962,HILLWOOD SCHOOL,2521 SCOTT St,San Francisco,CA,94115,37.793364000000004,-122.439834,"(37.793364, -122.439834)",,5962_20161114,11/14/2016 0:00,96.0,Routine - Unscheduled,5962_20161114_103131,Moderate risk vermin infestation,Moderate Risk,20161114,103131,2016-11-14,2,0,2,0,1,0,2
973,973,3359,23704,Jug Shop Inc,1590 Pacific Ave,San Francisco,CA,94109,37.79511,-122.421411,"(37.79511, -122.421411)",,23704_20160328,3/28/2016 0:00,96.0,Routine - Unscheduled,23704_20160328_103131,Moderate risk vermin infestation,Moderate Risk,20160328,103131,2016-03-28,0,3,0,0,3,0,1
974,974,3362,84582,Mateo's Taqueria,2471 Mission St,San Francisco,CA,94110,,,,14155646000.0,84582_20160908,9/8/2016 0:00,85.0,Routine - Unscheduled,84582_20160908_103109,Unclean or unsanitary food contact surfaces,High Risk,20160908,103109,2016-09-08,0,0,4,0,0,3,1
975,975,3363,75429,Home Cafe,1222 Noriega St,San Francisco,CA,94122,,,,14155427207.0,75429_20160608,6/8/2016 0:00,96.0,Routine - Unscheduled,75429_20160608_103121,Inadequate procedures or records for time as a public health control,Moderate Risk,20160608,103121,2016-06-08,0,0,0,0,2,1,0
976,976,3364,70452,Kennedy Market & Deli,4600 03rd St,San Francisco,CA,94124,37.736301,-122.390293,"(37.736301, -122.390293)",14155285560.0,70452_20151007,10/7/2015 0:00,90.0,Routine - Unscheduled,70452_20151007_103124,Inadequately cleaned or sanitized food contact surfaces,Moderate Risk,20151007,103124,2015-10-07,3,0,0,0,4,0,3
977,977,3365,80037,Starbucks  Coffee #22607,100 Montgomery St,San Francisco,CA,94104,,,,,80037_20161108,11/8/2016 0:00,98.0,Routine - Unscheduled,80037_20161108_103144,Unapproved or unmaintained equipment or utensils,Low Risk,20161108,103144,2016-11-08,0,2,0,0,1,0,0
978,978,3366,86994,JW Marriott SF Union Square,500 Post St,San Francisco,CA,94102,,,,,86994_20161209,12/9/2016 0:00,98.0,Routine - Unscheduled,86994_20161209_103147,Inadequate ventilation or lighting,Low Risk,20161209,103147,2016-12-09,0,0,0,0,1,0,0
979,979,3367,63653,SFDH - Scala's Bistro Restaurant,450 Powell St 1st Floor,San Francisco,CA,94102,37.788918,-122.408507,"(37.788918, -122.408507)",,63653_20160502,5/2/2016 0:00,89.0,Routine - Unscheduled,63653_20160502_103109,Unclean or unsanitary food contact surfaces,High Risk,20160502,103109,2016-05-02,0,0,0,0,0,3,0
980,980,3368,35828,A1 Geneva Bakery,959 GENEVA Ave,San Francisco,CA,94112,37.715986,-122.44003899999998,"(37.715986, -122.440039)",,35828_20161004,10/4/2016 0:00,79.0,Routine - Unscheduled,35828_20161004_103114,High risk vermin infestation,High Risk,20161004,103114,2016-10-04,0,6,0,0,6,0,4
981,981,3380,88326,Live Oak School,1555 Mariposa St,San Francisco,CA,94107,,,,14155564723.0,88326_20180227,2/27/2018 0:00,92.0,Routine - Unscheduled,88326_20180227_103119,Inadequate and inaccessible handwashing facilities,Moderate Risk,20180227,103119,2018-02-27,2,3,0,0,4,0,0
982,982,3390,66808,Burger King 3684,819 Van Ness Ave,San Francisco,CA,94109,37.783196000000004,-122.42098500000002,"(37.783196, -122.420985)",,66808_20161020,10/20/2016 0:00,88.0,Routine - Unscheduled,66808_20161020_103131,Moderate risk vermin infestation,Moderate Risk,20161020,103131,2016-10-20,0,0,0,2,3,0,0
983,983,3391,62784,Mission Shell,3550 MISSION St,San Francisco,CA,94110,37.740018,-122.42351799999999,"(37.740018, -122.423518)",,62784_20160330,3/30/2016 0:00,92.0,Routine - Unscheduled,62784_20160330_103154,Unclean or degraded floors walls or ceilings,Low Risk,20160330,103154,2016-03-30,0,0,2,0,1,3,4
984,984,3396,82413,Farmhouse Kitchen Thai Cuisine,710 Florida St,San Francisco,CA,94110,,,,,82413_20150814,8/14/2015 0:00,82.0,Routine - Unscheduled,82413_20150814_103105,Improper cooling methods,High Risk,20150814,103105,2015-08-14,0,5,0,0,3,0,3
985,985,3397,18981,Frascati,1901 Hyde St,San Francisco,CA,94109,37.798392,-122.41892299999999,"(37.798392, -122.418923)",,18981_20180223,2/23/2018 0:00,96.0,Routine - Unscheduled,18981_20180223_103152,Unclean unmaintained or improperly constructed toilet facilities,Low Risk,20180223,103152,2018-02-23,2,0,0,0,0,1,0
986,986,3398,86154,Jamba Juice,2300 16th St.,San Francisco,CA,94103,,,,14155205946.0,86154_20171206,12/6/2017 0:00,98.0,Routine - Unscheduled,86154_20171206_103149,Wiping cloths not clean or properly stored or inadequate sanitizer,Low Risk,20171206,103149,2017-12-06,0,1,0,4,0,1,0
987,987,3402,9652,TOWN HALL RESTAURANT,342 HOWARD STREET,San Francisco,CA,94105,37.789563,-122.394821,"(37.789563, -122.394821)",,9652_20180222,2/22/2018 0:00,89.0,Routine - Unscheduled,9652_20180222_103121,Inadequate procedures or records for time as a public health control,Moderate Risk,20180222,103121,2018-02-22,2,0,0,0,6,0,0
988,988,3405,2924,Leatherneck Steakhouse - Marines' Memorial Assn,"609 Sutter St,  12th Floor",San Francisco,CA,94102,37.788954,-122.410467,"(37.788954, -122.410467)",,2924_20161207,12/7/2016 0:00,82.0,Routine - Unscheduled,2924_20161207_103148,No thermometers or uncalibrated thermometers,Low Risk,20161207,103148,2016-12-07,0,1,0,0,7,0,0
989,989,3409,9103,Marketbar,1 Ferry Building #36,San Francisco,CA,94111,37.795225,-122.39376999999999,"(37.795225, -122.39377)",,9103_20161202,12/2/2016 0:00,89.0,Routine - Unscheduled,9103_20161202_103145,Improper storage of equipment utensils or linens,Low Risk,20161202,103145,2016-12-02,1,0,0,0,3,0,1
990,990,3422,709,MONG THU COFFEE SHOP,248 HYDE St,San Francisco,CA,94102,37.783041,-122.415719,"(37.783041, -122.415719)",,709_20170927,9/27/2017 0:00,87.0,Routine - Unscheduled,709_20170927_103105,Improper cooling methods,High Risk,20170927,103105,2017-09-27,0,0,3,0,5,0,4
991,991,3424,7856,Mee Mee Bakery,1328 Stockton St,San Francisco,CA,94133,37.797934999999995,-122.40858100000001,"(37.797935, -122.408581)",,7856_20161207,12/7/2016 0:00,84.0,Routine - Unscheduled,7856_20161207_103131,Moderate risk vermin infestation,Moderate Risk,20161207,103131,2016-12-07,0,0,0,0,5,0,5
992,992,3425,3216,House of Donuts/Copper Kettle,2240 TARAVAL St,San Francisco,CA,94116,37.742438,-122.490301,"(37.742438, -122.490301)",,3216_20170822,8/22/2017 0:00,,Complaint,3216_20170822_103149,Wiping cloths not clean or properly stored or inadequate sanitizer,Low Risk,20170822,103149,2017-08-22,0,0,4,0,3,2,0
993,993,3429,59638,JR. Seafood LLC,310 Bayshore Blvd,San Francisco,CA,94124,37.74286,-122.40544799999999,"(37.74286, -122.405448)",,59638_20151029,10/29/2015 0:00,94.0,Routine - Unscheduled,59638_20151029_103149,Wiping cloths not clean or properly stored or inadequate sanitizer,Low Risk,20151029,103149,2015-10-29,0,0,0,4,0,0,2
994,994,3431,62176,J & V Catering,2020 JERROLD Ave,San Francisco,CA,94124,37.743496,-122.39731699999999,"(37.743496, -122.397317)",,62176_20150413,4/13/2015 0:00,92.0,Routine - Unscheduled,62176_20150413_103139,Improper food storage,Low Risk,20150413,103139,2015-04-13,0,1,0,0,0,0,4
995,995,3433,74955,Darioush Inc.,3065 Jackson St,San Francisco,CA,94115,,,,,74955_20180228,2/28/2018 0:00,93.0,Routine - Unscheduled,74955_20180228_103109,Unclean or unsanitary food contact surfaces,High Risk,20180228,103109,2018-02-28,1,0,0,0,2,0,0
996,996,3437,82721,Bon Appetit @ Twitter,875 Stevenson St 10th Floor,San Francisco,CA,94103,,,,,82721_20161207,12/7/2016 0:00,92.0,Routine - Unscheduled,82721_20161207_103138,Improper storage use or identification of toxic substances,Low Risk,20161207,103138,2016-12-07,1,0,0,0,3,1,0
997,997,3443,70220,Trader Joe's #200,1095 Hyde St,San Francisco,CA,94109,,,,14155297665.0,70220_20160511,5/11/2016 0:00,98.0,Routine - Unscheduled,70220_20160511_103142,Unclean nonfood contact surfaces,Low Risk,20160511,103142,2016-05-11,0,0,1,0,0,1,0
998,998,3445,67356,Indigo Restaurant,687 MCALLISTER St,San Francisco,CA,94102,37.779674,-122.42330700000001,"(37.779674, -122.423307)",,67356_20160407,4/7/2016 0:00,79.0,Routine - Unscheduled,67356_20160407_103120,Moderate risk food holding temperature,Moderate Risk,20160407,103120,2016-04-07,0,0,0,0,0,5,0
999,999,3455,1002,BIG MOUTH BURGERS,3392 24th St,San Francisco,CA,94110,37.752158,-122.42036200000001,"(37.752158, -122.420362)",,1002_20170928,9/28/2017 0:00,85.0,Routine - Unscheduled,1002_20170928_103161,Low risk vermin infestation,Low Risk,20170928,103161,2017-09-28,0,0,4,0,0,4,4
1000,1000,3458,77693,SH Dream Inc,253 Church St,San Francisco,CA,94114,,,,14155860447.0,77693_20150908,9/8/2015 0:00,83.0,Routine - Unscheduled,77693_20150908_103133,Foods not protected from contamination,Moderate Risk,20150908,103133,2015-09-08,0,0,5,0,0,0,5
1001,1001,3461,36022,Wok In Chinese American Food,50 MENDELL St 6,San Francisco,CA,94124,37.743419,-122.383536,"(37.743419, -122.383536)",,36022_20150819,8/19/2015 0:00,83.0,Routine - Unscheduled,36022_20150819_103132,Improper thawing methods,Moderate Risk,20150819,103132,2015-08-19,0,0,0,0,6,0,4
1002,1002,3462,86715,Green Heart Foods LLC,1069 Pennsylvania Ave,San Francisco,CA,94107,,,,14155277307.0,86715_20161110,11/10/2016 0:00,91.0,Routine - Unscheduled,86715_20161110_103102,Unclean hands or improper use of gloves,High Risk,20161110,103102,2016-11-10,0,2,0,0,2,0,3
1003,1003,3470,80893,The Progress,1525 Fillmore St,San Francisco,CA,94115,,,,14155781272.0,80893_20160105,1/5/2016 0:00,93.0,Routine - Unscheduled,80893_20160105_103109,Unclean or unsanitary food contact surfaces,High Risk,20160105,103109,2016-01-05,0,0,0,0,1,0,1
1004,1004,3471,67,Revolution Cafe,3248 22nd St,San Francisco,CA,94110,37.755419,-122.41954199999999,"(37.755419, -122.419542)",,67_20161019,10/19/2016 0:00,94.0,Routine - Unscheduled,67_20161019_103154,Unclean or degraded floors walls or ceilings,Low Risk,20161019,103154,2016-10-19,4,0,6,0,2,4,3
1005,1005,3472,3482,Sears Fine Food,439 Powell St,San Francisco,CA,94102,37.788823,-122.40855400000001,"(37.788823, -122.408554)",,3482_20160425,4/25/2016 0:00,81.0,Routine - Unscheduled,3482_20160425_103150,Improper or defective plumbing,Low Risk,20160425,103150,2016-04-25,0,0,0,6,0,6,5
1006,1006,3474,5010,LATTE EXPRESS,48 05th St,San Francisco,CA,94103,37.783225,-122.407252,"(37.783225, -122.407252)",14155287328.0,5010_20160331,3/31/2016 0:00,92.0,Routine - Unscheduled,5010_20160331_103139,Improper food storage,Low Risk,20160331,103139,2016-03-31,0,0,2,0,2,0,3
1007,1007,3488,76895,Third Rail,628 20th St,San Francisco,CA,94107,,,,,76895_20150324,3/24/2015 0:00,96.0,Routine - Unscheduled,76895_20150324_103133,Foods not protected from contamination,Moderate Risk,20150324,103133,2015-03-24,0,0,0,0,1,0,0
1008,1008,3489,92110,Maxfield's House of Caffeine,398 dolores St,San Francisco,CA,94110,,,,,92110_20170705,7/5/2017 0:00,90.0,Routine - Unscheduled,92110_20170705_103149,Wiping cloths not clean or properly stored or inadequate sanitizer,Low Risk,20170705,103149,2017-07-05,1,0,4,0,0,0,0
1009,1009,3500,2428,LA GALLINITA,2989 24th St,San Francisco,CA,94110,37.752634,-122.411658,"(37.752634, -122.411658)",,2428_20160120,1/20/2016 0:00,86.0,Routine - Unscheduled,2428_20160120_103119,Inadequate and inaccessible handwashing facilities,Moderate Risk,20160120,103119,2016-01-20,0,0,5,0,0,5,5
1010,1010,3507,66736,Sozai,1500 Irving St,San Francisco,CA,94122,,,,,66736_20160412,4/12/2016 0:00,81.0,Routine - Unscheduled,66736_20160412_103133,Foods not protected from contamination,Moderate Risk,20160412,103133,2016-04-12,0,0,0,0,0,4,0
1011,1011,3515,758,BAKERY/ICE CREAM/STOREROOM,2 New Montgomery St,San Francisco,CA,94105,37.788286,-122.40154299999999,"(37.788286, -122.401543)",,758_20171212,12/12/2017 0:00,94.0,Routine - Unscheduled,758_20171212_103154,Unclean or degraded floors walls or ceilings,Low Risk,20171212,103154,2017-12-12,0,2,0,0,0,2,0
1012,1012,3524,7405,TRADER JOE'S,3 MASONIC Ave,San Francisco,CA,94118,37.783444,-122.447294,"(37.783444, -122.447294)",14155349964.0,7405_20150519,5/19/2015 0:00,89.0,Routine - Unscheduled,7405_20150519_103103,High risk food holding temperature,High Risk,20150519,103103,2015-05-19,0,2,0,0,0,0,3
1013,1013,3525,68618,Ike's Place,1650 Holloway Ave,San Francisco,CA,94132,37.720894,-122.478029,"(37.720894, -122.478029)",,68618_20160520,5/20/2016 0:00,,Reinspection/Followup,68618_20160520_103149,Wiping cloths not clean or properly stored or inadequate sanitizer,Low Risk,20160520,103149,2016-05-20,0,4,0,0,2,1,0
1014,1014,3528,1619,BENDERS BAR & GRILL,800-806 SOUTH VAN NESS Ave,San Francisco,CA,94110,37.76031,-122.417123,"(37.76031, -122.417123)",14155558050.0,1619_20160628,6/28/2016 0:00,94.0,Routine - Unscheduled,1619_20160628_103157,Food safety certificate or food handler card not available,Low Risk,20160628,103157,2016-06-28,0,0,2,0,0,2,0
1015,1015,3531,68160,Gourmet Carousel,1559 FRANKLIN St,San Francisco,CA,94109,37.789072999999995,-122.42378400000001,"(37.789073, -122.423784)",,68160_20151019,10/19/2015 0:00,67.0,Routine - Unscheduled,68160_20151019_103103,High risk food holding temperature,High Risk,20151019,103103,2015-10-19,0,0,0,7,0,0,4
1016,1016,3534,83046,Project Juice,364 Hayes St,San Francisco,CA,94102,,,,,83046_20151023,10/23/2015 0:00,96.0,Routine - Unscheduled,83046_20151023_103154,Unclean or degraded floors walls or ceilings,Low Risk,20151023,103154,2015-10-23,0,1,0,0,4,0,2
1017,1017,3540,91236,Target Store T-3264 Starbucks,233 Winston Dr,San Francisco,CA,94132,,,,14152307613.0,91236_20170718,7/18/2017 0:00,,New Ownership,91236_20170718_103149,Wiping cloths not clean or properly stored or inadequate sanitizer,Low Risk,20170718,103149,2017-07-18,0,0,1,0,0,0,0
1018,1018,3557,1991,SRI THAI CUISINE,4621 LINCOLN Way,San Francisco,CA,94122,37.764072999999996,-122.507779,"(37.764073, -122.507779)",,1991_20160504,5/4/2016 0:00,91.0,Routine - Unscheduled,1991_20160504_103142,Unclean nonfood contact surfaces,Low Risk,20160504,103142,2016-05-04,0,4,0,0,0,2,0
1019,1019,3561,19041,Nama Sushi,227 King St,San Francisco,CA,94107,37.777398,-122.39239099999999,"(37.777398, -122.392391)",14155492007.0,19041_20161110,11/10/2016 0:00,85.0,Routine - Unscheduled,19041_20161110_103119,Inadequate and inaccessible handwashing facilities,Moderate Risk,20161110,103119,2016-11-10,0,0,0,0,4,0,0
1020,1020,3563,1668,SILVER CREST DONUT SHOP,340 BAYSHORE Blvd,San Francisco,CA,94124,37.742456,-122.40576599999999,"(37.742456, -122.405766)",14155820753.0,1668_20150401,4/1/2015 0:00,98.0,Routine - Unscheduled,1668_20150401_103138,Improper storage use or identification of toxic substances,Low Risk,20150401,103138,2015-04-01,0,0,1,0,0,0,1
1021,1021,3566,184,RADIO HABANA,1109 VALENCIA St,San Francisco,CA,94110,37.755124,-122.42091599999999,"(37.755124, -122.420916)",14155827659.0,184_20161003,10/3/2016 0:00,98.0,Routine - Unscheduled,184_20161003_103149,Wiping cloths not clean or properly stored or inadequate sanitizer,Low Risk,20161003,103149,2016-10-03,3,0,0,0,1,0,0
1022,1022,3577,6025,KIMOCHI INC,1840 SUTTER St 208,San Francisco,CA,94115,37.786428,-122.43088300000001,"(37.786428, -122.430883)",14155932294.0,6025_20150411,4/11/2015 0:00,83.0,Routine - Unscheduled,6025_20150411_103109,Unclean or unsanitary food contact surfaces,High Risk,20150411,103109,2015-04-11,0,0,0,0,3,1,5
1023,1023,3584,5892,MISSION HIGH SCHOOL,3750 18th St,San Francisco,CA,94114,37.761425,-122.42729299999999,"(37.761425, -122.427293)",,5892_20160311,3/11/2016 0:00,82.0,Routine - Unscheduled,5892_20160311_103109,Unclean or unsanitary food contact surfaces,High Risk,20160311,103109,2016-03-11,0,0,2,0,1,1,3
1024,1024,3589,77731,Souvla,517 Hayes St,San Francisco,CA,94102,,,,,77731_20150527,5/27/2015 0:00,94.0,Routine - Unscheduled,77731_20150527_103149,Wiping cloths not clean or properly stored or inadequate sanitizer,Low Risk,20150527,103149,2015-05-27,1,0,0,2,0,0,3
1025,1025,3591,69706,The Bagelry of S.F.,2139 A Polk St,San Francisco,CA,94109,37.796308,-122.421907,"(37.796308, -122.421907)",,69706_20161021,10/21/2016 0:00,90.0,Routine - Unscheduled,69706_20161021_103154,Unclean or degraded floors walls or ceilings,Low Risk,20161021,103154,2016-10-21,0,3,0,0,5,0,3
1026,1026,3604,5835,Rosa Parks Elementary School,1501 O'Farrell St,San Francisco,CA,94115,37.783604,-122.43014099999999,"(37.783604, -122.430141)",14155745519.0,5835_20160318,3/18/2016 0:00,94.0,Routine - Unscheduled,5835_20160318_103131,Moderate risk vermin infestation,Moderate Risk,20160318,103131,2016-03-18,0,1,0,0,1,1,2
1027,1027,3606,66336,Nizario's Pizza #2,4077 18th St,San Francisco,CA,94114,37.760892999999996,-122.434459,"(37.760893, -122.434459)",,66336_20160725,7/25/2016 0:00,92.0,Routine - Unscheduled,66336_20160725_103119,Inadequate and inaccessible handwashing facilities,Moderate Risk,20160725,103119,2016-07-25,0,0,0,0,0,2,3
1028,1028,3608,74971,Nucha,425 Barneveld Ave,San Francisco,CA,94124,,,,,74971_20151006,10/6/2015 0:00,98.0,Routine - Unscheduled,74971_20151006_103149,Wiping cloths not clean or properly stored or inadequate sanitizer,Low Risk,20151006,103149,2015-10-06,0,0,1,0,0,0,1
1029,1029,3616,82332,Craftsman and Wolves Pacific,1643 Pacific St,San Francisco,CA,94109,,,,,82332_20161019,10/19/2016 0:00,92.0,Routine - Unscheduled,82332_20161019_103127,Noncompliance with HAACP plan or variance,Moderate Risk,20161019,103127,2016-10-19,0,2,0,0,2,0,2
1030,1030,3619,75258,The Battery - Main Kitchen,717 Battery St 1st Floor,San Francisco,CA,94111,,,,,75258_20160325,3/25/2016 0:00,91.0,Routine - Unscheduled,75258_20160325_103149,Wiping cloths not clean or properly stored or inadequate sanitizer,Low Risk,20160325,103149,2016-03-25,0,0,0,3,2,0,2
1031,1031,3620,63265,Sun Maxim's Bakery,2034 IRVING St,San Francisco,CA,94122,37.763467999999996,-122.479851,"(37.763468, -122.479851)",,63265_20160418,4/18/2016 0:00,91.0,Routine - Unscheduled,63265_20160418_103103,High risk food holding temperature,High Risk,20160418,103103,2016-04-18,0,0,4,0,0,3,0
1032,1032,3648,69048,AT&T PARK - 1ST BASE CARVERY,24 Willie Mays Plaza,San Francisco,CA,94107,,,,,69048_20160410,4/10/2016 0:00,94.0,Routine - Unscheduled,69048_20160410_103149,Wiping cloths not clean or properly stored or inadequate sanitizer,Low Risk,20160410,103149,2016-04-10,0,0,0,0,1,2,1
1033,1033,3665,1844,Basque Hotel,15 Romolo Pl,San Francisco,CA,94133,37.798244,-122.406324,"(37.798244, -122.406324)",,1844_20160520,5/20/2016 0:00,92.0,Routine - Unscheduled,1844_20160520_103139,Improper food storage,Low Risk,20160520,103139,2016-05-20,0,0,0,0,0,3,0
1034,1034,3676,4068,Roaring 20's,552 Broadway St,San Francisco,CA,94133,37.797948,-122.406393,"(37.797948, -122.406393)",,4068_20160520,5/20/2016 0:00,96.0,Routine - Unscheduled,4068_20160520_103129,Insufficient hot water or running water,Moderate Risk,20160520,103129,2016-05-20,0,0,3,0,0,1,0
1035,1035,3677,62780,Potrero Shell,2890 03rd St,San Francisco,CA,94107,37.752974,-122.38796,"(37.752974, -122.38796)",,62780_20170106,1/6/2017 0:00,90.0,Routine - Unscheduled,62780_20170106_103120,Moderate risk food holding temperature,Moderate Risk,20170106,103120,2017-01-06,0,0,0,0,3,0,3
1036,1036,3680,81595,Freshroll,230 Bush St #128,San Francisco,CA,94104,,,,,81595_20171212,12/12/2017 0:00,91.0,Routine - Unscheduled,81595_20171212_103113,Sewage or wastewater contamination,High Risk,20171212,103113,2017-12-12,0,2,0,0,0,2,0
1037,1037,3686,3019,Tad's,120 Powell St,San Francisco,CA,94102,37.78592800000001,-122.40788700000002,"(37.785928, -122.407887)",,3019_20160505,5/5/2016 0:00,92.0,Routine - Unscheduled,3019_20160505_103133,Foods not protected from contamination,Moderate Risk,20160505,103133,2016-05-05,0,0,0,3,0,3,0
1038,1038,3687,5206,Western Addition Senior Citizen Service,1390 TURK St,San Francisco,CA,94115,37.780567,-122.43196499999999,"(37.780567, -122.431965)",,5206_20161207,12/7/2016 0:00,88.0,Routine - Unscheduled,5206_20161207_103131,Moderate risk vermin infestation,Moderate Risk,20161207,103131,2016-12-07,0,0,0,0,3,2,0
1039,1039,3692,89516,Sofia Cafe,3463 16th St,San Francisco,CA,94114,,,,14155718656.0,89516_20170830,8/30/2017 0:00,79.0,Routine - Unscheduled,89516_20170830_103133,Foods not protected from contamination,Moderate Risk,20170830,103133,2017-08-30,0,0,5,0,0,0,0
1040,1040,3694,236,Gelato Classico Italian Ice,576 Union St,San Francisco,CA,94133,37.800543,-122.40878400000001,"(37.800543, -122.408784)",,236_20161017,10/17/2016 0:00,96.0,Routine - Unscheduled,236_20161017_103149,Wiping cloths not clean or properly stored or inadequate sanitizer,Low Risk,20161017,103149,2016-10-17,0,0,0,0,2,0,2
1041,1041,3697,84813,5th Avenue Deli & Market,4 Embarcadero Center,San Francisco,CA,94111,,,,,84813_20161207,12/7/2016 0:00,84.0,Routine - Unscheduled,84813_20161207_103124,Inadequately cleaned or sanitized food contact surfaces,Moderate Risk,20161207,103124,2016-12-07,0,0,0,0,4,0,0
1042,1042,3707,87107,Russian Renaissance Restaurant,5241 Geary Blvd,San Francisco,CA,94118,,,,14155758558.0,87107_20170929,9/29/2017 0:00,88.0,Routine - Unscheduled,87107_20170929_103118,Employee eating or smoking,Moderate Risk,20170929,103118,2017-09-29,0,0,4,0,0,2,0
1043,1043,3709,2933,Castagnola's Restaurant,286 Jefferson St,San Francisco,CA,94133,37.808098,-122.417194,"(37.808098, -122.417194)",,2933_20160211,2/11/2016 0:00,86.0,Routine - Unscheduled,2933_20160211_103133,Foods not protected from contamination,Moderate Risk,20160211,103133,2016-02-11,5,0,5,0,0,5,4
1044,1044,3712,7718,Mare Island,Pier 41,San Francisco,CA,94133,,,,,7718_20180223,2/23/2018 0:00,91.0,Routine - Unscheduled,7718_20180223_103112,No hot water or running water,High Risk,20180223,103112,2018-02-23,2,0,0,0,0,0,0
1045,1045,3725,1852,Pat's Cafe,2330 Taylor St,San Francisco,CA,94133,37.803946999999994,-122.414927,"(37.803947, -122.414927)",,1852_20170106,1/6/2017 0:00,88.0,Routine - Unscheduled,1852_20170106_103120,Moderate risk food holding temperature,Moderate Risk,20170106,103120,2017-01-06,0,5,0,0,4,3,0
1046,1046,3726,4434,NOE VALLEY BAKERY & BREAD CO.,4073 24th St,San Francisco,CA,94114,37.751314,-122.43340900000001,"(37.751314, -122.433409)",14155551405.0,4434_20160608,6/8/2016 0:00,96.0,Routine - Unscheduled,4434_20160608_103161,Low risk vermin infestation,Low Risk,20160608,103161,2016-06-08,0,2,0,0,0,2,0
1047,1047,3732,63896,Smokin' Warehouse BBQ,1465 Carroll Ave,San Francisco,CA,94124,37.723465999999995,-122.390795,"(37.723466, -122.390795)",,63896_20151102,11/2/2015 0:00,94.0,Routine - Unscheduled,63896_20151102_103154,Unclean or degraded floors walls or ceilings,Low Risk,20151102,103154,2015-11-02,0,0,0,0,2,0,2
1048,1048,3733,72164,Modern Thai Inc.,1247 Polk St,San Francisco,CA,94109,,,,,72164_20160418,4/18/2016 0:00,81.0,Routine - Unscheduled,72164_20160418_103115,Other high risk violation,High Risk,20160418,103115,2016-04-18,3,4,0,0,6,5,0
1049,1049,3741,5496,AT&T - (CART 20) DOGGIE DINNER [145108],24 WILLIE MAYS PLAZA,San Francisco,CA,94107,,,,14155971500.0,5496_20160814,8/14/2016 0:00,93.0,Routine - Unscheduled,5496_20160814_103103,High risk food holding temperature,High Risk,20160814,103103,2016-08-14,0,0,0,1,1,1,1
1050,1050,3742,2646,THE PHOENIX BAR & RESTAURANT,811 VALENCIA St,San Francisco,CA,94110,37.759823,-122.421346,"(37.759823, -122.421346)",,2646_20160908,9/8/2016 0:00,90.0,Routine - Unscheduled,2646_20160908_103124,Inadequately cleaned or sanitized food contact surfaces,Moderate Risk,20160908,103124,2016-09-08,0,0,5,0,0,3,3
1051,1051,3743,75685,"Guckenheimer - Square, Inc.",1455 Market St 9th Floor,San Francisco,CA,94103,,,,,75685_20180222,2/22/2018 0:00,96.0,Routine - Unscheduled,75685_20180222_103131,Moderate risk vermin infestation,Moderate Risk,20180222,103131,2018-02-22,1,0,0,0,1,0,0
1052,1052,3744,84517,iNoodles,1650 Holloway Ave C134,San Francisco,CA,94132,,,,14152751708.0,84517_20171213,12/13/2017 0:00,96.0,Routine - Unscheduled,84517_20171213_103144,Unapproved or unmaintained equipment or utensils,Low Risk,20171213,103144,2017-12-13,0,2,0,3,0,3,2
1053,1053,3745,80280,Fire of Brazil Express,845 Market St Box A,San Francisco,CA,94103,,,,,80280_20160415,4/15/2016 0:00,82.0,Routine - Unscheduled,80280_20160415_103103,High risk food holding temperature,High Risk,20160415,103103,2016-04-15,1,0,0,0,1,3,0
1054,1054,3751,62069,Golden Eagle Deli & Grill,4401 03rd St,San Francisco,CA,94124,37.737719,-122.389559,"(37.737719, -122.389559)",14155822110.0,62069_20150831,8/31/2015 0:00,92.0,Routine - Unscheduled,62069_20150831_103148,No thermometers or uncalibrated thermometers,Low Risk,20150831,103148,2015-08-31,0,0,0,1,0,0,3
1055,1055,3764,2866,ELIZA'S RESTAURANT,2877 CALIFORNIA St,San Francisco,CA,94115,37.78788400000001,-122.441657,"(37.787884, -122.441657)",,2866_20171212,12/12/2017 0:00,85.0,Routine - Unscheduled,2866_20171212_103109,Unclean or unsanitary food contact surfaces,High Risk,20171212,103109,2017-12-12,0,3,0,0,0,3,0
1056,1056,3766,69492,Bay Area Little John's Candies,1422 Market St,San Francisco,CA,94102,,,,,69492_20160505,5/5/2016 0:00,90.0,Routine - Unscheduled,69492_20160505_103157,Food safety certificate or food handler card not available,Low Risk,20160505,103157,2016-05-05,0,0,4,0,0,3,0
1057,1057,3768,71456,Sam's Cable Car Lounge,222 Powell St,San Francisco,CA,94102,37.786671999999996,-122.408005,"(37.786672, -122.408005)",,71456_20161205,12/5/2016 0:00,96.0,Routine - Unscheduled,71456_20161205_103159,Worker safety hazards,Low Risk,20161205,103159,2016-12-05,0,0,0,0,2,0,3
1058,1058,3770,2008,Hook a Cook,Pier 39  Building B  Space 1-3,San Francisco,CA,94133,37.786766,-122.461545,"(37.786766, -122.461545)",14155217717.0,2008_20150825,8/25/2015 0:00,86.0,Routine - Unscheduled,2008_20150825_103144,Unapproved or unmaintained equipment or utensils,Low Risk,20150825,103144,2015-08-25,0,5,0,0,5,5,6
1059,1059,3776,92709,Scotch Bonnet,101 Spear St. # A13,San Francisco,CA,94105,,,,,92709_20180227,2/27/2018 0:00,83.0,Routine - Unscheduled,92709_20180227_103119,Inadequate and inaccessible handwashing facilities,Moderate Risk,20180227,103119,2018-02-27,4,0,0,0,0,0,0
1060,1060,3783,59016,Mission Martco,5098 MISSION St,San Francisco,CA,94112,37.716782,-122.440816,"(37.716782, -122.440816)",,59016_20170106,1/6/2017 0:00,96.0,Routine - Unscheduled,59016_20170106_103124,Inadequately cleaned or sanitized food contact surfaces,Moderate Risk,20170106,103124,2017-01-06,0,2,0,0,1,1,1
1061,1061,3787,83436,San Francisco Marriott Union Square - Main Kitchen,480 Sutter St 1st Floor,San Francisco,CA,94108,,,,,83436_20160628,6/28/2016 0:00,92.0,Routine - Unscheduled,83436_20160628_103133,Foods not protected from contamination,Moderate Risk,20160628,103133,2016-06-28,2,0,0,0,0,2,0
1062,1062,3789,18824,Fresca Restaurant,24 WEST PORTAL Ave,San Francisco,CA,94122,37.740502,-122.46619199999999,"(37.740502, -122.466192)",,18824_20170126,1/26/2017 0:00,92.0,Routine - Unscheduled,18824_20170126_103120,Moderate risk food holding temperature,Moderate Risk,20170126,103120,2017-01-26,2,0,0,0,3,1,0
1063,1063,3796,5838,HARVEY MILK ELEMENTARY SCHOOL,4235 19th St,San Francisco,CA,94114,37.759173,-122.43648799999998,"(37.759173, -122.436488)",14155246276.0,5838_20160316,3/16/2016 0:00,90.0,Routine - Unscheduled,5838_20160316_103124,Inadequately cleaned or sanitized food contact surfaces,Moderate Risk,20160316,103124,2016-03-16,0,0,1,0,1,0,3
1064,1064,3815,3122,Tadich Grill,240 California St,San Francisco,CA,94111,37.79335800000001,-122.39944299999999,"(37.793358, -122.399443)",,3122_20170109,1/9/2017 0:00,81.0,Routine - Unscheduled,3122_20170109_103109,Unclean or unsanitary food contact surfaces,High Risk,20170109,103109,2017-01-09,0,0,3,0,5,4,0
1065,1065,3816,81528,Hyatt Fisherman's Wharf,555 North Point St,San Francisco,CA,94133,,,,,81528_20161207,12/7/2016 0:00,96.0,Routine - Unscheduled,81528_20161207_103144,Unapproved or unmaintained equipment or utensils,Low Risk,20161207,103144,2016-12-07,0,1,0,0,2,4,0
1066,1066,3817,66276,Martita's Restaurant,1401 EGBERT Ave,San Francisco,CA,94124,37.722776,-122.39286399999999,"(37.722776, -122.392864)",,66276_20151019,10/19/2015 0:00,80.0,Routine - Unscheduled,66276_20151019_103145,Improper storage of equipment utensils or linens,Low Risk,20151019,103145,2015-10-19,0,0,0,0,0,5,4
1067,1067,3821,82315,Cafe De Casa,2701 Leavenworth St,San Francisco,CA,94133,,,,,82315_20161020,10/20/2016 0:00,94.0,Routine - Unscheduled,82315_20161020_103119,Inadequate and inaccessible handwashing facilities,Moderate Risk,20161020,103119,2016-10-20,0,0,0,0,2,0,3
1068,1068,3827,32733,Xanath Ice Cream,951 Valencia St,San Francisco,CA,94110,37.757692999999996,-122.421136,"(37.757693, -122.421136)",,32733_20161020,10/20/2016 0:00,96.0,Routine - Unscheduled,32733_20161020_103129,Insufficient hot water or running water,Moderate Risk,20161020,103129,2016-10-20,2,0,1,0,1,2,0
1069,1069,3828,70071,Monterey Deli,499 Monterey Blvd,San Francisco,CA,94127,,,,14155741225.0,70071_20170928,9/28/2017 0:00,96.0,Routine - Unscheduled,70071_20170928_103120,Moderate risk food holding temperature,Moderate Risk,20170928,103120,2017-09-28,0,0,1,0,0,1,2
1070,1070,3829,19043,Underdogs Sports Bar & Grill,1824 Irving St,San Francisco,CA,94122,37.763597,-122.47763799999998,"(37.763597, -122.477638)",,19043_20161209,12/9/2016 0:00,87.0,Routine - Unscheduled,19043_20161209_103124,Inadequately cleaned or sanitized food contact surfaces,Moderate Risk,20161209,103124,2016-12-09,0,0,3,0,3,3,0
1071,1071,3830,4519,HSS 121 CAFE,1600 HOLLOWAY Ave,San Francisco,CA,94132,37.720851,-122.477084,"(37.720851, -122.477084)",14155374525.0,4519_20160509,5/9/2016 0:00,96.0,Routine - Unscheduled,4519_20160509_103129,Insufficient hot water or running water,Moderate Risk,20160509,103129,2016-05-09,0,0,1,0,0,1,0
1072,1072,3833,80659,Azalina's,1355 Market St,San Francisco,CA,94103,,,,,80659_20170106,1/6/2017 0:00,94.0,Routine - Unscheduled,80659_20170106_103157,Food safety certificate or food handler card not available,Low Risk,20170106,103157,2017-01-06,0,0,3,0,2,5,1
1073,1073,3835,741,MOZZARELLA DI BUFALA PIZZERIA II,069 WEST PORTAL Ave,San Francisco,CA,94127,37.740052,-122.466544,"(37.740052, -122.466544)",14155668900.0,741_20180222,2/22/2018 0:00,94.0,Routine - Unscheduled,741_20180222_103144,Unapproved or unmaintained equipment or utensils,Low Risk,20180222,103144,2018-02-22,2,0,0,0,0,4,0
1074,1074,3837,36861,Double Decker,465 Grove St,San Francisco,CA,94102,37.777673,-122.42408700000001,"(37.777673, -122.424087)",,36861_20170504,5/4/2017 0:00,,Complaint,36861_20170504_103142,Unclean nonfood contact surfaces,Low Risk,20170504,103142,2017-05-04,0,2,0,4,0,2,0
1075,1075,3841,65679,Red House Bakery,2818 San Bruno Ave,San Francisco,CA,94134,37.72618,-122.40308200000001,"(37.72618, -122.403082)",,65679_20171204,12/4/2017 0:00,81.0,Routine - Unscheduled,65679_20171204_103103,High risk food holding temperature,High Risk,20171204,103103,2017-12-04,0,6,0,0,6,5,0
1076,1076,3847,65396,Carmelina's Cafe,1855 Folsom St,San Francisco,CA,94103,37.767664,-122.415456,"(37.767664, -122.415456)",,65396_20170106,1/6/2017 0:00,87.0,Routine - Unscheduled,65396_20170106_103139,Improper food storage,Low Risk,20170106,103139,2017-01-06,0,1,0,0,3,0,0
1077,1077,3851,462,Garden of Eden,529 Broadway St,San Francisco,CA,94133,37.797933,-122.40601799999999,"(37.797933, -122.406018)",,462_20160520,5/20/2016 0:00,94.0,Routine - Unscheduled,462_20160520_103124,Inadequately cleaned or sanitized food contact surfaces,Moderate Risk,20160520,103124,2016-05-20,0,0,1,0,0,2,0
1078,1078,3858,87122,Devil's Teeth Inc,3876 Noriega St,San Francisco,CA,94122,,,,14155685533.0,87122_20161018,10/18/2016 0:00,98.0,Routine - Unscheduled,87122_20161018_103154,Unclean or degraded floors walls or ceilings,Low Risk,20161018,103154,2016-10-18,0,1,0,0,1,0,0
1079,1079,3869,12344,The Village Market & Pizza,750 Font Blvd,San Francisco,CA,94132,37.723462,-122.48301200000002,"(37.723462, -122.483012)",14155374525.0,12344_20160511,5/11/2016 0:00,96.0,Routine - Unscheduled,12344_20160511_103120,Moderate risk food holding temperature,Moderate Risk,20160511,103120,2016-05-11,0,1,0,0,1,1,0
1080,1080,3882,3317,Pane e Vino Trattoria,1715 UNION St,San Francisco,CA,94123,37.798063,-122.427637,"(37.798063, -122.427637)",14155442111.0,3317_20160906,9/6/2016 0:00,93.0,Routine - Unscheduled,3317_20160906_103105,Improper cooling methods,High Risk,20160906,103105,2016-09-06,0,7,0,0,0,1,4
1081,1081,3883,86798,Futo,3224 22nd St,San Francisco,CA,94110,,,,,86798_20161019,10/19/2016 0:00,,Reinspection/Followup,86798_20161019_103132,Improper thawing methods,Moderate Risk,20161019,103132,2016-10-19,0,0,0,0,1,2,0
1082,1082,3895,82097,The Lunchpad,581 Hayes St,San Francisco,CA,94102,,,,,82097_20160419,4/19/2016 0:00,87.0,Routine - Unscheduled,82097_20160419_103102,Unclean hands or improper use of gloves,High Risk,20160419,103102,2016-04-19,0,2,0,3,0,3,0
1083,1083,3908,538,Marnee Thai Restaurant,2225 Irving St,San Francisco,CA,94122,37.763343,-122.48180900000001,"(37.763343, -122.481809)",,538_20160411,4/11/2016 0:00,85.0,Routine - Unscheduled,538_20160411_103149,Wiping cloths not clean or properly stored or inadequate sanitizer,Low Risk,20160411,103149,2016-04-11,0,0,4,0,0,4,0
1084,1084,3911,63897,Bob's Donuts and Pastries,1621 Polk St,San Francisco,CA,94109,37.791914,-122.420984,"(37.791914, -122.420984)",14155773141.0,63897_20160406,4/6/2016 0:00,96.0,Routine - Unscheduled,63897_20160406_103154,Unclean or degraded floors walls or ceilings,Low Risk,20160406,103154,2016-04-06,0,0,3,0,3,2,0
1085,1085,3912,5453,AT&T - (CART 6)  BAYSIDE BREWS,24 WILLIE MAYS PLAZA,San Francisco,CA,94107,,,,14155971500.0,5453_20160410,4/10/2016 0:00,92.0,Routine - Unscheduled,5453_20160410_103120,Moderate risk food holding temperature,Moderate Risk,20160410,103120,2016-04-10,0,0,0,0,0,2,0
1086,1086,3927,80236,Spinnerie,1401 Polk St,San Francisco,CA,94109,,,,,80236_20160329,3/29/2016 0:00,90.0,Routine - Unscheduled,80236_20160329_103119,Inadequate and inaccessible handwashing facilities,Moderate Risk,20160329,103119,2016-03-29,2,0,5,0,8,0,3
1087,1087,3931,5843,HOOVER MIDDLE SCHOOL,2290 14th Ave,San Francisco,CA,94116,37.745374,-122.470308,"(37.745374, -122.470308)",14155752783.0,5843_20160412,4/12/2016 0:00,86.0,Routine - Unscheduled,5843_20160412_103129,Insufficient hot water or running water,Moderate Risk,20160412,103129,2016-04-12,0,0,0,0,1,4,2
1088,1088,3936,67174,Cybernet Entertainment,1800 Mission St,San Francisco,CA,94103,37.768168,-122.419995,"(37.768168, -122.419995)",,67174_20160629,6/29/2016 0:00,98.0,Routine - Unscheduled,67174_20160629_103139,Improper food storage,Low Risk,20160629,103139,2016-06-29,1,0,0,0,0,1,0
1089,1089,3943,2032,QUEEN ANNE HOTEL,1590 SUTTER St,San Francisco,CA,94109,37.786988,-122.426464,"(37.786988, -122.426464)",14155442828.0,2032_20160126,1/26/2016 0:00,90.0,Routine - Unscheduled,2032_20160126_103129,Insufficient hot water or running water,Moderate Risk,20160126,103129,2016-01-26,0,0,0,0,3,0,3
1090,1090,3944,33527,Popeyes Chicken & Biscuits,1426 Fillmore St Space T,San Francisco,CA,94115,37.782817,-122.432577,"(37.782817, -122.432577)",,33527_20160128,1/28/2016 0:00,92.0,Routine - Unscheduled,33527_20160128_103154,Unclean or degraded floors walls or ceilings,Low Risk,20160128,103154,2016-01-28,5,0,0,0,4,4,3
1091,1091,3949,19094,Rigolo,3465 California St,San Francisco,CA,94118,37.786663,-122.45114699999999,"(37.786663, -122.451147)",,19094_20161004,10/4/2016 0:00,,Complaint,19094_20161004_103149,Wiping cloths not clean or properly stored or inadequate sanitizer,Low Risk,20161004,103149,2016-10-04,3,0,0,0,2,0,3
1092,1092,3970,63713,Superb Garden Grocery,2433 Noriega St,San Francisco,CA,94122,37.75360300000001,-122.48968799999999,"(37.753603, -122.489688)",,63713_20160523,5/23/2016 0:00,96.0,Routine - Unscheduled,63713_20160523_103119,Inadequate and inaccessible handwashing facilities,Moderate Risk,20160523,103119,2016-05-23,0,2,0,0,2,1,0
1093,1093,3976,69368,Onigilly,343 Kearny St,San Francisco,CA,94108,37.791149,-122.40417099999999,"(37.791149, -122.404171)",14155674706.0,69368_20160505,5/5/2016 0:00,86.0,Routine - Unscheduled,69368_20160505_103127,Noncompliance with HAACP plan or variance,Moderate Risk,20160505,103127,2016-05-05,0,0,2,0,0,5,0
1094,1094,3977,424,CHATZ,301 ARKANSAS St,San Francisco,CA,94107,37.762334,-122.398416,"(37.762334, -122.398416)",,424_20150505,5/5/2015 0:00,81.0,Routine - Unscheduled,424_20150505_103129,Insufficient hot water or running water,Moderate Risk,20150505,103129,2015-05-05,0,5,0,0,5,0,5
1095,1095,3980,81170,Limon Rotisserie,5800 03rd St  1004,San Francisco,CA,94124,,,,,81170_20170821,8/21/2017 0:00,,Complaint,81170_20170821_103114,High risk vermin infestation,High Risk,20170821,103114,2017-08-21,0,0,7,0,3,0,2
1096,1096,3981,69195,Center Cafe,205 13th St,San Francisco,CA,94103,37.769751,-122.41832,"(37.769751, -122.41832)",14155863888.0,69195_20170621,6/21/2017 0:00,81.0,Routine - Unscheduled,69195_20170621_103154,Unclean or degraded floors walls or ceilings,Low Risk,20170621,103154,2017-06-21,0,0,0,6,0,5,0
1097,1097,3991,66679,New Woey Loy Goey Restaurant,699 Jackson St,San Francisco,CA,94133,37.796013,-122.406507,"(37.796013, -122.406507)",,66679_20160503,5/3/2016 0:00,72.0,Routine - Unscheduled,66679_20160503_103103,High risk food holding temperature,High Risk,20160503,103103,2016-05-03,0,9,0,0,0,7,0
1098,1098,3998,69044,AT&T PARK - NEW DERBY GRILL,24 Willie Mays Plaza,San Francisco,CA,94107,,,,,69044_20160814,8/14/2016 0:00,96.0,Routine - Unscheduled,69044_20160814_103120,Moderate risk food holding temperature,Moderate Risk,20160814,103120,2016-08-14,0,0,1,2,2,1,0
1099,1099,4009,84888,Christopher Elbow Chocolates,401 Hayes St,San Francisco,CA,94102,,,,,84888_20151023,10/23/2015 0:00,90.0,Routine - Unscheduled,84888_20151023_103129,Insufficient hot water or running water,Moderate Risk,20151023,103129,2015-10-23,0,1,0,1,0,0,3
1100,1100,4020,80935,Advance Magazine Publishers Inc.,520 03 St  Third Floor,San Francisco,CA,94107,,,,14155275152.0,80935_20170925,9/25/2017 0:00,94.0,Routine - Unscheduled,80935_20170925_103139,Improper food storage,Low Risk,20170925,103139,2017-09-25,0,0,2,0,0,0,0
1101,1101,4023,7663,GGP MARKET,2948 24th St,San Francisco,CA,94110,37.752748,-122.410822,"(37.752748, -122.410822)",,7663_20170104,1/4/2017 0:00,94.0,Routine - Unscheduled,7663_20170104_103142,Unclean nonfood contact surfaces,Low Risk,20170104,103142,2017-01-04,0,3,3,0,3,3,3
1102,1102,4026,3640,HAYES STREET GRILL,324 HAYES St,San Francisco,CA,94102,37.777048,-122.421844,"(37.777048, -122.421844)",,3640_20150402,4/2/2015 0:00,,Complaint,3640_20150402_103125,Noncompliance with shell fish tags or display,Moderate Risk,20150402,103125,2015-04-02,0,0,4,0,0,2,2
1103,1103,4033,816,B & J QUARTER POUNDER BURGERS,6202 03rd St,San Francisco,CA,94124,37.722374,-122.39584099999999,"(37.722374, -122.395841)",,816_20150819,8/19/2015 0:00,87.0,Routine - Unscheduled,816_20150819_103103,High risk food holding temperature,High Risk,20150819,103103,2015-08-19,0,0,0,0,3,0,3
1104,1104,4035,5856,Sanchez School,325 Sanchez St,San Francisco,CA,94114,37.76395,-122.43076699999999,"(37.76395, -122.430767)",14155246380.0,5856_20180226,2/26/2018 0:00,98.0,Routine - Unscheduled,5856_20180226_103154,Unclean or degraded floors walls or ceilings,Low Risk,20180226,103154,2018-02-26,1,0,2,0,0,1,2
1105,1105,4036,84381,TANCCA,776 Broadway St,San Francisco,CA,94133,,,,,84381_20170106,1/6/2017 0:00,90.0,Routine - Unscheduled,84381_20170106_103119,Inadequate and inaccessible handwashing facilities,Moderate Risk,20170106,103119,2017-01-06,0,6,0,0,3,5,0
1106,1106,4040,82955,Philz Coffee,549 Castro St,San Francisco,CA,94114,,,,14155835933.0,82955_20161110,11/10/2016 0:00,96.0,Routine - Unscheduled,82955_20161110_103124,Inadequately cleaned or sanitized food contact surfaces,Moderate Risk,20161110,103124,2016-11-10,0,1,0,0,1,0,0
1107,1107,4044,78852,Pork Store Cafe Valencia,3122 16th St,San Francisco,CA,94103,,,,14155625523.0,78852_20171207,12/7/2017 0:00,89.0,Routine - Unscheduled,78852_20171207_103120,Moderate risk food holding temperature,Moderate Risk,20171207,103120,2017-12-07,0,2,0,0,0,3,5
1108,1108,4047,5818,MISSION ED. CENTER ELEMENTARY,1670 NOE St,San Francisco,CA,94131,37.742294,-122.43104,"(37.742294, -122.43104)",14155695313.0,5818_20160317,3/17/2016 0:00,93.0,Routine - Unscheduled,5818_20160317_103103,High risk food holding temperature,High Risk,20160317,103103,2016-03-17,0,0,0,0,2,0,1
1109,1109,4050,36850,A.K. Meat,2346 clement st.,San Francisco,CA,94118,37.782058,-122.484602,"(37.782058, -122.484602)",,36850_20160418,4/18/2016 0:00,89.0,Routine - Unscheduled,36850_20160418_103107,Improper reheating of food,High Risk,20160418,103107,2016-04-18,0,0,2,0,3,3,0
1110,1110,4051,1671,Just For You Cafe Inc.,732 22ND St,San Francisco,CA,94107,37.757948,-122.38886200000002,"(37.757948, -122.388862)",,1671_20150330,3/30/2015 0:00,86.0,Routine - Unscheduled,1671_20150330_103120,Moderate risk food holding temperature,Moderate Risk,20150330,103120,2015-03-30,0,0,0,0,3,0,2
1111,1111,4057,86992,JW Marriott SF Union Square,500 Post St,San Francisco,CA,94102,,,,14155922030.0,86992_20161209,12/9/2016 0:00,98.0,Routine - Unscheduled,86992_20161209_103159,Worker safety hazards,Low Risk,20161209,103159,2016-12-09,0,0,0,0,1,0,0
1112,1112,4065,2244,Starbucks Coffee Company,295 California St,San Francisco,CA,94111,37.793225,-122.399899,"(37.793225, -122.399899)",,2244_20160609,6/9/2016 0:00,96.0,Routine - Unscheduled,2244_20160609_103124,Inadequately cleaned or sanitized food contact surfaces,Moderate Risk,20160609,103124,2016-06-09,0,1,0,0,0,1,0
1113,1113,4066,67495,Southern Pacific Brewing,620 Treat Ave,San Francisco,CA,94110,37.760191999999996,-122.41379199999999,"(37.760192, -122.413792)",,67495_20171208,12/8/2017 0:00,96.0,Routine - Unscheduled,67495_20171208_103133,Foods not protected from contamination,Moderate Risk,20171208,103133,2017-12-08,0,1,0,0,2,0,1
1114,1114,4072,69053,AT&T PARK - 134 HOT CORNER BAR,24 Willie Mays Plaza,San Francisco,CA,94107,,,,14155971500.0,69053_20160814,8/14/2016 0:00,98.0,Routine - Unscheduled,69053_20160814_103144,Unapproved or unmaintained equipment or utensils,Low Risk,20160814,103144,2016-08-14,0,0,1,0,0,1,0
1115,1115,4075,83841,Bruno's Pizza & Restaurant,1375 Fillmore St,San Francisco,CA,94115,,,,,83841_20161107,11/7/2016 0:00,93.0,Routine - Unscheduled,83841_20161107_103103,High risk food holding temperature,High Risk,20161107,103103,2016-11-07,0,0,0,0,1,0,2
1116,1116,4078,1116,STARBUCKS COFFEE #509,1899 UNION St,San Francisco,CA,94123,37.797713,-122.43033600000001,"(37.797713, -122.430336)",14155924049.0,1116_20170929,9/29/2017 0:00,,Reinspection/Followup,1116_20170929_103109,Unclean or unsanitary food contact surfaces,High Risk,20170929,103109,2017-09-29,0,0,1,0,0,2,3
1117,1117,4090,65014,The Old Clam House,299 BAYSHORE Blvd,San Francisco,CA,94124,37.743212,-122.405055,"(37.743212, -122.405055)",,65014_20150622,6/22/2015 0:00,84.0,Routine - Unscheduled,65014_20150622_103103,High risk food holding temperature,High Risk,20150622,103103,2015-06-22,0,0,0,6,0,0,1
1118,1118,4117,91564,Guckenheimer 1142.01,1 Market St.,San Francisco,CA,94105,,,,,91564_20171211,12/11/2017 0:00,96.0,Routine - Unscheduled,91564_20171211_103119,Inadequate and inaccessible handwashing facilities,Moderate Risk,20171211,103119,2017-12-11,0,1,0,0,0,0,0
1119,1119,4128,80629,Kazan,2809 24th St,San Francisco,CA,94110,,,,14155824045.0,80629_20160108,1/8/2016 0:00,,New Ownership,80629_20160108_103119,Inadequate and inaccessible handwashing facilities,Moderate Risk,20160108,103119,2016-01-08,3,0,3,0,4,2,1
1120,1120,4138,69575,Thomas John Events,1501 Cortland Ave,San Francisco,CA,94110,37.739764,-122.409475,"(37.739764, -122.409475)",,69575_20150508,5/8/2015 0:00,100.0,Routine - Unscheduled,69575_20150508_103119,Inadequate and inaccessible handwashing facilities,Moderate Risk,20150508,103119,2015-05-08,0,0,0,0,0,0,1
1121,1121,4148,79401,S & B Supermarket Inc.,2203 Irving St,San Francisco,CA,94122,,,,,79401_20160418,4/18/2016 0:00,94.0,Routine - Unscheduled,79401_20160418_103139,Improper food storage,Low Risk,20160418,103139,2016-04-18,0,3,0,0,1,2,0
1122,1122,4181,253,Ann's Donut Coffee Shop,4488 Mission St,San Francisco,CA,94112,37.725949,-122.43390600000001,"(37.725949, -122.433906)",14155331761.0,253_20161208,12/8/2016 0:00,96.0,Routine - Unscheduled,253_20161208_103154,Unclean or degraded floors walls or ceilings,Low Risk,20161208,103154,2016-12-08,0,4,0,0,2,2,0
1123,1123,4185,30532,Roadhouse Cafe,5191 03rd St,San Francisco,CA,94124,37.73095900000001,-122.39193999999999,"(37.730959, -122.39194)",,30532_20150721,7/21/2015 0:00,87.0,Routine - Unscheduled,30532_20150721_103103,High risk food holding temperature,High Risk,20150721,103103,2015-07-21,0,0,0,0,2,0,3
1124,1124,4195,32671,La Taqueria Guadalajara,3146 24th St,San Francisco,CA,94110,37.752512,-122.41510900000002,"(37.752512, -122.415109)",14155644892.0,32671_20160629,6/29/2016 0:00,84.0,Routine - Unscheduled,32671_20160629_103142,Unclean nonfood contact surfaces,Low Risk,20160629,103142,2016-06-29,0,0,5,0,7,7,4
1125,1125,4197,5104,In-N-Out Burger,333 Jefferson St,San Francisco,CA,94133,37.807922999999995,-122.41788700000001,"(37.807923, -122.417887)",,5104_20160630,6/30/2016 0:00,98.0,Routine - Unscheduled,5104_20160630_103156,Permit license or inspection report not posted,Low Risk,20160630,103156,2016-06-30,0,1,0,0,0,1,0
1126,1126,4200,7771,NEW SWEETHEART BAKERY,2956 24th St,San Francisco,CA,94110,37.752756,-122.41108600000001,"(37.752756, -122.411086)",,7771_20170104,1/4/2017 0:00,90.0,Routine - Unscheduled,7771_20170104_103139,Improper food storage,Low Risk,20170104,103139,2017-01-04,0,0,4,0,5,5,5
1127,1127,4203,36570,"7-Eleven, Store 2366-21389F",2200 BAYSHORE Blvd,San Francisco,CA,94134,37.712165999999996,-122.402934,"(37.712166, -122.402934)",,36570_20160701,7/1/2016 0:00,83.0,Routine - Unscheduled,36570_20160701_103120,Moderate risk food holding temperature,Moderate Risk,20160701,103120,2016-07-01,0,5,0,0,4,4,0
1128,1128,4208,2228,Tokyo Express,660 Sacramento St,San Francisco,CA,94111,37.793698,-122.40398400000001,"(37.793698, -122.403984)",,2228_20160204,2/4/2016 0:00,,Reinspection/Followup,2228_20160204_103142,Unclean nonfood contact surfaces,Low Risk,20160204,103142,2016-02-04,0,0,0,0,7,0,2
1129,1129,4221,4425,STARBUCKS COFFEE,1298 HOWARD St,San Francisco,CA,94103,37.775314,-122.412819,"(37.775314, -122.412819)",14155567385.0,4425_20160504,5/4/2016 0:00,94.0,Routine - Unscheduled,4425_20160504_103149,Wiping cloths not clean or properly stored or inadequate sanitizer,Low Risk,20160504,103149,2016-05-04,0,2,0,0,3,3,0
1130,1130,4231,3895,Cable Car Restaurant,1040 Columbus Ave,San Francisco,CA,94133,37.803984,-122.415453,"(37.803984, -122.415453)",14155744455.0,3895_20160217,2/17/2016 0:00,78.0,Routine - Unscheduled,3895_20160217_103119,Inadequate and inaccessible handwashing facilities,Moderate Risk,20160217,103119,2016-02-17,6,0,6,0,0,8,6
1131,1131,4249,61516,Gastronaut LLC,5919 03rd St,San Francisco,CA,94124,37.724496,-122.394539,"(37.724496, -122.394539)",,61516_20150908,9/8/2015 0:00,87.0,Routine - Unscheduled,61516_20150908_103156,Permit license or inspection report not posted,Low Risk,20150908,103156,2015-09-08,0,0,0,0,1,0,3
1132,1132,4254,82718,Bon Appetit @ Twitter,875 Stevenson St 9th Floor,San Francisco,CA,94103,,,,,82718_20161207,12/7/2016 0:00,96.0,Routine - Unscheduled,82718_20161207_103145,Improper storage of equipment utensils or linens,Low Risk,20161207,103145,2016-12-07,0,0,0,0,2,2,0
1133,1133,4255,89931,Almanac San Francisco,2704 24th St,San Francisco,CA,94110,,,,,89931_20171201,12/1/2017 0:00,98.0,Routine - Unscheduled,89931_20171201_103145,Improper storage of equipment utensils or linens,Low Risk,20171201,103145,2017-12-01,0,1,0,0,0,0,0
1134,1134,4256,4806,WHITE PALACE LIQUOR & DELI,1524 SILVER Ave,San Francisco,CA,94134,37.732344,-122.405852,"(37.732344, -122.405852)",,4806_20160701,7/1/2016 0:00,92.0,Routine - Unscheduled,4806_20160701_103116,Inadequate food safety knowledge or lack of certified food safety manager,Moderate Risk,20160701,103116,2016-07-01,0,3,0,0,2,3,1
1135,1135,4266,39031,Moki's Sushi and Pacific Grill,615 CORTLAND AVENUE,San Francisco,CA,94110,37.739047,-122.415706,"(37.739047, -122.415706)",,39031_20160629,6/29/2016 0:00,94.0,Routine - Unscheduled,39031_20160629_103149,Wiping cloths not clean or properly stored or inadequate sanitizer,Low Risk,20160629,103149,2016-06-29,2,0,3,2,0,3,2
1136,1136,4274,420,Buster's,366 Columbus Ave,San Francisco,CA,94133,37.798444,-122.407444,"(37.798444, -122.407444)",,420_20160504,5/4/2016 0:00,78.0,Routine - Unscheduled,420_20160504_103148,No thermometers or uncalibrated thermometers,Low Risk,20160504,103148,2016-05-04,0,7,0,0,0,2,0
1137,1137,4278,84911,Fiorella,2339 Clement St,San Francisco,CA,94121,,,,,84911_20160609,6/9/2016 0:00,90.0,Routine - Unscheduled,84911_20160609_103157,Food safety certificate or food handler card not available,Low Risk,20160609,103157,2016-06-09,0,0,2,0,0,3,0
1138,1138,4279,62435,Church Key,1402 Grant Ave,San Francisco,CA,94133,37.799958000000004,-122.407417,"(37.799958, -122.407417)",,62435_20160504,5/4/2016 0:00,91.0,Routine - Unscheduled,62435_20160504_103109,Unclean or unsanitary food contact surfaces,High Risk,20160504,103109,2016-05-04,0,0,0,0,0,2,0
1139,1139,4285,81092,Vallarta's Taco Bar,3033 24th St,San Francisco,CA,94110,,,,14155828116.0,81092_20160701,7/1/2016 0:00,82.0,Routine - Unscheduled,81092_20160701_103120,Moderate risk food holding temperature,Moderate Risk,20160701,103120,2016-07-01,3,0,0,6,0,6,0
1140,1140,4287,15055,Ono Hawaiin BBQ,1501 Sloat #A,San Francisco,CA,94132,37.733973999999996,-122.489729,"(37.733974, -122.489729)",,15055_20161221,12/21/2016 0:00,93.0,Routine - Unscheduled,15055_20161221_103102,Unclean hands or improper use of gloves,High Risk,20161221,103102,2016-12-21,0,0,3,0,1,3,3
1141,1141,4292,88525,McDonald's,2805 Mission St,San Francisco,CA,94110,,,,14155253309.0,88525_20180227,2/27/2018 0:00,96.0,Routine - Unscheduled,88525_20180227_103161,Low risk vermin infestation,Low Risk,20180227,103161,2018-02-27,2,0,3,0,0,3,0
1142,1142,4295,92479,Dragoneats,350 Golden Gate Ave,San Francisco,CA,94102,,,,,92479_20171010,10/10/2017 0:00,,New Ownership,92479_20171010_103139,Improper food storage,Low Risk,20171010,103139,2017-10-10,0,1,0,0,0,0,0
1143,1143,4305,69494,Ottimista Enoteca-Cafe,1838 UNION St,San Francisco,CA,94123,,,,,69494_20150401,4/1/2015 0:00,90.0,Routine - Unscheduled,69494_20150401_103144,Unapproved or unmaintained equipment or utensils,Low Risk,20150401,103144,2015-04-01,0,5,0,9,0,0,5
1144,1144,4307,63413,Mymy,1500 California St,San Francisco,CA,94109,37.790797999999995,-122.419214,"(37.790798, -122.419214)",14155807466.0,63413_20160701,7/1/2016 0:00,87.0,Routine - Unscheduled,63413_20160701_103102,Unclean hands or improper use of gloves,High Risk,20160701,103102,2016-07-01,0,2,0,0,2,3,3
1145,1145,4308,79121,Black Sands,701 Haight St,San Francisco,CA,94117,,,,14155535194.0,79121_20170103,1/3/2017 0:00,92.0,Routine - Unscheduled,79121_20170103_103148,No thermometers or uncalibrated thermometers,Low Risk,20170103,103148,2017-01-03,0,0,0,0,3,0,0
1146,1146,4323,32845,Genki Ramen,3944 Geary Blvd,San Francisco,CA,94118,37.78122800000001,-122.461851,"(37.781228, -122.461851)",,32845_20160705,7/5/2016 0:00,75.0,Routine - Unscheduled,32845_20160705_103145,Improper storage of equipment utensils or linens,Low Risk,20160705,103145,2016-07-05,0,0,0,0,4,7,0
1147,1147,4328,69501,Fog City,1300 Battery St,San Francisco,CA,94111,,,,14155982000.0,69501_20160325,3/25/2016 0:00,,Reinspection/Followup,69501_20160325_103109,Unclean or unsanitary food contact surfaces,High Risk,20160325,103109,2016-03-25,0,0,0,2,0,3,1
1148,1148,4335,1154,SUNFLOWER RESTAURANT,506 Valencia St,San Francisco,CA,94103,37.764678,-122.42190500000001,"(37.764678, -122.421905)",14155625023.0,1154_20160912,9/12/2016 0:00,76.0,Routine - Unscheduled,1154_20160912_103119,Inadequate and inaccessible handwashing facilities,Moderate Risk,20160912,103119,2016-09-12,5,0,0,0,0,7,4
1149,1149,4336,5074,NOAH'S NEW YORK BAGELS #2105,1521 SLOAT Blvd,San Francisco,CA,94132,37.733944,-122.49043799999998,"(37.733944, -122.490438)",,5074_20160610,6/10/2016 0:00,88.0,Routine - Unscheduled,5074_20160610_103119,Inadequate and inaccessible handwashing facilities,Moderate Risk,20160610,103119,2016-06-10,0,0,2,0,3,4,5
1150,1150,4337,35503,Left Coast Catering and Cafe,2152 03rd St,San Francisco,CA,94107,37.762368,-122.38887700000001,"(37.762368, -122.388877)",,35503_20150601,6/1/2015 0:00,94.0,Routine - Unscheduled,35503_20150601_103150,Improper or defective plumbing,Low Risk,20150601,103150,2015-06-01,0,0,0,0,0,0,1
1151,1151,4338,69769,Whole Foods Market,1150 Ocean Ave,San Francisco,CA,94112,37.723652,-122.45461,"(37.723652, -122.45461)",14155337400.0,69769_20160628,6/28/2016 0:00,90.0,Routine - Unscheduled,69769_20160628_103120,Moderate risk food holding temperature,Moderate Risk,20160628,103120,2016-06-28,0,0,0,4,0,4,0
1152,1152,4341,90971,Esan Classic,739 Larkin St,San Francisco,CA,94109,,,,,90971_20170929,9/29/2017 0:00,89.0,Routine - Unscheduled,90971_20170929_103103,High risk food holding temperature,High Risk,20170929,103103,2017-09-29,0,0,2,0,0,0,0
1153,1153,4344,2143,THE BITTER END,441 CLEMENT St,San Francisco,CA,94118,37.782933,-122.46408000000001,"(37.782933, -122.46408)",,2143_20160609,6/9/2016 0:00,86.0,Routine - Unscheduled,2143_20160609_103139,Improper food storage,Low Risk,20160609,103139,2016-06-09,0,0,0,0,3,5,0
1154,1154,4350,67809,Big Four Restaurant,1075 California St,San Francisco,CA,94108,37.791643,-122.412067,"(37.791643, -122.412067)",,67809_20160609,6/9/2016 0:00,76.0,Routine - Unscheduled,67809_20160609_103120,Moderate risk food holding temperature,Moderate Risk,20160609,103120,2016-06-09,3,0,0,0,0,6,0
1155,1155,4356,2596,LA VIE VIETNAMESE REST,5830 GEARY Blvd,San Francisco,CA,94121,37.780297999999995,-122.482022,"(37.780298, -122.482022)",,2596_20160609,6/9/2016 0:00,74.0,Routine - Unscheduled,2596_20160609_103103,High risk food holding temperature,High Risk,20160609,103103,2016-06-09,0,0,4,0,0,6,0
1156,1156,4358,5494,AT&T - (CART 18) NACHO-COMPADRES [145106],24 WILLIE MAYS PLAZA,San Francisco,CA,94107,,,,14155971500.0,5494_20160814,8/14/2016 0:00,98.0,Routine - Unscheduled,5494_20160814_103145,Improper storage of equipment utensils or linens,Low Risk,20160814,103145,2016-08-14,0,0,0,1,0,1,3
1157,1157,4359,5867,MALCOLM X ELEMENTARY SCHOOL,350 Harbor Rd,San Francisco,CA,94124,37.733740999999995,-122.380619,"(37.733741, -122.380619)",14155695950.0,5867_20150910,9/10/2015 0:00,96.0,Routine - Unscheduled,5867_20150910_103116,Inadequate food safety knowledge or lack of certified food safety manager,Moderate Risk,20150910,103116,2015-09-10,0,0,1,0,0,0,1
1158,1158,4360,403,HAAGEN-DAZS #561,865 MARKET St,San Francisco,CA,94103,37.784317,-122.40756299999998,"(37.784317, -122.407563)",14155891550.0,403_20160701,7/1/2016 0:00,81.0,Routine - Unscheduled,403_20160701_103119,Inadequate and inaccessible handwashing facilities,Moderate Risk,20160701,103119,2016-07-01,0,0,4,0,0,6,5
1159,1159,4361,7087,VALENCIA FARMER'S MARKET,1299 VALENCIA St,San Francisco,CA,94110,37.752162,-122.420585,"(37.752162, -122.420585)",14155286863.0,7087_20160701,7/1/2016 0:00,92.0,Routine - Unscheduled,7087_20160701_103119,Inadequate and inaccessible handwashing facilities,Moderate Risk,20160701,103119,2016-07-01,4,0,4,0,0,3,3
1160,1160,4363,62785,Harrison Shell,1201 Harrison St,San Francisco,CA,94103,37.773568,-122.40871200000001,"(37.773568, -122.408712)",,62785_20170106,1/6/2017 0:00,90.0,Routine - Unscheduled,62785_20170106_103119,Inadequate and inaccessible handwashing facilities,Moderate Risk,20170106,103119,2017-01-06,0,4,0,0,3,0,0
1161,1161,4365,68298,Walgreens #4609,1301 Market St,San Francisco,CA,94103,37.777167999999996,-122.416702,"(37.777168, -122.416702)",,68298_20160630,6/30/2016 0:00,92.0,Routine - Unscheduled,68298_20160630_103119,Inadequate and inaccessible handwashing facilities,Moderate Risk,20160630,103119,2016-06-30,0,0,0,2,0,3,0
1162,1162,4367,86393,Corridor Cafe,100 Van Ness Ave B,San Francisco,CA,94102,,,,,86393_20160705,7/5/2016 0:00,89.0,Routine - Unscheduled,86393_20160705_103157,Food safety certificate or food handler card not available,Low Risk,20160705,103157,2016-07-05,0,0,0,0,0,3,0
1163,1163,4368,37304,Balompie Cafe No. 3 Inc.,3801 Mission St,San Francisco,CA,94110,37.73598,-122.424438,"(37.73598, -122.424438)",,37304_20160629,6/29/2016 0:00,89.0,Routine - Unscheduled,37304_20160629_103105,Improper cooling methods,High Risk,20160629,103105,2016-06-29,6,0,0,0,4,3,2
1164,1164,4369,86385,Poki Time,549 Irving St,San Francisco,CA,94122,,,,14155706333.0,86385_20160314,3/14/2016 0:00,90.0,Routine - Unscheduled,86385_20160314_103132,Improper thawing methods,Moderate Risk,20160314,103132,2016-03-14,6,0,0,0,0,0,3
1165,1165,4373,3054,McCormick & Kuleto's Seafood Restaunt,900 North Point St,San Francisco,CA,94109,37.805427,-122.422854,"(37.805427, -122.422854)",,3054_20160609,6/9/2016 0:00,89.0,Routine - Unscheduled,3054_20160609_103143,Inadequate warewashing facilities or equipment,Low Risk,20160609,103143,2016-06-09,0,0,0,0,0,3,2
1166,1166,4374,935,PEKING WOK RESTAURANT,4920 03rd St,San Francisco,CA,94124,37.733891,-122.39118300000001,"(37.733891, -122.391183)",,935_20150928,9/28/2015 0:00,85.0,Routine - Unscheduled,935_20150928_103102,Unclean hands or improper use of gloves,High Risk,20150928,103102,2015-09-28,5,3,0,0,0,4,3
1167,1167,4376,88239,Foodie,133 6th St,San Francisco,CA,94103,,,,14155721394.0,88239_20171213,12/13/2017 0:00,98.0,Routine - Unscheduled,88239_20171213_103138,Improper storage use or identification of toxic substances,Low Risk,20171213,103138,2017-12-13,0,1,0,0,0,1,0
1168,1168,4382,5982,SF Senior Center at Aquatic Park Meals Program,890 Beach St,San Francisco,CA,94109,37.806258,-122.423704,"(37.806258, -122.423704)",,5982_20160418,4/18/2016 0:00,96.0,Routine - Unscheduled,5982_20160418_103131,Moderate risk vermin infestation,Moderate Risk,20160418,103131,2016-04-18,0,0,1,0,0,1,2
1169,1169,4386,84095,Juice Shop,2 Trinity Pl,San Francisco,CA,94104,,,,,84095_20170104,1/4/2017 0:00,87.0,Routine - Unscheduled,84095_20170104_103102,Unclean hands or improper use of gloves,High Risk,20170104,103102,2017-01-04,0,0,0,0,3,0,0
1170,1170,4387,35771,Starbucks Coffee,462 Powell St,San Francisco,CA,94102,37.788918,-122.408507,"(37.788918, -122.408507)",,35771_20171211,12/11/2017 0:00,98.0,Routine - Unscheduled,35771_20171211_103149,Wiping cloths not clean or properly stored or inadequate sanitizer,Low Risk,20171211,103149,2017-12-11,0,1,0,0,0,1,1
1171,1171,4388,3504,Oriental Pearl Restaurant,760 Clay St,San Francisco,CA,94108,37.794346999999995,-122.40599399999999,"(37.794347, -122.405994)",,3504_20160630,6/30/2016 0:00,94.0,Routine - Unscheduled,3504_20160630_103154,Unclean or degraded floors walls or ceilings,Low Risk,20160630,103154,2016-06-30,0,4,0,0,2,2,3
1172,1172,4393,71831,Cafe Terminus,16 California St,San Francisco,CA,94111,,,,,71831_20160705,7/5/2016 0:00,82.0,Routine - Unscheduled,71831_20160705_103119,Inadequate and inaccessible handwashing facilities,Moderate Risk,20160705,103119,2016-07-05,0,7,0,0,0,6,0
1173,1173,4394,5816,WEST PORTAL ELEMENTARY SCHOOL,5 LENOX Way,San Francisco,CA,94127,,,,14155752846.0,5816_20160411,4/11/2016 0:00,94.0,Routine - Unscheduled,5816_20160411_103131,Moderate risk vermin infestation,Moderate Risk,20160411,103131,2016-04-11,0,0,0,0,1,2,2
1174,1174,4403,268,LOS HERMANOS,2026 CHESTNUT St,San Francisco,CA,94123,37.800767,-122.436924,"(37.800767, -122.436924)",,268_20150903,9/3/2015 0:00,94.0,Routine - Unscheduled,268_20150903_103145,Improper storage of equipment utensils or linens,Low Risk,20150903,103145,2015-09-03,0,0,0,0,0,2,2
1175,1175,4426,80627,A & L Sweet,709 Larkin St,San Francisco,CA,94109,,,,14155449003.0,80627_20160909,9/9/2016 0:00,82.0,Routine - Unscheduled,80627_20160909_103149,Wiping cloths not clean or properly stored or inadequate sanitizer,Low Risk,20160909,103149,2016-09-09,8,0,5,0,0,6,0
1176,1176,4437,5912,ARGONNE ALTERNATIVE ELEMENTARY SCHO,680 18th Ave,San Francisco,CA,94118,37.775155,-122.476785,"(37.775155, -122.476785)",14155758460.0,5912_20180223,2/23/2018 0:00,93.0,Routine - Unscheduled,5912_20180223_103112,No hot water or running water,High Risk,20180223,103112,2018-02-23,1,0,0,1,0,0,0
1177,1177,4445,93490,Little Kite,3515 20th St.,San Francisco,CA,94110,,,,,93490_20180221,2/21/2018 0:00,72.0,Routine - Unscheduled,93490_20180221_103142,Unclean nonfood contact surfaces,Low Risk,20180221,103142,2018-02-21,6,0,0,0,0,0,0
1178,1178,4446,2974,LEAPING LEMUR CAFE,1 ZOO Rd,San Francisco,CA,94132,37.73017,-122.50253500000001,"(37.73017, -122.502535)",14155757182.0,2974_20160722,7/22/2016 0:00,89.0,Routine - Unscheduled,2974_20160722_103124,Inadequately cleaned or sanitized food contact surfaces,Moderate Risk,20160722,103124,2016-07-22,0,0,0,0,8,2,0
1179,1179,4450,75457,Doc Ricketts,124 Columbus Ave,San Francisco,CA,94133,,,,14150830418.0,75457_20161108,11/8/2016 0:00,96.0,Routine - Unscheduled,75457_20161108_103127,Noncompliance with HAACP plan or variance,Moderate Risk,20161108,103127,2016-11-08,0,0,0,0,1,0,0
1180,1180,4455,83005,Loews Regency San Francisco (Pantry),222 Sansome St 3rd Floor,San Francisco,CA,94104,,,,,83005_20170928,9/28/2017 0:00,96.0,Routine - Unscheduled,83005_20170928_103127,Noncompliance with HAACP plan or variance,Moderate Risk,20170928,103127,2017-09-28,0,0,1,0,0,2,0
1181,1181,4457,61187,The Deli Lama,150 TOLAND St #7,San Francisco,CA,94124,37.746322,-122.39679299999999,"(37.746322, -122.396793)",,61187_20150406,4/6/2015 0:00,96.0,Routine - Unscheduled,61187_20150406_103116,Inadequate food safety knowledge or lack of certified food safety manager,Moderate Risk,20150406,103116,2015-04-06,0,0,2,0,0,0,1
1182,1182,4468,4789,WHITCOMB  HOTEL- EMPLOYEES / BSMT CAFETERIA,1231 MARKET St,San Francisco,CA,94103,37.778357,-122.415182,"(37.778357, -122.415182)",14155628000.0,4789_20160630,6/30/2016 0:00,88.0,Routine - Unscheduled,4789_20160630_103120,Moderate risk food holding temperature,Moderate Risk,20160630,103120,2016-06-30,0,0,0,0,2,4,0
1183,1183,4489,74854,Gaspar,185 Sutter St,San Francisco,CA,94104,,,,,74854_20160901,9/1/2016 0:00,94.0,Routine - Unscheduled,74854_20160901_103120,Moderate risk food holding temperature,Moderate Risk,20160901,103120,2016-09-01,0,3,0,0,0,2,0
1184,1184,4495,1075,"SANDWICH PLACE, THE",2029 MISSION St,San Francisco,CA,94110,37.764384,-122.41956599999999,"(37.764384, -122.419566)",14155433811.0,1075_20160309,3/9/2016 0:00,,Complaint,1075_20160309_103144,Unapproved or unmaintained equipment or utensils,Low Risk,20160309,103144,2016-03-09,0,0,3,0,0,0,3
1185,1185,4498,7747,SAFEWAY STORE #964,4950 Mission St,San Francisco,CA,94112,37.71954,-122.438775,"(37.71954, -122.438775)",14155587200.0,7747_20160609,6/9/2016 0:00,81.0,Routine - Unscheduled,7747_20160609_103103,High risk food holding temperature,High Risk,20160609,103103,2016-06-09,0,0,4,0,5,6,0
1186,1186,4499,19171,Gestalt,3159 16th St,San Francisco,CA,94103,37.764803,-122.423309,"(37.764803, -122.423309)",,19171_20160912,9/12/2016 0:00,94.0,Routine - Unscheduled,19171_20160912_103120,Moderate risk food holding temperature,Moderate Risk,20160912,103120,2016-09-12,0,0,0,0,0,2,2
1187,1187,4505,19138,Pho Ha Tien,1900 OCEAN Ave,San Francisco,CA,94127,37.725305999999996,-122.46226100000001,"(37.725306, -122.462261)",,19138_20150423,4/23/2015 0:00,81.0,Routine - Unscheduled,19138_20150423_103103,High risk food holding temperature,High Risk,20150423,103103,2015-04-23,0,0,0,0,3,1,5
1188,1188,4511,70254,Dynamo Donut and Coffee,110 Yacht Rd,San Francisco,CA,94123,,,,,70254_20160909,9/9/2016 0:00,96.0,Routine - Unscheduled,70254_20160909_103142,Unclean nonfood contact surfaces,Low Risk,20160909,103142,2016-09-09,1,0,0,0,0,2,2
1189,1189,4514,89188,Genji Sushi CAS,2001 Market St,San Francisco,CA,94114,,,,14155525782.0,89188_20170228,2/28/2017 0:00,,New Ownership,89188_20170228_103149,Wiping cloths not clean or properly stored or inadequate sanitizer,Low Risk,20170228,103149,2017-02-28,0,1,0,0,2,0,0
1190,1190,4516,2233,The AA Bakery & Cafe,1068 Stockton St,San Francisco,CA,94108,37.795564,-122.40808999999999,"(37.795564, -122.40809)",,2233_20160610,6/10/2016 0:00,,Reinspection/Followup,2233_20160610_103103,High risk food holding temperature,High Risk,20160610,103103,2016-06-10,0,3,0,0,0,1,0
1191,1191,4524,72046,Palmer's,2298 Fillmore St,San Francisco,CA,94115,,,,,72046_20171004,10/4/2017 0:00,94.0,Routine - Unscheduled,72046_20171004_103144,Unapproved or unmaintained equipment or utensils,Low Risk,20171004,103144,2017-10-04,0,2,0,0,0,2,0
1192,1192,4529,23865,Bi-Rite Creamery,3692 18th St,San Francisco,CA,94110,37.761503999999995,-122.425817,"(37.761504, -122.425817)",,23865_20160816,8/16/2016 0:00,83.0,Routine - Unscheduled,23865_20160816_103102,Unclean hands or improper use of gloves,High Risk,20160816,103102,2016-08-16,3,0,0,0,0,4,2
1193,1193,4530,65896,Oasis Grill,200 04th St,San Francisco,CA,94103,37.783208,-122.40271899999999,"(37.783208, -122.402719)",,65896_20160817,8/17/2016 0:00,88.0,Routine - Unscheduled,65896_20160817_103124,Inadequately cleaned or sanitized food contact surfaces,Moderate Risk,20160817,103124,2016-08-17,0,3,0,0,0,4,0
1194,1194,4535,70939,La Fromagerie,2425 03rd St,San Francisco,CA,94107,,,,14155865002.0,70939_20150403,4/3/2015 0:00,92.0,Routine - Unscheduled,70939_20150403_103119,Inadequate and inaccessible handwashing facilities,Moderate Risk,20150403,103119,2015-04-03,0,0,0,0,3,0,1
1195,1195,4536,1700,Raintree Cafe,118 West Portal Ave,San Francisco,CA,94127,37.739413,-122.46744,"(37.739413, -122.46744)",14155249000.0,1700_20180222,2/22/2018 0:00,93.0,Routine - Unscheduled,1700_20180222_103103,High risk food holding temperature,High Risk,20180222,103103,2018-02-22,1,0,0,0,3,0,0
1196,1196,4538,80940,Goodfellas Pizzeria & Grill,377 Bay St Suite A,San Francisco,CA,94133,,,,14155391000.0,80940_20160815,8/15/2016 0:00,88.0,Routine - Unscheduled,80940_20160815_103124,Inadequately cleaned or sanitized food contact surfaces,Moderate Risk,20160815,103124,2016-08-15,6,0,6,0,0,5,5
1197,1197,4543,485,"Silverhat Bar, Inc",678 Green St,San Francisco,CA,94133,37.799388,-122.410223,"(37.799388, -122.410223)",,485_20161207,12/7/2016 0:00,96.0,Routine - Unscheduled,485_20161207_103161,Low risk vermin infestation,Low Risk,20161207,103161,2016-12-07,0,0,0,0,2,0,1
1198,1198,4545,768,MOSHI MOSHI,2092 03rd St,San Francisco,CA,94107,37.763187,-122.38889499999999,"(37.763187, -122.388895)",,768_20150601,6/1/2015 0:00,87.0,Routine - Unscheduled,768_20150601_103119,Inadequate and inaccessible handwashing facilities,Moderate Risk,20150601,103119,2015-06-01,0,0,0,0,3,0,3
1199,1199,4550,3630,MAD DOG IN THE FOG,530 HAIGHT St,San Francisco,CA,94117,37.772096999999995,-122.43081399999998,"(37.772097, -122.430814)",14155627279.0,3630_20160630,6/30/2016 0:00,90.0,Routine - Unscheduled,3630_20160630_103158,Unpermitted food facility,Low Risk,20160630,103158,2016-06-30,2,0,0,0,0,3,0
1200,1200,4551,4614,Sun Sang Market,1205 Stockton St,San Francisco,CA,94133,37.796973,-122.40850400000001,"(37.796973, -122.408504)",,4614_20160816,8/16/2016 0:00,75.0,Routine - Unscheduled,4614_20160816_103154,Unclean or degraded floors walls or ceilings,Low Risk,20160816,103154,2016-08-16,0,7,0,0,0,8,8
1201,1201,4554,69392,Wonderland Restaurant,500 Haight St,San Francisco,CA,94117,37.772096999999995,-122.43080400000001,"(37.772097, -122.430804)",,69392_20160630,6/30/2016 0:00,70.0,Routine - Unscheduled,69392_20160630_103139,Improper food storage,Low Risk,20160630,103139,2016-06-30,0,1,6,0,0,10,0
1202,1202,4555,4184,GLENEAGLES GOLF COURSE AT M P,2100 SUNNYDALE Ave,San Francisco,CA,94134,37.714351,-122.424419,"(37.714351, -122.424419)",,4184_20160524,5/24/2016 0:00,96.0,Routine - Unscheduled,4184_20160524_103142,Unclean nonfood contact surfaces,Low Risk,20160524,103142,2016-05-24,0,3,0,0,2,2,0
1203,1203,4560,69275,Tacos El Tuca,428 11th St,San Francisco,CA,94103,37.769957,-122.41166799999999,"(37.769957, -122.411668)",,69275_20160817,8/17/2016 0:00,87.0,Routine - Unscheduled,69275_20160817_103154,Unclean or degraded floors walls or ceilings,Low Risk,20160817,103154,2016-08-17,0,0,0,0,0,4,4
1204,1204,4562,2152,HARD KNOX CAFE,2526 03rd St,San Francisco,CA,94107,37.757554999999996,-122.388443,"(37.757555, -122.388443)",,2152_20151001,10/1/2015 0:00,82.0,Routine - Unscheduled,2152_20151001_103102,Unclean hands or improper use of gloves,High Risk,20151001,103102,2015-10-01,0,0,0,0,2,0,3
1205,1205,4567,2131,DRAGON WELL,2142 CHESTNUT St,San Francisco,CA,94123,37.800528,-122.43866399999999,"(37.800528, -122.438664)",,2131_20160630,6/30/2016 0:00,92.0,Routine - Unscheduled,2131_20160630_103157,Food safety certificate or food handler card not available,Low Risk,20160630,103157,2016-06-30,0,3,0,0,0,3,0
1206,1206,4569,2318,Garcon,1101 VALENCIA St,San Francisco,CA,94110,37.755291,-122.420898,"(37.755291, -122.420898)",,2318_20150325,3/25/2015 0:00,96.0,Routine - Unscheduled,2318_20150325_103118,Employee eating or smoking,Moderate Risk,20150325,103118,2015-03-25,0,0,4,0,0,3,0
1207,1207,4575,80354,Project Juice LLC,1355 Market St,San Francisco,CA,94103,,,,,80354_20160630,6/30/2016 0:00,96.0,Routine - Unscheduled,80354_20160630_103139,Improper food storage,Low Risk,20160630,103139,2016-06-30,0,3,0,0,1,2,2
1208,1208,4576,82090,Lord Stanley,2065 Polk St,San Francisco,CA,94109,,,,,82090_20160330,3/30/2016 0:00,98.0,Routine - Unscheduled,82090_20160330_103162,Other low risk violation,Low Risk,20160330,103162,2016-03-30,2,0,0,0,1,0,1
1209,1209,4579,90234,The ARC San Francisco,1520 Howard St,San Francisco,CA,94103,,,,,90234_20171207,12/7/2017 0:00,92.0,Routine - Unscheduled,90234_20171207_103131,Moderate risk vermin infestation,Moderate Risk,20171207,103131,2017-12-07,0,2,0,0,0,0,0
1210,1210,4581,1085,STARBUCKS COFFEE #9219,333 MARKET St,San Francisco,CA,94105,37.792037,-122.397852,"(37.792037, -122.397852)",,1085_20171207,12/7/2017 0:00,96.0,Routine - Unscheduled,1085_20171207_103119,Inadequate and inaccessible handwashing facilities,Moderate Risk,20171207,103119,2017-12-07,0,1,0,0,3,0,0
1211,1211,4584,39665,Peet's Coffee & Tea,1400 Van Ness Ave,San Francisco,CA,94109,37.788668,-122.421917,"(37.788668, -122.421917)",,39665_20160701,7/1/2016 0:00,96.0,Routine - Unscheduled,39665_20160701_103154,Unclean or degraded floors walls or ceilings,Low Risk,20160701,103154,2016-07-01,2,0,3,0,0,2,6
1212,1212,4585,61460,Pera,1457 18th St,San Francisco,CA,94107,37.762493,-122.39707299999999,"(37.762493, -122.397073)",,61460_20150505,5/5/2015 0:00,84.0,Routine - Unscheduled,61460_20150505_103153,Inadequate dressing rooms or improper storage of personal items,Low Risk,20150505,103153,2015-05-05,4,0,0,0,4,0,5
1213,1213,4593,86742,Blue Iguana,600 Monterey Blvd,San Francisco,CA,94127,,,,,86742_20160729,7/29/2016 0:00,81.0,Routine - Unscheduled,86742_20160729_103102,Unclean hands or improper use of gloves,High Risk,20160729,103102,2016-07-29,0,2,0,0,0,4,0
1214,1214,4596,3134,Lee's Deli,222 Front St,San Francisco,CA,94111,37.793777,-122.398857,"(37.793777, -122.398857)",,3134_20160610,6/10/2016 0:00,82.0,Routine - Unscheduled,3134_20160610_103144,Unapproved or unmaintained equipment or utensils,Low Risk,20160610,103144,2016-06-10,0,0,4,0,0,4,0
1215,1215,4599,85333,Illy Caffe SF_Battery Street,123 Battery St,San Francisco,CA,94111,,,,,85333_20170104,1/4/2017 0:00,89.0,Routine - Unscheduled,85333_20170104_103109,Unclean or unsanitary food contact surfaces,High Risk,20170104,103109,2017-01-04,3,0,0,0,3,0,1
1216,1216,4604,3325,Jacks Cannery,2801 Leavenworth St,San Francisco,CA,94133,37.807155,-122.419004,"(37.807155, -122.419004)",,3325_20160816,8/16/2016 0:00,83.0,Routine - Unscheduled,3325_20160816_103131,Moderate risk vermin infestation,Moderate Risk,20160816,103131,2016-08-16,0,2,0,0,0,2,2
1217,1217,4611,74374,Gallardo's Mexican Restaurant,3248 18th St,San Francisco,CA,94110,,,,,74374_20151022,10/22/2015 0:00,70.0,Routine - Unscheduled,74374_20151022_103114,High risk vermin infestation,High Risk,20151022,103114,2015-10-22,0,0,0,5,0,0,7
1218,1218,4616,78018,Blueprint Tap Room,680 08th St Ste.#170,San Francisco,CA,94103,,,,,78018_20170106,1/6/2017 0:00,83.0,Routine - Unscheduled,78018_20170106_103103,High risk food holding temperature,High Risk,20170106,103103,2017-01-06,3,0,0,0,4,0,0
1219,1219,4619,82930,Blue Bottle Coffee,115 Sansome St,San Francisco,CA,94104,,,,,82930_20160705,7/5/2016 0:00,85.0,Routine - Unscheduled,82930_20160705_103120,Moderate risk food holding temperature,Moderate Risk,20160705,103120,2016-07-05,0,1,0,0,0,3,0
1220,1220,4620,67448,Soo Fong Restaurant,3801 03rd St 370,San Francisco,CA,94124,37.741828999999996,-122.388098,"(37.741829, -122.388098)",,67448_20150527,5/27/2015 0:00,78.0,Routine - Unscheduled,67448_20150527_103133,Foods not protected from contamination,Moderate Risk,20150527,103133,2015-05-27,0,0,0,4,4,0,2
1221,1221,4625,82145,California Bakery,77 McAllister St,San Francisco,CA,94102,,,,,82145_20171212,12/12/2017 0:00,86.0,Routine - Unscheduled,82145_20171212_103131,Moderate risk vermin infestation,Moderate Risk,20171212,103131,2017-12-12,0,4,0,7,0,4,3
1222,1222,4627,3414,TASTE CATERING,3450 03rd St 4D,San Francisco,CA,94124,37.7456,-122.387309,"(37.7456, -122.387309)",,3414_20170926,9/26/2017 0:00,98.0,Routine - Unscheduled,3414_20170926_103154,Unclean or degraded floors walls or ceilings,Low Risk,20170926,103154,2017-09-26,0,0,1,0,0,0,1
1223,1223,4628,77213,Right Way Market & Deli,596 O'Farrell St,San Francisco,CA,94102,,,,,77213_20160504,5/4/2016 0:00,94.0,Routine - Unscheduled,77213_20160504_103154,Unclean or degraded floors walls or ceilings,Low Risk,20160504,103154,2016-05-04,0,0,0,2,0,3,0
1224,1224,4638,14688,Eagle Cafe,111 Pine St,San Francisco,CA,94111,37.792343,-122.39856699999999,"(37.792343, -122.398567)",,14688_20160831,8/31/2016 0:00,96.0,Routine - Unscheduled,14688_20160831_103148,No thermometers or uncalibrated thermometers,Low Risk,20160831,103148,2016-08-31,0,1,0,0,0,2,2
1225,1225,4640,83073,The Richfield,195 05th Ave,San Francisco,CA,94118,,,,,83073_20160505,5/5/2016 0:00,96.0,Routine - Unscheduled,83073_20160505_103149,Wiping cloths not clean or properly stored or inadequate sanitizer,Low Risk,20160505,103149,2016-05-05,0,0,0,0,2,2,0
1226,1226,4645,77432,TY Sandwich,4829 Mission St,San Francisco,CA,94112,,,,,77432_20161209,12/9/2016 0:00,89.0,Routine - Unscheduled,77432_20161209_103129,Insufficient hot water or running water,Moderate Risk,20161209,103129,2016-12-09,0,0,0,3,2,4,0
1227,1227,4650,2970,Good Earth Cafe,835 Kearny St,San Francisco,CA,94108,37.795844,-122.40509399999999,"(37.795844, -122.405094)",,2970_20160524,5/24/2016 0:00,92.0,Routine - Unscheduled,2970_20160524_103131,Moderate risk vermin infestation,Moderate Risk,20160524,103131,2016-05-24,2,0,1,0,0,3,1
1228,1228,4651,77913,Eclectic Cookery,101 Horne Ave,San Francisco,CA,94124,,,,,77913_20150526,5/26/2015 0:00,98.0,Routine - Unscheduled,77913_20150526_103154,Unclean or degraded floors walls or ceilings,Low Risk,20150526,103154,2015-05-26,0,0,2,0,3,0,1
1229,1229,4655,76436,Cantina Verde,388 Market St #104,San Francisco,CA,94111,,,,,76436_20170802,8/2/2017 0:00,,Complaint,76436_20170802_103148,No thermometers or uncalibrated thermometers,Low Risk,20170802,103148,2017-08-02,0,0,2,0,0,5,0
1230,1230,4657,60331,Sunflower Potrero Hill,288 CONNECTICUT St,San Francisco,CA,94107,37.762646999999994,-122.397545,"(37.762647, -122.397545)",,60331_20150521,5/21/2015 0:00,82.0,Routine - Unscheduled,60331_20150521_103105,Improper cooling methods,High Risk,20150521,103105,2015-05-21,0,5,0,0,8,0,4
1231,1231,4663,5950,LICK-WILMERDING HIGH SCHOOL,755 OCEAN Ave,San Francisco,CA,94112,37.72293300000001,-122.448971,"(37.722933, -122.448971)",14155334021.0,5950_20180226,2/26/2018 0:00,93.0,Routine - Unscheduled,5950_20180226_103109,Unclean or unsanitary food contact surfaces,High Risk,20180226,103109,2018-02-26,1,2,0,0,1,3,2
1232,1232,4667,87858,Cherry Blossom Bakery 2,1552 Ocean Ave,San Francisco,CA,94112,,,,14155826737.0,87858_20160628,6/28/2016 0:00,90.0,Routine - Unscheduled,87858_20160628_103129,Insufficient hot water or running water,Moderate Risk,20160628,103129,2016-06-28,0,0,0,1,5,4,0
1233,1233,4669,68105,Gilberth's Rottiserie & Grill,2427 03rd St,San Francisco,CA,94107,37.758903000000004,-122.38823799999999,"(37.758903, -122.388238)",,68105_20150806,8/6/2015 0:00,90.0,Routine - Unscheduled,68105_20150806_103145,Improper storage of equipment utensils or linens,Low Risk,20150806,103145,2015-08-06,0,0,0,0,4,0,3
1234,1234,4670,76465,Firetrail Pizza,428 11th St,San Francisco,CA,94103,,,,,76465_20160817,8/17/2016 0:00,91.0,Routine - Unscheduled,76465_20160817_103103,High risk food holding temperature,High Risk,20160817,103103,2016-08-17,0,0,0,2,0,2,3
1235,1235,4672,82111,Phil'z Coffee,1 Front St Annex Suite 100,San Francisco,CA,94111,,,,,82111_20160701,7/1/2016 0:00,85.0,Routine - Unscheduled,82111_20160701_103119,Inadequate and inaccessible handwashing facilities,Moderate Risk,20160701,103119,2016-07-01,0,3,0,0,0,4,0
1236,1236,4676,66418,Turtle Tower Restaurant,5716 GEARY BLVD,San Francisco,CA,94121,37.780348,-122.480861,"(37.780348, -122.480861)",,66418_20160517,5/17/2016 0:00,77.0,Routine - Unscheduled,66418_20160517_103132,Improper thawing methods,Moderate Risk,20160517,103132,2016-05-17,0,0,0,0,5,6,0
1237,1237,4678,62779,SF Third Street Shell,551 03rd St,San Francisco,CA,94107,37.780739000000004,-122.39501499999999,"(37.780739, -122.395015)",,62779_20151202,12/2/2015 0:00,81.0,Routine - Unscheduled,62779_20151202_103119,Inadequate and inaccessible handwashing facilities,Moderate Risk,20151202,103119,2015-12-02,0,0,6,0,0,0,5
1238,1238,4682,2124,RUTH'S CHRIS STEAK HOUSE,1700 CALIFORNIA St,San Francisco,CA,94109,37.790298,-122.42303400000002,"(37.790298, -122.423034)",,2124_20180227,2/27/2018 0:00,94.0,Routine - Unscheduled,2124_20180227_103143,Inadequate warewashing facilities or equipment,Low Risk,20180227,103143,2018-02-27,2,0,0,0,0,0,2
1239,1239,4686,60472,Mikaku Restaurant,323 Grant Ave,San Francisco,CA,94108,37.78999500000001,-122.405484,"(37.789995, -122.405484)",,60472_20160524,5/24/2016 0:00,84.0,Routine - Unscheduled,60472_20160524_103131,Moderate risk vermin infestation,Moderate Risk,20160524,103131,2016-05-24,0,0,0,4,0,6,1
1240,1240,4697,33914,Subway 30303,3911 Alemany Bl.,San Francisco,CA,94132,37.711185,-122.46779,"(37.711185, -122.46779)",,33914_20180214,2/14/2018 0:00,85.0,Routine - Unscheduled,33914_20180214_103157,Food safety certificate or food handler card not available,Low Risk,20180214,103157,2018-02-14,5,0,0,0,5,4,3
1241,1241,4698,77169,TJ Cafe,724 La Playa St,San Francisco,CA,94121,,,,14155861125.0,77169_20160104,1/4/2016 0:00,96.0,Routine - Unscheduled,77169_20160104_103120,Moderate risk food holding temperature,Moderate Risk,20160104,103120,2016-01-04,2,0,0,0,0,1,1
1242,1242,4700,79520,Huli Huli Hawaiian Grill,4100 03rd St,San Francisco,CA,94124,,,,,79520_20150810,8/10/2015 0:00,90.0,Routine - Unscheduled,79520_20150810_103149,Wiping cloths not clean or properly stored or inadequate sanitizer,Low Risk,20150810,103149,2015-08-10,0,3,0,0,6,0,3
1243,1243,4701,5970,"Heritage, The",3400 LAGUNA St,San Francisco,CA,94123,37.802797999999996,-122.431547,"(37.802798, -122.431547)",,5970_20180223,2/23/2018 0:00,94.0,Routine - Unscheduled,5970_20180223_103144,Unapproved or unmaintained equipment or utensils,Low Risk,20180223,103144,2018-02-23,2,0,0,0,0,1,0
1244,1244,4703,2358,TAQUERIA SAN JOSE #1,2830 MISSION St,San Francisco,CA,94110,37.751687,-122.41845500000001,"(37.751687, -122.418455)",14155280203.0,2358_20150902,9/2/2015 0:00,85.0,Routine - Unscheduled,2358_20150902_103133,Foods not protected from contamination,Moderate Risk,20150902,103133,2015-09-02,3,0,5,0,0,0,3
1245,1245,4711,16329,Oscar Burger & Deli,1850 Cesar Chavez St,San Francisco,CA,94124,37.749798,-122.39596200000001,"(37.749798, -122.395962)",,16329_20150529,5/29/2015 0:00,81.0,Routine - Unscheduled,16329_20150529_103149,Wiping cloths not clean or properly stored or inadequate sanitizer,Low Risk,20150529,103149,2015-05-29,0,0,5,0,0,0,5
1246,1246,4716,84625,ETC Dessert Cafe,1919 Irving St,San Francisco,CA,94122,,,,14155533312.0,84625_20160614,6/14/2016 0:00,,New Ownership,84625_20160614_103109,Unclean or unsanitary food contact surfaces,High Risk,20160614,103109,2016-06-14,0,2,0,0,0,1,0
1247,1247,4718,2360,LA TAQUERIA,2889 MISSION St,San Francisco,CA,94110,37.750855,-122.41828600000001,"(37.750855, -122.418286)",14155287117.0,2360_20150713,7/13/2015 0:00,92.0,Routine - Unscheduled,2360_20150713_103133,Foods not protected from contamination,Moderate Risk,20150713,103133,2015-07-13,0,0,4,0,0,3,2
1248,1248,4727,2472,Starbucks,1501 FILLMORE St,San Francisco,CA,94115,37.783505,-122.43278400000001,"(37.783505, -122.432784)",,2472_20150605,6/5/2015 0:00,96.0,Routine - Unscheduled,2472_20150605_103152,Unclean unmaintained or improperly constructed toilet facilities,Low Risk,20150605,103152,2015-06-05,0,0,0,0,0,0,2
1249,1249,4744,826,ANGELINA'S DELI-CAFE & CATERING,6000 CALIFORNIA St,San Francisco,CA,94121,37.784038,-122.481982,"(37.784038, -122.481982)",,826_20160523,5/23/2016 0:00,83.0,Routine - Unscheduled,826_20160523_103133,Foods not protected from contamination,Moderate Risk,20160523,103133,2016-05-23,0,0,5,0,0,4,0
1250,1250,4747,93615,SF International HS/New School of SF,655 De Haro St,San Francisco,CA,94107,,,,14155743604.0,93615_20180220,2/20/2018 0:00,96.0,Routine - Unscheduled,93615_20180220_103116,Inadequate food safety knowledge or lack of certified food safety manager,Moderate Risk,20180220,103116,2018-02-20,1,2,0,0,0,0,0
1251,1251,4762,2871,STARBUCK'S COFFEE #6605,2727 MARIPOSA St,San Francisco,CA,94110,37.762963,-122.41070900000001,"(37.762963, -122.410709)",,2871_20180223,2/23/2018 0:00,96.0,Routine - Unscheduled,2871_20180223_103131,Moderate risk vermin infestation,Moderate Risk,20180223,103131,2018-02-23,1,0,0,0,1,0,0
1252,1252,4764,16424,Sam's Market,580 Precita Ave,San Francisco,CA,94110,37.74749600000001,-122.40957,"(37.747496, -122.40957)",,16424_20151229,12/29/2015 0:00,92.0,Routine - Unscheduled,16424_20151229_103119,Inadequate and inaccessible handwashing facilities,Moderate Risk,20151229,103119,2015-12-29,3,0,0,0,4,0,2
1253,1253,4765,80989,Best Beverage Catering,1290 Sutter St,San Francisco,CA,94109,,,,14155642410.0,80989_20160520,5/20/2016 0:00,90.0,Routine - Unscheduled,80989_20160520_103154,Unclean or degraded floors walls or ceilings,Low Risk,20160520,103154,2016-05-20,0,4,0,0,0,4,0
1254,1254,4766,82636,Marcella's Lasagneria E Cucina,1099 Tennessee St,San Francisco,CA,94107,,,,,82636_20150812,8/12/2015 0:00,89.0,Routine - Unscheduled,82636_20150812_103105,Improper cooling methods,High Risk,20150812,103105,2015-08-12,0,0,0,0,2,0,2
1255,1255,4771,3095,Whitcomb Hotel Bar & Grill,1231 MARKET St,San Francisco,CA,94103,37.778357,-122.415182,"(37.778357, -122.415182)",14155628000.0,3095_20160630,6/30/2016 0:00,85.0,Routine - Unscheduled,3095_20160630_103144,Unapproved or unmaintained equipment or utensils,Low Risk,20160630,103144,2016-06-30,0,0,0,0,4,4,0
1256,1256,4774,64933,Magic Flute Restaurant,3673 SACRAMENTO St,San Francisco,CA,94118,37.787372999999995,-122.45311699999999,"(37.787373, -122.453117)",,64933_20160203,2/3/2016 0:00,100.0,Routine - Unscheduled,64933_20160203_103131,Moderate risk vermin infestation,Moderate Risk,20160203,103131,2016-02-03,0,0,0,0,4,0,2
1257,1257,4789,423,Orale Orale Inc,113 Sacramento St,San Francisco,CA,94111,37.794501000000004,-122.39716000000001,"(37.794501, -122.39716)",,423_20160901,9/1/2016 0:00,85.0,Routine - Unscheduled,423_20160901_103103,High risk food holding temperature,High Risk,20160901,103103,2016-09-01,0,5,0,0,0,4,0
1258,1258,4791,3420,MCDONALD'S #7413,345 BAYSHORE Blvd,San Francisco,CA,94124,37.742331,-122.405736,"(37.742331, -122.405736)",,3420_20160901,9/1/2016 0:00,85.0,Routine - Unscheduled,3420_20160901_103145,Improper storage of equipment utensils or linens,Low Risk,20160901,103145,2016-09-01,0,0,0,0,0,4,2
1259,1259,4806,74131,Deena's Market and Smoke Shop,600 O'Farrell St,San Francisco,CA,94109,,,,,74131_20160909,9/9/2016 0:00,83.0,Routine - Unscheduled,74131_20160909_103120,Moderate risk food holding temperature,Moderate Risk,20160909,103120,2016-09-09,3,0,1,0,0,5,5
1260,1260,4808,74563,Golden Ocean Quickly,1039 Ocean Ave,San Francisco,CA,94112,,,,14155727698.0,74563_20160419,4/19/2016 0:00,72.0,Routine - Unscheduled,74563_20160419_103121,Inadequate procedures or records for time as a public health control,Moderate Risk,20160419,103121,2016-04-19,0,5,4,0,2,7,0
1261,1261,4828,9183,GOLD CORNER CAFE,2723 OAKDALE AVENUE,San Francisco,CA,94124,37.742012,-122.40352299999999,"(37.742012, -122.403523)",,9183_20151120,11/20/2015 0:00,82.0,Routine - Unscheduled,9183_20151120_103120,Moderate risk food holding temperature,Moderate Risk,20151120,103120,2015-11-20,0,0,4,0,0,0,3
1262,1262,4834,4817,BIG SAVE MARKET,5001 03rd St,San Francisco,CA,94124,37.733019,-122.39123899999998,"(37.733019, -122.391239)",,4817_20150928,9/28/2015 0:00,90.0,Routine - Unscheduled,4817_20150928_103120,Moderate risk food holding temperature,Moderate Risk,20150928,103120,2015-09-28,0,0,0,0,2,0,3
1263,1263,4835,2523,VENICE PIZZA AND RESTAURANT,5228 MISSION St,San Francisco,CA,94112,37.715315000000004,-122.442007,"(37.715315, -122.442007)",,2523_20160817,8/17/2016 0:00,89.0,Routine - Unscheduled,2523_20160817_103149,Wiping cloths not clean or properly stored or inadequate sanitizer,Low Risk,20160817,103149,2016-08-17,0,0,4,0,0,3,1
1264,1264,4846,27055,Chenery Market,100 CHENERY St,San Francisco,CA,94131,37.739670000000004,-122.425623,"(37.73967, -122.425623)",,27055_20160729,7/29/2016 0:00,92.0,Routine - Unscheduled,27055_20160729_103120,Moderate risk food holding temperature,Moderate Risk,20160729,103120,2016-07-29,4,0,0,0,2,3,1
1265,1265,4852,69884,Zoe's,3088 24th St,San Francisco,CA,94110,,,,,69884_20160630,6/30/2016 0:00,90.0,Routine - Unscheduled,69884_20160630_103157,Food safety certificate or food handler card not available,Low Risk,20160630,103157,2016-06-30,0,6,0,7,4,4,5
1266,1266,4855,86972,The Lodge on Haight,400 Haight St,San Francisco,CA,94117,,,,14155879582.0,86972_20160323,3/23/2016 0:00,,New Ownership,86972_20160323_103154,Unclean or degraded floors walls or ceilings,Low Risk,20160323,103154,2016-03-23,0,0,0,0,0,0,5
1267,1267,4862,6030,Woolf House Senior Center,801 Howard St . #413,San Francisco,CA,94103,37.783037,-122.402952,"(37.783037, -122.402952)",14155677603.0,6030_20160701,7/1/2016 0:00,94.0,Routine - Unscheduled,6030_20160701_103119,Inadequate and inaccessible handwashing facilities,Moderate Risk,20160701,103119,2016-07-01,0,1,0,0,0,2,3
1268,1268,4878,82228,"Cava22, Inc",3239 22nd St,San Francisco,CA,94110,,,,14155647224.0,82228_20150518,5/18/2015 0:00,87.0,Routine - Unscheduled,82228_20150518_103139,Improper food storage,Low Risk,20150518,103139,2015-05-18,0,0,4,0,0,4,3
1269,1269,4885,85955,India Clay Oven Restaurant and Bar,2436 Clement St,San Francisco,CA,94121,,,,14155750505.0,85955_20160705,7/5/2016 0:00,81.0,Routine - Unscheduled,85955_20160705_103119,Inadequate and inaccessible handwashing facilities,Moderate Risk,20160705,103119,2016-07-05,0,0,6,0,0,5,7
1270,1270,4895,59002,Yummy Bakery & Restaurant,607 Jackson St,San Francisco,CA,94133,37.796152,-122.40525500000001,"(37.796152, -122.405255)",14155988388.0,59002_20160524,5/24/2016 0:00,94.0,Routine - Unscheduled,59002_20160524_103154,Unclean or degraded floors walls or ceilings,Low Risk,20160524,103154,2016-05-24,0,0,3,0,0,2,0
1271,1271,4905,66811,BK11852,1298 HOWARD St,San Francisco,CA,94103,37.775314,-122.412819,"(37.775314, -122.412819)",,66811_20160504,5/4/2016 0:00,90.0,Routine - Unscheduled,66811_20160504_103131,Moderate risk vermin infestation,Moderate Risk,20160504,103131,2016-05-04,0,7,0,0,4,4,0
1272,1272,4917,75013,Libby Jane Cafe,644 Polk St,San Francisco,CA,94102,,,,,75013_20160705,7/5/2016 0:00,87.0,Routine - Unscheduled,75013_20160705_103144,Unapproved or unmaintained equipment or utensils,Low Risk,20160705,103144,2016-07-05,0,2,0,0,0,3,0
1273,1273,4921,5491,AT&T - (CART 15) FRESH POPCORN [145103],24 WILLIE MAYS PLAZA,San Francisco,CA,94107,,,,14155971500.0,5491_20160410,4/10/2016 0:00,98.0,Routine - Unscheduled,5491_20160410_103145,Improper storage of equipment utensils or linens,Low Risk,20160410,103145,2016-04-10,0,0,0,0,0,1,0
1274,1274,4922,25162,Westin St Francis - Oak Room/Banquet,335 Powell St Lobby,San Francisco,CA,94102,37.7877,-122.408345,"(37.7877, -122.408345)",,25162_20160408,4/8/2016 0:00,98.0,Routine - Unscheduled,25162_20160408_103150,Improper or defective plumbing,Low Risk,20160408,103150,2016-04-08,0,0,0,0,2,1,0
1275,1275,4923,4584,KERY MARKET,648 ANDOVER St,San Francisco,CA,94110,37.735714,-122.416775,"(37.735714, -122.416775)",,4584_20160405,4/5/2016 0:00,96.0,Routine - Unscheduled,4584_20160405_103154,Unclean or degraded floors walls or ceilings,Low Risk,20160405,103154,2016-04-05,0,0,1,0,3,1,3
1276,1276,4924,200,JIM'S SMOKE SHOP,600 20th St,San Francisco,CA,94107,37.760568,-122.387772,"(37.760568, -122.387772)",,200_20151001,10/1/2015 0:00,94.0,Routine - Unscheduled,200_20151001_103120,Moderate risk food holding temperature,Moderate Risk,20151001,103120,2015-10-01,0,0,0,0,4,0,2
1277,1277,4927,37171,InterContinental San Francisco Club Lounge,888 Howard St 6th Floor,San Francisco,CA,94103,37.781664,-122.40477800000001,"(37.781664, -122.404778)",,37171_20160523,5/23/2016 0:00,96.0,Routine - Unscheduled,37171_20160523_103142,Unclean nonfood contact surfaces,Low Risk,20160523,103142,2016-05-23,0,0,0,0,1,2,0
1278,1278,4930,4828,SAY CHEESE,856 COLE St,San Francisco,CA,94117,37.766017,-122.449976,"(37.766017, -122.449976)",14155665020.0,4828_20171212,12/12/2017 0:00,96.0,Routine - Unscheduled,4828_20171212_103120,Moderate risk food holding temperature,Moderate Risk,20171212,103120,2017-12-12,0,1,0,0,0,1,0
1279,1279,4935,7575,SUPER MIRA,1790 SUTTER St,San Francisco,CA,94115,37.786568,-122.429754,"(37.786568, -122.429754)",14155926529.0,7575_20160603,6/3/2016 0:00,90.0,Routine - Unscheduled,7575_20160603_103133,Foods not protected from contamination,Moderate Risk,20160603,103133,2016-06-03,0,0,0,0,3,3,0
1280,1280,4943,80798,L'emigrante,2199 Mission St,San Francisco,CA,94110,,,,14155864777.0,80798_20160609,6/9/2016 0:00,90.0,Routine - Unscheduled,80798_20160609_103157,Food safety certificate or food handler card not available,Low Risk,20160609,103157,2016-06-09,0,0,4,0,0,3,0
1281,1281,4946,85953,WesBurger N' More,2240 Mission St,San Francisco,CA,94110,,,,14155371648.0,85953_20161207,12/7/2016 0:00,92.0,Routine - Unscheduled,85953_20161207_103119,Inadequate and inaccessible handwashing facilities,Moderate Risk,20161207,103119,2016-12-07,0,2,0,0,2,4,0
1282,1282,4957,75965,Mixt Greens,100 California St Suite 103,San Francisco,CA,94111,,,,,75965_20160610,6/10/2016 0:00,87.0,Routine - Unscheduled,75965_20160610_103120,Moderate risk food holding temperature,Moderate Risk,20160610,103120,2016-06-10,0,0,2,0,0,3,0
1283,1283,4959,36208,Silver Cafe,4300 MISSION St,San Francisco,CA,94112,37.728582,-122.431482,"(37.728582, -122.431482)",14155583237.0,36208_20160513,5/13/2016 0:00,84.0,Routine - Unscheduled,36208_20160513_103154,Unclean or degraded floors walls or ceilings,Low Risk,20160513,103154,2016-05-13,0,4,0,0,3,5,0
1284,1284,4964,77404,Shabu Bar,219 King St,San Francisco,CA,94107,,,,,77404_20180123,1/23/2018 0:00,68.0,Routine - Unscheduled,77404_20180123_103124,Inadequately cleaned or sanitized food contact surfaces,Moderate Risk,20180123,103124,2018-01-23,8,0,0,0,0,2,0
1285,1285,4969,86995,JW Marriott SF Union Square,500 Post St,San Francisco,CA,94102,,,,,86995_20161209,12/9/2016 0:00,96.0,Routine - Unscheduled,86995_20161209_103161,Low risk vermin infestation,Low Risk,20161209,103161,2016-12-09,0,0,0,0,2,0,0
1286,1286,4971,89072,Epicurean@SHCP,1055 Ellis St.,San Francisco,CA,94109,,,,,89072_20171201,12/1/2017 0:00,91.0,Routine - Unscheduled,89072_20171201_103154,Unclean or degraded floors walls or ceilings,Low Risk,20171201,103154,2017-12-01,0,2,0,0,3,3,0
1287,1287,4975,2323,BLUE FRONT DELI,1430 HAIGHT St,San Francisco,CA,94117,37.770146999999994,-122.446044,"(37.770147, -122.446044)",,2323_20150513,5/13/2015 0:00,62.0,Routine - Unscheduled,2323_20150513_103131,Moderate risk vermin infestation,Moderate Risk,20150513,103131,2015-05-13,0,0,0,0,3,0,4
1288,1288,4976,1635,KEZAR PUB,770 Stanyan St,San Francisco,CA,94117,37.767828,-122.453227,"(37.767828, -122.453227)",14155389292.0,1635_20171215,12/15/2017 0:00,91.0,Routine - Unscheduled,1635_20171215_103114,High risk vermin infestation,High Risk,20171215,103114,2017-12-15,0,2,0,0,0,0,3
1289,1289,4981,76156,Reveille Coffee Co.,4080 18th St,San Francisco,CA,94114,,,,14155508336.0,76156_20170106,1/6/2017 0:00,96.0,Routine - Unscheduled,76156_20170106_103124,Inadequately cleaned or sanitized food contact surfaces,Moderate Risk,20170106,103124,2017-01-06,0,3,0,0,1,0,1
1290,1290,4986,19150,Mission-Silver Market,4304 MISSION St,San Francisco,CA,94112,37.728698,-122.43141000000001,"(37.728698, -122.43141)",,19150_20160513,5/13/2016 0:00,94.0,Routine - Unscheduled,19150_20160513_103161,Low risk vermin infestation,Low Risk,20160513,103161,2016-05-13,0,5,0,0,2,3,0
1291,1291,4988,64745,Mint,1 Dr Carlton B. Goodlett Pl Basement,San Francisco,CA,94102,37.778492,-122.418291,"(37.778492, -122.418291)",,64745_20170106,1/6/2017 0:00,88.0,Routine - Unscheduled,64745_20170106_103161,Low risk vermin infestation,Low Risk,20170106,103161,2017-01-06,0,0,0,0,4,0,1
1292,1292,4989,18443,Rumble Fish,200 23rd Ave,San Francisco,CA,94121,37.783833,-122.482826,"(37.783833, -122.482826)",,18443_20160517,5/17/2016 0:00,82.0,Routine - Unscheduled,18443_20160517_103120,Moderate risk food holding temperature,Moderate Risk,20160517,103120,2016-05-17,0,0,7,0,0,5,0
1293,1293,4990,3337,The Real Food Company,2140 Polk St,San Francisco,CA,94109,37.796478,-122.42183700000001,"(37.796478, -122.421837)",,3337_20171218,12/18/2017 0:00,86.0,Routine - Unscheduled,3337_20171218_103142,Unclean nonfood contact surfaces,Low Risk,20171218,103142,2017-12-18,0,4,0,0,0,3,6
1294,1294,4991,2483,CAFE UNION,1830 UNION St,San Francisco,CA,94123,37.797878000000004,-122.42950400000001,"(37.797878, -122.429504)",14155674119.0,2483_20160907,9/7/2016 0:00,96.0,Routine - Unscheduled,2483_20160907_103120,Moderate risk food holding temperature,Moderate Risk,20160907,103120,2016-09-07,3,0,1,0,0,1,2
1295,1295,4992,85706,Butter Love Bakeshop,3717 Balboa St,San Francisco,CA,94121,,,,14155603988.0,85706_20160908,9/8/2016 0:00,90.0,Routine - Unscheduled,85706_20160908_103131,Moderate risk vermin infestation,Moderate Risk,20160908,103131,2016-09-08,3,0,0,0,0,3,2
1296,1296,5001,4449,Universal Bakery Inc.,3458 MISSION St,San Francisco,CA,94110,37.741316999999995,-122.42268700000001,"(37.741317, -122.422687)",,4449_20171218,12/18/2017 0:00,83.0,Routine - Unscheduled,4449_20171218_103154,Unclean or degraded floors walls or ceilings,Low Risk,20171218,103154,2017-12-18,0,5,0,0,7,4,4
1297,1297,5006,33386,Stella Pastry,446 Columbus Ave,San Francisco,CA,94133,37.799065,-122.408355,"(37.799065, -122.408355)",,33386_20160512,5/12/2016 0:00,80.0,Routine - Unscheduled,33386_20160512_103149,Wiping cloths not clean or properly stored or inadequate sanitizer,Low Risk,20160512,103149,2016-05-12,3,0,0,0,4,4,0
1298,1298,5011,34033,Cafe Meuse,1400 Pacific Ave,San Francisco,CA,94109,37.795468,-122.418474,"(37.795468, -122.418474)",,34033_20161021,10/21/2016 0:00,98.0,Routine - Unscheduled,34033_20161021_103150,Improper or defective plumbing,Low Risk,20161021,103150,2016-10-21,4,0,0,0,1,2,0
1299,1299,5014,76220,Bonita Taqueria and Rotisserie,2257 Chestnut St,San Francisco,CA,94123,,,,,76220_20171218,12/18/2017 0:00,90.0,Routine - Unscheduled,76220_20171218_103161,Low risk vermin infestation,Low Risk,20171218,103161,2017-12-18,0,3,0,0,2,0,2
1300,1300,5026,4753,Tan's Cafe III,155 Francisco St,San Francisco,CA,94133,37.805285999999995,-122.408075,"(37.805286, -122.408075)",,4753_20160505,5/5/2016 0:00,90.0,Routine - Unscheduled,4753_20160505_103153,Inadequate dressing rooms or improper storage of personal items,Low Risk,20160505,103153,2016-05-05,1,0,1,0,1,3,0
1301,1301,5030,88722,Armenian Cultural Center,825 Brotherhood Way,San Francisco,CA,94132,,,,14155588686.0,88722_20170324,3/24/2017 0:00,94.0,Routine - Unscheduled,88722_20170324_103139,Improper food storage,Low Risk,20170324,103139,2017-03-24,0,1,0,0,3,0,0
1302,1302,5034,63654,SFDH - Scala's Bistro Bakery,450 Powell St 1st Floor,San Francisco,CA,94102,37.788782,-122.40843899999999,"(37.788782, -122.408439)",,63654_20160502,5/2/2016 0:00,98.0,Routine - Unscheduled,63654_20160502_103139,Improper food storage,Low Risk,20160502,103139,2016-05-02,0,0,0,0,0,1,0
1303,1303,5037,65561,"House of Dim Sum, Inc.",735 Jackson St,San Francisco,CA,94133,37.795873,-122.407495,"(37.795873, -122.407495)",,65561_20160419,4/19/2016 0:00,68.0,Routine - Unscheduled,65561_20160419_103102,Unclean hands or improper use of gloves,High Risk,20160419,103102,2016-04-19,0,5,0,0,5,1,0
1304,1304,5039,80487,Stem Kitchen and Garden,499 Illinois St,San Francisco,CA,94107,,,,,80487_20150917,9/17/2015 0:00,96.0,Routine - Unscheduled,80487_20150917_103119,Inadequate and inaccessible handwashing facilities,Moderate Risk,20150917,103119,2015-09-17,0,0,0,0,2,0,1
1305,1305,5050,2717,GOURMET DIM SUM & CAFE,651 CLEMENT St,San Francisco,CA,94118,37.782823,-122.46635900000001,"(37.782823, -122.466359)",,2717_20160512,5/12/2016 0:00,75.0,Routine - Unscheduled,2717_20160512_103131,Moderate risk vermin infestation,Moderate Risk,20160512,103131,2016-05-12,0,0,5,0,0,1,0
1306,1306,5072,1065,UNIVERSAL CAFE,2814 19th St,San Francisco,CA,94110,37.760487,-122.41066200000002,"(37.760487, -122.410662)",,1065_20150806,8/6/2015 0:00,80.0,Routine - Unscheduled,1065_20150806_103116,Inadequate food safety knowledge or lack of certified food safety manager,Moderate Risk,20150806,103116,2015-08-06,0,0,5,0,0,0,4
1307,1307,5074,76876,Begoni Bistro,615 Jackson St,San Francisco,CA,94133,,,,,76876_20160908,9/8/2016 0:00,70.0,Routine - Unscheduled,76876_20160908_103114,High risk vermin infestation,High Risk,20160908,103114,2016-09-08,0,0,7,0,0,6,7
1308,1308,5081,64346,Fillmore Bake Shop,1890 FILLMORE St,San Francisco,CA,94115,37.786951,-122.43336200000002,"(37.786951, -122.433362)",,64346_20160602,6/2/2016 0:00,87.0,Routine - Unscheduled,64346_20160602_103144,Unapproved or unmaintained equipment or utensils,Low Risk,20160602,103144,2016-06-02,0,0,0,0,2,4,0
1309,1309,5086,62056,Mission Minis,3168 22nd St,San Francisco,CA,94110,37.755555,-122.41808,"(37.755555, -122.41808)",,62056_20180227,2/27/2018 0:00,96.0,Routine - Unscheduled,62056_20180227_103119,Inadequate and inaccessible handwashing facilities,Moderate Risk,20180227,103119,2018-02-27,1,0,1,0,0,1,1
1310,1310,5090,83648,7 Eleven Store #2366-39475B,3400 Mission,San Francisco,CA,94110,,,,,83648_20160628,6/28/2016 0:00,86.0,Routine - Unscheduled,83648_20160628_103157,Food safety certificate or food handler card not available,Low Risk,20160628,103157,2016-06-28,0,5,3,0,5,6,0
1311,1311,5096,69194,Grandma's Deli & Cafe,1551 Mission St,San Francisco,CA,94103,,,,,69194_20170105,1/5/2017 0:00,96.0,Routine - Unscheduled,69194_20170105_103147,Inadequate ventilation or lighting,Low Risk,20170105,103147,2017-01-05,0,0,0,0,2,0,0
1312,1312,5102,86777,Smitten Ice Cream,2268 Chestnut St,San Francisco,CA,94123,,,,14155818419.0,86777_20171215,12/15/2017 0:00,94.0,Routine - Unscheduled,86777_20171215_103154,Unclean or degraded floors walls or ceilings,Low Risk,20171215,103154,2017-12-15,0,2,0,0,0,2,0
1313,1313,5104,494,San Francisco Athletic Club,1630 Stockton St,San Francisco,CA,94133,37.800897,-122.40918899999998,"(37.800897, -122.409189)",,494_20160512,5/12/2016 0:00,74.0,Routine - Unscheduled,494_20160512_103119,Inadequate and inaccessible handwashing facilities,Moderate Risk,20160512,103119,2016-05-12,0,0,0,2,0,6,0
1314,1314,5106,2559,HAI'S RESTAURANT,227 HYDE St,San Francisco,CA,94102,37.782953000000006,-122.41580400000001,"(37.782953, -122.415804)",,2559_20150413,4/13/2015 0:00,73.0,Routine - Unscheduled,2559_20150413_103154,Unclean or degraded floors walls or ceilings,Low Risk,20150413,103154,2015-04-13,0,0,0,0,2,3,5
1315,1315,5112,89111,Los Colores Taqueria & Grill,709 O'Farrell St,San Francisco,CA,94109,,,,,89111_20161019,10/19/2016 0:00,90.0,Routine - Unscheduled,89111_20161019_103124,Inadequately cleaned or sanitized food contact surfaces,Moderate Risk,20161019,103124,2016-10-19,0,3,0,0,3,0,0
1316,1316,5119,65057,The Brixton,2140 UNION St,San Francisco,CA,94123,37.797238,-122.434533,"(37.797238, -122.434533)",14155401114.0,65057_20171221,12/21/2017 0:00,92.0,Routine - Unscheduled,65057_20171221_103142,Unclean nonfood contact surfaces,Low Risk,20171221,103142,2017-12-21,0,3,4,0,0,7,0
1317,1317,5120,12768,VASQUEZ COFFEE CO,50 MENDELL STREET #1,San Francisco,CA,94124,37.743419,-122.383536,"(37.743419, -122.383536)",,12768_20150406,4/6/2015 0:00,96.0,Routine - Unscheduled,12768_20150406_103120,Moderate risk food holding temperature,Moderate Risk,20150406,103120,2015-04-06,0,3,0,0,0,3,1
1318,1318,5122,84109,Regalito Rosticeria,3481 18th St,San Francisco,CA,94110,,,,14155500650.0,84109_20171214,12/14/2017 0:00,88.0,Routine - Unscheduled,84109_20171214_103131,Moderate risk vermin infestation,Moderate Risk,20171214,103131,2017-12-14,0,3,0,0,0,0,0
1319,1319,5126,1262,NORTH BEACH PIZZA,800 STANYAN St,San Francisco,CA,94117,37.767286,-122.453075,"(37.767286, -122.453075)",14155752300.0,1262_20171215,12/15/2017 0:00,90.0,Routine - Unscheduled,1262_20171215_103144,Unapproved or unmaintained equipment or utensils,Low Risk,20171215,103144,2017-12-15,0,4,0,0,0,0,4
1320,1320,5128,9232,Fillmore Street Cafe,1301 Fillmore Street,San Francisco,CA,94115,37.781974,-122.432474,"(37.781974, -122.432474)",,9232_20160405,4/5/2016 0:00,94.0,Routine - Unscheduled,9232_20160405_103120,Moderate risk food holding temperature,Moderate Risk,20160405,103120,2016-04-05,0,0,0,0,4,2,0
1321,1321,5134,85433,Denny's Restaurant,495 Beach St,San Francisco,CA,94133,,,,,85433_20180227,2/27/2018 0:00,98.0,Routine - Unscheduled,85433_20180227_103144,Unapproved or unmaintained equipment or utensils,Low Risk,20180227,103144,2018-02-27,1,0,2,0,0,0,0
1322,1322,5139,3196,United Irish Cultural Center,2700 45th Ave,San Francisco,CA,94116,37.735943,-122.50308600000001,"(37.735943, -122.503086)",,3196_20160610,6/10/2016 0:00,87.0,Routine - Unscheduled,3196_20160610_103105,Improper cooling methods,High Risk,20160610,103105,2016-06-10,4,0,0,0,2,3,0
1323,1323,5140,7764,YASUKOCHI'S SWEET SHOP,1790 SUTTER St,San Francisco,CA,94115,37.786590000000004,-122.42981499999999,"(37.78659, -122.429815)",14155938165.0,7764_20160603,6/3/2016 0:00,96.0,Routine - Unscheduled,7764_20160603_103138,Improper storage use or identification of toxic substances,Low Risk,20160603,103138,2016-06-03,0,0,0,0,1,2,0
1324,1324,5141,2697,HOWARD'S CAFE,1309 09th Ave,San Francisco,CA,94122,37.758941,-122.48591,"(37.758941, -122.48591)",,2697_20170926,9/26/2017 0:00,,Complaint,2697_20170926_103154,Unclean or degraded floors walls or ceilings,Low Risk,20170926,103154,2017-09-26,0,0,5,0,0,3,0
1325,1325,5148,7241,CHEVRON #1712,1790 LOMBARD St,San Francisco,CA,94123,37.800538,-122.43086399999999,"(37.800538, -122.430864)",,7241_20160906,9/6/2016 0:00,96.0,Routine - Unscheduled,7241_20160906_103154,Unclean or degraded floors walls or ceilings,Low Risk,20160906,103154,2016-09-06,1,0,2,0,0,2,0
1326,1326,5191,28209,Subway Sandwiches #7307,2375 MARKET St,San Francisco,CA,94114,37.76292700000001,-122.43460800000001,"(37.762927, -122.434608)",,28209_20151224,12/24/2015 0:00,92.0,Routine - Unscheduled,28209_20151224_103124,Inadequately cleaned or sanitized food contact surfaces,Moderate Risk,20151224,103124,2015-12-24,0,2,0,0,4,0,2
1327,1327,5193,33710,Phil'z Coffee,3101 24th St,San Francisco,CA,94110,37.752455,-122.41411599999999,"(37.752455, -122.414116)",,33710_20160321,3/21/2016 0:00,98.0,Routine - Unscheduled,33710_20160321_103154,Unclean or degraded floors walls or ceilings,Low Risk,20160321,103154,2016-03-21,2,0,2,0,2,2,1
1328,1328,5194,10282,Jewish Community Center,3200 California,San Francisco,CA,94118,37.787310999999995,-122.44683899999998,"(37.787311, -122.446839)",,10282_20160907,9/7/2016 0:00,86.0,Routine - Unscheduled,10282_20160907_103108,Contaminated or adulterated food,High Risk,20160907,103108,2016-09-07,0,0,0,2,0,2,0
1329,1329,5202,86658,Clay Oven Indian Cuisine,1689 Church St,San Francisco,CA,94131,,,,14155822400.0,86658_20161026,10/26/2016 0:00,83.0,Routine - Unscheduled,86658_20161026_103149,Wiping cloths not clean or properly stored or inadequate sanitizer,Low Risk,20161026,103149,2016-10-26,0,0,0,3,6,5,7
1330,1330,5203,65270,California Pacific Medical Center - Cafe,2333 Buchanan St 1st Floor,San Francisco,CA,94115,37.791426,-122.43103899999998,"(37.791426, -122.431039)",,65270_20160603,6/3/2016 0:00,94.0,Routine - Unscheduled,65270_20160603_103154,Unclean or degraded floors walls or ceilings,Low Risk,20160603,103154,2016-06-03,0,0,0,0,1,2,0
1331,1331,5205,61861,SO,1010 BRYANT St,San Francisco,CA,94103,37.772264,-122.407339,"(37.772264, -122.407339)",,61861_20171214,12/14/2017 0:00,85.0,Routine - Unscheduled,61861_20171214_103161,Low risk vermin infestation,Low Risk,20171214,103161,2017-12-14,0,5,0,0,8,0,8
1332,1332,5211,67833,Dear Mom,2700 16th St,San Francisco,CA,94103,37.765459,-122.41346200000001,"(37.765459, -122.413462)",,67833_20170105,1/5/2017 0:00,88.0,Routine - Unscheduled,67833_20170105_103161,Low risk vermin infestation,Low Risk,20170105,103161,2017-01-05,0,3,0,0,6,0,0
1333,1333,5213,66705,Green Island Restaurant,4012 Geary Blvd,San Francisco,CA,94118,37.781208,-122.462432,"(37.781208, -122.462432)",,66705_20160512,5/12/2016 0:00,71.0,Routine - Unscheduled,66705_20160512_103132,Improper thawing methods,Moderate Risk,20160512,103132,2016-05-12,0,0,0,0,6,8,0
1334,1334,5225,5257,LITTLE BAOBAB,3388 19th St,San Francisco,CA,94110,37.760295,-122.418953,"(37.760295, -122.418953)",14155776209.0,5257_20160610,6/10/2016 0:00,,Routine - Scheduled,5257_20160610_103148,No thermometers or uncalibrated thermometers,Low Risk,20160610,103148,2016-06-10,0,0,0,0,2,3,0
1335,1335,5231,2053,ZA,1919 Hyde St,San Francisco,CA,94109,37.79855300000001,-122.41896399999999,"(37.798553, -122.418964)",,2053_20171214,12/14/2017 0:00,96.0,Routine - Unscheduled,2053_20171214_103148,No thermometers or uncalibrated thermometers,Low Risk,20171214,103148,2017-12-14,0,2,0,0,0,2,4
1336,1336,5234,74756,Easy Breezy Frozen Yogurt,718 Irving St,San Francisco,CA,94122,,,,14155503351.0,74756_20160415,4/15/2016 0:00,90.0,Routine - Unscheduled,74756_20160415_103138,Improper storage use or identification of toxic substances,Low Risk,20160415,103138,2016-04-15,0,0,0,1,0,4,0
1337,1337,5255,37167,InterContinental San Francisco Employee Cafeteria,888 Howard St 2nd Floor,San Francisco,CA,94013,37.781664,-122.40477800000001,"(37.781664, -122.404778)",,37167_20160523,5/23/2016 0:00,92.0,Routine - Unscheduled,37167_20160523_103149,Wiping cloths not clean or properly stored or inadequate sanitizer,Low Risk,20160523,103149,2016-05-23,0,0,0,0,1,4,0
1338,1338,5256,77955,Patriot House,2 Embarcadero Center,San Francisco,CA,94111,,,,,77955_20160819,8/19/2016 0:00,,Reinspection/Followup,77955_20160819_103154,Unclean or degraded floors walls or ceilings,Low Risk,20160819,103154,2016-08-19,0,0,0,0,0,1,4
1339,1339,5257,5803,SUNNYSIDE ELEMENTARY SCHOOL,250 FOERSTER St,San Francisco,CA,94112,37.730307,-122.448801,"(37.730307, -122.448801)",,5803_20160419,4/19/2016 0:00,96.0,Routine - Unscheduled,5803_20160419_103119,Inadequate and inaccessible handwashing facilities,Moderate Risk,20160419,103119,2016-04-19,1,2,0,0,1,1,2
1340,1340,5258,84453,Marengo on the Alley,531 Commercial St,San Francisco,CA,94111,,,,,84453_20161205,12/5/2016 0:00,87.0,Routine - Unscheduled,84453_20161205_103102,Unclean hands or improper use of gloves,High Risk,20161205,103102,2016-12-05,0,0,0,0,3,0,0
1341,1341,5262,14005,Yuyu Sushi,1559 A Sloat St,San Francisco,CA,94132,37.733901,-122.490726,"(37.733901, -122.490726)",14155666477.0,14005_20171205,12/5/2017 0:00,90.0,Routine - Unscheduled,14005_20171205_103120,Moderate risk food holding temperature,Moderate Risk,20171205,103120,2017-12-05,0,3,0,0,3,2,0
1342,1342,5266,1000,HEUNG YUEN RESTAURANT,3279 22nd St,San Francisco,CA,94110,37.755282,-122.420493,"(37.755282, -122.420493)",,1000_20171002,10/2/2017 0:00,74.0,Routine - Unscheduled,1000_20171002_103161,Low risk vermin infestation,Low Risk,20171002,103161,2017-10-02,0,7,0,0,0,6,0
1343,1343,5269,80361,Tadu Ethiopian Kitchen,484 Ellis St,San Francisco,CA,94102,,,,14150284906.0,80361_20180305,3/5/2018 0:00,94.0,Routine - Unscheduled,80361_20180305_103139,Improper food storage,Low Risk,20180305,103139,2018-03-05,3,0,0,0,2,0,0
1344,1344,5271,78426,Pabu,101 California St,San Francisco,CA,94111,,,,,78426_20161207,12/7/2016 0:00,,Complaint,78426_20161207_103127,Noncompliance with HAACP plan or variance,Moderate Risk,20161207,103127,2016-12-07,5,0,0,0,5,0,0
1345,1345,5276,70090,Cathead's BBQ,1665 FOLSOM St,San Francisco,CA,94103,37.770126,-122.415342,"(37.770126, -122.415342)",,70090_20170105,1/5/2017 0:00,93.0,Routine - Unscheduled,70090_20170105_103105,Improper cooling methods,High Risk,20170105,103105,2017-01-05,2,0,0,0,1,0,0
1346,1346,5280,86645,Old Siam Thai Restaurant,201 Ellis St,San Francisco,CA,94102,,,,,86645_20180306,3/6/2018 0:00,79.0,Routine - Unscheduled,86645_20180306_103119,Inadequate and inaccessible handwashing facilities,Moderate Risk,20180306,103119,2018-03-06,5,0,3,0,0,6,0
1347,1347,5287,90603,Reina's Restaurant,5479 Mission St,San Francisco,CA,94112,,,,,90603_20180305,3/5/2018 0:00,84.0,Routine - Unscheduled,90603_20180305_103154,Unclean or degraded floors walls or ceilings,Low Risk,20180305,103154,2018-03-05,5,0,0,5,0,0,0
1348,1348,5289,37168,InterContinental San Francisco 3rd Fl. Banquet Kitchen,888 Howard St 3rd Floor,San Francisco,CA,94103,37.781664,-122.40477800000001,"(37.781664, -122.404778)",,37168_20160523,5/23/2016 0:00,96.0,Routine - Unscheduled,37168_20160523_103139,Improper food storage,Low Risk,20160523,103139,2016-05-23,1,0,0,0,1,2,0
1349,1349,5291,2337,EL TACO LOCO INC.,3274 24th St,San Francisco,CA,94110,37.752308,-122.41788100000001,"(37.752308, -122.417881)",,2337_20171003,10/3/2017 0:00,86.0,Routine - Unscheduled,2337_20171003_103120,Moderate risk food holding temperature,Moderate Risk,20171003,103120,2017-10-03,0,4,0,0,4,0,5
1350,1350,5294,69299,Restaurante Monte Cristo #2,6286 03rd St,San Francisco,CA,94124,37.721007,-122.39643899999999,"(37.721007, -122.396439)",,69299_20150423,4/23/2015 0:00,88.0,Routine - Unscheduled,69299_20150423_103120,Moderate risk food holding temperature,Moderate Risk,20150423,103120,2015-04-23,0,0,0,0,4,0,3
1351,1351,5295,83589,City Pizza and Burger Inc.,464 Broadway St,San Francisco,CA,94133,,,,,83589_20151013,10/13/2015 0:00,70.0,Routine - Unscheduled,83589_20151013_103119,Inadequate and inaccessible handwashing facilities,Moderate Risk,20151013,103119,2015-10-13,4,0,0,0,0,4,8
1352,1352,5299,34354,The Olympic Club Restaurant,524 Post St 2nd Floor,San Francisco,CA,94102,37.787978,-122.410904,"(37.787978, -122.410904)",,34354_20180308,3/8/2018 0:00,90.0,Routine - Unscheduled,34354_20180308_103120,Moderate risk food holding temperature,Moderate Risk,20180308,103120,2018-03-08,3,0,0,0,4,0,0
1353,1353,5300,69984,Schools of the Sacred Heart - San Francisco,2222 BROADWAY St,San Francisco,CA,94115,,,,,69984_20180226,2/26/2018 0:00,91.0,Routine - Unscheduled,69984_20180226_103114,High risk vermin infestation,High Risk,20180226,103114,2018-02-26,2,0,2,0,3,3,4
1354,1354,5307,88063,Sichuan Home Inc,5037 Geary St,San Francisco,CA,94118,,,,14155223288.0,88063_20160721,7/21/2016 0:00,,New Construction,88063_20160721_103144,Unapproved or unmaintained equipment or utensils,Low Risk,20160721,103144,2016-07-21,0,0,1,0,0,6,0
1355,1355,5311,78865,Unicorn Pan Asian Restaurant,191 Pine St,San Francisco,CA,94111,,,,,78865_20160524,5/24/2016 0:00,77.0,Routine - Unscheduled,78865_20160524_103133,Foods not protected from contamination,Moderate Risk,20160524,103133,2016-05-24,0,9,0,0,0,6,0
1356,1356,5312,447,L'Osteria Del Forno,519 Columbus Ave,San Francisco,CA,94133,37.799837,-122.409517,"(37.799837, -122.409517)",,447_20160908,9/8/2016 0:00,96.0,Routine - Unscheduled,447_20160908_103149,Wiping cloths not clean or properly stored or inadequate sanitizer,Low Risk,20160908,103149,2016-09-08,0,0,0,0,0,2,3
1357,1357,5313,34505,Whole Foods Market,450 Rhode Island St,San Francisco,CA,94103,37.764139,-122.40254499999999,"(37.764139, -122.402545)",,34505_20171116,11/16/2017 0:00,,Complaint,34505_20171116_103132,Improper thawing methods,Moderate Risk,20171116,103132,2017-11-16,0,3,0,0,5,0,2
1358,1358,5314,71087,The Roosevelt,2817 24th St,San Francisco,CA,94110,37.752824,-122.408599,"(37.752824, -122.408599)",,71087_20170928,9/28/2017 0:00,94.0,Routine - Unscheduled,71087_20170928_103131,Moderate risk vermin infestation,Moderate Risk,20170928,103131,2017-09-28,0,0,2,0,0,0,0
1359,1359,5315,83041,Kurotaka Ramen,431 2nd St,San Francisco,CA,94107,,,,,83041_20180306,3/6/2018 0:00,,Structural Inspection,83041_20180306_103162,Other low risk violation,Low Risk,20180306,103162,2018-03-06,1,0,0,0,2,2,0
1360,1360,5317,3121,Le Central Bistro Corp,453 Bush St,San Francisco,CA,94108,37.790603000000004,-122.40503799999999,"(37.790603, -122.405038)",,3121_20150331,3/31/2015 0:00,86.0,Routine - Unscheduled,3121_20150331_103124,Inadequately cleaned or sanitized food contact surfaces,Moderate Risk,20150331,103124,2015-03-31,0,0,0,0,0,3,0
1361,1361,5319,93856,7 Eleven #2366-35663H,690 Market St,San Francisco,CA,94104,,,,,93856_20180306,3/6/2018 0:00,,New Ownership,93856_20180306_103116,Inadequate food safety knowledge or lack of certified food safety manager,Moderate Risk,20180306,103116,2018-03-06,4,0,0,0,0,0,0
1362,1362,5321,68451,Buckhorn Grills,101 04th St #1060,San Francisco,CA,94103,37.784548,-122.40418999999999,"(37.784548, -122.40419)",,68451_20180226,2/26/2018 0:00,74.0,Routine - Unscheduled,68451_20180226_103119,Inadequate and inaccessible handwashing facilities,Moderate Risk,20180226,103119,2018-02-26,6,0,0,0,0,3,0
1363,1363,5324,1687,Sai's Vietnamese Restaurant,505 Washington St,San Francisco,CA,94111,37.795659,-122.40172,"(37.795659, -122.40172)",,1687_20160525,5/25/2016 0:00,96.0,Routine - Unscheduled,1687_20160525_103161,Low risk vermin infestation,Low Risk,20160525,103161,2016-05-25,0,0,1,0,0,2,4
1364,1364,5325,76218,Tenderloin Market & Deli,200 Leavenworth,San Francisco,CA,94102,,,,,76218_20160523,5/23/2016 0:00,86.0,Routine - Unscheduled,76218_20160523_103131,Moderate risk vermin infestation,Moderate Risk,20160523,103131,2016-05-23,0,0,5,0,7,4,7
1365,1365,5330,79415,Sungari Dumpling House,4543 Mission St,San Francisco,CA,94112,,,,,79415_20171214,12/14/2017 0:00,82.0,Routine - Unscheduled,79415_20171214_103124,Inadequately cleaned or sanitized food contact surfaces,Moderate Risk,20171214,103124,2017-12-14,0,5,0,0,4,4,0
1366,1366,5333,36534,Jewish Community Center of San Francisco,3200 California,San Francisco,CA,94118,37.787217999999996,-122.44740300000001,"(37.787218, -122.447403)",,36534_20160907,9/7/2016 0:00,92.0,Routine - Unscheduled,36534_20160907_103119,Inadequate and inaccessible handwashing facilities,Moderate Risk,20160907,103119,2016-09-07,0,0,0,4,0,2,0
1367,1367,5335,2788,Sushi Hunter,1701 Powell St,San Francisco,CA,94133,37.800424,-122.410894,"(37.800424, -122.410894)",,2788_20160523,5/23/2016 0:00,90.0,Routine - Unscheduled,2788_20160523_103144,Unapproved or unmaintained equipment or utensils,Low Risk,20160523,103144,2016-05-23,0,0,0,0,0,5,0
1368,1368,5339,26340,VIP Coffee & Cake Shop,671 Broadway St,San Francisco,CA,94133,37.797703999999996,-122.40805800000001,"(37.797704, -122.408058)",,26340_20170424,4/24/2017 0:00,,Complaint,26340_20170424_103105,Improper cooling methods,High Risk,20170424,103105,2017-04-24,0,0,0,7,0,0,8
1369,1369,5349,17570,Tres Agaves,130 Townsend St,San Francisco,CA,94107,37.780084,-122.391278,"(37.780084, -122.391278)",,17570_20160829,8/29/2016 0:00,,Complaint,17570_20160829_103139,Improper food storage,Low Risk,20160829,103139,2016-08-29,0,0,0,0,0,5,5
1370,1370,5354,93913,Hodala Restaurant,5801 Geary Blvd,San Francisco,CA,94121,,,,,93913_20180222,2/22/2018 0:00,92.0,Routine - Unscheduled,93913_20180222_103131,Moderate risk vermin infestation,Moderate Risk,20180222,103131,2018-02-22,3,0,0,0,0,0,0
1371,1371,5356,81540,Wang Dae Bak,2642  Ave,San Francisco,CA,94132,,,,14155679248.0,81540_20180227,2/27/2018 0:00,94.0,Routine - Unscheduled,81540_20180227_103116,Inadequate food safety knowledge or lack of certified food safety manager,Moderate Risk,20180227,103116,2018-02-27,2,0,0,0,4,2,7
1372,1372,5357,85709,Wokitchen,888 Brannan St,San Francisco,CA,94103,,,,,85709_20180306,3/6/2018 0:00,,Structural Inspection,85709_20180306_103162,Other low risk violation,Low Risk,20180306,103162,2018-03-06,2,0,0,0,0,1,0
1373,1373,5361,88756,Sweet Basil Thai Cuisine,3221 Mission St,San Francisco,CA,94110,,,,,88756_20160809,8/9/2016 0:00,88.0,Routine - Unscheduled,88756_20160809_103120,Moderate risk food holding temperature,Moderate Risk,20160809,103120,2016-08-09,0,4,0,6,7,4,0
1374,1374,5364,87440,El Aji Peruvian Restaurant,3015 Mission St,San Francisco,CA,94110,,,,14155657349.0,87440_20170925,9/25/2017 0:00,86.0,Routine - Unscheduled,87440_20170925_103125,Noncompliance with shell fish tags or display,Moderate Risk,20170925,103125,2017-09-25,0,0,5,0,0,2,0
1375,1375,5366,67154,RIVERSIDE SEAFOOD RESTAURANT,1201 VICENTE St,San Francisco,CA,94116,37.739065000000004,-122.47976899999999,"(37.739065, -122.479769)",,67154_20171207,12/7/2017 0:00,,Complaint,67154_20171207_103133,Foods not protected from contamination,Moderate Risk,20171207,103133,2017-12-07,0,3,0,0,5,7,0
1376,1376,5368,91989,Kuma Sushi + Sake,1040 Polk St,San Francisco,CA,94109,,,,,91989_20171004,10/4/2017 0:00,94.0,Routine - Unscheduled,91989_20171004_103149,Wiping cloths not clean or properly stored or inadequate sanitizer,Low Risk,20171004,103149,2017-10-04,0,2,0,0,0,0,0
1377,1377,5370,62362,Cafe Pellegrini,659 Columbus Ave,San Francisco,CA,94133,37.800851,-122.41106200000002,"(37.800851, -122.411062)",,62362_20160909,9/9/2016 0:00,96.0,Routine - Unscheduled,62362_20160909_103154,Unclean or degraded floors walls or ceilings,Low Risk,20160909,103154,2016-09-09,0,0,0,0,0,2,4
1378,1378,5373,84418,"Dong Hing, LLC",1210 Stockton St,San Francisco,CA,94133,,,,,84418_20151116,11/16/2015 0:00,82.0,Routine - Unscheduled,84418_20151116_103119,Inadequate and inaccessible handwashing facilities,Moderate Risk,20151116,103119,2015-11-16,0,0,0,6,0,0,6
1379,1379,5374,34352,The Olympic Club Cafe,524 Post St Basement,San Francisco,CA,94102,37.787978,-122.410904,"(37.787978, -122.410904)",,34352_20180308,3/8/2018 0:00,92.0,Routine - Unscheduled,34352_20180308_103149,Wiping cloths not clean or properly stored or inadequate sanitizer,Low Risk,20180308,103149,2018-03-08,3,0,0,0,2,0,0
1380,1380,5378,83655,Bellissimo Pizza,920 Sutter St,San Francisco,CA,94109,,,,,83655_20150826,8/26/2015 0:00,,New Ownership,83655_20150826_103144,Unapproved or unmaintained equipment or utensils,Low Risk,20150826,103144,2015-08-26,0,3,0,0,4,4,1
1381,1381,5379,78698,Pakwan Restaurant,3180 16th St,San Francisco,CA,94103,,,,14155252440.0,78698_20160523,5/23/2016 0:00,71.0,Routine - Unscheduled,78698_20160523_103154,Unclean or degraded floors walls or ceilings,Low Risk,20160523,103154,2016-05-23,4,0,0,0,4,9,2
1382,1382,5383,86224,El Rancho Grande at Haight,1654 Haight St,San Francisco,CA,94117,,,,14155721757.0,86224_20160405,4/5/2016 0:00,,Reinspection/Followup,86224_20160405_103144,Unapproved or unmaintained equipment or utensils,Low Risk,20160405,103144,2016-04-05,0,2,0,0,0,2,2
1383,1383,5390,86555,Cumaica Cofee,1398 Mission St,San Francisco,CA,94103,,,,14155859300.0,86555_20161107,11/7/2016 0:00,,New Ownership,86555_20161107_103119,Inadequate and inaccessible handwashing facilities,Moderate Risk,20161107,103119,2016-11-07,0,3,0,0,5,0,0
1384,1384,5393,89305,Golden Coast Restaurant,1540 Ocean St,San Francisco,CA,94112,,,,14155608877.0,89305_20170927,9/27/2017 0:00,69.0,Routine - Unscheduled,89305_20170927_103102,Unclean hands or improper use of gloves,High Risk,20170927,103102,2017-09-27,0,2,10,0,0,3,0
1385,1385,5395,69113,Upcider,"1160 Polk St, 2nd Floor",San Francisco,CA,94109,37.787468,-122.419997,"(37.787468, -122.419997)",,69113_20160701,7/1/2016 0:00,96.0,Routine - Unscheduled,69113_20160701_103139,Improper food storage,Low Risk,20160701,103139,2016-07-01,3,0,0,0,0,2,0
1386,1386,5397,18800,7-Mission Restaurant,150 07th St,San Francisco,CA,94103,37.778546999999996,-122.41013000000001,"(37.778547, -122.41013)",14155863298.0,18800_20160309,3/9/2016 0:00,86.0,Routine - Unscheduled,18800_20160309_103138,Improper storage use or identification of toxic substances,Low Risk,20160309,103138,2016-03-09,0,2,0,0,0,4,5
1387,1387,5402,34743,Rotee Express,180 HOWARD St,San Francisco,CA,94105,37.790863,-122.39315900000001,"(37.790863, -122.393159)",,34743_20160826,8/26/2016 0:00,71.0,Routine - Unscheduled,34743_20160826_103103,High risk food holding temperature,High Risk,20160826,103103,2016-08-26,0,0,0,0,0,6,0
1388,1388,5404,884,House of Nanking,919 Kearny St,San Francisco,CA,94133,37.796463,-122.405224,"(37.796463, -122.405224)",,884_20160309,3/9/2016 0:00,86.0,Routine - Unscheduled,884_20160309_103120,Moderate risk food holding temperature,Moderate Risk,20160309,103120,2016-03-09,0,3,0,0,5,0,4
1389,1389,5405,76638,Shah's Halal,1650 Holloway Ave West Plaza Alcove C,San Francisco,CA,94132,,,,14150466016.0,76638_20170502,5/2/2017 0:00,,Foodborne Illness Investigation,76638_20170502_103120,Moderate risk food holding temperature,Moderate Risk,20170502,103120,2017-05-02,0,0,0,4,1,0,0
1390,1390,5406,68394,Mission Bowling Club,3176 17th St,San Francisco,CA,94110,37.763628000000004,-122.416652,"(37.763628, -122.416652)",,68394_20180301,3/1/2018 0:00,85.0,Routine - Unscheduled,68394_20180301_103109,Unclean or unsanitary food contact surfaces,High Risk,20180301,103109,2018-03-01,3,0,0,0,3,0,3
1391,1391,5407,86647,Da Cafe,407 Clement St,San Francisco,CA,94118,,,,,86647_20160504,5/4/2016 0:00,66.0,Routine - Unscheduled,86647_20160504_103124,Inadequately cleaned or sanitized food contact surfaces,Moderate Risk,20160504,103124,2016-05-04,6,0,0,6,0,9,0
1392,1392,5412,37170,InterContinental San Francisco 5th Fl. Kitchen,888 Howard St 5th Floor,San Francisco,CA,94103,37.781664,-122.40477800000001,"(37.781664, -122.404778)",,37170_20160523,5/23/2016 0:00,96.0,Routine - Unscheduled,37170_20160523_103119,Inadequate and inaccessible handwashing facilities,Moderate Risk,20160523,103119,2016-05-23,0,0,0,0,1,1,0
1393,1393,5414,4594,DOUBLE ROCK GROCERY,2830 Ingalls St,San Francisco,CA,94124,37.721140999999996,-122.391223,"(37.721141, -122.391223)",,4594_20151102,11/2/2015 0:00,94.0,Routine - Unscheduled,4594_20151102_103119,Inadequate and inaccessible handwashing facilities,Moderate Risk,20151102,103119,2015-11-02,0,0,0,0,3,0,2
1394,1394,5415,91830,7 Eleven 2366-20643D,2000 Ocean Ave,San Francisco,CA,94127,,,,,91830_20180227,2/27/2018 0:00,84.0,Routine - Unscheduled,91830_20180227_103156,Permit license or inspection report not posted,Low Risk,20180227,103156,2018-02-27,6,0,4,0,0,0,0
1395,1395,5417,75108,Panchitas Cart,3091 16th St,San Francisco,CA,94103,,,,,75108_20160718,7/18/2016 0:00,,New Construction,75108_20160718_103119,Inadequate and inaccessible handwashing facilities,Moderate Risk,20160718,103119,2016-07-18,0,0,0,5,6,5,0
1396,1396,5420,489,Dol-Ho Restaurant,808 Pacific Ave,San Francisco,CA,94133,37.796718,-122.40871399999999,"(37.796718, -122.408714)",,489_20150728,7/28/2015 0:00,72.0,Routine - Unscheduled,489_20150728_103154,Unclean or degraded floors walls or ceilings,Low Risk,20150728,103154,2015-07-28,0,7,0,0,7,7,6
1397,1397,5421,83336,Nombe Catering & Events,173 Eddy St,San Francisco,CA,94102,,,,,83336_20150513,5/13/2015 0:00,92.0,Routine - Unscheduled,83336_20150513_103143,Inadequate warewashing facilities or equipment,Low Risk,20150513,103143,2015-05-13,0,0,0,0,0,0,3
1398,1398,5424,63119,Oakside Cafe,1195 OAK St,San Francisco,CA,94117,37.772904,-122.438926,"(37.772904, -122.438926)",,63119_20160516,5/16/2016 0:00,,Complaint,63119_20160516_103157,Food safety certificate or food handler card not available,Low Risk,20160516,103157,2016-05-16,0,0,0,0,0,2,5
1399,1399,5430,2132,B & M MEI SING RESTAURANT,62 02nd St,San Francisco,CA,94105,37.788453000000004,-122.400466,"(37.788453, -122.400466)",14155772888.0,2132_20170928,9/28/2017 0:00,85.0,Routine - Unscheduled,2132_20170928_103154,Unclean or degraded floors walls or ceilings,Low Risk,20170928,103154,2017-09-28,0,0,4,0,0,0,0
1400,1400,5433,70758,Burger King 9365,3900 GEARY Blvd,San Francisco,CA,94118,37.781248,-122.461251,"(37.781248, -122.461251)",,70758_20161024,10/24/2016 0:00,93.0,Routine - Unscheduled,70758_20161024_103102,Unclean hands or improper use of gloves,High Risk,20161024,103102,2016-10-24,0,0,0,0,1,0,3
1401,1401,5436,1856,Diller's Delicatessen,348 Pine St,San Francisco,CA,94104,37.792059,-122.40178,"(37.792059, -122.40178)",,1856_20170623,6/23/2017 0:00,81.0,Routine - Unscheduled,1856_20170623_103148,No thermometers or uncalibrated thermometers,Low Risk,20170623,103148,2017-06-23,0,0,0,5,0,5,4
1402,1402,5437,7762,Liguria Bakery,1700 Stockton St,San Francisco,CA,94133,37.801407,-122.409296,"(37.801407, -122.409296)",,7762_20160706,7/6/2016 0:00,83.0,Routine - Unscheduled,7762_20160706_103124,Inadequately cleaned or sanitized food contact surfaces,Moderate Risk,20160706,103124,2016-07-06,0,0,0,0,0,4,3
1403,1403,5439,86471,Frjtz Valencia,590 Valencia St,San Francisco,CA,94110,,,,14155868272.0,86471_20160929,9/29/2016 0:00,63.0,Routine - Unscheduled,86471_20160929_103116,Inadequate food safety knowledge or lack of certified food safety manager,Moderate Risk,20160929,103116,2016-09-29,6,0,0,0,4,11,0
1404,1404,5441,5810,DENMAN MIDDLE SCHOOL,241 ONEIDA St,San Francisco,CA,94112,37.721825,-122.442876,"(37.721825, -122.442876)",14155464535.0,5810_20160909,9/9/2016 0:00,92.0,Routine - Unscheduled,5810_20160909_103120,Moderate risk food holding temperature,Moderate Risk,20160909,103120,2016-09-09,2,0,0,0,1,2,2
1405,1405,5443,90539,Andronica's Community Markets,1200 Irving St,San Francisco,CA,94122,,,,,90539_20180215,2/15/2018 0:00,,Complaint,90539_20180215_103138,Improper storage use or identification of toxic substances,Low Risk,20180215,103138,2018-02-15,1,0,0,0,0,0,0
1406,1406,5445,75637,Sushi Bistro,431 Balboa St,San Francisco,CA,94118,,,,14155937100.0,75637_20171218,12/18/2017 0:00,,Reinspection/Followup,75637_20171218_103131,Moderate risk vermin infestation,Moderate Risk,20171218,103131,2017-12-18,0,1,0,0,0,2,0
1407,1407,5451,2810,Starbucks Coffee,222 Mason St,San Francisco,CA,94102,37.785647999999995,-122.409497,"(37.785648, -122.409497)",,2810_20160209,2/9/2016 0:00,98.0,Routine - Unscheduled,2810_20160209_103154,Unclean or degraded floors walls or ceilings,Low Risk,20160209,103154,2016-02-09,3,0,0,0,1,0,1
1408,1408,5453,85501,Connecticut Yankee,100 Connecticut St,San Francisco,CA,94107,,,,,85501_20160524,5/24/2016 0:00,96.0,Routine - Unscheduled,85501_20160524_103145,Improper storage of equipment utensils or linens,Low Risk,20160524,103145,2016-05-24,0,2,0,0,0,2,0
1409,1409,5455,86638,Bowl'D Acai,14 Mint Plaza,San Francisco,CA,94103,,,,14155777000.0,86638_20160505,5/5/2016 0:00,96.0,Routine - Unscheduled,86638_20160505_103143,Inadequate warewashing facilities or equipment,Low Risk,20160505,103143,2016-05-05,0,0,0,0,0,2,0
1410,1410,5461,2156,GOAT HILL PIZZA,300 CONNECTICUT St,San Francisco,CA,94107,37.762367,-122.39751499999998,"(37.762367, -122.397515)",,2156_20150723,7/23/2015 0:00,85.0,Routine - Unscheduled,2156_20150723_103120,Moderate risk food holding temperature,Moderate Risk,20150723,103120,2015-07-23,0,3,0,0,2,0,3
1411,1411,5462,69759,Fish N Gari,1718 Polk St,San Francisco,CA,94109,37.792577,-122.421016,"(37.792577, -122.421016)",,69759_20180305,3/5/2018 0:00,75.0,Routine - Unscheduled,69759_20180305_103145,Improper storage of equipment utensils or linens,Low Risk,20180305,103145,2018-03-05,7,0,8,0,0,8,4
1412,1412,5468,78075,Belly Burger,5740 Geary Blvd,San Francisco,CA,94121,,,,,78075_20160310,3/10/2016 0:00,88.0,Routine - Unscheduled,78075_20160310_103149,Wiping cloths not clean or properly stored or inadequate sanitizer,Low Risk,20160310,103149,2016-03-10,0,0,0,8,5,0,4
1413,1413,5469,15806,Vital Tea Leaf,1044 Grant Ave,San Francisco,CA,94133,37.796597,-122.406696,"(37.796597, -122.406696)",,15806_20180302,3/2/2018 0:00,98.0,Routine - Unscheduled,15806_20180302_103157,Food safety certificate or food handler card not available,Low Risk,20180302,103157,2018-03-02,1,0,0,0,0,2,2
1414,1414,5470,25167,Glaze Donuts,4499 Mission St A,San Francisco,CA,94112,37.726402,-122.433476,"(37.726402, -122.433476)",14155331144.0,25167_20161208,12/8/2016 0:00,92.0,Routine - Unscheduled,25167_20161208_103120,Moderate risk food holding temperature,Moderate Risk,20161208,103120,2016-12-08,0,3,0,0,2,2,0
1415,1415,5471,83371,Left Coast Catering,1400 Yosemite Ave,San Francisco,CA,94124,,,,,83371_20160415,4/15/2016 0:00,98.0,Routine - Unscheduled,83371_20160415_103150,Improper or defective plumbing,Low Risk,20160415,103150,2016-04-15,0,0,0,0,0,1,0
1416,1416,5479,61180,Burger Bar SF,251 Geary St 6th Floor,San Francisco,CA,94102,37.787423,-122.407417,"(37.787423, -122.407417)",,61180_20160705,7/5/2016 0:00,91.0,Routine - Unscheduled,61180_20160705_103154,Unclean or degraded floors walls or ceilings,Low Risk,20160705,103154,2016-07-05,0,0,0,0,0,2,4
1417,1417,5481,66280,The Posh Bagel,742 IRVING St,San Francisco,CA,94122,37.764088,-122.46587199999999,"(37.764088, -122.465872)",,66280_20160415,4/15/2016 0:00,84.0,Routine - Unscheduled,66280_20160415_103150,Improper or defective plumbing,Low Risk,20160415,103150,2016-04-15,2,0,0,0,0,5,0
1418,1418,5483,89069,Yangtze Meat & Fish Market,4599 Mission St,San Francisco,CA,94112,,,,,89069_20161202,12/2/2016 0:00,,New Ownership,89069_20161202_103133,Foods not protected from contamination,Moderate Risk,20161202,103133,2016-12-02,0,3,0,0,4,0,0
1419,1419,5484,77669,Quickly,44 West Portal Ave,San Francisco,CA,94127,,,,14155343905.0,77669_20161114,11/14/2016 0:00,90.0,Routine - Unscheduled,77669_20161114_103149,Wiping cloths not clean or properly stored or inadequate sanitizer,Low Risk,20161114,103149,2016-11-14,0,0,0,0,4,0,0
1420,1420,5486,1609,Tung Sing Restaurant,4015 24th St,San Francisco,CA,94114,37.751373,-122.43231899999999,"(37.751373, -122.432319)",14155648582.0,1609_20170705,7/5/2017 0:00,72.0,Routine - Unscheduled,1609_20170705_103105,Improper cooling methods,High Risk,20170705,103105,2017-07-05,0,0,7,0,0,0,4
1421,1421,5489,85766,Domino's#8418,3116 Noriega St #38th,San Francisco,CA,94122,,,,14155688100.0,85766_20160603,6/3/2016 0:00,91.0,Routine - Unscheduled,85766_20160603_103139,Improper food storage,Low Risk,20160603,103139,2016-06-03,0,2,0,0,2,2,1
1422,1422,5490,65554,Kobe Bento,901 Kearny St,San Francisco,CA,94133,37.796463,-122.405224,"(37.796463, -122.405224)",,65554_20180305,3/5/2018 0:00,92.0,Routine - Unscheduled,65554_20180305_103150,Improper or defective plumbing,Low Risk,20180305,103150,2018-03-05,3,0,3,0,0,3,1
1423,1423,5494,40123,Saffron Grill,1279 Fulton st,San Francisco,CA,94117,37.776853,-122.43778300000001,"(37.776853, -122.437783)",,40123_20160511,5/11/2016 0:00,90.0,Routine - Unscheduled,40123_20160511_103131,Moderate risk vermin infestation,Moderate Risk,20160511,103131,2016-05-11,0,0,0,0,0,3,0
1424,1424,5498,62688,Auntie April's,4618 03rd St,San Francisco,CA,94124,37.736277,-122.39033400000001,"(37.736277, -122.390334)",,62688_20171002,10/2/2017 0:00,86.0,Routine - Unscheduled,62688_20171002_103109,Unclean or unsanitary food contact surfaces,High Risk,20171002,103109,2017-10-02,0,1,0,0,0,0,4
1425,1425,5504,7529,BILLIARD PALACADE,5179 MISSION St,San Francisco,CA,94112,37.715769,-122.441505,"(37.715769, -122.441505)",,7529_20171214,12/14/2017 0:00,98.0,Routine - Unscheduled,7529_20171214_103161,Low risk vermin infestation,Low Risk,20171214,103161,2017-12-14,0,1,0,0,0,1,0
1426,1426,5508,69172,Victoria Pastry Co.,700 Filbert St,San Francisco,CA,94133,37.8012,-122.41119099999999,"(37.8012, -122.411191)",14155981655.0,69172_20170103,1/3/2017 0:00,96.0,Routine - Unscheduled,69172_20170103_103144,Unapproved or unmaintained equipment or utensils,Low Risk,20170103,103144,2017-01-03,0,2,0,0,2,3,4
1427,1427,5509,65485,Batter Up,888 Geneva Ave,San Francisco,CA,94112,37.716703,-122.44122800000001,"(37.716703, -122.441228)",,65485_20171215,12/15/2017 0:00,90.0,Routine - Unscheduled,65485_20171215_103154,Unclean or degraded floors walls or ceilings,Low Risk,20171215,103154,2017-12-15,0,4,0,0,0,2,1
1428,1428,5512,78028,The Clay Pot House LLC,1000 Clement St,San Francisco,CA,94118,,,,,78028_20160609,6/9/2016 0:00,87.0,Routine - Unscheduled,78028_20160609_103157,Food safety certificate or food handler card not available,Low Risk,20160609,103157,2016-06-09,0,0,5,0,0,4,0
1429,1429,5514,87791,Maple Restaurant,5820 Mission St,San Francisco,CA,94112,,,,,87791_20180301,3/1/2018 0:00,73.0,Routine - Unscheduled,87791_20180301_103119,Inadequate and inaccessible handwashing facilities,Moderate Risk,20180301,103119,2018-03-01,7,0,0,0,6,0,0
1430,1430,5520,68955,Ghirardelli Chocolate,845 Market St Suite 014,San Francisco,CA,94103,37.784848,-122.406892,"(37.784848, -122.406892)",,68955_20160907,9/7/2016 0:00,96.0,Routine - Unscheduled,68955_20160907_103156,Permit license or inspection report not posted,Low Risk,20160907,103156,2016-09-07,2,0,0,2,0,2,2
1431,1431,5522,81610,Farina Food Service,704 Valencia St,San Francisco,CA,94110,,,,14155561900.0,81610_20171003,10/3/2017 0:00,,Complaint,81610_20171003_103114,High risk vermin infestation,High Risk,20171003,103114,2017-10-03,0,5,0,0,4,0,0
1432,1432,5528,62735,China Express Deli,2732 MISSION St,San Francisco,CA,94110,37.7533,-122.41863000000001,"(37.7533, -122.41863)",,62735_20161107,11/7/2016 0:00,76.0,Routine - Unscheduled,62735_20161107_103149,Wiping cloths not clean or properly stored or inadequate sanitizer,Low Risk,20161107,103149,2016-11-07,0,5,0,0,5,0,4
1433,1433,5537,3929,"OPERA HOUSE - BASEMENT,LOWER LOUNGE",301 VAN NESS Ave,San Francisco,CA,94102,37.778271999999994,-122.42003100000001,"(37.778272, -122.420031)",14155251932.0,3929_20170406,4/6/2017 0:00,,Complaint,3929_20170406_103127,Noncompliance with HAACP plan or variance,Moderate Risk,20170406,103127,2017-04-06,0,0,0,4,0,2,0
1434,1434,5545,2721,Red Jade Restaurant,245 Church St.,San Francisco,CA,94114,37.766814000000004,-122.428846,"(37.766814, -122.428846)",,2721_20150422,4/22/2015 0:00,77.0,Routine - Unscheduled,2721_20150422_103131,Moderate risk vermin infestation,Moderate Risk,20150422,103131,2015-04-22,0,0,5,0,0,0,3
1435,1435,5567,3285,Wing Lum Cafe,1150 Polk St,San Francisco,CA,94109,37.787438,-122.419952,"(37.787438, -122.419952)",,3285_20160324,3/24/2016 0:00,81.0,Routine - Unscheduled,3285_20160324_103148,No thermometers or uncalibrated thermometers,Low Risk,20160324,103148,2016-03-24,0,5,0,0,6,0,5
1436,1436,5568,7450,GENKI,330 CLEMENT St,San Francisco,CA,94118,37.783048,-122.462822,"(37.783048, -122.462822)",,7450_20170424,4/24/2017 0:00,,Complaint,7450_20170424_103120,Moderate risk food holding temperature,Moderate Risk,20170424,103120,2017-04-24,0,0,0,4,5,6,0
1437,1437,5569,60550,Annie's Hot Dogs & Pretzels,"Golden Gate Park, JFK Dr.@8th Ave",San Francisco,CA,zzzzz,37.777122,-122.41963899999999,"(37.777122, -122.419639)",,60550_20160701,7/1/2016 0:00,96.0,Routine - Unscheduled,60550_20160701_103129,Insufficient hot water or running water,Moderate Risk,20160701,103129,2016-07-01,0,0,0,0,2,1,2
1438,1438,5570,68189,Silverstone Cafe,3278 24th St,San Francisco,CA,94110,37.752308,-122.41796200000002,"(37.752308, -122.417962)",,68189_20171002,10/2/2017 0:00,92.0,Routine - Unscheduled,68189_20171002_103149,Wiping cloths not clean or properly stored or inadequate sanitizer,Low Risk,20171002,103149,2017-10-02,0,3,0,0,3,0,2
1439,1439,5572,251,BEANERY INC.,602 Irving St,San Francisco,CA,94122,37.764148,-122.46439099999999,"(37.764148, -122.464391)",14155661090.0,251_20180306,3/6/2018 0:00,98.0,Routine - Unscheduled,251_20180306_103154,Unclean or degraded floors walls or ceilings,Low Risk,20180306,103154,2018-03-06,1,0,0,0,0,1,0
1440,1440,5575,71999,Shabu Club,951 Clement St,San Francisco,CA,94118,,,,,71999_20171127,11/27/2017 0:00,,Foodborne Illness Investigation,71999_20171127_103109,Unclean or unsanitary food contact surfaces,High Risk,20171127,103109,2017-11-27,0,4,0,0,4,0,5
1441,1441,5577,91300,Zzan,643 Post St,San Francisco,CA,94109,,,,,91300_20171002,10/2/2017 0:00,94.0,Routine - Unscheduled,91300_20171002_103161,Low risk vermin infestation,Low Risk,20171002,103161,2017-10-02,0,3,0,0,0,0,0
1442,1442,5579,86148,Bento,2152 03rd St,San Francisco,CA,94107,,,,14155301332.0,86148_20160311,3/11/2016 0:00,,New Ownership,86148_20160311_103154,Unclean or degraded floors walls or ceilings,Low Risk,20160311,103154,2016-03-11,0,0,0,0,0,0,3
1443,1443,5580,2077,Peet's Coffee & Tea,2139C Polk St,San Francisco,CA,94109,37.796316,-122.42190900000001,"(37.796316, -122.421909)",,2077_20171214,12/14/2017 0:00,96.0,Routine - Unscheduled,2077_20171214_103149,Wiping cloths not clean or properly stored or inadequate sanitizer,Low Risk,20171214,103149,2017-12-14,0,2,0,0,6,0,2
1444,1444,5581,91453,Nara Sushi,1515 Polk St,San Francisco,CA,94109,,,,,91453_20170606,6/6/2017 0:00,88.0,Routine - Unscheduled,91453_20170606_103138,Improper storage use or identification of toxic substances,Low Risk,20170606,103138,2017-06-06,0,0,0,5,0,0,0
1445,1445,5582,2797,MELS DRIVE-IN,1050 VAN NESS Ave,San Francisco,CA,94109,37.785358,-122.421357,"(37.785358, -122.421357)",14155296357.0,2797_20170615,6/15/2017 0:00,,Complaint,2797_20170615_103103,High risk food holding temperature,High Risk,20170615,103103,2017-06-15,0,4,0,6,4,0,5
1446,1446,5587,81606,Jo Jo's Cafe,1537 Ocean Ave,San Francisco,CA,94112,,,,14155459618.0,81606_20161004,10/4/2016 0:00,,Reinspection/Followup,81606_20161004_103123,Food in poor condition,Moderate Risk,20161004,103123,2016-10-04,0,0,0,1,3,5,4
1447,1447,5588,64379,Piccadilly Fish & Chips,1348 Polk St,San Francisco,CA,94109,37.789299,-122.42035200000001,"(37.789299, -122.420352)",14155776477.0,64379_20180307,3/7/2018 0:00,96.0,Routine - Unscheduled,64379_20180307_103142,Unclean nonfood contact surfaces,Low Risk,20180307,103142,2018-03-07,2,0,3,0,4,2,2
1448,1448,5592,68036,City Chopsticks,883 Bush St,San Francisco,CA,94108,37.789763,-122.41178700000002,"(37.789763, -122.411787)",,68036_20160815,8/15/2016 0:00,86.0,Routine - Unscheduled,68036_20160815_103119,Inadequate and inaccessible handwashing facilities,Moderate Risk,20160815,103119,2016-08-15,0,0,3,0,0,4,0
1449,1449,5598,4538,LUCCA FOOD & WINE SHOP,1899 IRVING St,San Francisco,CA,94122,37.763457,-122.47819799999999,"(37.763457, -122.478198)",,4538_20161004,10/4/2016 0:00,90.0,Routine - Unscheduled,4538_20161004_103154,Unclean or degraded floors walls or ceilings,Low Risk,20161004,103154,2016-10-04,0,0,2,0,3,1,0
1450,1450,5599,81135,Lale,731 Irving St,San Francisco,CA,94122,,,,14155314980.0,81135_20180302,3/2/2018 0:00,90.0,Routine - Unscheduled,81135_20180302_103133,Foods not protected from contamination,Moderate Risk,20180302,103133,2018-03-02,3,0,0,0,0,0,1
1451,1451,5604,23068,El Cafetazo,3087 16th St,San Francisco,CA,94103,37.764903000000004,-122.42143899999999,"(37.764903, -122.421439)",,23068_20151228,12/28/2015 0:00,87.0,Routine - Unscheduled,23068_20151228_103150,Improper or defective plumbing,Low Risk,20151228,103150,2015-12-28,0,5,0,0,0,3,4
1452,1452,5606,2798,MONGKOK DIM SUM & RESTAURANT,2438 NORIEGA  St,San Francisco,CA,94122,37.753678,-122.489972,"(37.753678, -122.489972)",,2798_20160524,5/24/2016 0:00,83.0,Routine - Unscheduled,2798_20160524_103142,Unclean nonfood contact surfaces,Low Risk,20160524,103142,2016-05-24,0,4,0,0,4,4,0
1453,1453,5609,90256,Swamp Restaurant,5423 Geary Blvd,San Francisco,CA,94121,,,,14155872828.0,90256_20170105,1/5/2017 0:00,,New Ownership,90256_20170105_103120,Moderate risk food holding temperature,Moderate Risk,20170105,103120,2017-01-05,0,0,0,0,4,0,0
1454,1454,5610,69016,Lahore Karahi,612 O'Farrell St,San Francisco,CA,94109,37.785635,-122.41477900000001,"(37.785635, -122.414779)",,69016_20180301,3/1/2018 0:00,72.0,Routine - Unscheduled,69016_20180301_103119,Inadequate and inaccessible handwashing facilities,Moderate Risk,20180301,103119,2018-03-01,10,0,6,0,0,0,8
1455,1455,5611,91390,Mandarin House SF,3452 Mission St.,San Francisco,CA,94110,,,,,91390_20171218,12/18/2017 0:00,80.0,Routine - Unscheduled,91390_20171218_103103,High risk food holding temperature,High Risk,20171218,103103,2017-12-18,0,4,0,6,0,0,0
1456,1456,5612,38875,Benjarong Thai Cuisine,1968 Lombard St,San Francisco,CA,94123,37.800148,-122.433894,"(37.800148, -122.433894)",,38875_20160915,9/15/2016 0:00,88.0,Routine - Unscheduled,38875_20160915_103120,Moderate risk food holding temperature,Moderate Risk,20160915,103120,2016-09-15,5,0,0,0,0,5,4
1457,1457,5613,1344,Beanery,1307 09th Ave,San Francisco,CA,94122,37.758941,-122.48591,"(37.758941, -122.48591)",,1344_20170925,9/25/2017 0:00,,Complaint,1344_20170925_103161,Low risk vermin infestation,Low Risk,20170925,103161,2017-09-25,0,0,2,0,0,0,0
1458,1458,5615,1921,TARAVAL OKAZU YA,1735 Taraval St,San Francisco,CA,94116,37.742603,-122.484646,"(37.742603, -122.484646)",,1921_20180228,2/28/2018 0:00,,Complaint,1921_20180228_103135,No person in charge of food facility,Low Risk,20180228,103135,2018-02-28,6,0,0,4,0,3,0
1459,1459,5623,65350,Cordova Market,301 ROLPH St,San Francisco,CA,94112,37.713426,-122.436347,"(37.713426, -122.436347)",,65350_20180305,3/5/2018 0:00,84.0,Routine - Unscheduled,65350_20180305_103124,Inadequately cleaned or sanitized food contact surfaces,Moderate Risk,20180305,103124,2018-03-05,5,0,0,0,5,5,4
1460,1460,5629,6086,SAN FRANCISCO FOOD BANK,900 PENNSYLVANIA St,San Francisco,CA,94107,37.755098,-122.392975,"(37.755098, -122.392975)",,6086_20180228,2/28/2018 0:00,94.0,Routine - Unscheduled,6086_20180228_103119,Inadequate and inaccessible handwashing facilities,Moderate Risk,20180228,103119,2018-02-28,2,0,0,0,0,0,1
1461,1461,5634,81654,AllStars Donuts,399 05th St,San Francisco,CA,94107,,,,14155880889.0,81654_20171003,10/3/2017 0:00,78.0,Routine - Unscheduled,81654_20171003_103133,Foods not protected from contamination,Moderate Risk,20171003,103133,2017-10-03,0,4,0,0,0,0,0
1462,1462,5641,92288,Ardiana,1781 Church St,San Francisco,CA,94131,,,,,92288_20170803,8/3/2017 0:00,,New Ownership,92288_20170803_103120,Moderate risk food holding temperature,Moderate Risk,20170803,103120,2017-08-03,0,0,3,0,0,0,0
1463,1463,5646,88323,Naan Stop Curry,Off the Grid,San Francisco,CA,94102,,,,14150617277.0,88323_20171002,10/2/2017 0:00,,Reinspection/Followup,88323_20171002_103103,High risk food holding temperature,High Risk,20171002,103103,2017-10-02,0,7,0,0,4,0,0
1464,1464,5647,76061,Bobo's Lounge,1434 Lombard St,San Francisco,CA,94123,,,,,76061_20171219,12/19/2017 0:00,90.0,Routine - Unscheduled,76061_20171219_103145,Improper storage of equipment utensils or linens,Low Risk,20171219,103145,2017-12-19,0,4,0,0,0,3,3
1465,1465,5648,84743,Three Twins Ice Cream Wharf,79 Jefferson St,San Francisco,CA,94133,,,,,84743_20160205,2/5/2016 0:00,94.0,Routine - Unscheduled,84743_20160205_103119,Inadequate and inaccessible handwashing facilities,Moderate Risk,20160205,103119,2016-02-05,0,0,0,0,0,0,2
1466,1466,5655,76035,Zhong Shan Restaurant,2237 Taraval St,San Francisco,CA,94116,,,,14155598938.0,76035_20161004,10/4/2016 0:00,78.0,Routine - Unscheduled,76035_20161004_103109,Unclean or unsanitary food contact surfaces,High Risk,20161004,103109,2016-10-04,0,0,7,0,5,5,0
1467,1467,5657,89453,Burger King #4668,1690 Valencia St.,San Francisco,CA,94110,,,,,89453_20161019,10/19/2016 0:00,90.0,Routine - Unscheduled,89453_20161019_103131,Moderate risk vermin infestation,Moderate Risk,20161019,103131,2016-10-19,0,6,0,0,4,0,0
1468,1468,5665,8202,Xiao Loong,250 WEST PORTAL AVENUE,San Francisco,CA,zzzzz,37.738616,-122.468775,"(37.738616, -122.468775)",14155272647.0,8202_20160510,5/10/2016 0:00,69.0,Routine - Unscheduled,8202_20160510_103154,Unclean or degraded floors walls or ceilings,Low Risk,20160510,103154,2016-05-10,5,0,0,0,0,6,0
1469,1469,5673,62708,H20 Cafe,1330 Polk St,San Francisco,CA,94109,37.789288,-122.420387,"(37.789288, -122.420387)",,62708_20151104,11/4/2015 0:00,88.0,Routine - Unscheduled,62708_20151104_103156,Permit license or inspection report not posted,Low Risk,20151104,103156,2015-11-04,0,0,4,0,4,4,5
1470,1470,5678,71131,Rico Pan,5488 MISSION St,San Francisco,CA,94112,37.71291,-122.44456000000001,"(37.71291, -122.44456)",,71131_20161005,10/5/2016 0:00,81.0,Routine - Unscheduled,71131_20161005_103154,Unclean or degraded floors walls or ceilings,Low Risk,20161005,103154,2016-10-05,0,0,0,5,5,0,5
1471,1471,5681,90487,"Yemen Kitchen, Inc.",219 Jones St,San Francisco,CA,94102,,,,,90487_20170418,4/18/2017 0:00,,New Ownership,90487_20170418_103143,Inadequate warewashing facilities or equipment,Low Risk,20170418,103143,2017-04-18,4,0,0,4,0,0,0
1472,1472,5682,84417,Pompei's Grotto,340 Jefferson St,San Francisco,CA,94133,,,,,84417_20170714,7/14/2017 0:00,87.0,Routine - Unscheduled,84417_20170714_103103,High risk food holding temperature,High Risk,20170714,103103,2017-07-14,3,0,4,0,0,2,2
1473,1473,5683,4627,Guerra Quality Meats,490 Taraval,San Francisco,CA,94116,37.743278000000004,-122.471171,"(37.743278, -122.471171)",,4627_20180227,2/27/2018 0:00,90.0,Routine - Unscheduled,4627_20180227_103154,Unclean or degraded floors walls or ceilings,Low Risk,20180227,103154,2018-02-27,4,0,0,0,0,4,0
1474,1474,5685,2252,Niji Japanese Grille,50 Post St Space #53,San Francisco,CA,94104,37.789064,-122.40286100000002,"(37.789064, -122.402861)",,2252_20171215,12/15/2017 0:00,84.0,Routine - Unscheduled,2252_20171215_103157,Food safety certificate or food handler card not available,Low Risk,20171215,103157,2017-12-15,0,5,0,0,1,0,0
1475,1475,5691,90801,Ikes Love & Sandwiches,901 Polk St,San Francisco,CA,94109,,,,,90801_20171003,10/3/2017 0:00,98.0,Routine - Unscheduled,90801_20171003_103149,Wiping cloths not clean or properly stored or inadequate sanitizer,Low Risk,20171003,103149,2017-10-03,0,1,0,0,0,0,0
1476,1476,5692,71723,Sparrow Bar and Kitchen,1640 Haight St,San Francisco,CA,94117,,,,,71723_20160607,6/7/2016 0:00,86.0,Routine - Unscheduled,71723_20160607_103133,Foods not protected from contamination,Moderate Risk,20160607,103133,2016-06-07,0,0,0,0,0,5,0
1477,1477,5694,86306,Dim Sum Bistro,675 Broadway St,San Francisco,CA,94133,,,,,86306_20160516,5/16/2016 0:00,77.0,Routine - Unscheduled,86306_20160516_103144,Unapproved or unmaintained equipment or utensils,Low Risk,20160516,103144,2016-05-16,0,4,0,0,0,6,0
1478,1478,5695,305,PACIFIC CATCH,2027 CHESTNUT St,San Francisco,CA,94123,37.800763,-122.436536,"(37.800763, -122.436536)",14155441950.0,305_20160518,5/18/2016 0:00,87.0,Routine - Unscheduled,305_20160518_103103,High risk food holding temperature,High Risk,20160518,103103,2016-05-18,4,0,0,0,0,3,0
1479,1479,5700,70562,Dunya Bistro,1609 Polk St,San Francisco,CA,94109,37.791694,-122.42094399999999,"(37.791694, -122.420944)",,70562_20160406,4/6/2016 0:00,90.0,Routine - Unscheduled,70562_20160406_103120,Moderate risk food holding temperature,Moderate Risk,20160406,103120,2016-04-06,3,0,3,0,2,3,0
1480,1480,5704,75139,Hakka Restaurant,4401 A Cabrillo St Suite A,San Francisco,CA,94121,,,,14155876898.0,75139_20150722,7/22/2015 0:00,,Complaint,75139_20150722_103138,Improper storage use or identification of toxic substances,Low Risk,20150722,103138,2015-07-22,7,0,0,0,0,10,10
1481,1481,5708,1294,ANCHOR OYSTER BAR INC.,579 Castro St,San Francisco,CA,94114,37.759613,-122.434817,"(37.759613, -122.434817)",14155433990.0,1294_20170106,1/6/2017 0:00,93.0,Routine - Unscheduled,1294_20170106_103102,Unclean hands or improper use of gloves,High Risk,20170106,103102,2017-01-06,0,2,0,0,1,1,1
1482,1482,5711,68511,Gioia Pizzeria,2238 Polk St,San Francisco,CA,94109,37.797424,-122.42199099999999,"(37.797424, -122.421991)",14150227844.0,68511_20161021,10/21/2016 0:00,98.0,Routine - Unscheduled,68511_20161021_103153,Inadequate dressing rooms or improper storage of personal items,Low Risk,20161021,103153,2016-10-21,3,0,0,0,1,0,2
1483,1483,5712,2837,KITARO JAPANESE RESTAURANT,5723 GEARY Blvd,San Francisco,CA,94121,37.780193,-122.48088,"(37.780193, -122.48088)",,2837_20160805,8/5/2016 0:00,93.0,Routine - Unscheduled,2837_20160805_103103,High risk food holding temperature,High Risk,20160805,103103,2016-08-05,0,0,0,0,0,1,2
1484,1484,5714,75147,Il Casaro Pizzeria Mozzarella Bar,348 Columbus Ave,San Francisco,CA,94133,,,,,75147_20160504,5/4/2016 0:00,89.0,Routine - Unscheduled,75147_20160504_103109,Unclean or unsanitary food contact surfaces,High Risk,20160504,103109,2016-05-04,0,3,0,0,0,2,0
1485,1485,5717,64814,My Ivy Corp.,1901 DIVISADERO St,San Francisco,CA,94115,37.787323,-122.44032299999999,"(37.787323, -122.440323)",,64814_20160224,2/24/2016 0:00,72.0,Routine - Unscheduled,64814_20160224_103124,Inadequately cleaned or sanitized food contact surfaces,Moderate Risk,20160224,103124,2016-02-24,0,0,0,3,0,4,6
1486,1486,5720,88574,Teaspoon,2125 Polk St,San Francisco,CA,94109,,,,,88574_20171214,12/14/2017 0:00,96.0,Routine - Unscheduled,88574_20171214_103149,Wiping cloths not clean or properly stored or inadequate sanitizer,Low Risk,20171214,103149,2017-12-14,0,2,0,0,4,0,0
1487,1487,5721,38458,Kissa Ko,1581 Webster St #195,San Francisco,CA,94115,37.785227,-122.431472,"(37.785227, -122.431472)",,38458_20160512,5/12/2016 0:00,94.0,Routine - Unscheduled,38458_20160512_103120,Moderate risk food holding temperature,Moderate Risk,20160512,103120,2016-05-12,0,0,0,0,0,2,0
1488,1488,5724,63150,Local Diner,1244 Market St,San Francisco,CA,94102,37.778343,-122.415348,"(37.778343, -122.415348)",14155250247.0,63150_20160209,2/9/2016 0:00,65.0,Routine - Unscheduled,63150_20160209_103116,Inadequate food safety knowledge or lack of certified food safety manager,Moderate Risk,20160209,103116,2016-02-09,0,0,6,0,0,0,7
1489,1489,5725,24572,S & T Hong Kong Seafood,2588 Noriega St,San Francisco,CA,94122,37.753608,-122.49131299999999,"(37.753608, -122.491313)",,24572_20171004,10/4/2017 0:00,72.0,Routine - Unscheduled,24572_20171004_103119,Inadequate and inaccessible handwashing facilities,Moderate Risk,20171004,103119,2017-10-04,0,6,0,0,4,6,0
1490,1490,5729,88382,Macha Cafe,1355 Sutter St,San Francisco,CA,94109,,,,14155335504.0,88382_20160829,8/29/2016 0:00,,New Ownership,88382_20160829_103129,Insufficient hot water or running water,Moderate Risk,20160829,103129,2016-08-29,0,0,0,3,0,3,0
1491,1491,5731,3260,KENTUCKY FRIED CHICKEN,2040 OCEAN Ave,San Francisco,CA,94127,37.726337,-122.46503100000001,"(37.726337, -122.465031)",14155580566.0,3260_20160930,9/30/2016 0:00,96.0,Routine - Unscheduled,3260_20160930_103144,Unapproved or unmaintained equipment or utensils,Low Risk,20160930,103144,2016-09-30,0,0,0,2,0,2,2
1492,1492,5733,89920,King Kee,101 Cyril Magnin St,San Francisco,CA,94102,,,,,89920_20180306,3/6/2018 0:00,98.0,Routine - Unscheduled,89920_20180306_103156,Permit license or inspection report not posted,Low Risk,20180306,103156,2018-03-06,1,0,0,0,1,0,0
1493,1493,5741,83305,El Rincon Yucateco,491 O'Farrell St,San Francisco,CA,94102,,,,,83305_20180227,2/27/2018 0:00,88.0,Routine - Unscheduled,83305_20180227_103139,Improper food storage,Low Risk,20180227,103139,2018-02-27,4,0,0,0,6,0,0
1494,1494,5743,84887,Silver Market Inc.,2501 San Bruno Ave,San Francisco,CA,94134,,,,,84887_20170421,4/21/2017 0:00,72.0,Routine - Unscheduled,84887_20170421_103154,Unclean or degraded floors walls or ceilings,Low Risk,20170421,103154,2017-04-21,0,0,0,6,7,0,0
1495,1495,5750,59872,KAMEKYO,943 COLE St,San Francisco,CA,94117,37.765164,-122.449874,"(37.765164, -122.449874)",14155758428.0,59872_20171214,12/14/2017 0:00,89.0,Routine - Unscheduled,59872_20171214_103147,Inadequate ventilation or lighting,Low Risk,20171214,103147,2017-12-14,0,3,0,0,0,1,4
1496,1496,5751,94944,Equator Coffees & Teas,222 02nd St,San Francisco,CA,94105,,,,,94944_20180212,2/12/2018 0:00,94.0,Routine - Unscheduled,94944_20180212_103139,Improper food storage,Low Risk,20180212,103139,2018-02-12,2,0,0,0,0,0,0
1497,1497,5757,92983,La Loma Produce #8,2840 Mission St.,San Francisco,CA,94110,,,,,92983_20180228,2/28/2018 0:00,84.0,Routine - Unscheduled,92983_20180228_103148,No thermometers or uncalibrated thermometers,Low Risk,20180228,103148,2018-02-28,6,0,0,0,0,0,0
1498,1498,5764,69849,Darren's Cafe,2731 Taylor St,San Francisco,CA,94133,37.80758400000001,-122.41573999999999,"(37.807584, -122.41574)",,69849_20180305,3/5/2018 0:00,94.0,Routine - Unscheduled,69849_20180305_103142,Unclean nonfood contact surfaces,Low Risk,20180305,103142,2018-03-05,3,0,3,0,0,4,3
1499,1499,5766,69813,The Mission Oyster Bar Seafood Rest. & Mkt.t,2282 MISSION St,San Francisco,CA,94110,,,,14155217250.0,69813_20160419,4/19/2016 0:00,89.0,Routine - Unscheduled,69813_20160419_103109,Unclean or unsanitary food contact surfaces,High Risk,20160419,103109,2016-04-19,0,2,0,0,1,2,1
1500,1500,5768,70983,M.Y. China,845 Market St Ste. 400,San Francisco,CA,94103,,,,,70983_20160504,5/4/2016 0:00,63.0,Routine - Unscheduled,70983_20160504_103144,Unapproved or unmaintained equipment or utensils,Low Risk,20160504,103144,2016-05-04,0,1,0,0,1,9,0
1501,1501,5771,4323,DIVA'S,1081 Post St,San Francisco,CA,94109,,,,14155473482.0,4323_20180302,3/2/2018 0:00,96.0,Routine - Unscheduled,4323_20180302_103152,Unclean unmaintained or improperly constructed toilet facilities,Low Risk,20180302,103152,2018-03-02,2,0,3,0,5,0,5
1502,1502,5773,80587,Tao Sushi,4808 Mission St,San Francisco,CA,94112,,,,14155585505.0,80587_20171002,10/2/2017 0:00,83.0,Routine - Unscheduled,80587_20171002_103161,Low risk vermin infestation,Low Risk,20171002,103161,2017-10-02,0,4,0,0,4,0,2
1503,1503,5777,85835,New World Market,5641 Geary Blvd,San Francisco,CA,94121,,,,14155758810.0,85835_20160204,2/4/2016 0:00,,New Ownership,85835_20160204_103154,Unclean or degraded floors walls or ceilings,Low Risk,20160204,103154,2016-02-04,4,0,0,0,7,0,10
1504,1504,5782,6003,JOSEPH LEE RECREATION CENTER,1395 MENDELL St,San Francisco,CA,94124,37.735232,-122.38969399999999,"(37.735232, -122.389694)",14155829040.0,6003_20150429,4/29/2015 0:00,100.0,Routine - Unscheduled,6003_20150429_103119,Inadequate and inaccessible handwashing facilities,Moderate Risk,20150429,103119,2015-04-29,1,0,0,0,1,0,2
1505,1505,5785,93426,Sean's Market Cafe,3558 23rd St.,San Francisco,CA,94110,,,,,93426_20180228,2/28/2018 0:00,83.0,Routine - Unscheduled,93426_20180228_103145,Improper storage of equipment utensils or linens,Low Risk,20180228,103145,2018-02-28,5,0,0,0,0,0,0
1506,1506,5786,4588,PICCOLO PETES,2155 BAYSHORE Blvd,San Francisco,CA,94134,37.712686,-122.400903,"(37.712686, -122.400903)",,4588_20150414,4/14/2015 0:00,81.0,Routine - Unscheduled,4588_20150414_103132,Improper thawing methods,Moderate Risk,20150414,103132,2015-04-14,0,0,0,0,3,0,4
1507,1507,5788,60602,Nizario's Pizza No 4,279 Columbus St,San Francisco,CA,94133,37.79782700000001,-122.406598,"(37.797827, -122.406598)",,60602_20171214,12/14/2017 0:00,92.0,Routine - Unscheduled,60602_20171214_103144,Unapproved or unmaintained equipment or utensils,Low Risk,20171214,103144,2017-12-14,0,3,0,0,0,2,3
1508,1508,5789,74371,Golden Lotus,631 Larkin St,San Francisco,CA,94109,,,,,74371_20171215,12/15/2017 0:00,77.0,Routine - Unscheduled,74371_20171215_103133,Foods not protected from contamination,Moderate Risk,20171215,103133,2017-12-15,0,6,0,0,0,2,4
1509,1509,5790,2610,CAFE LA BOHEME,3318 24th St,San Francisco,CA,94110,37.752284,-122.41892800000001,"(37.752284, -122.418928)",,2610_20171003,10/3/2017 0:00,90.0,Routine - Unscheduled,2610_20171003_103120,Moderate risk food holding temperature,Moderate Risk,20171003,103120,2017-10-03,0,3,0,0,4,0,2
1510,1510,5791,35702,MENKEE WONTON,1701 Noriega St,San Francisco,CA,94122,37.753954,-122.481866,"(37.753954, -122.481866)",,35702_20180306,3/6/2018 0:00,61.0,Routine - Unscheduled,35702_20180306_103132,Improper thawing methods,Moderate Risk,20180306,103132,2018-03-06,10,0,0,5,5,5,0
1511,1511,5797,5817,LAKESHORE ELEMENTARY SCHOOL,220 MIDDLEFIELD Dr,San Francisco,CA,94132,37.730637,-122.4861,"(37.730637, -122.4861)",14155752825.0,5817_20171003,10/3/2017 0:00,94.0,Routine - Unscheduled,5817_20171003_103149,Wiping cloths not clean or properly stored or inadequate sanitizer,Low Risk,20171003,103149,2017-10-03,2,2,0,0,2,3,0
1512,1512,5801,92662,Jasmine Tea House,3253 Mission St.,San Francisco,CA,94110,,,,,92662_20170921,9/21/2017 0:00,,New Ownership,92662_20170921_103142,Unclean nonfood contact surfaces,Low Risk,20170921,103142,2017-09-21,3,0,3,0,0,0,0
1513,1513,5804,86261,Taqueria Dos Charros,55 Cambon Dr,San Francisco,CA,94132,,,,14155336075.0,86261_20160229,2/29/2016 0:00,87.0,Routine - Unscheduled,86261_20160229_103150,Improper or defective plumbing,Low Risk,20160229,103150,2016-02-29,0,0,0,4,4,4,3
1514,1514,5808,69291,Cheese Boutique,660 Chenery St,San Francisco,CA,94131,37.734548,-122.433341,"(37.734548, -122.433341)",,69291_20160330,3/30/2016 0:00,98.0,Routine - Unscheduled,69291_20160330_103147,Inadequate ventilation or lighting,Low Risk,20160330,103147,2016-03-30,0,0,2,0,0,0,1
1515,1515,5809,2262,Ritz-Carlton SF - Banquet Kitchen,600 Stockton St 2nd Floor,San Francisco,CA,94108,37.791757000000004,-122.407377,"(37.791757, -122.407377)",,2262_20160330,3/30/2016 0:00,94.0,Routine - Unscheduled,2262_20160330_103144,Unapproved or unmaintained equipment or utensils,Low Risk,20160330,103144,2016-03-30,0,0,0,1,0,0,2
1516,1516,5823,62896,Spice Kit,405 Howard St Suite 130,San Francisco,CA,94105,37.789057,-122.395322,"(37.789057, -122.395322)",,62896_20161213,12/13/2016 0:00,90.0,Routine - Unscheduled,62896_20161213_103139,Improper food storage,Low Risk,20161213,103139,2016-12-13,0,4,0,0,4,3,0
1517,1517,5827,69253,Chili Cha Cha 2,3166 24th St,San Francisco,CA,94110,,,,,69253_20160630,6/30/2016 0:00,94.0,Routine - Unscheduled,69253_20160630_103120,Moderate risk food holding temperature,Moderate Risk,20160630,103120,2016-06-30,0,3,4,0,2,2,1
1518,1518,5831,5820,GLEN PARK ELEMENTARY SCHOOL,151 LIPPARD Ave,San Francisco,CA,94122,37.73322,-122.435998,"(37.73322, -122.435998)",14155464713.0,5820_20180305,3/5/2018 0:00,96.0,Routine - Unscheduled,5820_20180305_103148,No thermometers or uncalibrated thermometers,Low Risk,20180305,103148,2018-03-05,2,0,2,0,1,4,3
1519,1519,5833,81862,Kufu-Ya Japanese Restaurant Inc.,7001 Geary Blvd,San Francisco,CA,94121,,,,14155534526.0,81862_20180301,3/1/2018 0:00,85.0,Routine - Unscheduled,81862_20180301_103131,Moderate risk vermin infestation,Moderate Risk,20180301,103131,2018-03-01,4,0,0,0,0,0,1
1520,1520,5835,3343,PERRYS,1944 UNION St,San Francisco,CA,94123,37.797647999999995,-122.431274,"(37.797648, -122.431274)",14155929022.0,3343_20160907,9/7/2016 0:00,96.0,Routine - Unscheduled,3343_20160907_103144,Unapproved or unmaintained equipment or utensils,Low Risk,20160907,103144,2016-09-07,0,3,0,0,0,2,4
1521,1521,5838,77406,Hogwash,582 Sutter St,San Francisco,CA,94102,,,,,77406_20160523,5/23/2016 0:00,93.0,Routine - Unscheduled,77406_20160523_103109,Unclean or unsanitary food contact surfaces,High Risk,20160523,103109,2016-05-23,0,0,0,1,0,1,0
1522,1522,5841,85945,Bon Appetit @ LinkedIn,222 02nd St 3rd Floor,San Francisco,CA,94105,,,,14150798010.0,85945_20170920,9/20/2017 0:00,89.0,Routine - Unscheduled,85945_20170920_103105,Improper cooling methods,High Risk,20170920,103105,2017-09-20,0,0,2,0,0,0,0
1523,1523,5842,68018,Cafeto Coffee Shop,111 Richland Ave,San Francisco,CA,94110,37.736078000000006,-122.424108,"(37.736078, -122.424108)",,68018_20180306,3/6/2018 0:00,96.0,Routine - Unscheduled,68018_20180306_103124,Inadequately cleaned or sanitized food contact surfaces,Moderate Risk,20180306,103124,2018-03-06,1,0,1,0,0,1,1
1524,1524,5844,4894,SUNRISE MARKET,688 Haight St,San Francisco,CA,94117,37.771747999999995,-122.433493,"(37.771748, -122.433493)",,4894_20161024,10/24/2016 0:00,85.0,Routine - Unscheduled,4894_20161024_103120,Moderate risk food holding temperature,Moderate Risk,20161024,103120,2016-10-24,0,0,0,0,4,0,2
1525,1525,5850,33638,Pissed Off Pete's,4528 MISSION St,San Francisco,CA,94112,37.725390999999995,-122.43436499999999,"(37.725391, -122.434365)",,33638_20171002,10/2/2017 0:00,94.0,Routine - Unscheduled,33638_20171002_103161,Low risk vermin infestation,Low Risk,20171002,103161,2017-10-02,0,3,0,0,0,2,0
1526,1526,5851,81264,Arsicault Bakery,397 Arguello Blvd,San Francisco,CA,94118,,,,14158982739.0,81264_20160210,2/10/2016 0:00,,New Ownership,81264_20160210_103153,Inadequate dressing rooms or improper storage of personal items,Low Risk,20160210,103153,2016-02-10,0,0,0,0,2,0,3
1527,1527,5853,82950,Acquolina,1600 Stockton St,San Francisco,CA,94133,,,,,82950_20160701,7/1/2016 0:00,,Reinspection/Followup,82950_20160701_103161,Low risk vermin infestation,Low Risk,20160701,103161,2016-07-01,0,0,0,0,0,1,1
1528,1528,5862,1493,Peet's Coffee & Tea,1 Ferry Building  C3,San Francisco,CA,94111,37.795184000000006,-122.393819,"(37.795184, -122.393819)",,1493_20160331,3/31/2016 0:00,92.0,Routine - Unscheduled,1493_20160331_103151,Inadequate or unsanitary refuse containers or area or no garbage service,Low Risk,20160331,103151,2016-03-31,0,0,0,0,0,0,4
1529,1529,5867,65050,House of Banquet,939 Clement St,San Francisco,CA,94118,37.782663,-122.46935900000001,"(37.782663, -122.469359)",14155780203.0,65050_20160608,6/8/2016 0:00,71.0,Routine - Unscheduled,65050_20160608_103131,Moderate risk vermin infestation,Moderate Risk,20160608,103131,2016-06-08,0,0,0,8,0,7,4
1530,1530,5876,81258,Pineapple King Bakery,1915 Irving St,San Francisco,CA,94122,,,,14155997075.0,81258_20171214,12/14/2017 0:00,90.0,Routine - Unscheduled,81258_20171214_103124,Inadequately cleaned or sanitized food contact surfaces,Moderate Risk,20171214,103124,2017-12-14,0,3,0,0,3,3,0
1531,1531,5886,74759,The Crepevine,624 Irving St,San Francisco,CA,94122,,,,14155685858.0,74759_20180306,3/6/2018 0:00,91.0,Routine - Unscheduled,74759_20180306_103135,No person in charge of food facility,Low Risk,20180306,103135,2018-03-06,2,0,0,0,0,0,0
1532,1532,5896,5156,McDONALD'S,302 POTRERO Ave,San Francisco,CA,94110,37.765507,-122.40756499999999,"(37.765507, -122.407565)",14155863295.0,5156_20161024,10/24/2016 0:00,84.0,Routine - Unscheduled,5156_20161024_103154,Unclean or degraded floors walls or ceilings,Low Risk,20161024,103154,2016-10-24,0,0,3,0,5,0,0
1533,1533,5899,90708,Creperie Saint Germain,201 2nd St,San Francisco,CA,94105,,,,14155947348.0,90708_20171221,12/21/2017 0:00,79.0,Routine - Unscheduled,90708_20171221_103133,Foods not protected from contamination,Moderate Risk,20171221,103133,2017-12-21,0,5,0,0,0,0,0
1534,1534,5905,79821,Perilla Vietnamese Cuisine,836 Irving St,San Francisco,CA,94122,,,,14155569980.0,79821_20150721,7/21/2015 0:00,79.0,Routine - Unscheduled,79821_20150721_103144,Unapproved or unmaintained equipment or utensils,Low Risk,20150721,103144,2015-07-21,0,0,0,7,0,0,5
1535,1535,5907,5786,UNION STREET INN,2229 UNION St,San Francisco,CA,94123,37.79697700000001,-122.43596799999999,"(37.796977, -122.435968)",14155340424.0,5786_20171003,10/3/2017 0:00,94.0,Routine - Unscheduled,5786_20171003_103161,Low risk vermin infestation,Low Risk,20171003,103161,2017-10-03,0,2,0,0,0,0,0
1536,1536,5912,69529,Backroom Dining,339 Taraval St,San Francisco,CA,94116,,,,14155683228.0,69529_20150616,6/16/2015 0:00,98.0,Routine - Unscheduled,69529_20150616_103144,Unapproved or unmaintained equipment or utensils,Low Risk,20150616,103144,2015-06-16,0,0,0,0,0,0,1
1537,1537,5913,473,Caffe Greco,423 Columbus Ave,San Francisco,CA,94133,37.79886,-122.408204,"(37.79886, -122.408204)",,473_20150720,7/20/2015 0:00,,Complaint,473_20150720_103103,High risk food holding temperature,High Risk,20150720,103103,2015-07-20,0,0,0,0,0,3,3
1538,1538,5916,65830,Bubba Gump Shrimp Co.,Pier 39  M210,San Francisco,CA,94133,37.80824000000001,-122.41018899999999,"(37.80824, -122.410189)",,65830_20171004,10/4/2017 0:00,94.0,Routine - Unscheduled,65830_20171004_103150,Improper or defective plumbing,Low Risk,20171004,103150,2017-10-04,0,2,0,0,0,3,4
1539,1539,5919,64938,Xpress Market,498 O'Farrell St,San Francisco,CA,94102,37.785861,-122.412954,"(37.785861, -122.412954)",14155923063.0,64938_20180227,2/27/2018 0:00,79.0,Routine - Unscheduled,64938_20180227_103118,Employee eating or smoking,Moderate Risk,20180227,103118,2018-02-27,6,0,0,0,5,0,1
1540,1540,5920,78779,Pakwan Restaurant,501 O'Farrell St,San Francisco,CA,94102,,,,,78779_20180227,2/27/2018 0:00,80.0,Routine - Unscheduled,78779_20180227_103156,Permit license or inspection report not posted,Low Risk,20180227,103156,2018-02-27,4,0,0,0,5,0,7
1541,1541,5925,87778,Martha & Brothers Coffee Co,3868 24th St,San Francisco,CA,94114,,,,14155644433.0,87778_20161011,10/11/2016 0:00,,Reinspection/Followup,87778_20161011_103157,Food safety certificate or food handler card not available,Low Risk,20161011,103157,2016-10-11,0,6,0,0,5,0,0
1542,1542,5929,80422,Seed + Salt,2240 Chestnut St,San Francisco,CA,94123,,,,14155671440.0,80422_20160518,5/18/2016 0:00,,Reinspection/Followup,80422_20160518_103105,Improper cooling methods,High Risk,20160518,103105,2016-05-18,0,0,0,0,0,1,0
1543,1543,5930,60628,Phillies,932 GENEVA Ave,San Francisco,CA,94112,37.716165000000004,-122.440572,"(37.716165, -122.440572)",,60628_20180305,3/5/2018 0:00,94.0,Routine - Unscheduled,60628_20180305_103144,Unapproved or unmaintained equipment or utensils,Low Risk,20180305,103144,2018-03-05,2,0,0,2,0,2,2
1544,1544,5934,9208,Nordstrom Expresso Bar,285 Winston Dr.,San Francisco,CA,94132,37.726895,-122.47586100000001,"(37.726895, -122.475861)",,9208_20160913,9/13/2016 0:00,80.0,Routine - Unscheduled,9208_20160913_103112,No hot water or running water,High Risk,20160913,103112,2016-09-13,0,1,0,0,2,4,0
1545,1545,5937,4849,FAMILY MARKET,198 BROAD St,San Francisco,CA,94112,37.713219,-122.458851,"(37.713219, -122.458851)",14155582458.0,4849_20160331,3/31/2016 0:00,84.0,Routine - Unscheduled,4849_20160331_103110,Unapproved food source,High Risk,20160331,103110,2016-03-31,0,0,0,0,4,0,3
1546,1546,5947,91911,Max's Opera Cafe,601 Van Ness Ave.,San Francisco,CA,94102,,,,14155777300.0,91911_20170612,6/12/2017 0:00,,New Ownership,91911_20170612_103133,Foods not protected from contamination,Moderate Risk,20170612,103133,2017-06-12,0,0,0,4,0,0,0
1547,1547,5949,88508,McDonald's,5454 Mission St,San Francisco,CA,94112,,,,,88508_20180305,3/5/2018 0:00,94.0,Routine - Unscheduled,88508_20180305_103144,Unapproved or unmaintained equipment or utensils,Low Risk,20180305,103144,2018-03-05,2,0,0,0,3,0,0
1548,1548,5965,84735,Hippie Thai Street Food,1418 Haight St,San Francisco,CA,94117,,,,14155275380.0,84735_20160119,1/19/2016 0:00,,New Ownership,84735_20160119_103119,Inadequate and inaccessible handwashing facilities,Moderate Risk,20160119,103119,2016-01-19,0,0,0,0,0,0,3
1549,1549,5968,4553,RUTILY'S MARKET,1700 FILBERT St,San Francisco,CA,94123,37.799078,-122.42763400000001,"(37.799078, -122.427634)",,4553_20171003,10/3/2017 0:00,92.0,Routine - Unscheduled,4553_20171003_103120,Moderate risk food holding temperature,Moderate Risk,20171003,103120,2017-10-03,0,3,0,0,0,4,0
1550,1550,5970,4665,7-ELEVEN #20473,2222 TARAVAL St,San Francisco,CA,94116,37.742447999999996,-122.49003200000001,"(37.742448, -122.490032)",,4665_20160524,5/24/2016 0:00,94.0,Routine - Unscheduled,4665_20160524_103154,Unclean or degraded floors walls or ceilings,Low Risk,20160524,103154,2016-05-24,0,2,0,0,2,2,4
1551,1551,5972,39586,Loving Cup,2356 Polk St,San Francisco,CA,94109,37.798587,-122.422257,"(37.798587, -122.422257)",,39586_20171215,12/15/2017 0:00,94.0,Routine - Unscheduled,39586_20171215_103154,Unclean or degraded floors walls or ceilings,Low Risk,20171215,103154,2017-12-15,0,2,0,0,0,3,0
1552,1552,5977,2387,MEMPHIS MINNIE'S BBQ JOINT,576 HAIGHT St,San Francisco,CA,94117,37.771978000000004,-122.43165400000001,"(37.771978, -122.431654)",14155647427.0,2387_20180301,3/1/2018 0:00,92.0,Routine - Unscheduled,2387_20180301_103144,Unapproved or unmaintained equipment or utensils,Low Risk,20180301,103144,2018-03-01,4,0,0,0,0,6,0
1553,1553,5980,71286,21 Taste House,1109 Ocean Ave,San Francisco,CA,94112,37.723461,-122.454226,"(37.723461, -122.454226)",14155932233.0,71286_20180302,3/2/2018 0:00,90.0,Routine - Unscheduled,71286_20180302_103144,Unapproved or unmaintained equipment or utensils,Low Risk,20180302,103144,2018-03-02,4,0,0,2,0,4,3
1554,1554,5983,2996,PALOMINO EURO-BISTRO,345 SPEAR St,San Francisco,CA,94105,37.789394,-122.390073,"(37.789394, -122.390073)",,2996_20160908,9/8/2016 0:00,86.0,Routine - Unscheduled,2996_20160908_103102,Unclean hands or improper use of gloves,High Risk,20160908,103102,2016-09-08,0,0,0,0,0,2,0
1555,1555,5993,5077,SEAKOR DELI,5957 GEARY Blvd,San Francisco,CA,94121,37.780054,-122.483181,"(37.780054, -122.483181)",,5077_20180308,3/8/2018 0:00,96.0,Routine - Unscheduled,5077_20180308_103127,Noncompliance with HAACP plan or variance,Moderate Risk,20180308,103127,2018-03-08,1,0,0,0,0,0,0
1556,1556,5995,83497,Petit Crenn,609 Hayes St,San Francisco,CA,94102,,,,,83497_20150909,9/9/2015 0:00,92.0,Routine - Unscheduled,83497_20150909_103116,Inadequate food safety knowledge or lack of certified food safety manager,Moderate Risk,20150909,103116,2015-09-09,0,0,0,0,4,1,2
1557,1557,5996,80137,Los Trinos Restaurant,5672 Mission St,San Francisco,CA,94112,,,,14155575645.0,80137_20161005,10/5/2016 0:00,92.0,Routine - Unscheduled,80137_20161005_103149,Wiping cloths not clean or properly stored or inadequate sanitizer,Low Risk,20161005,103149,2016-10-05,0,0,4,0,3,0,1
1558,1558,6008,1122,STARBUCKS COFFEE #531,2132 CHESTNUT St,San Francisco,CA,94123,37.800546999999995,-122.43849399999999,"(37.800547, -122.438494)",,1122_20171214,12/14/2017 0:00,94.0,Routine - Unscheduled,1122_20171214_103150,Improper or defective plumbing,Low Risk,20171214,103150,2017-12-14,0,3,0,0,4,0,3
1559,1559,6013,80744,Azalina's Kitchen,1324 Fitzgerald Ave,San Francisco,CA,94124,,,,14155402038.0,80744_20150717,7/17/2015 0:00,82.0,Routine - Unscheduled,80744_20150717_103133,Foods not protected from contamination,Moderate Risk,20150717,103133,2015-07-17,0,0,0,0,3,0,3
1560,1560,6020,70148,Mission Street Sports Bar SF,2565 Mission St.,San Francisco,CA,94110,,,,14157306425.0,70148_20150727,7/27/2015 0:00,88.0,Routine - Unscheduled,70148_20150727_103116,Inadequate food safety knowledge or lack of certified food safety manager,Moderate Risk,20150727,103116,2015-07-27,4,0,0,0,0,2,4
1561,1561,6023,79125,"Belcampo Meat Company, LLC",1998 Polk St,San Francisco,CA,94109,,,,14155665573.0,79125_20171221,12/21/2017 0:00,94.0,Routine - Unscheduled,79125_20171221_103156,Permit license or inspection report not posted,Low Risk,20171221,103156,2017-12-21,0,2,1,2,1,2,4
1562,1562,6032,67545,Keiko a Nob Hill,1250 Jones St,San Francisco,CA,94109,37.793068,-122.41440700000001,"(37.793068, -122.414407)",,67545_20160502,5/2/2016 0:00,94.0,Routine - Unscheduled,67545_20160502_103138,Improper storage use or identification of toxic substances,Low Risk,20160502,103138,2016-05-02,0,0,0,2,0,3,4
1563,1563,6034,78215,Mission Chinese Food SF,2234 Mission St,San Francisco,CA,94110,,,,14155862800.0,78215_20180305,3/5/2018 0:00,83.0,Routine - Unscheduled,78215_20180305_103119,Inadequate and inaccessible handwashing facilities,Moderate Risk,20180305,103119,2018-03-05,5,0,8,0,0,6,3
1564,1564,6036,64843,Palmyra,700 HAIGHT St,San Francisco,CA,94117,37.771698,-122.433903,"(37.771698, -122.433903)",,64843_20161024,10/24/2016 0:00,87.0,Routine - Unscheduled,64843_20161024_103105,Improper cooling methods,High Risk,20161024,103105,2016-10-24,0,0,0,0,4,0,6
1565,1565,6038,64502,Pizzeria Sophia,1934 OCEAN Ave,San Francisco,CA,94127,37.725697,-122.463311,"(37.725697, -122.463311)",,64502_20160930,9/30/2016 0:00,92.0,Routine - Unscheduled,64502_20160930_103154,Unclean or degraded floors walls or ceilings,Low Risk,20160930,103154,2016-09-30,0,0,0,2,0,3,4
1566,1566,6042,39606,Stable Cafe,2128 Folsom St,San Francisco,CA,94110,37.76322800000001,-122.415135,"(37.763228, -122.415135)",,39606_20171213,12/13/2017 0:00,92.0,Routine - Unscheduled,39606_20171213_103129,Insufficient hot water or running water,Moderate Risk,20171213,103129,2017-12-13,0,3,0,0,1,0,0
1567,1567,6044,90409,McDonald's,1201 Ocean Ave,San Francisco,CA,94112,,,,14155458819.0,90409_20170927,9/27/2017 0:00,92.0,Routine - Unscheduled,90409_20170927_103119,Inadequate and inaccessible handwashing facilities,Moderate Risk,20170927,103119,2017-09-27,0,0,3,0,3,0,0
1568,1568,6046,89025,Keeva Indian Kitchen,908 Clement St,San Francisco,CA,94118,,,,,89025_20171003,10/3/2017 0:00,90.0,Routine - Unscheduled,89025_20171003_103154,Unclean or degraded floors walls or ceilings,Low Risk,20171003,103154,2017-10-03,0,3,0,0,6,0,0
1569,1569,6049,83570,Fuji Restaurant,301 West Portal Ave,San Francisco,CA,94127,,,,14155566360.0,83570_20150723,7/23/2015 0:00,,New Ownership,83570_20150723_103120,Moderate risk food holding temperature,Moderate Risk,20150723,103120,2015-07-23,0,0,0,0,0,7,1
1570,1570,6050,20291,Hazel's Kitchen,1319 18th St,San Francisco,CA,94107,37.762575,-122.395757,"(37.762575, -122.395757)",,20291_20150407,4/7/2015 0:00,92.0,Routine - Unscheduled,20291_20150407_103124,Inadequately cleaned or sanitized food contact surfaces,Moderate Risk,20150407,103124,2015-04-07,0,2,0,0,0,0,3
1571,1571,6052,91313,Tacos Santo Toribio,928 Toland,San Francisco,CA,zzzzz,,,,14155509190.0,91313_20180306,3/6/2018 0:00,,Structural Inspection,91313_20180306_103162,Other low risk violation,Low Risk,20180306,103162,2018-03-06,1,5,0,0,0,0,0
1572,1572,6055,3304,Round Table Pizza,801 Van Ness Ave,San Francisco,CA,94109,37.783025,-122.42095400000001,"(37.783025, -122.420954)",,3304_20160406,4/6/2016 0:00,88.0,Routine - Unscheduled,3304_20160406_103120,Moderate risk food holding temperature,Moderate Risk,20160406,103120,2016-04-06,0,0,0,0,4,3,0
1573,1573,6067,87316,Bit Me Sandwiches,4230 18th St,San Francisco,CA,94114,,,,,87316_20180228,2/28/2018 0:00,94.0,Routine - Unscheduled,87316_20180228_103119,Inadequate and inaccessible handwashing facilities,Moderate Risk,20180228,103119,2018-02-28,2,0,0,0,0,0,0
1574,1574,6068,2980,PUERTO ALEGRE,546 Valencia St,San Francisco,CA,94110,37.764148,-122.42185500000001,"(37.764148, -122.421855)",14155258201.0,2980_20161024,10/24/2016 0:00,89.0,Routine - Unscheduled,2980_20161024_103109,Unclean or unsanitary food contact surfaces,High Risk,20161024,103109,2016-10-24,2,0,0,0,2,2,2
1575,1575,6071,38808,PPQ Beef Noodle House,1816 IRVING St,San Francisco,CA,94122,37.763603,-122.477497,"(37.763603, -122.477497)",,38808_20160310,3/10/2016 0:00,75.0,Routine - Unscheduled,38808_20160310_103148,No thermometers or uncalibrated thermometers,Low Risk,20160310,103148,2016-03-10,0,0,6,0,0,4,7
1576,1576,6076,28206,Westfield Food Court Scullery,845 Market St Scullery (LL),San Francisco,CA,94103,37.784679,-122.40706100000001,"(37.784679, -122.407061)",14155516776.0,28206_20170510,5/10/2017 0:00,,Complaint,28206_20170510_103142,Unclean nonfood contact surfaces,Low Risk,20170510,103142,2017-05-10,4,0,0,7,0,7,4
1577,1577,6080,6029,ALEXIS APARTMENTS SR. MEALS PROGRAM,390 CLEMENTINA St,San Francisco,CA,94103,,,,,6029_20171002,10/2/2017 0:00,88.0,Routine - Unscheduled,6029_20171002_103124,Inadequately cleaned or sanitized food contact surfaces,Moderate Risk,20171002,103124,2017-10-02,0,3,0,0,0,0,0
1578,1578,6081,70022,Tenmatsu Grab and Go,336 Kearny St,San Francisco,CA,94108,37.791112,-122.40402399999999,"(37.791112, -122.404024)",,70022_20160331,3/31/2016 0:00,74.0,Routine - Unscheduled,70022_20160331_103138,Improper storage use or identification of toxic substances,Low Risk,20160331,103138,2016-03-31,0,0,5,0,0,0,7
1579,1579,6086,1249,KABABAYAN FAST FOOD,2706 MISSION St,San Francisco,CA,94110,37.753690999999996,-122.41865700000001,"(37.753691, -122.418657)",14155929635.0,1249_20171002,10/2/2017 0:00,78.0,Routine - Unscheduled,1249_20171002_103103,High risk food holding temperature,High Risk,20171002,103103,2017-10-02,0,6,0,0,0,5,5
1580,1580,6093,64141,Fresco Pizza and Grill,1338 Polk St,San Francisco,CA,94109,37.789278,-122.420387,"(37.789278, -122.420387)",,64141_20180307,3/7/2018 0:00,90.0,Routine - Unscheduled,64141_20180307_103120,Moderate risk food holding temperature,Moderate Risk,20180307,103120,2018-03-07,4,0,4,0,4,4,0
1581,1581,6094,442,My Canh Restaurant,626 Broadway St,San Francisco,CA,94133,37.797828,-122.407474,"(37.797828, -122.407474)",,442_20180123,1/23/2018 0:00,90.0,Routine - Unscheduled,442_20180123_103124,Inadequately cleaned or sanitized food contact surfaces,Moderate Risk,20180123,103124,2018-01-23,3,0,0,5,0,0,5
1582,1582,6096,619,A-1 BAKERY,1727 OCEAN Ave,San Francisco,CA,94112,37.724824,-122.460726,"(37.724824, -122.460726)",14155586923.0,619_20170929,9/29/2017 0:00,90.0,Routine - Unscheduled,619_20170929_103149,Wiping cloths not clean or properly stored or inadequate sanitizer,Low Risk,20170929,103149,2017-09-29,0,0,4,0,5,1,1
1583,1583,6100,83587,Orson's Belly,1737 Balboa St,San Francisco,CA,94121,,,,14155255588.0,83587_20160506,5/6/2016 0:00,96.0,Routine - Unscheduled,83587_20160506_103150,Improper or defective plumbing,Low Risk,20160506,103150,2016-05-06,0,0,0,0,0,2,0
1584,1584,6101,83389,Provender,1415 18th St,San Francisco,CA,94107,,,,,83389_20150814,8/14/2015 0:00,93.0,Routine - Unscheduled,83389_20150814_103105,Improper cooling methods,High Risk,20150814,103105,2015-08-14,0,1,0,0,1,0,1
1585,1585,6112,78408,Thinker's Cafe,1631 20th St,San Francisco,CA,94107,,,,,78408_20171211,12/11/2017 0:00,90.0,Routine - Unscheduled,78408_20171211_103131,Moderate risk vermin infestation,Moderate Risk,20171211,103131,2017-12-11,0,3,0,0,2,0,2
1586,1586,6115,1724,CAFE MUMS,1800 SUTTER St,San Francisco,CA,94115,37.786497999999995,-122.430283,"(37.786498, -122.430283)",14155936986.0,1724_20160309,3/9/2016 0:00,86.0,Routine - Unscheduled,1724_20160309_103131,Moderate risk vermin infestation,Moderate Risk,20160309,103131,2016-03-09,0,0,0,0,4,0,4
1587,1587,6117,3819,SAFEWAY #667,5290 DIAMOND HEIGHTS Blvd,San Francisco,CA,94131,37.744076,-122.43868400000001,"(37.744076, -122.438684)",14155827744.0,3819_20150610,6/10/2015 0:00,85.0,Routine - Unscheduled,3819_20150610_103120,Moderate risk food holding temperature,Moderate Risk,20150610,103120,2015-06-10,0,4,0,0,0,0,3
1588,1588,6120,65111,Cafe Fiore,3599 24th St,San Francisco,CA,94110,37.751951,-122.422827,"(37.751951, -122.422827)",,65111_20180306,3/6/2018 0:00,84.0,Routine - Unscheduled,65111_20180306_103120,Moderate risk food holding temperature,Moderate Risk,20180306,103120,2018-03-06,5,0,6,0,0,0,2
1589,1589,6124,86358,Tartine Manufactory,595 Alabama St,San Francisco,CA,94110,,,,14155482600.0,86358_20171215,12/15/2017 0:00,87.0,Routine - Unscheduled,86358_20171215_103131,Moderate risk vermin infestation,Moderate Risk,20171215,103131,2017-12-15,0,3,0,0,0,0,0
1590,1590,6126,2245,Starbucks Coffee Co,0264 Kearny St,San Francisco,CA,94108,37.790498,-122.403896,"(37.790498, -122.403896)",,2245_20160419,4/19/2016 0:00,92.0,Routine - Unscheduled,2245_20160419_103156,Permit license or inspection report not posted,Low Risk,20160419,103156,2016-04-19,0,0,1,0,0,3,0
1591,1591,6128,2601,Last Drop Tavern,550 Powell St,San Francisco,CA,94108,37.789883,-122.408666,"(37.789883, -122.408666)",,2601_20160310,3/10/2016 0:00,92.0,Routine - Unscheduled,2601_20160310_103139,Improper food storage,Low Risk,20160310,103139,2016-03-10,0,0,0,2,0,0,3
1592,1592,6132,3951,KIRIN RESTAURANT,6135 GEARY Blvd,San Francisco,CA,94121,37.779962,-122.48508700000001,"(37.779962, -122.485087)",,3951_20170920,9/20/2017 0:00,79.0,Routine - Unscheduled,3951_20170920_103114,High risk vermin infestation,High Risk,20170920,103114,2017-09-20,0,0,6,3,0,0,6
1593,1593,6141,86486,Surisan,505 Beach St,San Francisco,CA,94133,,,,,86486_20180228,2/28/2018 0:00,94.0,Routine - Unscheduled,86486_20180228_103133,Foods not protected from contamination,Moderate Risk,20180228,103133,2018-02-28,2,0,4,0,0,0,0
1594,1594,6146,89982,Pakwan Restaurant,1140 Ocean Ave,San Francisco,CA,94112,,,,14155841200.0,89982_20171003,10/3/2017 0:00,,Complaint,89982_20171003_103139,Improper food storage,Low Risk,20171003,103139,2017-10-03,0,5,0,0,6,0,0
1595,1595,6150,4071,Gino and Carlo Inc,548 Green St,San Francisco,CA,94133,37.799656,-122.408166,"(37.799656, -122.408166)",,4071_20160513,5/13/2016 0:00,,Reinspection/Followup,4071_20160513_103145,Improper storage of equipment utensils or linens,Low Risk,20160513,103145,2016-05-13,0,0,0,0,0,2,0
1596,1596,6151,11079,Cafe Bello,2885 Diamond St,San Francisco,CA,94131,37.733771000000004,-122.43403799999999,"(37.733771, -122.434038)",,11079_20160330,3/30/2016 0:00,94.0,Routine - Unscheduled,11079_20160330_103144,Unapproved or unmaintained equipment or utensils,Low Risk,20160330,103144,2016-03-30,0,0,5,0,4,0,3
1597,1597,6156,539,EL SALVADOR RESTAURANT,2278 MISSION St,San Francisco,CA,94110,37.760579,-122.41932,"(37.760579, -122.41932)",,539_20160419,4/19/2016 0:00,96.0,Routine - Unscheduled,539_20160419_103119,Inadequate and inaccessible handwashing facilities,Moderate Risk,20160419,103119,2016-04-19,0,3,0,0,1,1,2
1598,1598,6159,93023,Icicles,829 Mission St.,San Francisco,CA,94103,,,,,93023_20171101,11/1/2017 0:00,96.0,Routine - Unscheduled,93023_20171101_103124,Inadequately cleaned or sanitized food contact surfaces,Moderate Risk,20171101,103124,2017-11-01,0,1,0,0,0,0,0
1599,1599,6161,86407,SFSU Cafe in the Park,802 Font Blvd,San Francisco,CA,94132,,,,14155408041.0,86407_20160427,4/27/2016 0:00,98.0,Routine - Unscheduled,86407_20160427_103144,Unapproved or unmaintained equipment or utensils,Low Risk,20160427,103144,2016-04-27,0,0,0,1,0,1,0
1600,1600,6170,639,Swan Oyster Depot,1517 Polk St,San Francisco,CA,94109,37.790734,-122.42078300000001,"(37.790734, -122.420783)",,639_20160303,3/3/2016 0:00,,Complaint,639_20160303_103134,Other moderate risk violation,Moderate Risk,20160303,103134,2016-03-03,0,2,0,0,0,3,2
1601,1601,6171,87909,K and D Market,3177 16th Street,San Francisco,CA,94103,,,,,87909_20171101,11/1/2017 0:00,,New Ownership,87909_20171101_103137,Improperly washed fruits and vegetables,Low Risk,20171101,103137,2017-11-01,0,4,0,0,0,0,0
1602,1602,6173,64717,18 Reasons,3674 18th St,San Francisco,CA,94110,37.761497999999996,-122.425402,"(37.761498, -122.425402)",,64717_20180228,2/28/2018 0:00,92.0,Routine - Unscheduled,64717_20180228_103124,Inadequately cleaned or sanitized food contact surfaces,Moderate Risk,20180228,103124,2018-02-28,2,0,0,0,0,0,1
1603,1603,6176,36014,CATCH,2362 MARKET St,San Francisco,CA,94114,37.763263,-122.43446000000002,"(37.763263, -122.43446)",,36014_20180227,2/27/2018 0:00,,Reinspection/Followup,36014_20180227_103161,Low risk vermin infestation,Low Risk,20180227,103161,2018-02-27,2,0,0,0,3,0,4
1604,1604,6178,70207,Ten Ren Tea,550 Grant Ave,San Francisco,CA,94108,,,,,70207_20171215,12/15/2017 0:00,92.0,Routine - Unscheduled,70207_20171215_103116,Inadequate food safety knowledge or lack of certified food safety manager,Moderate Risk,20171215,103116,2017-12-15,0,2,0,0,0,2,1
1605,1605,6187,85972,Hot Duck,1900 Clement St,San Francisco,CA,94121,,,,14155632880.0,85972_20161005,10/5/2016 0:00,75.0,Routine - Unscheduled,85972_20161005_103147,Inadequate ventilation or lighting,Low Risk,20161005,103147,2016-10-05,0,0,2,0,5,0,4
1606,1606,6188,17822,Peet's Coffee & Tea,601 Van Ness Ave Suite A,San Francisco,CA,94102,37.781454,-122.420644,"(37.781454, -122.420644)",,17822_20150925,9/25/2015 0:00,91.0,Routine - Unscheduled,17822_20150925_103109,Unclean or unsanitary food contact surfaces,High Risk,20150925,103109,2015-09-25,0,0,0,0,0,0,2
1607,1607,6190,70516,Shabu House,2608 Ocean Ave,San Francisco,CA,94132,37.731746,-122.47331799999999,"(37.731746, -122.473318)",14155588800.0,70516_20180227,2/27/2018 0:00,94.0,Routine - Unscheduled,70516_20180227_103144,Unapproved or unmaintained equipment or utensils,Low Risk,20180227,103144,2018-02-27,3,0,0,4,0,4,8
1608,1608,6192,58573,Haus Coffee,3086 24th St,San Francisco,CA,94110,37.752548,-122.413882,"(37.752548, -122.413882)",,58573_20170925,9/25/2017 0:00,90.0,Routine - Unscheduled,58573_20170925_103156,Permit license or inspection report not posted,Low Risk,20170925,103156,2017-09-25,0,0,4,1,2,4,2
1609,1609,6193,90427,McDonald's,1100 Fillmore St.,San Francisco,CA,94115,,,,,90427_20170420,4/20/2017 0:00,,New Ownership,90427_20170420_103120,Moderate risk food holding temperature,Moderate Risk,20170420,103120,2017-04-20,0,0,0,2,0,0,0
1610,1610,6197,71682,Bernie's,50 Post St #8,San Francisco,CA,94104,37.789064,-122.40286100000002,"(37.789064, -122.402861)",,71682_20171215,12/15/2017 0:00,92.0,Routine - Unscheduled,71682_20171215_103156,Permit license or inspection report not posted,Low Risk,20171215,103156,2017-12-15,0,3,0,0,3,0,0
1611,1611,6199,2004,Elaine's Kitchen,434 Broadway St,San Francisco,CA,94133,37.798178,-122.40448400000001,"(37.798178, -122.404484)",,2004_20160701,7/1/2016 0:00,,Reinspection/Followup,2004_20160701_103149,Wiping cloths not clean or properly stored or inadequate sanitizer,Low Risk,20160701,103149,2016-07-01,0,4,0,0,0,1,0
1612,1612,6201,80995,AFC Sushi at Walgreens #890,135 Powell St,San Francisco,CA,94102,,,,14150603200.0,80995_20180306,3/6/2018 0:00,94.0,Routine - Unscheduled,80995_20180306_103120,Moderate risk food holding temperature,Moderate Risk,20180306,103120,2018-03-06,2,0,0,0,1,0,0
1613,1613,6213,72176,Wolfes Lunch,1220 16th St,San Francisco,CA,94107,,,,,72176_20160225,2/25/2016 0:00,60.0,Routine - Unscheduled,72176_20160225_103103,High risk food holding temperature,High Risk,20160225,103103,2016-02-25,0,0,0,0,9,0,8
1614,1614,6219,74549,Performance Service Station Inc.,388 Potrero St,San Francisco,CA,94103,,,,,74549_20171215,12/15/2017 0:00,94.0,Routine - Unscheduled,74549_20171215_103119,Inadequate and inaccessible handwashing facilities,Moderate Risk,20171215,103119,2017-12-15,0,2,0,0,4,0,0
1615,1615,6221,59215,Enjoy Vegetarian Restaurant #2,839 Kearny St,San Francisco,CA,94108,37.795675,-122.405098,"(37.795675, -122.405098)",,59215_20160524,5/24/2016 0:00,93.0,Routine - Unscheduled,59215_20160524_103105,Improper cooling methods,High Risk,20160524,103105,2016-05-24,0,3,0,0,2,1,0
1616,1616,6227,29429,The Plant Cafe,3352 STEINER ST,San Francisco,CA,94123,37.800407,-122.43779599999999,"(37.800407, -122.437796)",,29429_20171218,12/18/2017 0:00,85.0,Routine - Unscheduled,29429_20171218_103154,Unclean or degraded floors walls or ceilings,Low Risk,20171218,103154,2017-12-18,0,4,0,0,0,4,5
1617,1617,6228,60473,Dong Baek Korean Restaurant,631 O'Farrell St,San Francisco,CA,94109,37.78550300000001,-122.41515700000001,"(37.785503, -122.415157)",,60473_20171215,12/15/2017 0:00,92.0,Routine - Unscheduled,60473_20171215_103141,Improper food labeling or menu misrepresentation,Low Risk,20171215,103141,2017-12-15,0,4,0,3,0,0,5
1618,1618,6235,90510,Delish Dish Kitchen Inc.,2109 Clement St.,San Francisco,CA,94121,,,,,90510_20170424,4/24/2017 0:00,,Complaint,90510_20170424_103102,Unclean hands or improper use of gloves,High Risk,20170424,103102,2017-04-24,0,0,0,7,0,0,0
1619,1619,6251,81202,Weaver's Coffee & Tea,2301 Market St,San Francisco,CA,94114,,,,14155528945.0,81202_20180208,2/8/2018 0:00,,Complaint,81202_20180208_103144,Unapproved or unmaintained equipment or utensils,Low Risk,20180208,103144,2018-02-08,1,0,2,0,0,1,2
1620,1620,6260,76401,Bun Mee,650 Market St,San Francisco,CA,94104,,,,,76401_20151204,12/4/2015 0:00,,Complaint,76401_20151204_103161,Low risk vermin infestation,Low Risk,20151204,103161,2015-12-04,0,5,0,0,4,0,3
1621,1621,6268,84892,Denny's Restaurant,816 Mission St,San Francisco,CA,94103,,,,,84892_20161026,10/26/2016 0:00,,New Ownership,84892_20161026_103142,Unclean nonfood contact surfaces,Low Risk,20161026,103142,2016-10-26,0,0,0,0,2,0,0
1622,1622,6269,59599,Bite,912 Sutter St,San Francisco,CA,94109,37.788367,-122.415474,"(37.788367, -122.415474)",,59599_20180228,2/28/2018 0:00,90.0,Routine - Unscheduled,59599_20180228_103150,Improper or defective plumbing,Low Risk,20180228,103150,2018-02-28,3,0,2,0,2,2,0
1623,1623,6271,80619,CA Academy of Science Cafe,55 Music Concourse Dr,San Francisco,CA,94118,,,,14152332403.0,80619_20171005,10/5/2017 0:00,92.0,Routine - Unscheduled,80619_20171005_103119,Inadequate and inaccessible handwashing facilities,Moderate Risk,20171005,103119,2017-10-05,0,2,0,0,2,0,3
1624,1624,6285,7555,VINH KHANG HERBS & GINSENG,512 CLEMENT St,San Francisco,CA,94118,37.782957,-122.46476200000001,"(37.782957, -122.464762)",,7555_20160310,3/10/2016 0:00,90.0,Routine - Unscheduled,7555_20160310_103139,Improper food storage,Low Risk,20160310,103139,2016-03-10,0,1,0,0,0,0,4
1625,1625,6286,69199,Mehfil Indian Restaurant,28 02nd St,San Francisco,CA,94105,,,,,69199_20180223,2/23/2018 0:00,90.0,Routine - Unscheduled,69199_20180223_103139,Improper food storage,Low Risk,20180223,103139,2018-02-23,4,0,0,0,9,0,0
1626,1626,6289,2971,ST MARY'S HOSPITAL CAFETERIA,450 STANYAN St L-B,San Francisco,CA,94117,37.773657,-122.45441699999999,"(37.773657, -122.454417)",14155755666.0,2971_20150914,9/14/2015 0:00,96.0,Routine - Unscheduled,2971_20150914_103133,Foods not protected from contamination,Moderate Risk,20150914,103133,2015-09-14,0,0,0,0,0,0,1
1627,1627,6291,90139,The Spicy Shrimp,150 Waverly Pl,San Francisco,CA,94108,,,,,90139_20170425,4/25/2017 0:00,90.0,Routine - Unscheduled,90139_20170425_103134,Other moderate risk violation,Moderate Risk,20170425,103134,2017-04-25,0,0,0,4,0,0,0
1628,1628,6292,37361,Ghirardelli Chocolate Fountain,801 Beach St,San Francisco,CA,94109,37.806388,-122.42216499999999,"(37.806388, -122.422165)",,37361_20160328,3/28/2016 0:00,96.0,Routine - Unscheduled,37361_20160328_103119,Inadequate and inaccessible handwashing facilities,Moderate Risk,20160328,103119,2016-03-28,0,0,0,0,0,0,1
1629,1629,6294,59833,Manhattan Hub Inc,343 Sansome St Suite 140,San Francisco,CA,94104,37.793693,-122.40119399999999,"(37.793693, -122.401194)",,59833_20170929,9/29/2017 0:00,92.0,Routine - Unscheduled,59833_20170929_103149,Wiping cloths not clean or properly stored or inadequate sanitizer,Low Risk,20170929,103149,2017-09-29,0,0,3,0,7,0,0
1630,1630,6295,83325,Five Star Truffles,4251 A 18th St,San Francisco,CA,94114,,,,14155555128.0,83325_20180122,1/22/2018 0:00,98.0,Routine - Unscheduled,83325_20180122_103157,Food safety certificate or food handler card not available,Low Risk,20180122,103157,2018-01-22,1,0,0,4,0,0,1
1631,1631,6297,2664,Alice's Restaurant,1599 Sanchez St,San Francisco,CA,94131,37.743602,-122.428803,"(37.743602, -122.428803)",14155288999.0,2664_20151110,11/10/2015 0:00,79.0,Routine - Unscheduled,2664_20151110_103119,Inadequate and inaccessible handwashing facilities,Moderate Risk,20151110,103119,2015-11-10,0,5,0,0,4,0,5
1632,1632,6302,1837,Cafe Bastille,22 Belden Pl,San Francisco,CA,94104,37.791139,-122.40371599999999,"(37.791139, -122.403716)",,1837_20160722,7/22/2016 0:00,85.0,Routine - Unscheduled,1837_20160722_103157,Food safety certificate or food handler card not available,Low Risk,20160722,103157,2016-07-22,0,0,5,0,0,4,0
1633,1633,6306,84339,Bon Appetit Management Co,1455 Market St 5th Floor,San Francisco,CA,94103,,,,,84339_20160413,4/13/2016 0:00,96.0,Routine - Unscheduled,84339_20160413_103124,Inadequately cleaned or sanitized food contact surfaces,Moderate Risk,20160413,103124,2016-04-13,0,0,0,0,0,1,0
1634,1634,6311,522,Boudin Sourdough Bakery,3251 20th Ave,San Francisco,CA,94132,37.728497,-122.47563899999999,"(37.728497, -122.475639)",14155561849.0,522_20151124,11/24/2015 0:00,93.0,Routine - Unscheduled,522_20151124_103103,High risk food holding temperature,High Risk,20151124,103103,2015-11-24,0,0,3,0,4,2,1
1635,1635,6313,1595,Zazie,941 COLE St,San Francisco,CA,94117,37.765343,-122.44991399999999,"(37.765343, -122.449914)",14155565332.0,1595_20171214,12/14/2017 0:00,92.0,Routine - Unscheduled,1595_20171214_103120,Moderate risk food holding temperature,Moderate Risk,20171214,103120,2017-12-14,0,1,0,0,0,2,2
1636,1636,6315,87799,"Yin Du Wonton Noodle, LLC",648 Pacific Ave,San Francisco,CA,94133,,,,,87799_20160621,6/21/2016 0:00,71.0,Routine - Unscheduled,87799_20160621_103154,Unclean or degraded floors walls or ceilings,Low Risk,20160621,103154,2016-06-21,0,4,0,0,0,6,0
1637,1637,6324,67565,King of Thai Noodles Cafe,1541 TARAVAL St,San Francisco,CA,94116,37.74270300000001,-122.48281899999999,"(37.742703, -122.482819)",,67565_20161212,12/12/2016 0:00,81.0,Routine - Unscheduled,67565_20161212_103132,Improper thawing methods,Moderate Risk,20161212,103132,2016-12-12,0,0,5,0,4,5,0
1638,1638,6325,62769,Loving Hut Vegan Cuisine,845 Market St FE12,San Francisco,CA,94103,37.784848,-122.406892,"(37.784848, -122.406892)",,62769_20171103,11/3/2017 0:00,81.0,Routine - Unscheduled,62769_20171103_103114,High risk vermin infestation,High Risk,20171103,103114,2017-11-03,0,5,0,0,0,4,0
1639,1639,6330,85164,La Boulangerie De San Francisco,500 Hayes St,San Francisco,CA,94102,,,,,85164_20180308,3/8/2018 0:00,88.0,Routine - Unscheduled,85164_20180308_103119,Inadequate and inaccessible handwashing facilities,Moderate Risk,20180308,103119,2018-03-08,4,0,4,0,4,2,0
1640,1640,6337,61326,Frances,3870 17th St,San Francisco,CA,94114,37.762698,-122.43223200000001,"(37.762698, -122.432232)",,61326_20171215,12/15/2017 0:00,96.0,Routine - Unscheduled,61326_20171215_103133,Foods not protected from contamination,Moderate Risk,20171215,103133,2017-12-15,0,1,0,0,0,0,0
1641,1641,6346,87469,Bon Appetit Management Co.,1455 Market St 4th Fl,San Francisco,CA,94103,,,,,87469_20160606,6/6/2016 0:00,96.0,Routine - Unscheduled,87469_20160606_103119,Inadequate and inaccessible handwashing facilities,Moderate Risk,20160606,103119,2016-06-06,0,0,0,0,0,1,0
1642,1642,6349,10332,Harvest Urban Market,191 08th St,San Francisco,CA,94103,37.776384,-122.41168400000001,"(37.776384, -122.411684)",14155620805.0,10332_20171002,10/2/2017 0:00,79.0,Routine - Unscheduled,10332_20171002_103133,Foods not protected from contamination,Moderate Risk,20171002,103133,2017-10-02,0,5,0,0,0,6,9
1643,1643,6358,91796,Le Cupboard,1298 Church St,San Francisco,CA,94114,,,,14155364725.0,91796_20171102,11/2/2017 0:00,92.0,Routine - Unscheduled,91796_20171102_103142,Unclean nonfood contact surfaces,Low Risk,20171102,103142,2017-11-02,0,4,0,0,0,0,0
1644,1644,6364,59574,Pan Lido Salvadoreno,3147 22nd St,San Francisco,CA,94110,37.755479,-122.41758300000001,"(37.755479, -122.417583)",14155283350.0,59574_20160909,9/9/2016 0:00,98.0,Routine - Unscheduled,59574_20160909_103149,Wiping cloths not clean or properly stored or inadequate sanitizer,Low Risk,20160909,103149,2016-09-09,4,0,3,0,0,1,1
1645,1645,6372,76355,AT&T PARK - Centerplate/Crazy Grab'z Cart,24 Willie Mays Plaza,San Francisco,CA,94107,,,,,76355_20160410,4/10/2016 0:00,98.0,Routine - Unscheduled,76355_20160410_103145,Improper storage of equipment utensils or linens,Low Risk,20160410,103145,2016-04-10,0,0,2,2,2,1,1
1646,1646,6373,68321,Capo's,641 Vallejo St,San Francisco,CA,94133,,,,,68321_20160407,4/7/2016 0:00,77.0,Routine - Unscheduled,68321_20160407_103148,No thermometers or uncalibrated thermometers,Low Risk,20160407,103148,2016-04-07,0,5,0,0,0,7,0
1647,1647,6377,3784,BLOWFISH SUSHI,2170 BRYANT St,San Francisco,CA,94110,37.759488,-122.409931,"(37.759488, -122.409931)",14155283848.0,3784_20150604,6/4/2015 0:00,94.0,Routine - Unscheduled,3784_20150604_103154,Unclean or degraded floors walls or ceilings,Low Risk,20150604,103154,2015-06-04,0,0,0,0,4,0,2
1648,1648,6383,75530,Super Duper Burgers,98 Mission St,San Francisco,CA,94105,,,,,75530_20161209,12/9/2016 0:00,86.0,Routine - Unscheduled,75530_20161209_103154,Unclean or degraded floors walls or ceilings,Low Risk,20161209,103154,2016-12-09,0,0,0,0,1,0,0
1649,1649,6385,3642,ABSINTHE PASTRY,201 IVY St,San Francisco,CA,94102,37.777491999999995,-122.421458,"(37.777492, -122.421458)",,3642_20151029,10/29/2015 0:00,94.0,Routine - Unscheduled,3642_20151029_103131,Moderate risk vermin infestation,Moderate Risk,20151029,103131,2015-10-29,0,3,0,3,0,0,2
1650,1650,6386,36513,Waterbar,399 Embarcadero,San Francisco,CA,94105,37.788613,-122.39389399999999,"(37.788613, -122.393894)",,36513_20160908,9/8/2016 0:00,91.0,Routine - Unscheduled,36513_20160908_103139,Improper food storage,Low Risk,20160908,103139,2016-09-08,0,0,0,0,0,2,0
1651,1651,6407,691,MARINA SUBMARINE,2299 UNION St,San Francisco,CA,94123,37.796893,-122.436847,"(37.796893, -122.436847)",,691_20180307,3/7/2018 0:00,92.0,Routine - Unscheduled,691_20180307_103142,Unclean nonfood contact surfaces,Low Risk,20180307,103142,2018-03-07,3,0,4,0,0,3,4
1652,1652,6412,6643,T & L FOOD MARKET,405 EDDY St,San Francisco,CA,94109,37.783660999999995,-122.414341,"(37.783661, -122.414341)",,6643_20170130,1/30/2017 0:00,,Complaint,6643_20170130_103138,Improper storage use or identification of toxic substances,Low Risk,20170130,103138,2017-01-30,0,0,0,0,8,9,0
1653,1653,6413,81164,Californios,3115 22nd St,San Francisco,CA,94110,,,,14155750994.0,81164_20171003,10/3/2017 0:00,94.0,Routine - Unscheduled,81164_20171003_103161,Low risk vermin infestation,Low Risk,20171003,103161,2017-10-03,0,2,0,0,0,0,1
1654,1654,6422,3160,Tandoori Mahal,941 Kearny St,San Francisco,CA,94133,37.796557,-122.40527800000001,"(37.796557, -122.405278)",,3160_20160308,3/8/2016 0:00,86.0,Routine - Unscheduled,3160_20160308_103124,Inadequately cleaned or sanitized food contact surfaces,Moderate Risk,20160308,103124,2016-03-08,0,3,0,0,0,3,4
1655,1655,6423,92555,Toy Soldier,52 Belden Pl,San Francisco,CA,94104,,,,,92555_20171002,10/2/2017 0:00,96.0,Routine - Unscheduled,92555_20171002_103161,Low risk vermin infestation,Low Risk,20171002,103161,2017-10-02,0,2,0,0,0,0,0
1656,1656,6425,74826,"Stuffed, LLC",2788 Mission St,San Francisco,CA,94110,,,,14155641069.0,74826_20170823,8/23/2017 0:00,,Complaint,74826_20170823_103131,Moderate risk vermin infestation,Moderate Risk,20170823,103131,2017-08-23,0,0,6,0,0,6,3
1657,1657,6431,4850,COOL GUYS,845 Holloway Ave,San Francisco,CA,94112,37.721794,-122.461991,"(37.721794, -122.461991)",14155451404.0,4850_20160419,4/19/2016 0:00,96.0,Routine - Unscheduled,4850_20160419_103118,Employee eating or smoking,Moderate Risk,20160419,103118,2016-04-19,0,0,1,0,3,1,0
1658,1658,6435,90837,Beanstalk - Inner Richmond,4555 California St,San Francisco,CA,94118,,,,,90837_20170719,7/19/2017 0:00,,Complaint,90837_20170719_103139,Improper food storage,Low Risk,20170719,103139,2017-07-19,0,0,3,0,0,0,0
1659,1659,6444,90525,Western Donut,2034 Mission St,San Francisco,CA,94110,,,,,90525_20170314,3/14/2017 0:00,,New Ownership,90525_20170314_103133,Foods not protected from contamination,Moderate Risk,20170314,103133,2017-03-14,5,0,0,0,6,0,0
1660,1660,6447,2620,Bambino's Ristorante,945 Cole St,San Francisco,CA,94117,37.765174,-122.44988400000001,"(37.765174, -122.449884)",14155731343.0,2620_20171214,12/14/2017 0:00,96.0,Routine - Unscheduled,2620_20171214_103136,Unsanitary employee garments hair or nails,Low Risk,20171214,103136,2017-12-14,0,2,0,0,0,0,2
1661,1661,6449,2829,EAGLE PIZZA,1712 TARAVAL St,San Francisco,CA,94116,37.742688,-122.484541,"(37.742688, -122.484541)",,2829_20180228,2/28/2018 0:00,96.0,Routine - Unscheduled,2829_20180228_103142,Unclean nonfood contact surfaces,Low Risk,20180228,103142,2018-02-28,2,0,0,0,0,3,0
1662,1662,6460,80964,Sunset Reservoir Brewing Company,1735 Noriega St,San Francisco,CA,94122,,,,14155633493.0,80964_20180306,3/6/2018 0:00,85.0,Routine - Unscheduled,80964_20180306_103103,High risk food holding temperature,High Risk,20180306,103103,2018-03-06,4,0,0,0,3,3,0
1663,1663,6469,8847,Village Market,1 Ferry Building #29,San Francisco,CA,94111,37.795225,-122.39376999999999,"(37.795225, -122.39377)",,8847_20151002,10/2/2015 0:00,98.0,Routine - Unscheduled,8847_20151002_103151,Inadequate or unsanitary refuse containers or area or no garbage service,Low Risk,20151002,103151,2015-10-02,0,0,0,0,4,0,1
1664,1664,6470,2406,THEP-PHANON RESTAURANT,400 WALLER St,San Francisco,CA,94117,37.77124,-122.430299,"(37.77124, -122.430299)",14155432526.0,2406_20180301,3/1/2018 0:00,85.0,Routine - Unscheduled,2406_20180301_103154,Unclean or degraded floors walls or ceilings,Low Risk,20180301,103154,2018-03-01,4,0,0,0,0,0,0
1665,1665,6473,86160,Hollow Cow,1875 Union St,San Francisco,CA,94123,,,,,86160_20170522,5/22/2017 0:00,83.0,Routine - Unscheduled,86160_20170522_103103,High risk food holding temperature,High Risk,20170522,103103,2017-05-22,0,4,0,4,0,0,0
1666,1666,6475,71980,Smile House Cafe,1030 Taraval St,San Francisco,CA,94116,,,,14155295057.0,71980_20160908,9/8/2016 0:00,89.0,Routine - Unscheduled,71980_20160908_103103,High risk food holding temperature,High Risk,20160908,103103,2016-09-08,0,0,0,0,5,2,3
1667,1667,6504,82373,Veganburg,1466 Haight St,San Francisco,CA,94117,,,,14154252889.0,82373_20171010,10/10/2017 0:00,92.0,Routine - Unscheduled,82373_20171010_103120,Moderate risk food holding temperature,Moderate Risk,20171010,103120,2017-10-10,0,2,0,0,0,3,2
1668,1668,6505,33468,Stacks Restaurant,501 Hayes St,San Francisco,CA,94102,37.776623,-122.42478700000001,"(37.776623, -122.424787)",,33468_20161004,10/4/2016 0:00,84.0,Routine - Unscheduled,33468_20161004_103131,Moderate risk vermin infestation,Moderate Risk,20161004,103131,2016-10-04,0,0,4,0,6,0,0
1669,1669,6507,85683,Chico's Pizza,468 Ellis St,San Francisco,CA,94109,,,,14155600047.0,85683_20180305,3/5/2018 0:00,92.0,Routine - Unscheduled,85683_20180305_103154,Unclean or degraded floors walls or ceilings,Low Risk,20180305,103154,2018-03-05,3,0,0,0,0,0,1
1670,1670,6514,2743,NOAH'S NEW YORK BAGELS #2147,2300 16 th St,San Francisco,CA,94103,37.765708000000004,-122.409002,"(37.765708, -122.409002)",14155862802.0,2743_20161024,10/24/2016 0:00,84.0,Routine - Unscheduled,2743_20161024_103154,Unclean or degraded floors walls or ceilings,Low Risk,20161024,103154,2016-10-24,0,3,0,0,3,0,0
1671,1671,6518,34839,Brenda's French Soul Food,652 B Polk St,San Francisco,CA,94102,37.782672,-122.419026,"(37.782672, -122.419026)",,34839_20170109,1/9/2017 0:00,79.0,Routine - Unscheduled,34839_20170109_103119,Inadequate and inaccessible handwashing facilities,Moderate Risk,20170109,103119,2017-01-09,0,0,5,0,5,0,4
1672,1672,6521,2932,Il Fornaio Gastronomia Italiana,1265 Battery St,San Francisco,CA,94111,37.802914,-122.40193500000001,"(37.802914, -122.401935)",,2932_20161128,11/28/2016 0:00,96.0,Routine - Unscheduled,2932_20161128_103144,Unapproved or unmaintained equipment or utensils,Low Risk,20161128,103144,2016-11-28,0,0,0,0,2,0,4
1673,1673,6523,34787,Hollywood Food Center,6146 Geary Blvd,San Francisco,CA,94121,37.780148,-122.485532,"(37.780148, -122.485532)",,34787_20160523,5/23/2016 0:00,94.0,Routine - Unscheduled,34787_20160523_103133,Foods not protected from contamination,Moderate Risk,20160523,103133,2016-05-23,0,0,2,0,0,2,0
1674,1674,6536,3061,Ghirardelli Chcocolate Company,900 North Point St #52,San Francisco,CA,94109,37.805427,-122.422854,"(37.805427, -122.422854)",,3061_20150709,7/9/2015 0:00,92.0,Routine - Unscheduled,3061_20150709_103149,Wiping cloths not clean or properly stored or inadequate sanitizer,Low Risk,20150709,103149,2015-07-09,0,1,0,0,0,2,3
1675,1675,6543,4732,BREAD & BUTTER MARKET,888 O'FARRELL St,San Francisco,CA,94109,37.785068,-122.41898300000001,"(37.785068, -122.418983)",,4732_20171219,12/19/2017 0:00,88.0,Routine - Unscheduled,4732_20171219_103116,Inadequate food safety knowledge or lack of certified food safety manager,Moderate Risk,20171219,103116,2017-12-19,0,4,1,0,5,0,6
1676,1676,6545,60114,Farmers Market & Produce,986 Polk St,San Francisco,CA,94109,37.785787,-122.41964399999999,"(37.785787, -122.419644)",,60114_20180305,3/5/2018 0:00,92.0,Routine - Unscheduled,60114_20180305_103119,Inadequate and inaccessible handwashing facilities,Moderate Risk,20180305,103119,2018-03-05,3,0,3,0,0,4,0
1677,1677,6552,74244,Wise Sons Deli,736 Mission St,San Francisco,CA,94103,,,,,74244_20171003,10/3/2017 0:00,89.0,Routine - Unscheduled,74244_20171003_103154,Unclean or degraded floors walls or ceilings,Low Risk,20171003,103154,2017-10-03,0,3,0,0,0,0,2
1678,1678,6553,35507,Marina Meats Inc.,2395 Chestnut St,San Francisco,CA,94123,37.799944,-122.44271599999999,"(37.799944, -122.442716)",,35507_20161209,12/9/2016 0:00,90.0,Routine - Unscheduled,35507_20161209_103132,Improper thawing methods,Moderate Risk,20161209,103132,2016-12-09,3,0,0,0,3,0,6
1679,1679,6555,90316,Blue Barn Gourmet,3344 Steiner St,San Francisco,CA,94123,,,,14155416864.0,90316_20180306,3/6/2018 0:00,91.0,Routine - Unscheduled,90316_20180306_103149,Wiping cloths not clean or properly stored or inadequate sanitizer,Low Risk,20180306,103149,2018-03-06,2,0,0,0,2,0,0
1680,1680,6559,80460,Tai Hing Inc.,681 Broadway St,San Francisco,CA,94133,,,,14155666668.0,80460_20161212,12/12/2016 0:00,88.0,Routine - Unscheduled,80460_20161212_103119,Inadequate and inaccessible handwashing facilities,Moderate Risk,20161212,103119,2016-12-12,0,0,0,0,4,0,4
1681,1681,6562,82944,Chez Maman,1401 18th St,San Francisco,CA,94107,,,,,82944_20171212,12/12/2017 0:00,90.0,Routine - Unscheduled,82944_20171212_103145,Improper storage of equipment utensils or linens,Low Risk,20171212,103145,2017-12-12,0,3,0,0,2,0,2
1682,1682,6564,81245,Green Bar,3 Embarcadero Center  Lobby Level,San Francisco,CA,94111,,,,,81245_20171002,10/2/2017 0:00,94.0,Routine - Unscheduled,81245_20171002_103139,Improper food storage,Low Risk,20171002,103139,2017-10-02,0,3,0,0,0,0,0
1683,1683,6565,60737,Parkside Tavern,1940 TARAVAL St,San Francisco,CA,94116,37.742579,-122.48711200000001,"(37.742579, -122.487112)",,60737_20161003,10/3/2016 0:00,92.0,Routine - Unscheduled,60737_20161003_103120,Moderate risk food holding temperature,Moderate Risk,20161003,103120,2016-10-03,4,0,0,0,2,0,0
1684,1684,6569,3082,ONE MARKET RESTAURANT,1 MARKET St,San Francisco,CA,94105,37.794346999999995,-122.39493200000001,"(37.794347, -122.394932)",,3082_20161118,11/18/2016 0:00,78.0,Routine - Unscheduled,3082_20161118_103105,Improper cooling methods,High Risk,20161118,103105,2016-11-18,3,0,0,0,5,0,0
1685,1685,6572,631,SUBWAY SANDWICHES & SALADS,1500 FILLMORE St,San Francisco,CA,94115,37.78332,-122.432647,"(37.78332, -122.432647)",,631_20150605,6/5/2015 0:00,,Routine - Scheduled,631_20150605_103120,Moderate risk food holding temperature,Moderate Risk,20150605,103120,2015-06-05,4,0,0,0,0,1,2
1686,1686,6577,26341,"Natural Market, Inc.",2201 PINE St,San Francisco,CA,94115,37.788113,-122.432147,"(37.788113, -122.432147)",14155921320.0,26341_20160602,6/2/2016 0:00,98.0,Routine - Unscheduled,26341_20160602_103145,Improper storage of equipment utensils or linens,Low Risk,20160602,103145,2016-06-02,0,0,0,0,2,1,0
1687,1687,6605,74524,Brass Tacks,488 A Hayes St,San Francisco,CA,94102,,,,,74524_20171025,10/25/2017 0:00,92.0,Routine - Unscheduled,74524_20171025_103133,Foods not protected from contamination,Moderate Risk,20171025,103133,2017-10-25,0,2,0,0,1,0,0
1688,1688,6616,23273,Mike Market,2200 SILVER Ave,San Francisco,CA,94124,37.736484000000004,-122.39841799999999,"(37.736484, -122.398418)",,23273_20171218,12/18/2017 0:00,96.0,Routine - Unscheduled,23273_20171218_103131,Moderate risk vermin infestation,Moderate Risk,20171218,103131,2017-12-18,0,1,0,0,2,0,1
1689,1689,6624,6734,"Chung Chou City, Inc #5",1230 Stockton St,San Francisco,CA,94133,37.797178,-122.408477,"(37.797178, -122.408477)",,6734_20160512,5/12/2016 0:00,82.0,Routine - Unscheduled,6734_20160512_103138,Improper storage use or identification of toxic substances,Low Risk,20160512,103138,2016-05-12,0,6,0,0,0,1,6
1690,1690,6627,2455,MUDDY WATERS,521 VALENCIA St,San Francisco,CA,94110,37.764484,-122.421815,"(37.764484, -122.421815)",14155868006.0,2455_20171003,10/3/2017 0:00,92.0,Routine - Unscheduled,2455_20171003_103120,Moderate risk food holding temperature,Moderate Risk,20171003,103120,2017-10-03,0,2,0,0,0,1,2
1691,1691,6631,77850,Blue Fin Sushi & Lounge,1814 Clement St,San Francisco,CA,94121,,,,,77850_20171218,12/18/2017 0:00,,Reinspection/Followup,77850_20171218_103109,Unclean or unsanitary food contact surfaces,High Risk,20171218,103109,2017-12-18,0,1,0,0,6,0,0
1692,1692,6632,71576,La Luna Cupcakes,50 Post St,San Francisco,CA,94104,,,,,71576_20171215,12/15/2017 0:00,92.0,Routine - Unscheduled,71576_20171215_103157,Food safety certificate or food handler card not available,Low Risk,20171215,103157,2017-12-15,0,3,0,0,2,0,0
1693,1693,6636,68824,Harvey's Place,330 05th St,San Francisco,CA,94107,37.779807,-122.402887,"(37.779807, -122.402887)",,68824_20171214,12/14/2017 0:00,98.0,Routine - Unscheduled,68824_20171214_103154,Unclean or degraded floors walls or ceilings,Low Risk,20171214,103154,2017-12-14,0,1,0,0,2,0,0
1694,1694,6641,68269,Walgreens #1126,1979 MISSION St,San Francisco,CA,94103,,,,14155558749.0,68269_20161024,10/24/2016 0:00,98.0,Routine - Unscheduled,68269_20161024_103154,Unclean or degraded floors walls or ceilings,Low Risk,20161024,103154,2016-10-24,0,0,2,0,1,3,0
1695,1695,6642,71327,Jillian's,175 04th St,San Francisco,CA,94103,,,,,71327_20170810,8/10/2017 0:00,,Complaint,71327_20170810_103131,Moderate risk vermin infestation,Moderate Risk,20170810,103131,2017-08-10,0,0,4,0,4,3,0
1696,1696,6648,89847,Mission Asia Noodle,5249 Mission St.,San Francisco,CA,94112,,,,,89847_20170802,8/2/2017 0:00,,New Ownership,89847_20170802_103133,Foods not protected from contamination,Moderate Risk,20170802,103133,2017-08-02,0,0,2,0,0,0,0
1697,1697,6654,87700,Banh Mi House,2701 San Bruno Ave,San Francisco,CA,94134,,,,,87700_20171004,10/4/2017 0:00,89.0,Routine - Unscheduled,87700_20171004_103136,Unsanitary employee garments hair or nails,Low Risk,20171004,103136,2017-10-04,0,3,0,0,2,0,0
1698,1698,6658,10170,Piaza Pellegrini,659 Columbus Ave,San Francisco,CA,94133,37.800851,-122.41106200000002,"(37.800851, -122.411062)",,10170_20160909,9/9/2016 0:00,82.0,Routine - Unscheduled,10170_20160909_103114,High risk vermin infestation,High Risk,20160909,103114,2016-09-09,0,0,0,0,0,1,5
1699,1699,6663,1232,Sunflower Cafe,284 O'Farrell St,San Francisco,CA,94102,37.786316,-122.409371,"(37.786316, -122.409371)",,1232_20160523,5/23/2016 0:00,98.0,Routine - Unscheduled,1232_20160523_103156,Permit license or inspection report not posted,Low Risk,20160523,103156,2016-05-23,0,2,0,7,0,1,0
1700,1700,6666,89788,Sajj,636 02nd St,San Francisco,CA,94107,,,,,89788_20170309,3/9/2017 0:00,,New Ownership,89788_20170309_103119,Inadequate and inaccessible handwashing facilities,Moderate Risk,20170309,103119,2017-03-09,0,0,0,0,1,0,0
1701,1701,6667,2818,STARBUCKS COFFEE #5486,36 02nd St,San Francisco,CA,94105,37.788727,-122.400798,"(37.788727, -122.400798)",,2818_20160916,9/16/2016 0:00,92.0,Routine - Unscheduled,2818_20160916_103139,Improper food storage,Low Risk,20160916,103139,2016-09-16,0,0,1,0,0,3,0
1702,1702,6671,10227,The Napper Tandy,3200 24th St,San Francisco,CA,94110,37.752581,-122.416482,"(37.752581, -122.416482)",,10227_20180307,3/7/2018 0:00,83.0,Routine - Unscheduled,10227_20180307_103144,Unapproved or unmaintained equipment or utensils,Low Risk,20180307,103144,2018-03-07,5,0,7,0,0,0,4
1703,1703,6674,81244,Tofu Village,1920 Irving St,San Francisco,CA,94122,,,,14155668322.0,81244_20171214,12/14/2017 0:00,88.0,Routine - Unscheduled,81244_20171214_103150,Improper or defective plumbing,Low Risk,20171214,103150,2017-12-14,0,4,0,0,2,3,0
1704,1704,6682,3118,Hyatt Union Square Main Kitchen,345 Stockton St Flr 3B,San Francisco,CA,94108,37.788944,-122.406884,"(37.788944, -122.406884)",,3118_20150929,9/29/2015 0:00,96.0,Routine - Unscheduled,3118_20150929_103124,Inadequately cleaned or sanitized food contact surfaces,Moderate Risk,20150929,103124,2015-09-29,0,0,0,2,0,0,1
1705,1705,6687,1949,PLUTO'S,627 IRVING St,San Francisco,CA,94122,37.764083,-122.46471000000001,"(37.764083, -122.46471)",14155758867.0,1949_20180305,3/5/2018 0:00,89.0,Routine - Unscheduled,1949_20180305_103133,Foods not protected from contamination,Moderate Risk,20180305,103133,2018-03-05,2,0,0,0,0,3,0
1706,1706,6698,62060,Cozy Cable Car Cafe,519 Powell St,San Francisco,CA,94108,37.789521,-122.408736,"(37.789521, -122.408736)",14155983097.0,62060_20160523,5/23/2016 0:00,96.0,Routine - Unscheduled,62060_20160523_103120,Moderate risk food holding temperature,Moderate Risk,20160523,103120,2016-05-23,0,0,0,1,0,1,0
1707,1707,6701,64361,Aroma Tea Shop,302 06th Ave,San Francisco,CA,94118,37.778382,-122.462787,"(37.778382, -122.462787)",,64361_20160222,2/22/2016 0:00,92.0,Routine - Unscheduled,64361_20160222_103152,Unclean unmaintained or improperly constructed toilet facilities,Low Risk,20160222,103152,2016-02-22,0,0,0,0,4,0,4
1708,1708,6708,37792,Auntie Anne's Pretzels,845 Market St Space 201,San Francisco,CA,94103,37.784848,-122.406892,"(37.784848, -122.406892)",14155371098.0,37792_20180228,2/28/2018 0:00,96.0,Routine - Unscheduled,37792_20180228_103154,Unclean or degraded floors walls or ceilings,Low Risk,20180228,103154,2018-02-28,2,0,0,2,0,2,1
1709,1709,6718,79756,The Crepe House,1755 Polk St,San Francisco,CA,94109,,,,,79756_20161214,12/14/2016 0:00,94.0,Routine - Unscheduled,79756_20161214_103131,Moderate risk vermin infestation,Moderate Risk,20161214,103131,2016-12-14,0,3,0,0,2,3,4
1710,1710,6723,4755,Aunt Fanny's Hot Pretzels,Pier 39  Lot 12,San Francisco,CA,94133,37.802479,-122.41123400000001,"(37.802479, -122.411234)",,4755_20171004,10/4/2017 0:00,94.0,Routine - Unscheduled,4755_20171004_103139,Improper food storage,Low Risk,20171004,103139,2017-10-04,0,3,0,0,5,3,1
1711,1711,6724,84449,Live Feed,2200 Jerrold Ave Unit Z,San Francisco,CA,94124,,,,,84449_20151120,11/20/2015 0:00,98.0,Routine - Unscheduled,84449_20151120_103156,Permit license or inspection report not posted,Low Risk,20151120,103156,2015-11-20,0,0,0,0,0,0,1
1712,1712,6735,64176,Dragon River Restaurant,5045 GEARY Blvd,San Francisco,CA,94118,37.780522999999995,-122.47358,"(37.780523, -122.47358)",,64176_20160419,4/19/2016 0:00,80.0,Routine - Unscheduled,64176_20160419_103154,Unclean or degraded floors walls or ceilings,Low Risk,20160419,103154,2016-04-19,0,0,6,0,0,4,5
1713,1713,6736,7479,RJ's Market,1425 Sansome St,San Francisco,CA,94111,37.803634,-122.40328500000001,"(37.803634, -122.403285)",14155397160.0,7479_20161128,11/28/2016 0:00,88.0,Routine - Unscheduled,7479_20161128_103119,Inadequate and inaccessible handwashing facilities,Moderate Risk,20161128,103119,2016-11-28,0,0,0,0,3,0,3
1714,1714,6737,2066,Thai Spice Restaurant,1730 Polk St,San Francisco,CA,94109,37.79267700000001,-122.42103600000002,"(37.792677, -122.421036)",,2066_20180307,3/7/2018 0:00,88.0,Routine - Unscheduled,2066_20180307_103142,Unclean nonfood contact surfaces,Low Risk,20180307,103142,2018-03-07,4,0,7,0,4,4,0
1715,1715,6743,68352,Vogue Theatre,3290 Sacramento St,San Francisco,CA,94115,37.788247999999996,-122.446674,"(37.788248, -122.446674)",,68352_20161114,11/14/2016 0:00,92.0,Routine - Unscheduled,68352_20161114_103154,Unclean or degraded floors walls or ceilings,Low Risk,20161114,103154,2016-11-14,0,0,0,0,3,0,3
1716,1716,6744,3948,Mel's Drive-In,833 MISSION St,San Francisco,CA,94103,37.78355,-122.40535600000001,"(37.78355, -122.405356)",14155220793.0,3948_20160328,3/28/2016 0:00,90.0,Routine - Unscheduled,3948_20160328_103154,Unclean or degraded floors walls or ceilings,Low Risk,20160328,103154,2016-03-28,3,0,0,0,2,0,4
1717,1717,6765,80312,Saigon Sandwiches,560 Larkin St,San Francisco,CA,94102,,,,,80312_20160419,4/19/2016 0:00,80.0,Routine - Unscheduled,80312_20160419_103120,Moderate risk food holding temperature,Moderate Risk,20160419,103120,2016-04-19,0,0,0,0,0,8,0
1718,1718,6770,83711,Phil'z Coffee,5 Embarcadero Center,San Francisco,CA,94111,,,,,83711_20180220,2/20/2018 0:00,100.0,Routine - Unscheduled,83711_20180220_103154,Unclean or degraded floors walls or ceilings,Low Risk,20180220,103154,2018-02-20,1,0,0,0,2,0,0
1719,1719,6774,80658,Seoul of Taipei,428 11th St,San Francisco,CA,94103,,,,14155657920.0,80658_20160701,7/1/2016 0:00,96.0,Routine - Unscheduled,80658_20160701_103124,Inadequately cleaned or sanitized food contact surfaces,Moderate Risk,20160701,103124,2016-07-01,0,0,0,1,0,1,0
1720,1720,6779,61073,Fat Angel,1740 O' Farrell St,San Francisco,CA,94115,37.783237,-122.43324299999999,"(37.783237, -122.433243)",,61073_20150929,9/29/2015 0:00,91.0,Routine - Unscheduled,61073_20150929_103147,Inadequate ventilation or lighting,Low Risk,20150929,103147,2015-09-29,0,0,0,0,4,2,2
1721,1721,6780,80273,Tikka Masala Ellis,425 Ellis St,San Francisco,CA,94102,,,,,80273_20160310,3/10/2016 0:00,62.0,Routine - Unscheduled,80273_20160310_103105,Improper cooling methods,High Risk,20160310,103105,2016-03-10,0,0,0,8,0,0,7
1722,1722,6781,74039,Boba Guys,3491 19th St,San Francisco,CA,94110,,,,14155962622.0,74039_20160329,3/29/2016 0:00,94.0,Routine - Unscheduled,74039_20160329_103149,Wiping cloths not clean or properly stored or inadequate sanitizer,Low Risk,20160329,103149,2016-03-29,0,1,0,0,1,0,3
1723,1723,6784,17750,Squat and Gobble Cafe,2263 Chestnut St,San Francisco,CA,94123,37.800253999999995,-122.440467,"(37.800254, -122.440467)",,17750_20161024,10/24/2016 0:00,81.0,Routine - Unscheduled,17750_20161024_103144,Unapproved or unmaintained equipment or utensils,Low Risk,20161024,103144,2016-10-24,4,0,0,0,5,0,3
1724,1724,6785,64004,Mission Groceteria,2950 23rd St,San Francisco,CA,94110,37.754298,-122.411272,"(37.754298, -122.411272)",,64004_20160608,6/8/2016 0:00,92.0,Routine - Unscheduled,64004_20160608_103157,Food safety certificate or food handler card not available,Low Risk,20160608,103157,2016-06-08,0,0,2,0,2,4,2
1725,1725,6805,6032,FRANCIS OF ASSISI SENIOR MEALS PROG,145 Guerrero St,San Francisco,CA,94103,37.768904,-122.424466,"(37.768904, -122.424466)",14155865790.0,6032_20160912,9/12/2016 0:00,96.0,Routine - Unscheduled,6032_20160912_103133,Foods not protected from contamination,Moderate Risk,20160912,103133,2016-09-12,0,0,0,0,0,1,0
1726,1726,6810,34910,Piccolo Italia Pizza,799 O'Farrell St,San Francisco,CA,94109,37.785121000000004,-122.417854,"(37.785121, -122.417854)",,34910_20180306,3/6/2018 0:00,92.0,Routine - Unscheduled,34910_20180306_103133,Foods not protected from contamination,Moderate Risk,20180306,103133,2018-03-06,3,6,0,0,4,0,4
1727,1727,6817,86470,Palou Market Inc,4919 3rd St,San Francisco,CA,94124,,,,,86470_20160316,3/16/2016 0:00,,New Ownership,86470_20160316_103149,Wiping cloths not clean or properly stored or inadequate sanitizer,Low Risk,20160316,103149,2016-03-16,0,0,0,0,0,0,2
1728,1728,6818,77816,Fuddhism,425 Barneveld Ave,San Francisco,CA,94124,,,,,77816_20150317,3/17/2015 0:00,100.0,Routine - Unscheduled,77816_20150317_103116,Inadequate food safety knowledge or lack of certified food safety manager,Moderate Risk,20150317,103116,2015-03-17,0,0,0,0,0,0,0
